Tweet id,Created Time,Tweet Details,Retweet counts,Source URL
881086262509285376,2017-07-01 09:45:09,"@Epigrammist @Rottoturbine  Hi Mr M80, the email is a hoax. Please delete it and do not click on the link. ^EC",0,http://www.hootsuite.com
881018790082863106,2017-07-01 05:17:02,@melville_tellez @ANZ_Media Can you please follow us so that we can send u a detailed response^EC,0,http://www.hootsuite.com
881016625150996481,2017-07-01 05:08:26,@melville_tellez @ANZ_Media  Apologies for the embarrassment caused Melville ^EC.,0,http://www.hootsuite.com
880979300081598464,2017-07-01 02:40:07,"@SvenDowideit  Apologies if your Internet Banking has been locked. Pls DM your full name, post code &amp; a phone no. &amp; we’ll look into it. ^NP",0,http://www.hootsuite.com
880940595254091776,2017-07-01 00:06:19,"@bob_ruub  Hi Bob, unfortunately you’ll have to update your IOS software to 9.3.5. ^NP",0,http://www.hootsuite.com
880832343132565505,2017-06-30 16:56:10,"@tweetsbyrichy Hi Richy, Pay Anyone transfers to ANZ can take up to 1 business day to clear depending on the way the payment was made. ^NK",0,http://www.hootsuite.com
880764570486308864,2017-06-30 12:26:52,@Carr1Graham We’re always here if you need us. We’re not going anywhere! ^CC,0,http://www.hootsuite.com
880763922428592128,2017-06-30 12:24:17,@VasiliosAgio Hi Vasilios if we can help with anything please DM us your details. ^CC,0,http://www.hootsuite.com
880763457200680960,2017-06-30 12:22:26,@__thewitch__ Hi Steven so we can search and also remove it to prevent further texts. ^CC,0,http://www.hootsuite.com
880757792860012545,2017-06-30 11:59:56,RT @ShoutForGood: Purchase a #rednose to support @RedNoseDay_Aus through our app on @ANZ_AU BladePay. Have you got yours yet? #savinglittle…,5,http://twitter.com/download/iphone
880725970424143872,2017-06-30 09:53:29,@__thewitch__ Hi again in that case it may be that u have a recycled No. Can you please DM us the details &amp; we’ll look into it for you. ^CC,0,http://www.hootsuite.com
880722639815413760,2017-06-30 09:40:15,"@anthonycr0 Hi Anthony, generally we do send an email. Can you pls DM us your details and we’ll look into this for you. ^CC",0,http://www.hootsuite.com
880720301922942978,2017-06-30 09:30:57,@__thewitch__ Hi Steven this does look like a legit text from us. Have u recd any other texts in the past? ^CC,0,http://www.hootsuite.com
880710714129874947,2017-06-30 08:52:51,@DeadBeatRobotWA Hi thks for your feedback regarding our Merchant fees. If you’d like us to look into this for u pls DM us your details. ^CC,0,http://www.hootsuite.com
880663464863313920,2017-06-30 05:45:06,"@davmoro Hi David we apologise for the wait that you’ve had at our Cranbourne branch, we’ll pass your feedback on to the branch Manager.",0,http://www.hootsuite.com
880663464305360896,2017-06-30 05:45:06,@davmoro  If we can help with anything plse let us know. ^CC,0,http://www.hootsuite.com
880642858163765248,2017-06-30 04:23:13,"@srdau Hi Stephen may need to contact a branch who has euros available pls send a DM with your details (full name, postcode, contact no) ^MM",0,http://www.hootsuite.com
880628286501437441,2017-06-30 03:25:19,"Whether you tweet, gram or post, we hope you have a great #SocialMediaDay! As always our social team is here if you… https://t.co/whXEMJPH6O",24,http://twitter.com
880598527998435329,2017-06-30 01:27:04,"@RundleTom @NicoleRundle @JaneRundle Hi Rundle, so proud to have you and your daughter as a part of our team! Welco… https://t.co/Pf8hlq0Tnl",0,http://twitter.com
880596842853040129,2017-06-30 01:20:22,"@nigelp73 Hi Nigel, so glad to hear you're joining us. Let us know if we can assist you in setting up your acc? ^JG",0,http://www.hootsuite.com
880575739686465536,2017-06-29 23:56:31,"@awmalloy Morning Anthony, I can take a look and see if I can fix this. Please send a DM with your full name, postcode and contact no. ^MM",0,http://www.hootsuite.com
880568693721321474,2017-06-29 23:28:31,@yasminerose_ Thanks Yasmine!!! I’ll forward on your feedback to our team. Please send us a DM if ever you need any help! ^MM,0,http://www.hootsuite.com
880551983614091264,2017-06-29 22:22:07,"@davidjfindlay Hi David we’ll send your feedback through to our ATM team, pls send us a DM with your details. if any issues continue ^MM",0,http://www.hootsuite.com
880309405706858497,2017-06-29 06:18:12,@jendudley we understand how you feel when your phone becomes your wallet. Great to see you're using #ANZApplePay to the max :) ^JG,0,http://www.hootsuite.com
880280629086212097,2017-06-29 04:23:51,"@charliesome Hi Charlie, I’m really sorry to hear this. The no. for the team is 1800190277. If you're having trouble, please send us a DM^KP",0,http://www.hootsuite.com
880267529960206337,2017-06-29 03:31:48,"@RiotChords Hop on board, Chris! We'll welcome you with open arms :) Let us know if you need help setting up an acc with us. ^JG",0,http://www.hootsuite.com
879990776771612673,2017-06-28 09:12:05,"@as_rama Hi, you have contacted ANZ Australia, link attached for Indonesia contact details https://t.co/8L5V78TZv9 ^PD",0,http://www.hootsuite.com
879989080548720640,2017-06-28 09:05:20,@smartcitycio I am sure small savings will help you win bigger Revolution then Rochambeau ^PD,0,http://www.hootsuite.com
879911594624512000,2017-06-28 03:57:26,"@ysihaoy I can look into this for you regarding the questions asked, please send us a DM with your full name postcode contact no. ^MM",0,http://www.hootsuite.com
879885879124279296,2017-06-28 02:15:15,RT @ANZ_bluenotes: 📧#Newsletter: Is the #IoT secure? Thinking over #FinkelReview. @fionaatwork on tough talks. + MORE!: https://t.co/IN0LBc…,3,http://twitter.com/download/iphone
879863317891866624,2017-06-28 00:45:36,"@mollyfud Hi Phil, if your interested in AndroidPay with ANZ, pls send a DM with your details, so we can help out! ^MM",0,http://www.hootsuite.com
879862530478309376,2017-06-28 00:42:28,"@_nicks_tweets Hi Nick, if your interested in Applepay with ANZ, pls send a DM with your details, so we can help out! ^MM",0,http://www.hootsuite.com
879861496712486912,2017-06-28 00:38:22,"@ttina222 Our ANZ Share trading website should be back up and running now, we have escalated this issue to our tech team. ^MM",0,http://www.hootsuite.com
879861152817315840,2017-06-28 00:37:00,"@HSydneyHC Our ANZ Share trading website should be back up and running now, we have escalated this issue to our tech team. ^MM",0,http://www.hootsuite.com
879685333134303232,2017-06-27 12:58:21,"@ysihaoy Hi, we are sorry to hear this, please let us know if we can assist in any way ? ^PD",0,http://www.hootsuite.com
879665827053785088,2017-06-27 11:40:51,@heartofdustt We will surely pass on your feedback for future consideration. ^PD,0,http://www.hootsuite.com
879637260295163904,2017-06-27 09:47:20,"@TranHoangANZ Hi Tran, all good at 833 BAU. ^PD",0,http://www.hootsuite.com
879634212185411584,2017-06-27 09:35:13,@ryannguyentt Thanks for your feedback Ryan. ^PD,0,http://www.hootsuite.com
879633812979953670,2017-06-27 09:33:38,"@heartofdustt Cont...registered for goMoney, which could be  quicker but can still take up to 1 business day. 2/2 ^PD",0,http://www.hootsuite.com
879633703458283520,2017-06-27 09:33:12,"@heartofdustt Hi, ANZ to ANZ transfers take 1 business day to clear, you can try goMoney pay to mobile, both parties should be 1/2",0,http://www.hootsuite.com
879590394161496064,2017-06-27 06:41:06,@chrisede_ cont .. for Card pay direct it has to be via a form. 2/2 ^PD,0,http://www.hootsuite.com
879590310590001152,2017-06-27 06:40:46,"@chrisede_  Hi Chris, if the payment is coming out of your ANZ account, you can setup pay credit card facility on Internet Banking 1/2",0,http://www.hootsuite.com
879521242998550530,2017-06-27 02:06:19,@PickardNR postcode and contact number. We will pass on your details and feedback to the Branch Manager. 2/2 ^CM,0,http://www.hootsuite.com
879521196370472960,2017-06-27 02:06:08,"@PickardNR Hi Nicholas, sorry to hear about the issue that have had. Can you pls DM us with your full name,",0,http://www.hootsuite.com
879457004632322048,2017-06-26 21:51:04,"@markdetre Hi Mark, the reference number is the Credit Card number. ^CM",0,http://www.hootsuite.com
879288829928243200,2017-06-26 10:42:48,"@rmkf Hi Ronan, you can direct message us anytime. Please note we won't ask you to click any links or provide your details via email.^Rodo",0,http://www.hootsuite.com
879270535410188288,2017-06-26 09:30:06,"@rmkf Hi Ronan,are you able to DM us a screenshot of the email? Please don’t click any links or attachment.Please DM us to assist further^RM",0,http://www.hootsuite.com
879249281483460608,2017-06-26 08:05:39,"@invisibleman_18 Hi Chris,sorry to hear this.If still required,pls DM us and we can have our personal bankers follow up the applicatioin.^RM",0,http://www.hootsuite.com
879243570208661505,2017-06-26 07:42:57,"#TaxTime is just around the corner, make sure you’re prepared before July 1 with this #EOFY checklist https://t.co/UxDxxVUPbT",35,https://ads.twitter.com
879227614854086656,2017-06-26 06:39:33,"@taniladesilva Hi Tanila,we are sorry to hear this.If we can be of any assistance,please DM us your enquiry to see how we can assist.^RM",0,http://www.hootsuite.com
879223421837615104,2017-06-26 06:22:53,"The newest calf at @TarongaZoo now has a name – Jai Dee, meaning Good Heart. So proud to continue to sponsor their… https://t.co/rDMDghTs0F",43,http://twitter.com
879219130750173184,2017-06-26 06:05:50,"@flea1709 Hi there, we are so sorry to hear this. Please DM us if we can be of any assistance. We noticed there is a Smart ATM in branch.^RM",0,http://www.hootsuite.com
879205659761401857,2017-06-26 05:12:18,"@MaddisonRose98 Hi Maddison, we’re glad to hear your positive feedback. ^RM",0,http://www.hootsuite.com
879204839741423616,2017-06-26 05:09:03,"@welsheagle @NAB Hi Gary,very sorry to hear this.If we can be of any assistance,please DM us with the enquiry to see how we can assist.^RM",0,http://www.hootsuite.com
879155368395493376,2017-06-26 01:52:28,"@macropin Hi Andrew, can you pls DM us with your full name, postcode and contact number. We can investigate further for you. ^CM",0,http://www.hootsuite.com
879104073139535872,2017-06-25 22:28:38,@robbiemceniery @CommBank Welcome Robbie! If you need a hand with the switch just send us a DM and we'll help get y… https://t.co/rLd2r8Gu1v,0,http://twitter.com
878970659195547650,2017-06-25 13:38:30,"@Hannah_S_Robert Sorry to hear about this Hannah, please DM your details and we’ll do our best to assist. ^NK",0,http://www.hootsuite.com
878798956301516800,2017-06-25 02:16:13,"@282_chris  remember the PIN then pls DM your full name, post code and a contact phone number. 2/2 ^NP",0,http://www.hootsuite.com
878798892694941696,2017-06-25 02:15:57,@282_chris   Most likely you have used the app before and so it’s asking you for 4 digits PIN previously used. If you don’t 1/2 ^NP,0,http://www.hootsuite.com
878796197934354432,2017-06-25 02:05:15,@kristianjackson  Not a problem Kristian. Have a great rest of the weekend. ^NP,0,http://www.hootsuite.com
878780873734328323,2017-06-25 01:04:21,@282_chris  Apologies for the experience you have had Chris. Please tell us if there is anything we could assist with. ^NP,0,http://www.hootsuite.com
878522916136202240,2017-06-24 07:59:20,@desertcrossing Hi Sarah if you’re an ANZ Customer there is no charge. ^CC,0,http://www.hootsuite.com
878509738421571584,2017-06-24 07:06:58,"@desertcrossing Hi Sarah the coin counting machine at Fremantle is in brnch, not the ATM at this stage. Apologies for any inconvenience. ^CC",0,http://www.hootsuite.com
878472158850297856,2017-06-24 04:37:38,"@Nigsy09  pls DM your full name, post code and a contact phone number and we’ll see if there is anything we could do to assist. ^NP",0,http://www.hootsuite.com
878421587900289024,2017-06-24 01:16:41,"@redsocksnpants @ASRC1 We have a wide array of charity partners supporting communities, you can see the full list h… https://t.co/LnDhUSM9k9",0,http://twitter.com
878366179076694016,2017-06-23 21:36:31,@LucasStarbuck  Not a problem Lucas. We are glad your enquiry was resolved. We do apologise for the experience you have had. ^NP,0,http://www.hootsuite.com
878310951929356288,2017-06-23 17:57:03,"@LucasStarbuck Hi Lucas, this isn’t the service we wish to provide, please accept our apologies and we’ll pass on your feedback. ^NK",0,http://www.hootsuite.com
878251581673787393,2017-06-23 14:01:08,"@connorhughes Thanks Connor, we’ll report this to our tech team; in the meantime please call 131614 for a quote (8am-8pm AEST, Mon-Fri). ^NK",0,http://www.hootsuite.com
878240763506819072,2017-06-23 13:18:09,"@connorhughes Hi Connor, what type of insurance were you trying to get a quote for? ^NK",0,http://www.hootsuite.com
878208675328012288,2017-06-23 11:10:39,"@spamdrew Hi There, thank you for letting us know that your inquiry was resolved. ^EC",0,http://www.hootsuite.com
878150670158897152,2017-06-23 07:20:09,"@Stevie_Beee Hi Steve, we apologise for the inconvenience that you’ve had when visiting our branch. 1/2",0,http://www.hootsuite.com
878146342283079680,2017-06-23 07:02:57,@Stevie_Beee Can you plse provide us with the location of the branch and we’ll forward your feedback on. 2/2 ^CC,0,http://www.hootsuite.com
878110452458201089,2017-06-23 04:40:21,"@tyrelle123 @ASRC1 We also partner with other charities &amp; support local communities, see: https://t.co/cUQEqDfJDe",0,http://twitter.com
878109359338799104,2017-06-23 04:36:00,"@patnjak @ASRC1 We believe in fostering an inclusive society, this is just one of our charity partners - see the fu… https://t.co/8LAsg9sHSq",0,http://twitter.com
878104422252896257,2017-06-23 04:16:23,"@benjmay Hi Ben, let me take a look at this and fix this up. Please send us DM with your full name postcode &amp; contact number ^MM",0,http://www.hootsuite.com
877937145830195200,2017-06-22 17:11:41,"@spamdrew Hi there, we can look into this for you, could you please send us a DM with your details (full name, postcode &amp; phone no)? ^NK",0,http://www.hootsuite.com
877888298311499776,2017-06-22 13:57:35,"@ShaunHodgins Sorry to hear this Shaun, if there’s anything we can assist with please send us a DM with the details. ^NK",0,http://www.hootsuite.com
877816971081003008,2017-06-22 09:14:09,"@nksrk that's strange, we suggest you speak to the dealership &amp; tell them settlement is ready to be done. ^PD",1,http://www.hootsuite.com
877798298593091585,2017-06-22 07:59:57,"@nksrk @honda_australia @EssendonHonda  Hi Nimmi, please let us know if we can assist in any way? ^PD",0,http://www.hootsuite.com
877783444591222785,2017-06-22 07:00:56,@Brett_A_Smith71 Hi Brett card needs to be cancelled if the transaction is unauthorised or card is on a compromised list. ^PD,0,http://www.hootsuite.com
877775696189206528,2017-06-22 06:30:08,#SCAMALERT: Beware of phone calls from scammers claiming your bank account has been hacked. Latest security alerts:… https://t.co/IvB7Tg0FYD,32,http://www.hootsuite.com
877757090906882048,2017-06-22 05:16:13,@meansblue Cont..8am-8pm AEST M-F to see if there is anything they can do to assist. (2/2) ^PD,0,http://www.hootsuite.com
877756793522409472,2017-06-22 05:15:02,"@meansblue Hi Sunil, generally these fees are not refunded, but you can speak to Credit Card Closures team on 1800064753 (1/2)",0,http://www.hootsuite.com
877753099657502721,2017-06-22 05:00:21,"@amazonastyle Hi Rebecca, please DM your Full Name, Postcode,Ph no&amp; a brief description of your enquiry so we can look into this for you.^PD",0,http://www.hootsuite.com
877742972162506753,2017-06-22 04:20:06,"@projecting Thanks Karyn for the shoutout, I will forward this on to our team in Saigon. ^MM",0,http://www.hootsuite.com
877734885997199363,2017-06-22 03:47:59,"@BigKev67 your full name, postcode and contact number. ^MM (2/2)",0,http://www.hootsuite.com
877734818271813632,2017-06-22 03:47:42,"@BigKev67 Hi Kevin, I can take a look and see if this is affecting your type of card. Please send a Direct Message with (1/2)",0,http://www.hootsuite.com
877721534684647424,2017-06-22 02:54:55,"@eclecticmedic No problems Marco, I’m happy to hear that was resolved. Please send us a Direct Message if there’s any further issue ^Michael",0,http://www.hootsuite.com
877712770883620864,2017-06-22 02:20:06,@eclecticmedic with your full name; postcode and contact number and I’ll see if we can fix this issue. ^MM (2/2),0,http://www.hootsuite.com
877712682861740032,2017-06-22 02:19:45,"@eclecticmedic Hi Marco, I’m sorry to hear about this, we apologise for the long wait times. Can you please send us a Direct Message  (1/2)",0,http://www.hootsuite.com
877703007311347714,2017-06-22 01:41:18,@jan190 our team immediately. Please send us a Direct Message if there is anything that we can do to help. ^MM,0,http://www.hootsuite.com
877702908522921985,2017-06-22 01:40:54,"@jan190 Hi Jan, we apologise for the inconvenience caused, I am more than happy to forward on your feedback to (1/2)",0,http://www.hootsuite.com
877688844426072064,2017-06-22 00:45:01,@realengland4eva institution so that they can organise a dispute case to reclaim the funds back into your accounts. ^MM (2/2),0,http://www.hootsuite.com
877688750268088321,2017-06-22 00:44:39,"@realengland4eva I’m so sorry to hear about this Chris, to get this resolved, you may need to speak to your banking (1/2)",0,http://www.hootsuite.com
877688027170054145,2017-06-22 00:41:46,RT @ElliottShayne: A gr8 report on @ANZ_AU Saver Plus - a financial literacy program we proudly run with Brotherhood of St Laurence https:/…,47,http://twitter.com/download/iphone
877667556076785664,2017-06-21 23:20:26,@ballast_point postcode and contact number so we can help as best as possible. ^MM (3/3),0,http://www.hootsuite.com
877667459129643009,2017-06-21 23:20:03,"@ballast_point In the meantime, please send us a Direct Message with your full name, (2/3)",0,http://www.hootsuite.com
877667377856598017,2017-06-21 23:19:43,"@ballast_point Hi Ray, we’re sorry to cause this inconvenience. We may be undergoing some refurbishments or changes being made. (1/3)",0,http://www.hootsuite.com
877660849866854400,2017-06-21 22:53:47,"@realengland4eva  your full name, postcode and contact number, so we can get this resolved. ^MM",0,http://www.hootsuite.com
877660774767800320,2017-06-21 22:53:29,"@realengland4eva Morning Chris, we are very sorry to see this has occurred. Please send us a Direct Message with (1/2)",0,http://www.hootsuite.com
877483041723043840,2017-06-21 11:07:14,"RT @Kon__K: Again. My Australia, your Australia. This is our story, one of compassion. Staff at @ANZ_AU collecting food all day for #refuge…",17,http://twitter.com/download/iphone
877450253053702144,2017-06-21 08:56:57,"@vertis Great, if we can assist further please let us know. ^PD",0,http://www.hootsuite.com
877427698322345985,2017-06-21 07:27:19,"@collectheworld Hi Lucy, apologies for the issue, our Internet banking is working fine, are you getting a message when you try to login? ^PD",0,http://www.hootsuite.com
877403553014218752,2017-06-21 05:51:23,"This #RefugeeWeek join us in our support for the @ASRC1 donation drive, providing food and goods for #refugees. See… https://t.co/0Ponq9B7Ez",36,http://twitter.com
877393001080737792,2017-06-21 05:09:27,Learn how to protect your business from #ransomware. Read our CISO @LynwenConnick’s top tips here. #cybersecurity… https://t.co/HVbOj5jCfr,13,http://twitter.com
877375829172408320,2017-06-21 04:01:13,@dantaylee regarding your recent experience. Please send us a Direct Message if you have any concerns that we can help. ^MM (2/2),0,http://www.hootsuite.com
877375735010398208,2017-06-21 04:00:50,"@dantaylee We very sorry to hear about this, I will certainly forward you feedback on to our Caringbah Branch (1/2)",0,http://www.hootsuite.com
877364170517233664,2017-06-21 03:14:53,RT @ANZ_bluenotes: 📧#Newsletter: #agile leadership with @MaileCarnegie . #Cybersecurity with @LynwenConnick. Retro #banking + MORE  https:/…,9,http://twitter.com/download/iphone
877231674966380546,2017-06-20 18:28:24,"@metal_jang Hi Chanik, our Internet banking team would be happy to help and can be contacted on 13 33 50, 24/7. ^JW",0,http://www.hootsuite.com
877174274552991745,2017-06-20 14:40:18,"@jamesvdm Hi James, is it ok if we try again now? JW",0,http://www.hootsuite.com
877158408775970816,2017-06-20 13:37:16,"@jamesvdm Hi James, unfortunately we cannot locate your original request.  Please DM your details and we will call you asap. ^JW",0,http://www.hootsuite.com
877140136886185984,2017-06-20 12:24:39,"@theclarklett Hi Clark, apologies for the experience, please DM your Full Name, Postcode &amp; Ph no so we can look into this for you. ^PD",0,http://www.hootsuite.com
877129163613851648,2017-06-20 11:41:03,"@_stuartbright Hi Stuart, we have responded to your Facebook PM. ^PD",0,http://www.hootsuite.com
877064330587627520,2017-06-20 07:23:26,"RT @that_kp: @ANZ_AU team taking calls, raising money and making new friends at the #ASRCTelethon for #WorldRefugeeDay https://t.co/WAlC6bP…",2,http://www.hootsuite.com
877064314259197952,2017-06-20 07:23:22,"@jamesvdm Hi James, we tried calling you but went to voice mail, please let us know and we can call you back. ^PD",0,http://www.hootsuite.com
877058807079342080,2017-06-20 07:01:29,"@PerthMusicKid Hi Adam, apologies for this, we will surely pass on the feedback to the team for you. ^PD",0,http://www.hootsuite.com
877021257123999748,2017-06-20 04:32:16,"@AtheistInOz Hi, sorry we don't have an update on this for the moment, but will post an update once we do. ^JG",0,http://www.hootsuite.com
877013816311263232,2017-06-20 04:02:42,"@HSydneyHC Sorry we have no update on this yet, we will be sure to post an update if anything changes. ^JG",0,http://www.hootsuite.com
877010446208860161,2017-06-20 03:49:19,"@edronmonds Hi Ron, the 3% is charged at the time of the transaction. ^CM",0,http://www.hootsuite.com
876993313236189184,2017-06-20 02:41:14,"@thegeekinasuit Hi Thanh, to order lounge passes pls contact ANZ Personal Concierge on 1300 580 765. ^CM",0,http://www.hootsuite.com
876965380396167169,2017-06-20 00:50:14,"@jendudley Sorry Jen about the hassle caused, we are looking into this for you now",0,http://twitter.com
876964690173333504,2017-06-20 00:47:30,"@Stickmansean Hi Sean, can you pls DM us with your full name, postcode and contact number. We will investigate for you. ^CM",0,http://www.hootsuite.com
876931216087236608,2017-06-19 22:34:29,"RT @ceejaybe: Thrilled to see @ANZ_AU #HOLDTIGHT recognised @Cannes_Lions Beautiful, important work #fourinarow https://t.co/pyhvfCSWp6",11,http://twitter.com/download/iphone
876927871436062721,2017-06-19 22:21:11,"@JpowerOz Hi James, can you pls DM us with some information, are you using an ATM, Eftpos or online. Which card are you using? ^CM",0,http://www.hootsuite.com
876893114245554181,2017-06-19 20:03:04,"@keranm Hi Keran, thanks for taking the time to provide the great feedback. ^JW",0,http://www.hootsuite.com
876882114918182912,2017-06-19 19:19:22,"@keranm Hi Keran, if you like we can check to make sure there is no issue on our end, please DM your full name, postcode and contact #. ^JW",0,http://www.hootsuite.com
876801203040137216,2017-06-19 13:57:51,"@darrenkwok  Hi Darren, sorry no ETA at this stage. ^JW",0,http://www.hootsuite.com
876797785781227522,2017-06-19 13:44:16,"@AlexisFomin Hi, very sorry to hear this, please DM your full name and phone # if you would like us to look into this further for you. ^JW",0,http://www.hootsuite.com
876788298366300160,2017-06-19 13:06:34,"@kara_ward Hi Kara, we have replied to your DM. ^JW",0,http://www.hootsuite.com
876778509150158849,2017-06-19 12:27:40,"@MeshForce Thanks for your feedback, we will surely pass it on to the relevant team for future improvements to the app. ^PD",0,http://www.hootsuite.com
876778009742770176,2017-06-19 12:25:41,"@australianspur Thanks for your feedback Alex, we will surely pass it on to the relevant team for future improvements. ^PD",0,http://www.hootsuite.com
876777585950248960,2017-06-19 12:24:00,"@Yvonne_Adele Thanks for the feedback Yvonne, its such a great feature to have. ^PD",0,http://www.hootsuite.com
876744558637350913,2017-06-19 10:12:46,"@kara_ward Hi Kara, we have replied to your DM. ^PD",0,http://www.hootsuite.com
876740430251122689,2017-06-19 09:56:22,"@edronmonds Hi Ron, there will be a 3% overseas transaction fee, we have attached a link for your reference https://t.co/l75xYELku3 ^PD",0,http://www.hootsuite.com
876731787317084160,2017-06-19 09:22:01,RT @TennisAustralia: ICYMI: @toddwoodbridge wrapped up the @ANZ_AU #TennisHotShots Racquet Roadshow with @morningshowon7. Watch https://t.c…,8,http://twitter.com/download/iphone
876695968829386752,2017-06-19 06:59:41,"@JpowerOz Hi James,we are sorry to hear about this.Please DM us your full name,post code &amp; phone number along with your enquiry. ^RM",0,http://www.hootsuite.com
876686816472162304,2017-06-19 06:23:19,"RT @ANZ_bluenotes: Programs like #giventhechance are great for the #community and great for @anz_au, @ElliottShayne says. ""Truly win-win"" #…",6,http://www.hootsuite.com
876686664470540288,2017-06-19 06:22:43,RT @MikaelaKoia: Great to hear Mariam Issa speaking at @ANZ_AU for #RefugeeWeek2017 https://t.co/S4j0pYsItO,4,http://www.hootsuite.com
876647618327085056,2017-06-19 03:47:34,"RT @ElliottShayne: Great to support @ANZ_AU customer Roll'd as it launches ANZ Bladepay with us. Innovation, convenience, collaboration htt…",9,http://twitter.com/download/iphone
