Tweet id,Created Time,Tweet Details,Retweet counts,Source URL
906040016870060033,2017-09-08 06:22:28,@chaddicksonanz Incredible! So much excitement! #ANZBladePay ^JG,0,http://www.hootsuite.com
905980527756414977,2017-09-08 02:26:04,@Yvonne_Adele  Apologies Yvonne. Please let us know if we could assist with anything else in the future. ^NP,0,http://www.hootsuite.com
905970342128218114,2017-09-08 01:45:36,"@Yvonne_Adele Hi Yvonne, sorry for the late reply. Let me follow this up immediately! Please DM your full name postcode &amp; contact no ^MM",0,http://www.hootsuite.com
905969955669139456,2017-09-08 01:44:04,"INFO: our Internet Banking, goMoney &amp; Grow apps and Phone Banking will be undergoing maintenance Sun 10 Sept 1am - 6am (AEST). Apologies.",7,http://twitter.com
905969555230556162,2017-09-08 01:42:28,"@AmandaEStrong Thanks for the compliment Amanda, I’ll forward this on to Alana and the South Melbourne branch! ^MM",0,http://www.hootsuite.com
905958997181812736,2017-09-08 01:00:31,"@mbrannigan2000 Hi mBrannigan, please check your Direct Message as I have responded to your enquiry. ^MM",0,http://www.hootsuite.com
905944073562816512,2017-09-08 00:01:13,"@paulyy8t6 Oh we know, glad you got to experience it 😉^JG #ANZSamsungPay https://t.co/hjR0mv6cSw",0,http://twitter.com
905938595948634112,2017-09-07 23:39:27,RT @ANZ_bluenotes: Newsletter: @MaileCarnegie on #digital upheaval. #Hospitality’s drinking problem. #Biometrics + MORE https://t.co/aPQnTx…,2,http://twitter.com/download/iphone
905934016578072576,2017-09-07 23:21:15,"@paulyy8t6 Hi Paul welcome to the family! If you need any help registering for your mobile payment apps, pls feel free to DM us! ^MM",0,http://www.hootsuite.com
905904468268646400,2017-09-07 21:23:50,RT @Liz_Bardwell: @ANZ_AU CEO @ElliottShayne gets down &amp; dirty for customers https://t.co/8x2IuVSB1B,2,http://twitter.com/download/iphone
905684762010013696,2017-09-07 06:50:48,"@XeroNomad Hi Mark, could you send us a DM with your name, number, and post code so we can look into this for you? ^JG",0,http://www.hootsuite.com
905678897341136896,2017-09-07 06:27:30,"@LindaDHoward Hi Linda, we're sorry for the wait, we will surely pass on your feedback to the branch for future improvements.^JG",0,http://www.hootsuite.com
905678320905228288,2017-09-07 06:25:13,"@erinito @ArtGalleryofNSW Hi Erin, yes, that's correct. Hopefully you'll have the time to see it. 🙂^JG",0,http://twitter.com
905677355661672449,2017-09-07 06:21:22,@petersarmas profile reports to provide market insights. Let us know how we can assist you further. ^JG (2/2),0,http://twitter.com
905677200292057088,2017-09-07 06:20:45,"@petersarmas Hi Peter, Coaches are not property advisors &amp; do not advise customers on which property to buy, instea… https://t.co/TrvZ66AKxz",0,http://twitter.com
905677046868795396,2017-09-07 06:20:09,"@parisba  Hi Paris, so sorry to hear about this, can you please confirm if your application was declined. ^EC",2,http://www.hootsuite.com
905676597956452352,2017-09-07 06:18:22,"@XeroNomad Hi Mark, at ANZ, we don't discriminate against disabled people and disability payments are an acceptable income source. ^JG",0,http://www.hootsuite.com
905671004814434305,2017-09-07 05:56:08,We’re all cheering for ANZ Tennis Ambassador @DylanAlcott in his opening #USOpen match. Good luck Dylan! https://t.co/zVOriEaB2t,11,http://twitter.com
905633294645059585,2017-09-07 03:26:17,"Big house or a big super balance? The answer for many Aussies is increasingly becoming #superannuation, read why https://t.co/q4gnSyFt9k",16,https://ads.twitter.com
905620079269830656,2017-09-07 02:33:47,"@GreeGreece  Apologies Tony. Please DM your full name, post code and a contact phone number and we’ll look into it for you. ^Nishant.",0,http://www.hootsuite.com
905590821679980545,2017-09-07 00:37:31,@iwashere33  Apologies Sam. What type of form were you after? ^NP,0,http://www.hootsuite.com
905587617990754305,2017-09-07 00:24:47,"@jannkarp Hi Jann, could you provide us more details through DM of what Spam you have received? We're more than hap… https://t.co/iE1g8INlU8",0,http://twitter.com
905567415962087424,2017-09-06 23:04:31,@lensenvy  We do appreciate you taking some time out to provide the feedback. We have passed it on. ^NP,0,http://www.hootsuite.com
905556060076998656,2017-09-06 22:19:23,"@rexorbis  Hi Rex, we have now replied to your DM. ^NP",0,http://www.hootsuite.com
905547452337573892,2017-09-06 21:45:11,@LindaDHoward  Please accept our apologies. The feedback has already been sent to the Branch Manager of Morley Branch. ^NP,0,http://www.hootsuite.com
905514452807806977,2017-09-06 19:34:03,"@rexorbis Hi Rex, sorry we are unable to locate your original Tweet, can you please DM us some details so we can follow this up for you? ^JW",0,http://www.hootsuite.com
905469794857742336,2017-09-06 16:36:36,"@WhiteMale9000  Hi, we are sorry you feel this way.  If there is anything we can help with please let us know. ^JW",0,http://www.hootsuite.com
905446233938030594,2017-09-06 15:02:59,"@liamhaswings Hi Liam, we would be happy to look into this for you. Please DM your full name, postcode and contact number. ^JW",0,http://www.hootsuite.com
905405268581908480,2017-09-06 12:20:12,"@adrianstep Hi Adrian, we can look into your enquiry. Please DM your full name,post code and phone number. ^RM",0,http://www.hootsuite.com
905403060951941120,2017-09-06 12:11:25,"@LindaDHoward Hi Linda, we are so sorry you waited that long in the branch. We will send the feedback to the branch. ^RM",0,http://www.hootsuite.com
905379984247635968,2017-09-06 10:39:44,"@TheLightJedi Hi Peter,it’s charged if you're overdrawn for more than $50.Pls DM your full name,post code &amp; phone number so we can check.^RM",0,http://www.hootsuite.com
905309930588131328,2017-09-06 06:01:21,"@studioprisoner Hi Josh, sorry to hear that you have to leave ANZ. Please DM your details so we can follow up for you. ^RM",0,http://www.hootsuite.com
905297042725097474,2017-09-06 05:10:09,"@awhipwell @ING_Aust @NAB Hi Alexander, thanks for your input, we will definitely put this into account and let our team know. ^JG",0,http://twitter.com
905296669121662976,2017-09-06 05:08:40,"@jannkarp Hi Jann, we're currently looking into this for you &amp; will get back to you soon. ^JG",0,http://www.hootsuite.com
905265175057625089,2017-09-06 03:03:31,"@WeirdAndRetro Let me see what I can do to have this fixed. Pls DM your full name, postcode and contact number. ^MM",0,http://www.hootsuite.com
905264848120025091,2017-09-06 03:02:13,"@gwakelin Hi Grant let me follow this up for you. Please send us a DM with full name, postcode and contact number. ^MM",0,http://www.hootsuite.com
905263750269341696,2017-09-06 02:57:51,"@andiee71 Let me follow this up for you. Pls DM you full name, postcode and contact number. ^MM",0,http://www.hootsuite.com
905206868255133697,2017-09-05 23:11:49,"@s______w______s Let me follow this up for you immediately. Please DM your full name, postcode and contact number. ^MM",0,http://www.hootsuite.com
905203955503841281,2017-09-05 23:00:15,@BeauGiles @Steve_Price_ @MattBuck76 @CommBank @Bankwest Blue (and rainbow 🌈) looks good on you Beau 👍😊,0,http://twitter.com/download/iphone
905197706330570752,2017-09-05 22:35:25,"@helen_HMA @ArtGalleryofNSW Yes, you can do that too! 😀#ANZApplePay ^JG",0,http://twitter.com
905196756895334400,2017-09-05 22:31:39,"@danieljohnyoung @ArtGalleryofNSW Hi Daniel, it's filmed in Hi-Res, we recommend viewing it while connected to WiFi… https://t.co/VQ7v5FUc7V",0,http://twitter.com
905174118198280192,2017-09-05 21:01:41,"@edgarchieng Hi Edgar, we apologise for the inconvenience, I have passed on your feedback to our team. ^MM",0,http://www.hootsuite.com
905157776997056512,2017-09-05 19:56:45,@edgarchieng Thanks for your feedback Edgar. We appreciate it and we’ll be sure to pass it on. ^NK,0,http://www.hootsuite.com
905049888467165185,2017-09-05 12:48:03,"@JayJKelley @CIOonline Hi, Thanks for contacting us, our fraud team is aware of this and looking into this. ^PD",0,http://www.hootsuite.com
905011930758340608,2017-09-05 10:17:13,"@SarahMaeAbRod Hi there, we are sorry for the delay. Can you please DM your full name, post code and phone number so we can follow up? ^RM",0,http://www.hootsuite.com
905006600447856641,2017-09-05 09:56:02,"@ghbrougham @bergeSok @ElliottShayne Hi George, it appears that your issue has been resolved via phone and DM, if y… https://t.co/6hLLShdPMf",0,http://twitter.com/download/iphone
904985784075345920,2017-09-05 08:33:19,"@verylongbloke @CIOonline Hi, Thanks for contacting us, our fraud team is aware of this and looking into this. ^PD",0,http://www.hootsuite.com
904985717973155840,2017-09-05 08:33:03,"@guypl @CIOonline Hi, Thanks for contacting us, our fraud team is aware of this and looking into this. ^PD",0,http://www.hootsuite.com
904981793530667008,2017-09-05 08:17:27,"@dave_whiteway Thanks Dave, we will pass on your feedback to the Claremont branch regarding this. ^PD",0,http://www.hootsuite.com
904946759142707200,2017-09-05 05:58:15,"@JamesACrabtree Hi James, please DM your Full Name, Postcode &amp; Ph no &amp; we can get the discharge team to look into this further. ^PD",0,http://www.hootsuite.com
904945372191219713,2017-09-05 05:52:44,"@dave_whiteway Hi Dave, thanks for your patience, can you please let us know which branch this was at so we can pass on the feedback. ^PD",0,http://www.hootsuite.com
904934468972036096,2017-09-05 05:09:24,"@JohnFeeney10 @MoonSunTruth Not at all, it's simply talking about our #FirstHomeCoach who'll guide you through the… https://t.co/1uqqf1Lcb0",0,http://twitter.com
904914115013070848,2017-09-05 03:48:32,"@hugojmd you have lost your voice, you can still use ANZ Internet Banking without Voice ID to transfer larger funds. ^MM",0,http://www.hootsuite.com
904914067109822466,2017-09-05 03:48:20,"@hugojmd Whenever the amount is above the limit for ANZ Grow, you can enable Voice ID to go over this limit. If for some reason (1/2)",0,http://www.hootsuite.com
904887872804794368,2017-09-05 02:04:15,"@ghbrougham Hi George, let me follow this up for you and see what the status is. Pls DM your full name, postcode &amp; contact no. ^MM",0,http://www.hootsuite.com
904876762152259584,2017-09-05 01:20:06,"@Alex08651648 Hi Alex, thanks for your input with regards to this, we will pass it on to our team to improve our services. ^JG",0,http://www.hootsuite.com
904876383750500352,2017-09-05 01:18:36,@hugojmd hard to imitate you or use pre-recorded audio of your voice. (2/2) ^JG,0,http://www.hootsuite.com
904876310052339712,2017-09-05 01:18:18,"@hugojmd Voice ID uses advanced biometric security to verify your voice based on hundreds of unique characteristics, this makes it (1/2)",0,http://www.hootsuite.com
904847978283753472,2017-09-04 23:25:43,Show your ANZ card at @ArtGalleryOfNSW this weekend to see the #ArchibaldPrize for free #ProudPresentingPartner… https://t.co/bjLcFksmLX,65,https://studio.twitter.com
904833685056352256,2017-09-04 22:28:56,"@sortova Hi Tarus, we are sorry to hear. Pls DM your full name postcode &amp; contact no. I’ll follow this up for you to have this resolved! ^MM",0,http://www.hootsuite.com
904716795935850496,2017-09-04 14:44:27,"@AndyyHope @TimOliverAU Hi Andyy, we’d love to have you on board, opening accounts and switching is easy https://t.co/8Dm8L68LwF ^NK",0,http://www.hootsuite.com
904716325683171330,2017-09-04 14:42:35,"@rl_leah Hi Leia, thanks for the positive feedback, we do our best to help where we can. ^NK",0,http://www.hootsuite.com
904706218127712258,2017-09-04 14:02:25,"@PaulPitkethly Hi Paul, we’d love to have you. Send us a DM with your details if you’d like to be contacted about switching to ANZ. ^NK",0,http://www.hootsuite.com
904703994563612672,2017-09-04 13:53:35,"@babsncats Hi Barbara, thanks for your feedback, we’ve passed this on to the Boronia branch on your behalf. ^NK",0,http://www.hootsuite.com
904662310647734273,2017-09-04 11:07:57,"@andychilton @ANZ_NZ Not a problem Andrew, we appreciate your concerns. ^RM",0,http://www.hootsuite.com
904661119922470913,2017-09-04 11:03:13,"@cuzza Hi Ben, we understand your concerns and we noted it. Rest assured that we treat internet banking security very seriously. ^RM",0,http://www.hootsuite.com
904657797723410432,2017-09-04 10:50:01,"@andychilton If you are with ANZ AU, being investigated and would like to confirm that your details are safe. 2/2 ^RM",0,http://www.hootsuite.com
904657700738490368,2017-09-04 10:49:38,"@andychilton Hi Andrew, can you confirm if your account is ANZ AU or NZ? The screenshot is referring to the ANZ NZ website. 1 / 2",0,http://www.hootsuite.com
904655990406172676,2017-09-04 10:42:50,"@5UNDER7 We apologise for the inconvenience.Pls DM us the enquiry along with your full name,post code &amp; phone number to assist further. ^RM",0,http://www.hootsuite.com
904643270818582528,2017-09-04 09:52:17,"@NadiaElizabethV Hi Nadia, we are sorry for this. Please DM your full name, post code and phone number to assist you further. ^RM",0,http://www.hootsuite.com
904642630067290112,2017-09-04 09:49:45,"@theinnercall Hi Glen,it’s a simple &amp; secure biometric security.Note that it’s an added security &amp; won’t replace existing security method^RM",0,http://www.hootsuite.com
904638910537637888,2017-09-04 09:34:58,@TimOliverAU @lordmortis Let us know if we can be of any assistance arranging a personal banker for you Tim. We are happy to call. ^RM,0,http://www.hootsuite.com
904606154218766336,2017-09-04 07:24:48,"@HenryPeacock Regarding your previous post Henry, the branch will need identification to release the card for security. ^RM",0,http://www.hootsuite.com
904603412779683840,2017-09-04 07:13:54,"@mattkocaj @troyhunt Hi Matt, please DM the browser you're using &amp; the version of the browser so we can investigate further. ^RM",0,http://www.hootsuite.com
904596051126095872,2017-09-04 06:44:39,"@Sigmatic_Minor Hi Hannah, we can arrange a personal banker to give you a call if you want.Please DM your details if you want a callback.^RM",0,http://www.hootsuite.com
904595097458810880,2017-09-04 06:40:52,@HenryPeacock We just saw your most recent Tweet. Apologise for asking if you got the card in my previous response. ^RM,0,http://www.hootsuite.com
904595035726819330,2017-09-04 06:40:37,"@clemyeung You're welcome, Clem. Hope you had a great Father's Day celebration! 👌^JG",0,http://twitter.com
904594748199104513,2017-09-04 06:39:29,"@HenryPeacock Hi Henry,pls DM your details if we can be of any assistance.Were you able to pick up the card?We can follow up if needed.^RM",0,http://www.hootsuite.com
904594617013755904,2017-09-04 06:38:57,"@Tony252955 There's nothing like a good laugh, Anthony 😁 ^JG",0,http://twitter.com
904578691258347521,2017-09-04 05:35:40,"@mattkocaj @troyhunt Hi Matt, we understand your concerns. Are you still having problems logging in? Please DM us to look into this. ^RM",0,http://www.hootsuite.com
904577593965506560,2017-09-04 05:31:19,"@LukeSmorgon Hi Luke, are you referring to a Share Investment held in another name? Please DM us if you’d like us to look into it. ^RM",0,http://www.hootsuite.com
904576527576248321,2017-09-04 05:27:05,"@DanielHillAU Hi Daniel, sorry to hear about your disappointment. We will pass this on. If we can be of any assistance please DM us. ^RM",0,http://www.hootsuite.com
904575152511483904,2017-09-04 05:21:37,"@bouncinbinsoy Hi Vince, please refer to the link below. There is also a contact link for more information. ^RM
https://t.co/scnyIuVXDN",0,http://www.hootsuite.com
904554125173633024,2017-09-04 03:58:03,"@timgws Hi Tim, we have just replied to your DM. We apologise for the inconvenience. A fix has been raised immediately to resolve this. ^MM",0,http://www.hootsuite.com
904553616438169600,2017-09-04 03:56:02,@mattkocaj Hi Matt an update occurred this weekend on our website which caused this error. A fix has been raised to get this rectified. ^MM,0,http://www.hootsuite.com
904537660215050241,2017-09-04 02:52:38,RT @ElliottShayne: Super exciting to see @ANZ_AU launch Voice ID today. Another leap forward making payments even easier and more secure ht…,71,http://twitter.com/download/iphone
904532136815988736,2017-09-04 02:30:41,"@timgws  No worries Tim, let us know if the issue continues and we will follow this up for you. ^MM",0,http://www.hootsuite.com
904526141955993600,2017-09-04 02:06:52,"@timgws Hi Tim, let me follow this up for you. Pls DM your full name, postcode &amp; contact no. ^MM",0,http://www.hootsuite.com
904507737081495557,2017-09-04 00:53:44,"@aubeachbum Hi David, thanks for your feedback. Which area did you have in mind? We will pass on your feedback to our team. ^JG",0,http://twitter.com
904505921467908096,2017-09-04 00:46:31,"@rosie6172 @SimonBurke We totally agree with you, Rosie! Glad you had a good laugh 😁^JG",0,http://twitter.com
904502267948130304,2017-09-04 00:32:00,"@VarunV3rma We're so glad to have you, hope you had a great Father's Day 😁^JG",0,http://twitter.com
904502013882400769,2017-09-04 00:30:59,"@jimibeavis Hi Jim, thanks for that, we'll pass it on to our team. ^JG",0,http://www.hootsuite.com
904501705965842432,2017-09-04 00:29:46,@Yvresse69 We're so glad to hear we made you laugh 😀 Hope you have the best day. ^JG,0,http://twitter.com
904496122953129985,2017-09-04 00:07:35,@chan478 Hi Chan I can organise a Personal Banker to help you find the right card for you. Pls DM your full name postcode contact no  ^MM,0,http://www.hootsuite.com
904491089037475840,2017-09-03 23:47:34,"Introducing #VoiceID on Grow by ANZ. Our customers can now make secure, high value payments on mobile. Learn how:… https://t.co/NXncJVzunn",39,https://ads.twitter.com
904405055578759170,2017-09-03 18:05:42,"@kingjdo Hi, we have replied to your DM. ^JW",0,http://www.hootsuite.com
904265274253340672,2017-09-03 08:50:16,@LGBTTravel01 We are glad you liked it and thanks for the feedback! ^RM,0,http://www.hootsuite.com
904182068376162305,2017-09-03 03:19:38,@Justice4TiagoG  We are sorry but we didn’t understand your enquiry. Please tell us about your enquiry in English. ^NP,0,http://www.hootsuite.com
904173739079761921,2017-09-03 02:46:32,"@AussieCozy  Not a problem Aj, have a great rest of the weekend. ^NP",0,http://www.hootsuite.com
904165782514532352,2017-09-03 02:14:55,@AussieCozy  It should fix the issue. 2/2 ^NP,0,http://www.hootsuite.com
904165751648608256,2017-09-03 02:14:48,@AussieCozy  On the error screen please click on ‘Advanced’ button and then click on 'Add exception and Confirm Security Exception'. 1/2 ^NP,0,http://www.hootsuite.com
904123226749407232,2017-09-02 23:25:49,"@jimibeavis Good pick up! Sorry about that one, you're right it should be 'gets'",1,http://twitter.com/download/iphone
904120767859875840,2017-09-02 23:16:03,@alsterbeck  Please also try clearing cache/cookies/history or try using a different browser. ^NP,0,http://www.hootsuite.com
904120730065010692,2017-09-02 23:15:54,@mirrormatt86  Please also try clearing cache/cookies/history or try using a different browser. ^NP,0,http://www.hootsuite.com
904113149703581696,2017-09-02 22:45:47,@alsterbeck  It is browser related issue. Please update the browser or change security settings on it and see how you go. ^NP,0,http://www.hootsuite.com
904111991014518785,2017-09-02 22:41:10,"@mirrormatt86  Hi Matt, this is a browser issue. Please update the browser or change the security settings on it and you’ll be fine. ^NP",0,http://www.hootsuite.com
904058007184596992,2017-09-02 19:06:40,We asked some dads around the office for their best dad jokes.. this is all they could come up with #HappyFathersDay https://t.co/8D71dowDDj,178,http://twitter.com/download/iphone
903899092211961857,2017-09-02 08:35:11,"@HenryPeacock  Apologies Henry, We are happy to look into those fees for u pls DM ur full name, postcode &amp; contact number ^EC",0,http://www.hootsuite.com
903853815841120256,2017-09-02 05:35:17,"@Toonlancer  Hi John, ANZ internet banking is not experiencing technical issues . It could be ur browser/ internet connectivity related. ^EC",0,http://www.hootsuite.com
903707582501617664,2017-09-01 19:54:12,"@smokingwheels Hi, you can correspond with ANZ through SecureMail via your Internet Banking. ^JB",0,http://www.hootsuite.com
903624478269337600,2017-09-01 14:23:58,"@Emmjo27 Hi, we have responded via direct message. ^JB",0,http://www.hootsuite.com
903578813296250881,2017-09-01 11:22:31,@kingjdo Hi can u please DM us your details including your oseas No. and we’ll call u and put you in touch with our credit cards team. ^CC,0,http://www.hootsuite.com
903578148599734272,2017-09-01 11:19:52,@romant Hi Roman we’re sorry to see that you’ve had some problems with VBV. Can u please DM us your details so we can investigate? ^CC,0,http://www.hootsuite.com
903533860964663299,2017-09-01 08:23:53,@kylieanne221 Thanks for the info we’ll have this looked in to. ^CC,0,http://www.hootsuite.com
903531891000782850,2017-09-01 08:16:04,@kylieanne221 Hi we apologise for the inconvenience. Can you please let us know the location and we can have it checked out? ^CC,0,http://www.hootsuite.com
903531363348959232,2017-09-01 08:13:58,"@kathleengadalof Thanks Kathleen, very glad to help out. Please let us know if we can help with anything else. ^CC",0,http://www.hootsuite.com
903465311025762304,2017-09-01 03:51:30,@dave_whiteway Hi Dave sorry for the inconvenience. I’ll forward on your feedback to our branch straight away. ^Michael,0,http://www.hootsuite.com
903450976404758528,2017-09-01 02:54:32,First home feeling impossible? Not if we can help it. Talk to an ANZ First Home Coach today. #FirstHomeCoach https://t.co/f0J26ZfmM4,72,https://ads.twitter.com
903437392379510784,2017-09-01 02:00:34,@jgwongau Thanks for the feedback! I’ll forward this through to our Internet Banking team regarding this matter. ^MM,0,http://www.hootsuite.com
903402355349180418,2017-08-31 23:41:20,"@AdmiralW238 Hi Gary, that looks like a hoax! Pls send to hoax@cybersecurity.anz.com and delete email once sent. ^MM",0,http://www.hootsuite.com
903389723854610433,2017-08-31 22:51:08,"@AlexZoot Hi Alex, if you need any help to discuss your needs further with us, pls DM your full name postcode &amp; contact no ^MM",0,http://www.hootsuite.com
903381339545763840,2017-08-31 22:17:50,"@martyvis Hi Martin, please DM your full name postcode &amp; contact no, so I can escalate this matter further and have this fixed for you. ^MM",0,http://www.hootsuite.com
903379576184823808,2017-08-31 22:10:49,@HSydneyHC Pls DM your full name postcode &amp; contact no as this issue may be user based and we need to make sure this issue is resolved. ^MM,0,http://www.hootsuite.com
903370597048229892,2017-08-31 21:35:08,@HSydneyHC We are sorry to hear about this. I’ll speak to our ANZ Share Investment team and have this issue escalated. ^MM,0,http://www.hootsuite.com
903208280725520386,2017-08-31 10:50:09,"@Katt72 Hi Katrina, the email is a hoax, please delete it. ^EC",0,http://www.hootsuite.com
903127240535355392,2017-08-31 05:28:08,@chriskelly83 Please send the pics and then delete the email once sent. Remember to scan your device to make sure its safe. Thanks Chris ^MM,0,http://www.hootsuite.com
903126835537596418,2017-08-31 05:26:31,"@nathanoldfield6 always contact us directly on 13 13 14, from overseas +613 9683 9999, available from 7am to 10pm, 7 days a week. ^MM (2/2)",0,http://www.hootsuite.com
903126754335883264,2017-08-31 05:26:12,"@nathanoldfield6 We have different departments who use different domains to send email’s to our customers. If unsure, you can (1/2)",0,http://www.hootsuite.com
903102576719273988,2017-08-31 03:50:07,"@nathanoldfield6 Hi Nathan, sounds like a hoax. Pls send copy at hoax@cybersecurity.anz.com, delete email and run virus scan once sent. ^MM",1,http://www.hootsuite.com
903102000975499265,2017-08-31 03:47:50,"@chriskelly83 Hi Chris, looks like a hoax Pls send copy at hoax@cybersecurity.anz.com and delete email once sent. Pls also run virus scan^MM",1,http://www.hootsuite.com
903078771120582656,2017-08-31 02:15:32,@AidenHowlett  but will keep you posted on any changes! ^MM (2/2),0,http://www.hootsuite.com
903078666699239424,2017-08-31 02:15:07,"@AidenHowlett Hi Aiden! I’ll send your feedback through regarding this. At this stage, we yet to have this feature on Android (1/2)",0,http://www.hootsuite.com
903076763315707904,2017-08-31 02:07:33,"@thecwordagency We are sorry to hear about this, please DM your full name postcode &amp; contact no &amp; I can certainly follow this up for you ^MM",0,http://www.hootsuite.com
903051715833933824,2017-08-31 00:28:01,"@Rampant111 Please DM your full name, postcode &amp; contact no if there's anything we can do to help. ^MM (2/2)",0,http://www.hootsuite.com
903051460438622208,2017-08-31 00:27:00,"@Rampant111 Hi Peter, apologies for the inconvenience, I’ve forwarded on your feedback to our team (1/2)",0,http://www.hootsuite.com
903034563596865536,2017-08-30 23:19:52,"@atomicsecretspy Hi Brant, we can call you and provide these details straight away. Pls send a DM with full name, postcode &amp; contact no. ^MM",0,http://www.hootsuite.com
903032355992064001,2017-08-30 23:11:05,@brockhenry Hi Brock pls send a DM with full name postcode &amp; contact no so we can load a travel note as the card may be blocked. ^MM,0,http://www.hootsuite.com
902861232776114177,2017-08-30 11:51:06,"@42piyush Hi Piyush,  it will cost you $18.00 on internet, link attached for rates banking, https://t.co/gOrF0NylJC ^PD",0,http://www.hootsuite.com
