Tweet id,Created Time,Tweet Details,Retweet counts,Source URL
858967044699684864,2017-05-01 08:51:16,"@mysteryhunt Hi Liz, the ANZ website is working from our end. Are you able to DM us if you still having troubles logging on?^RM",0,http://www.hootsuite.com
858884618761768960,2017-05-01 03:23:45,"@rachannily Hi Rachael, can you pls DM us with your full name, postcode, contact number. We can arrange for a call back to you. ^CM",0,http://www.hootsuite.com
858874251855659008,2017-05-01 02:42:33,"@jenanistons Hi Jess, can you pls DM us with your full name, postcode, contact number. We will reply to your securemail request. ^CM",0,http://www.hootsuite.com
858866575432089600,2017-05-01 02:12:03,"@thanodr Hi Merrin, unfortunately you will not be able to use your Salary Packaging card with any of our Mobile app’s. ^CM",0,http://www.hootsuite.com
858864623025442816,2017-05-01 02:04:17,@nathmallon @Westpac @BankofMelb If you need a hand with the switch just let us know Nath! I'm sure you'll love #ANZApplePay 😊,0,http://twitter.com
858821324512165892,2017-04-30 23:12:14,@duggythicc @CommBank We can get you started with #ANZApplePay - just drop us a DM if you want to chat 😊,0,http://twitter.com
858705260126273538,2017-04-30 15:31:02,"@shawnleecl Hi Shawn, it should be ok. What happens when you try to gain access, are you getting any error messages? ^NK",0,http://www.hootsuite.com
858667311976329216,2017-04-30 13:00:15,"@Jezwyn  Hi Miss Jess, we have not received any of the details we have requested via DM in order to assist with your enquiry. 1/5^EC",0,http://www.hootsuite.com
858667311682736128,2017-04-30 13:00:15,@Jezwyn  Unfortunately we cannot assist u if you do not provide us the details we have requested. 2/5 ^EC,0,http://www.hootsuite.com
858667310269247489,2017-04-30 13:00:14,@Jezwyn Regretfully we will not be able to further assist with your enquiry via Twitter. 3/5 ^EC,0,http://www.hootsuite.com
858667309212340226,2017-04-30 13:00:14,"@itsjacob17 @SamsungAU @SamsungPay @CommBank  Hi Jacob, at this stage we do not support Samsung Pay but we do offer Android Pay. ^EC",0,http://www.hootsuite.com
858667309078118400,2017-04-30 13:00:14,@Jezwyn  Or please wait for the SecureMail Team to respond to your enquiry in 2 business days. Have a great Night. 5/5 ^EC,0,http://www.hootsuite.com
858667309027786752,2017-04-30 13:00:14,"@Jezwyn  Alternatively for further assistance you may contact our Internet Banking Team on 13 33 50, 7am-10pm, AEST, 7days.  4/5^EC",0,http://www.hootsuite.com
858652204424679424,2017-04-30 12:00:13,@Jezwyn  Or please wait for the SecureMail Team to reply to your enquiry in 2 business days. 5/6 ^EC,0,http://www.hootsuite.com
858652203548127233,2017-04-30 12:00:12,"@Jezwyn We cannot discuss your enquiry via Twitter due to security reasons, as we do need to identify who you are? 2/6 ^EC",0,http://www.hootsuite.com
858652203166334976,2017-04-30 12:00:12,"@Jezwyn  Hi Miss Jess, we have not received any messages from you via DM. 1/6 ^EC",0,http://www.hootsuite.com
858652203099332609,2017-04-30 12:00:12,"@Jezwyn  Alternatively please contact our Internet Banking Team on 13 33 50, 7am-10pm, AEST, 7days. 4/6 ^EC",0,http://www.hootsuite.com
858652203057283073,2017-04-30 12:00:12,"@Jezwyn  DM your full name, postcode, contact number &amp; a suitable time to call. 4/6 ^EC",0,http://www.hootsuite.com
858652202864390145,2017-04-30 12:00:12,@Jezwyn  If you wish we are happy to call you to discuss your enquiry 3/6 ^EC,0,http://www.hootsuite.com
858637490298552320,2017-04-30 11:01:45,"@Jezwyn And identify who you are? Please contact Internet banking on 13 33 50, 7am-10pm, AEST, 7days for further assistance 2/3 ^EC",0,http://twitter.com/download/iphone
858637095484739584,2017-04-30 11:00:10,@Jezwyn  In regards to your enquiry raised via SecureMail you should receive a response in 2 business days. 3/3 ^EC,0,http://www.hootsuite.com
858637094310346752,2017-04-30 11:00:10,"@Jezwyn  So sorry, your enquiry cannot be resolved via Twitter due to security reason, we do need to speak with u directly 1/3 ^EC",0,http://www.hootsuite.com
858622011823845376,2017-04-30 10:00:14,"@Jezwyn  Hi There, we are sorry to hear abt this, pls call Internet Banking on 13 33 50, 7am-10pm, AEST, 7days for further assistance. ^EC",0,http://www.hootsuite.com
858584230271606785,2017-04-30 07:30:06,"@DannyjClayton  Hi Danny, Thanks for letting us know, we are aware of this hoax text targeting both ANZ &amp; Non ANZ Customers. ^EC",1,http://www.hootsuite.com
858472434953015296,2017-04-30 00:05:52,@seceng11 We can investigate further for you. 2/2 ^CM,0,http://www.hootsuite.com
858472345010397184,2017-04-30 00:05:31,"@seceng11 Hi, we will pass on your feedback. Can you pls DM us with your full name, postcode, contact no. ½",0,http://www.hootsuite.com
858455820538871808,2017-04-29 22:59:51,"@fotomarz Hi, we have sent your feedback to our ATM Service team. They will investigate the issue. ^CM",0,http://www.hootsuite.com
858306294511480833,2017-04-29 13:05:41,"@thomassenland Hi Adele, sorry for the delay, send your DASP to Superannuation Enquiry Centre: GPO Box 4028, Sydney NSW 2001. ^NK",0,http://www.hootsuite.com
858260005895655424,2017-04-29 10:01:45,"@PetesSchmidt Hi There, thank you for letting us know, the text is a scam, pls do not click on the link, delete the text please. ^EC",0,http://twitter.com/download/iphone
858244507871182848,2017-04-29 09:00:10,"@tintinaujapon HI Brendan, DM ur full name, postcode &amp; contact number so that we can get the technical team to investigate this for u.^EC",0,http://www.hootsuite.com
858235007206404096,2017-04-29 08:22:25,"@nervous_twittch Hi there, its definitely a scam txt thanks for letting us know, please delete it^EC",0,http://www.hootsuite.com
858173432911060992,2017-04-29 04:17:45,"@tintinaujapon  What do you click on to call us from the App. Do you go through Help? Also, what type of device do you have. ^NP",0,http://www.hootsuite.com
858161065187782656,2017-04-29 03:28:36,@correzpond  Apologies Correz. Please provide some more information on the enquiry and the type of card you are referring to. ^NP,0,http://www.hootsuite.com
858155455780192256,2017-04-29 03:06:19,@tintinaujapon  Thanks Brendan. We just checked it and it did call 13 33 50. Is your app updated? ^NP,0,http://www.hootsuite.com
858144724674379776,2017-04-29 02:23:40,@tintinaujapon  Thanks for bringing this to our attention. Which app did you dial through? Was it goMoney or GROW? ^NP,0,http://www.hootsuite.com
858144064746770432,2017-04-29 02:21:03,"@Kellinthenameof  Hi Kellin, please DM your full name, post code and a contact phone number and we’ll look into this for you. ^NP",0,http://www.hootsuite.com
858105200896352256,2017-04-28 23:46:37,"@ShaeTeagan  Apologies, if you have had a bad experience. Please tell us if we could assist with anything. ^NP",0,http://www.hootsuite.com
857938729272565761,2017-04-28 12:45:07,"@yuvi78 Hi Ravi, please contact Credit Card Assessments on 1800 092 098, 8am - 7pm Mon-Fri AEST, ^EC",0,http://www.hootsuite.com
857909089732624384,2017-04-28 10:47:20,@bensonsaulo Thanks for the update Benson have a great night.^EC,0,http://www.hootsuite.com
857898450377203712,2017-04-28 10:05:04,"@bensonsaulo Apologies for the delayed response pls contact Customer Service on 13 13 14, 7am-10pm,AEST,7days ^EC",0,http://www.hootsuite.com
857851502609801216,2017-04-28 06:58:30,"@LordPhantom Hi Matthew, glad to hear that your online statements are available on your internet banking. ^EC",0,http://www.hootsuite.com
857851407029993472,2017-04-28 06:58:08,"@MollyAdelaide Apologies for the long wait times Molly, we hope u were able to get in touch with our Settlements Team. ^EC",0,http://www.hootsuite.com
857832164708188160,2017-04-28 05:41:40,RT @ElliottShayne: Small business is key to economy and we are determined to make @ANZ_AU the best small business bank. Easiest. Fairest. C…,39,http://www.hootsuite.com
857820534217744385,2017-04-28 04:55:27,"@TryManson Yes we did, the change only impacts future fixed rate home loan customers &amp; not our existing customers",0,http://twitter.com
857807169680494593,2017-04-28 04:02:21,@mattlangtree Pls delete the msg and scan your phone just to make sure everything is safe. (2/2) ^MM,0,http://www.hootsuite.com
857807077544263681,2017-04-28 04:01:59,"@mattlangtree Hi Matt, thanks for the heads up! If possible, pls send this screenshot to our team hoax@cybersecurity.anz.com. (1/2)",0,http://www.hootsuite.com
857805246592147457,2017-04-28 03:54:42,"@maru00x2 Hi Maru, we can take a look closer and see what we can do, pls send us a DM with your full name, postcode and contact #, ^MM",0,http://www.hootsuite.com
857804666561757187,2017-04-28 03:52:24,@pauld08 I have forwarded this on to the branch. Thanks for the feedback! (2/2) ^MM,0,http://www.hootsuite.com
857804543337406466,2017-04-28 03:51:55,"@pauld08 Hi Paul, we are ecstatic to hear that you received great service from Jessica at our ANZ Branch in Docklands. (1/2)",0,http://www.hootsuite.com
857573763357052928,2017-04-27 12:34:52,"@_lowtapuosi Hi sorry to hear this, can you please tell us the issue you were facing? ^PD",0,http://www.hootsuite.com
857573580942475264,2017-04-27 12:34:09,"@YumchaAddict Hi apologies for the issue, you can use Bpay over Internet banking on the website in the mean time. ^PD",0,http://www.hootsuite.com
857508697521704960,2017-04-27 08:16:19,@smokingwheels You are welcome. ^PD,0,http://www.hootsuite.com
857500538317004800,2017-04-27 07:43:54,"@HarryCook Hi Harry, we have replied to your DM. ^PD",0,http://www.hootsuite.com
857483632017100800,2017-04-27 06:36:43,@ChristoffBotha if not we can follow up for you. ^PD,0,http://www.hootsuite.com
857483473237536768,2017-04-27 06:36:05,"@ChristoffBotha Hi Chris, apologies for the wait over the phone, please let us know if you were able to get in touch with them 1/2 ^PD",0,http://www.hootsuite.com
857457105959354368,2017-04-27 04:51:19,@smokingwheels to check if calls are going through? Will note this down and see if it’s affecting anyone else. (3/3) ^MM,0,http://www.hootsuite.com
857457047155220480,2017-04-27 04:51:05,@smokingwheels It could possibly be an issue with your phone provider. Is it possible to contact your phone provider (2/3),0,http://www.hootsuite.com
857456994680283137,2017-04-27 04:50:52,"@smokingwheels Hi there, we currently have no issues with our contact number. That seems very strange. (1/3)",1,http://www.hootsuite.com
857428599258873857,2017-04-27 02:58:02,@TysvanderDrift @NAB @Westpac @Suncorp Personal Banker to give you a call. 2/2  ^CM,0,http://www.hootsuite.com
857428553993945089,2017-04-27 02:57:52,"@TysvanderDrift @NAB @Westpac @Suncorp Hi Tys, can you pls DM us with your full name, postcode, contact no. We can arrange for a ½",0,http://www.hootsuite.com
857426017710997504,2017-04-27 02:47:47,@rohankleem 2 Barrack Street – 388 George Street – 115 Pitt St. 2/2 ^CM,0,http://www.hootsuite.com
857425985419038720,2017-04-27 02:47:39,"@rohankleem Hi Rohan, we have a few in the surrounding area, not sure how far from where you are?
½",0,http://www.hootsuite.com
857411602555039744,2017-04-27 01:50:30,"@hariz_amirul94 Hi Hariz, is there an issue with your loan? Pls send us a DM with your full name, contact number and postcode. ^MM",0,http://www.hootsuite.com
857410809470885888,2017-04-27 01:47:21,"@hugobrown Hey Hugo, that’s right! The app will update later on with its own digital card number to use, while you wait for the card. ^MM",1,http://www.hootsuite.com
857406691389964288,2017-04-27 01:30:59,@hugobrown 15 minutes of replacing card. This however does not apply to Commercial or Corporate cards. (2/2) ^MM,0,http://www.hootsuite.com
857406490478596096,2017-04-27 01:30:11,"@hugobrown Hi Hugo, just to confirm you can use the your Android Pay or Apple Pay after a card has been replaced within approximately (1/2)",0,http://www.hootsuite.com
857404773905166336,2017-04-27 01:23:22,"@FenstarDeLuxe Hey Fen, we thank you for your patience. Will get this issue rectified as soon as possible! ^MM",0,http://www.hootsuite.com
857402409991020544,2017-04-27 01:13:58,RT @ANZ_BlueNotes: 📧 This week's newsletter: #SME success in #Asia. Get rid of #titles. Can #Amazon deliver? #Vanuatu + MORE! https://t.co/…,8,http://twitter.com/download/iphone
857398280896032768,2017-04-27 00:57:34,"@hugobrown Hi Hugo, you will have to wait for the card. ^CM",0,http://www.hootsuite.com
857397975248760832,2017-04-27 00:56:21,@FenstarDeLuxe Our technical team are working on a fix. Can you please try again later this afternoon? 2/2 ^CM,0,http://www.hootsuite.com
857397935562260480,2017-04-27 00:56:12,"@FenstarDeLuxe Hi Fen, apologies we are having issues with our Bpay payments in the GoMoney app at the moment. ½",0,http://www.hootsuite.com
857372280086822913,2017-04-26 23:14:15,"@shelliemcevoy Hi Shellie, understand your frustration, we will pass on your feedback. ^CM",0,http://www.hootsuite.com
857320448475922434,2017-04-26 19:48:17,"@MrRobbieCatMan HI Robbie, please DM your full name, postcode and contact number so we can advise you further, ^JW",0,http://www.hootsuite.com
857251403907178496,2017-04-26 15:13:56,"@ohmyzander Hi Zander, please DM your full name, post code and contact # so we can investigate this for you. ^JW",0,http://www.hootsuite.com
857245107967463425,2017-04-26 14:48:55,"@MIkeBernhardt5 Hi Mike, we have passed on your feedback to our digital development team. ^JW",1,http://www.hootsuite.com
857222621733236736,2017-04-26 13:19:34,@computerashleey We have passed on the details to our Marketing team. 2/2 JW,0,http://www.hootsuite.com
857220384952864770,2017-04-26 13:10:40,"@computerashleey Hi Ashleey, sincere apologies and thanks for bringing this to our attention. ½",0,http://www.hootsuite.com
857219376596086785,2017-04-26 13:06:40,"@Clarity_PRC @ElliottShayne Hi Clarity, please DM us your full name, postcode and contact# if you would like us to follow up on this. ^JW",0,http://www.hootsuite.com
857212802171375617,2017-04-26 12:40:32,"@Zevensoft Hi Timothy, sorry for the wait, unfortunately transactions are not processed on weekends and Public holidays. ^PD",0,http://www.hootsuite.com
857212375304417281,2017-04-26 12:38:51,@onewpc apologies again Wai. ^PD,0,http://www.hootsuite.com
857179955729510400,2017-04-26 10:30:01,"@onewpc Hi Wai, do you know what type of loan they are offering, please DM your Full Name, Postcode &amp; Ph no to opt out of marketing. ^PD",0,http://www.hootsuite.com
857150677423988739,2017-04-26 08:33:41,@FAotC a brief description of your enquiry so we can look into this for you. 2/2 ^PD,0,http://www.hootsuite.com
857150599414022146,2017-04-26 08:33:22,"@FAotC Hi, we are sorry to hear the experience you had over the phone Please DM your Full Name, Postcode &amp; Phone no &amp; 1/2 ^PD",0,http://www.hootsuite.com
857149763766153217,2017-04-26 08:30:03,"@NancyGeorges Hi Nancy, we can understand your frustration, we will pass on your feedback to the relevant team for future consideration. ^PD",0,http://www.hootsuite.com
857149083630391296,2017-04-26 08:27:21,@elisaiurato Credit card retention team on 1800064753 8am - 8pm AEST M-F to see if there is any special offers available on the account. ^PD,0,http://www.hootsuite.com
857148927098880002,2017-04-26 08:26:43,@elisaiurato Hi the changes are in relation to new card payment regulations being introduced later this year. You can speak to our 1/2 ^PD,0,http://www.hootsuite.com
857110468275691520,2017-04-26 05:53:54,"@markstott1980 please DM your Full Name, Postcode &amp; Ph no so we can look into this for you (2/2). ^PD",0,http://www.hootsuite.com
857110288847572993,2017-04-26 05:53:11,"@markstott1980 Hi, unfortunately it can't be switched back, we can load a temporary exemption, for this we need to speak to you (1/2) ^PD",0,http://www.hootsuite.com
857079476588613633,2017-04-26 03:50:45,@MollyAdelaide We can arrange for a Mortgage specialist to contact you. 2/2 ^CM,0,http://www.hootsuite.com
857079427913658368,2017-04-26 03:50:34,"@MollyAdelaide Hi Molly, sorry to hear about the long queues. Pls DM us with your full name, postcode, contact no. ½",0,http://www.hootsuite.com
857071084985884673,2017-04-26 03:17:24,"@sparkesy43 Hi Brad, correct, all of our cards now have PayWave. ^CM",0,http://www.hootsuite.com
857025842932854784,2017-04-26 00:17:38,"@mattpdunn Hi Matt, can you please DM us with your full name, postcode, contact no. We can give you a call and give you a telecode. ^CM",0,http://www.hootsuite.com
857022627566698496,2017-04-26 00:04:51,@leowings @CommBank You know where to find us when you're ready Leo!,0,http://twitter.com
857010884434157569,2017-04-25 23:18:11,"@Andyswordfish00 Hi Andy, due the National Public Holiday yesterday, no Bank processing was done. You pay may still go in today. ^CM",0,http://www.hootsuite.com
856754513654558721,2017-04-25 06:19:28,"@Hayden_B_Dalton Hi Hayden, all branches are closed today due to Public Holiday. ^PD",0,http://www.hootsuite.com
856738636632657920,2017-04-25 05:16:23,@TANYABussy  kindly refrain from using offensive language in future 2/2 . ^PD,0,http://www.hootsuite.com
856738443430436864,2017-04-25 05:15:37,"@TANYABussy Hi Tanya, please DM your Full Name, Postcode &amp; Ph no so we can look into this for you to see what we can do to assist 1/2. ^PD",0,http://www.hootsuite.com
856736779751346176,2017-04-25 05:09:00,"@LordPhantom Hi Mathew, yes they can, link attached for ID documents required  https://t.co/Pp8MV2EcIR ^PD",0,http://www.hootsuite.com
856688164504825858,2017-04-25 01:55:49,"@searzfm postcode, contact no. We can arrange for a call back. 2/2 ^CM",0,http://www.hootsuite.com
856688113372016640,2017-04-25 01:55:37,"@searzfm Hi Sears, you can contact our customer service team on 131314. Alternately, DM us with your full name, ½",0,http://www.hootsuite.com
856684125700456448,2017-04-25 01:39:46,"@searzfm Hi Sears, due the Public Holiday all of our ANZ Branches will be closed today. ^CM",0,http://www.hootsuite.com
856530891383992322,2017-04-24 15:30:52,"@neilmonks Hi Neil, the only number we have is + 44 0203 229 2121. ^JW",0,http://www.hootsuite.com
856425275265097730,2017-04-24 08:31:11,"@fatuglykid Hi James, please ask your friend to DM his Full Name, Postcode &amp; Phone no &amp; a brief description of the issue so we can check.^PD",0,http://www.hootsuite.com
856412190483599360,2017-04-24 07:39:12,"@KearrinSims Hi, we are sorry to hear this, we have replied to your PM on Facebook, if we can assist in any way please let us know. ^PD",0,http://www.hootsuite.com
856397845187973125,2017-04-24 06:42:12,"@CamCamWatt Hi, thanks for your feedback, we will surely pass it on to the relevant team for future consideration. ^PD",0,http://www.hootsuite.com
856382726651490304,2017-04-24 05:42:07,"@chunderchan Hi Jenny, we have replied to your DM. ^PD",0,http://www.hootsuite.com
856359425547923456,2017-04-24 04:09:32,@pattyspankpants happened? I’d love to have the opportunity to help get this rectified for you 2/2 ^KP,0,http://www.hootsuite.com
856359389455888384,2017-04-24 04:09:23,"@pattyspankpants Hi there, I am really sorry to hear this. Can you please DM us further information on what has ½",0,http://www.hootsuite.com
856356839977611265,2017-04-24 03:59:15,"@LordPhantom  Hi Mathew, are you able to send through a DM with your full name, contact number and postcode? ^Ash",0,http://www.hootsuite.com
856356441703186432,2017-04-24 03:57:40,"@LordPhantom  Hi Mathew,  are you able to send through a DM with your full name, contact number and postcode? ^Ash",0,http://www.hootsuite.com
856337548582506500,2017-04-24 02:42:36,"@SRGyory  Hi Stephen, we have notified the relevant team. We apologise for the inconvenience caused. ^Ash",0,http://www.hootsuite.com
856328111583088640,2017-04-24 02:05:06,"@MarkWCAU Hi Mark, transfers on weekends don’t get processed until the next business day. Processing for it will begin today ^KP",0,http://www.hootsuite.com
856321991934136320,2017-04-24 01:40:47,"@_cynnamonstix  Hi Cynthia, are you able to Direct Message us with your full name and contact number. We'd be happy to assist. ^Ash",0,http://www.hootsuite.com
856292638273785857,2017-04-23 23:44:08,@david_obrien  You can find this info. on &lt; https://t.co/DlmtpCTByV&gt; see under “International Money Transfers from overseas” ^Ash,0,http://www.hootsuite.com
856284749656190977,2017-04-23 23:12:47,"@david_obrien  Hi David, ANZ can charge up to $15 to process international transfers into your ANZ account in Australia.  ^Ash",0,http://www.hootsuite.com
856264911030276096,2017-04-23 21:53:58,"@randomknits Hi Donna, unfortunately it’s not compatible. I’m happy to take on the feedback though ^KP",0,http://www.hootsuite.com
856216513732386819,2017-04-23 18:41:39,@PKleka Here’s more information: https://t.co/N0VhNC0o03 2/2 ^NK,0,http://www.hootsuite.com
856216449324548096,2017-04-23 18:41:23,"@PKleka Hi Pawel, Travel Card can only be loaded via BPAY, Australia Post or ANZ Foreign Exchange Centre in Australia. 1/2 ^NK",0,http://www.hootsuite.com
856078210467061760,2017-04-23 09:32:05,"@kymazin  Hi Josh, we have replied to your DM ^EC",0,http://www.hootsuite.com
856043123855806464,2017-04-23 07:12:39,"@seceng11  Alternatively you may contact our Credit Card Team on 13 22 73, 7am-10pm, AEST, 7days to lodge a fraud report  2/2 ^EC",0,http://www.hootsuite.com
856043078771249152,2017-04-23 07:12:29,"@seceng11  Hi Seceng, please DM ur full name, postcode &amp; contact number so that we can investigate this for u ½ ^EC",0,http://www.hootsuite.com
855965100154507264,2017-04-23 02:02:37,"@RussellWAyres  Please DM your full name, post code and a contact phone number and we’ll look into it for you. ^NP",0,http://www.hootsuite.com
855957393645195264,2017-04-23 01:32:00,@RussellWAyres  At what stage are you getting this error? Is it after you put in your details or straight after you click on Register? ^NP,0,http://www.hootsuite.com
855944013458886656,2017-04-23 00:38:50,"@doylieboy1990  Hi Liam, please DM your full name, post code and a contact phone number and we’ll look into it for you. ^Nishant",0,http://www.hootsuite.com
855721490439974913,2017-04-22 09:54:36,"@AndresRome Thanks for the update Andres, wishing you a fun safe journey ^EC",0,http://www.hootsuite.com
855710131551707136,2017-04-22 09:09:28,"@AndresRome  or we are happy to call you please DM your full name, postcode &amp; contact number. 2/2 ^EC",0,http://www.hootsuite.com
855710065646592001,2017-04-22 09:09:12,"@AndresRome  Apologies for the long wait time Andres, u may send ur overseas notification by SecureMail via internet banking 1/2 ^EC",0,http://www.hootsuite.com
855709139380695041,2017-04-22 09:05:31,@JakeVarapodio contact number &amp; we will call u to activate ur card 2/2^EC,0,http://www.hootsuite.com
855709042500673536,2017-04-22 09:05:08,"@JakeVarapodio Apologies for the long wait times, u may also activate ur card via internet banking or pls DM ur full name, postcode, 1/2 ^EC",0,http://www.hootsuite.com
855634641952399362,2017-04-22 04:09:30,"@blakehhammond1  Hi Blake, please DM us your full name, post code and a contact phone number and we’ll look into it for you. ^Nishant",0,http://www.hootsuite.com
855627218516627456,2017-04-22 03:40:00,@che_fren   Please DM the requested info along with detailed info on the enquiry and we’ll check and see who is best able to assist you. ^NP,0,http://www.hootsuite.com
855608797582290944,2017-04-22 02:26:48,@EatWellTravOft   Please accept our apologies. Let us know if we could assist with anything in the future. ^NP,0,http://www.hootsuite.com
855608423894986752,2017-04-22 02:25:19,@MSY123  We are very sorry for long wait times. Please tell us if we could assist with anything. ^NP,0,http://www.hootsuite.com
855599277028114432,2017-04-22 01:48:58,"@che_fren  Hi Efren, pls DM your full name, post code, a phone no &amp; some more info on the enquiry &amp; we’ll look into it. ^NP",0,http://www.hootsuite.com
855598780464463872,2017-04-22 01:47:00,@jameskirsop  (from overseas +61 3 9683 7043) Mon-Fri 8am-8pm &amp; Sat-Sun 10am-6pm AEST. 2/2 ^NP,0,http://www.hootsuite.com
855598729939824641,2017-04-22 01:46:48,"@jameskirsop  Thanks James. In relation to this we’ll have to refer you to speak to Credit Card sales team on 13 33 33,  1/2 ^NP",0,http://www.hootsuite.com
855588242577666049,2017-04-22 01:05:07,@EatWellTravOft  Apologies. Please tell us if we could assist with anything. ^NP,0,http://www.hootsuite.com
855582315166261248,2017-04-22 00:41:34,"@jameskirsop   Hi James, please tell us which account/product are you applying for? ^NP",0,http://www.hootsuite.com
855392001507946497,2017-04-21 12:05:20,"@PaulPitkethly Hi, if you like to open an account and have a taste of apple pay,let us know &amp; we can get you in touch with our sales team^PD",0,http://www.hootsuite.com
855390463481843713,2017-04-21 11:59:13,@oztish Glad to hear it's working Tish. ^PD,0,http://www.hootsuite.com
855352869133877248,2017-04-21 09:29:50,"@oztish Hi our app seems to be working fine, what was the issue you were facing? ^PD",0,http://www.hootsuite.com
855352605102440448,2017-04-21 09:28:47,@DanielHillAU cont..offers available on the account. (2/2) ^PD,0,http://www.hootsuite.com
855352483060867072,2017-04-21 09:28:18,"@DanielHillAU Hi, You can speak to Credit card retention team on 1800064753 8am - 8pm AEST M-F to see if there is any special (1/2)",0,http://www.hootsuite.com
855315150248615937,2017-04-21 06:59:57,"@DanielHillAU Hi, we can understand your frustration, we will surely pass on your feedback to the relevant team for future consideration.^PD",0,http://www.hootsuite.com
