Tweet id,Created Time,Tweet Details,Retweet counts,Source URL
450390710378713089,2014-03-30 21:54:47,Electricity outage in Ringwood. Please call 131 799 and press option 3 for more info,0,http://twitter.com
450390661057888258,2014-03-30 21:54:36,Electricity outage in Cape Paterson. Please call 131 799 and press option 3 for more info,0,http://twitter.com
449205955700342784,2014-03-27 15:27:00,Electricity has been restored to Epping &amp; Lalor. Thank you for your patience,0,http://twitter.com
449152297939914752,2014-03-27 11:53:47,Electricity has been restored to Cape Paterson. Thank you for your patience,0,http://twitter.com
449124962855428096,2014-03-27 10:05:10,Electricity outage in Cape Paterson. Please call 131 799 and press option 3 for more info,0,http://twitter.com
449096564414226433,2014-03-27 08:12:19,Electricity outage in Epping &amp; Lalor. Please call 131 799 and press option 3 for more info,0,http://twitter.com
449049989356867585,2014-03-27 05:07:15,The planned electricity interruption in Selby today has been delayed. ETR: 18:30.,0,http://twitter.com
449046677416972288,2014-03-27 04:54:05,The planned electricity interruption in Rowville today has been delayed. ETR: 16:30.,0,http://twitter.com
449032192191000576,2014-03-27 03:56:31,The planned electricity interruption in Rosedale today has been delayed. ETR: 16:30.,0,http://twitter.com
448993910220537856,2014-03-27 01:24:24,Electricity has been restored to Yanakie. Thank you for your patience,0,http://twitter.com
448990190753697792,2014-03-27 01:09:37,"The planned electricity interruption in Diamond Creek, Hurtsbridge and Wattle Glen today has been cancelled.",0,http://twitter.com
448963254207799296,2014-03-26 23:22:35,The planned electricity interruption in Greta &amp; Greta West today has been cancelled.,0,http://twitter.com
448948221398634497,2014-03-26 22:22:51,The following Eletricty planned outages have been cancelled for today: El darado and Beechworth,0,http://twitter.com
448941232878657536,2014-03-26 21:55:05,Electricity outage in Fish Creek and surrounds. Please call 131 799 and press option 3 for more info,0,http://twitter.com
448906095705063424,2014-03-26 19:35:28,Electricity outage in Strathbogie and surrounds. Please call 131 799 and press option 3 for more info,0,http://twitter.com
448791251169456128,2014-03-26 11:59:07,Electricity has been restored to Eltham North. Thank you for your patience,0,http://twitter.com
448788935531974657,2014-03-26 11:49:54,Electricity has been restored to Heyfield. Thank you for your patience,0,http://twitter.com
448757380491116544,2014-03-26 09:44:31,"Electricity has been restored to Bruthen, Benambra &amp; Hinnomunjie and surrounds. Thank you for your patience",0,http://twitter.com
448750312006758400,2014-03-26 09:16:26,Electricity outage in Eltham North. Please call 131 799 and press option 3 for more info,0,http://twitter.com
448746416081338368,2014-03-26 09:00:57,Electricity outage in Heyfield. Please call 131 799 and press option 3 for more info,0,http://twitter.com
448725542510919680,2014-03-26 07:38:00,"Electricity outage in Bruthen, Benambra and Hinnomunjie. Please call 131 799 and press option 3 for more info",0,http://twitter.com
448677490681081856,2014-03-26 04:27:04,The planned electricity interruption in Mangalore today has been delayed. ETR 16:30,0,http://twitter.com
448671091523735552,2014-03-26 04:01:38,The planned electricity interruption in Montrose today has been delayed. ETR 16:30,0,http://twitter.com
447579419389882368,2014-03-23 03:43:43,The planned electricity interruption in Wangaratta and surrounds today has been delayed. ETR 17:00,1,http://twitter.com
447452319861309440,2014-03-22 19:18:40,Electricity has been restored to Myrtleford and surrounds. Thank you for your patience,0,http://twitter.com
447248780547473409,2014-03-22 05:49:53,Electricity outage in Myrtleford and surrounds. Please call 131 799 and press option 3 for more info,0,http://twitter.com
446880736641949696,2014-03-21 05:27:24,"The planned electricity interruption in Neerim Junction, Icy Creek and surrounds  today has been delayed. ETR 17:30",0,http://twitter.com
446843942235942913,2014-03-21 03:01:12,The planned electricity interruption in Ferntree Gully today has been cancelled.,0,http://twitter.com
446722765421170689,2014-03-20 18:59:41,Electricity has been restored to Boronia. Thank you for your patience,0,http://twitter.com
446665974511452160,2014-03-20 15:14:01,Electricity outage in Boronia. Please call 131 799 and press option 3 for more info,0,http://twitter.com
446313334166392832,2014-03-19 15:52:45,"The planned electricity interruption in Ringwood East, Croydon &amp; Croydon South today has been cancelled. 394 customers affected.",0,http://twitter.com
446142766158860288,2014-03-19 04:34:59,Electricity has been restored to Cranbourne. Thank you for your patience.,0,http://twitter.com
446091139053912064,2014-03-19 01:09:50,Electricity outage in Cranbourne. Please call 131 799 and press option 3 for more info,0,http://twitter.com
445806898697089024,2014-03-18 06:20:22,The planned electricity interruption in Broadford today has been delayed. Current ETR: 6:15pm 48 customers affected,0,http://twitter.com
445805889136496641,2014-03-18 06:16:21,The planned electricity interruption in Pakenham today has been delayed. Current ETR: 6:00pm 183 customers affected.,0,http://twitter.com
445794197602193408,2014-03-18 05:29:53,"The planned electricity interruption in Clematis, Emerald &amp; Menzies Creek today has been delayed. Current ETR: 5:30pm 70 customers affected.",0,http://twitter.com
445792091038175232,2014-03-18 05:21:31,"The planned electricity interruption in Buln Buln, Crossover, Rokeby today has been delayed. Current ETR: 5:30pm 62 customers affected.",0,http://twitter.com
445781635951108097,2014-03-18 04:39:58,The planned electricity interruption in Glenrowan and surroundings today has been delayed. Current ETR: 4:30pm 299 customers affected.,0,http://twitter.com
445555102800039937,2014-03-17 13:39:49,Electricity has been restored to Morwell. Thank you for your patience,0,http://twitter.com
445532418112380928,2014-03-17 12:09:40,Electricity outage in Morwell. Please call 131 799 and press option 3 for more info,0,http://twitter.com
444882775791779840,2014-03-15 17:08:13,Electricity has been restored to Cann River and surrounds. Thank you for your patience,0,http://twitter.com
444882697068871680,2014-03-15 17:07:55,Electricity has been restored to Bobinwarrah and surrounds. Thank you for your patience,0,http://twitter.com
444882606832623617,2014-03-15 17:07:33,Electricity has been restored to Newmerella and surrounds. Thank you for your patience,0,http://twitter.com
444882528264912896,2014-03-15 17:07:14,Electricity has been restored Nagambie and surrounds. Thank you for your patience,0,http://twitter.com
444823037922115586,2014-03-15 13:10:51,Electricity has been restored Ferntree Gully. Thank you for your patience,0,http://twitter.com
444771610361225216,2014-03-15 09:46:30,Electricity outage in Ferntree Gully. Please call 131 799 and press option 3 for more info,0,http://twitter.com
444748493848985600,2014-03-15 08:14:38,Electricity outage in Bobinawarrah and surrounds. Please call 131 799 and press option 3 for more info,0,http://twitter.com
444748400404074496,2014-03-15 08:14:16,Electricity outage in Nagambie and surrounds. Please call 131 799 and press option 3 for more info,0,http://twitter.com
444748235421138944,2014-03-15 08:13:37,Electricity outage in Newmerella and Surrounds. Please call 131 799 and press option 3 for more info,0,http://twitter.com
444748173156704257,2014-03-15 08:13:22,Electricity outage in Cann River and surrounds. Please call 131 799 and press option 3 for more info,0,http://twitter.com
443920024651059200,2014-03-13 01:22:36,The planned electricity interruption in Donvale and Ringwood North today has been delayed. ETR 17:00,1,http://twitter.com
443636278752325632,2014-03-12 06:35:05,"Electricity has been restored in Bobinawarrah, Carboor  &amp; Markwood. Thank you for your patience",0,http://twitter.com
443556087006908416,2014-03-12 01:16:26,"Electricity has been restored in Croydon, Kilsyth and Mooroolbark. Thank you for your patience",1,http://twitter.com
443475588469116928,2014-03-11 19:56:34,"Electricity outage in Bobinawarrah, Carboor  &amp; Markwood. Please call 131 799 and press option 3 for more info",0,http://twitter.com
443428364632596481,2014-03-11 16:48:55,"Electricity outage in Croydon, Kilsyth and Mooroolbark. Please call 131 799 and press option 3 for more info.",0,http://twitter.com
443353856789843968,2014-03-11 11:52:51,"Electricity has been restored in Tintaldra, Cudgewa and surroundings. Thank you for your patience",0,http://twitter.com
443316355119329280,2014-03-11 09:23:50,"Electricity has been restored in Clematis, Emerald  &amp; Menzies Creek. Thank you for your patience",0,http://twitter.com
443307843731460096,2014-03-11 08:50:00,"Electricity outage in Tintaldra, Cudgewa and surroundings . Please call 131 799 and press option 3 for more info",0,http://twitter.com
443307406131335168,2014-03-11 08:48:16,"Electricity outage in Clematis, Emerald  &amp; Menzies Creek. Please call 131 799 and press option 3 for more info",1,http://twitter.com
443307251097288704,2014-03-11 08:47:39,"Electricity has been restored in Bethanga, BellBridge  &amp; Talgarno. Thank you for your patience",0,http://twitter.com
443269253026680832,2014-03-11 06:16:40,"Electricity outage in Bethanga, BellBridge  &amp; Talgarno. Please call 131 799 and press option 3 for more info",1,http://twitter.com
443160684977586176,2014-03-10 23:05:15,"The planned electricity interruption in Ripplebrook, Longwarry and surrounds today has been cancelled.",0,http://twitter.com
443143179462647808,2014-03-10 21:55:41,The planned electricity interruption in Ferntree Gully (INCD12320) today has been cancelled.,0,http://twitter.com
442678163491938304,2014-03-09 15:07:53,Electricity has been restored in Ringwood. Thank you for your patience,0,http://twitter.com
442667871055802370,2014-03-09 14:26:59,Electricity has been restored in Eltham. Thank you for your patience,0,http://twitter.com
442661489459998721,2014-03-09 14:01:38,Electricity outage in Lower plenty &amp; Ringwood. Please call 131 799 and press option 3 for more info,0,http://twitter.com
442649759568760832,2014-03-09 13:15:01,Electricity outage in Eltham. Please call 131 799 and press option 3 for more info,0,http://twitter.com
442567231679905792,2014-03-09 07:47:05,Electricity has been restored in Tooradin. Thank you for your patience,0,http://twitter.com
442456659063881729,2014-03-09 00:27:42,The planned electricity interruption in Bayswater North &amp; Kilsyth South today has been cancelled.,0,http://twitter.com
442438668444110850,2014-03-08 23:16:13,The planned electricity interruption in Cockatoo today has been cancelled.,0,http://twitter.com
442245126316756992,2014-03-08 10:27:09,Electricity has been restored in Koo Wee Rup. Thank you for your patience,0,http://twitter.com
442223224571441152,2014-03-08 09:00:07,Electricity outage in Koo Wee Rup. Please call 131 799 and press option,0,http://twitter.com
442200891110592512,2014-03-08 07:31:22,Electricity has been restored in Menzies Creek. Thank you for your patience.,0,http://twitter.com
441782957062119425,2014-03-07 03:50:39,Electricity has been restored in Morwell &amp; Maryvale. Thank you for your patience,0,http://twitter.com
441740068319797248,2014-03-07 01:00:14,Electricity has been restored in Churchill. Thank you for your patience,0,http://twitter.com
441738444138504192,2014-03-07 00:53:46,Electricity outage in Morwell and Maryvale. Please call 131 799 and press option 3 for more info,1,http://twitter.com
441737785553080321,2014-03-07 00:51:09,Electricity has been restored in Morwell. Thank you for your patience.,1,http://twitter.com
441727483893665792,2014-03-07 00:10:13,Electricity outage in Morwell. Please call 131 799 and press option 3 for more info,0,http://twitter.com
441722775091150849,2014-03-06 23:51:31,Electricity outage in Churchill. Please call 131 799 and press option 3 for more info,1,http://twitter.com
441647397022605312,2014-03-06 18:51:59,Electricity has been restored in Ringwood &amp; Ringwood East. Thank you for your patience.,0,http://twitter.com
441520334521397248,2014-03-06 10:27:05,Electricity outage in Ringwood &amp; Ringwood East. Please call 131 799 and press option 3 for more info,0,http://twitter.com
441520235225419776,2014-03-06 10:26:41,Electricity has been restored in Croydon. Thank you for your patience.,0,http://twitter.com
441429411456221185,2014-03-06 04:25:47,Electricity outage in Croydon. Please call 131 799 and press option 3 for more info,0,http://twitter.com
441424009909911552,2014-03-06 04:04:19,The planned electricity interruption in Violet Town today has been delayed. ETR is 16:30,0,http://twitter.com
441420141348147200,2014-03-06 03:48:57,The planned electricity interruption in Briagolong today has been delayed. ETR is 15:30,0,http://twitter.com
441357603075919872,2014-03-05 23:40:27,The planned electricity interruption in Wantirna South today has been cancelled.,0,http://twitter.com
441344427672346624,2014-03-05 22:48:06,The planned electricity interruption in Pakenham today has been cancelled.,0,http://twitter.com
441077723461451776,2014-03-05 05:08:18,The planned electricity interruption in Gembrook today has been delayed. ETR is 17:30,0,http://twitter.com
441077659456385024,2014-03-05 05:08:03,"The planned electricity interruption in Catani, Vervale and Iona today has been delayed. ETR is 17:30",0,http://twitter.com
440818099575472128,2014-03-04 11:56:39,Electricity has been restored in Warburton &amp; East Warburton. Thank you for your patience.,0,http://twitter.com
440794267556904960,2014-03-04 10:21:57,Electricity outage in Warburton &amp; East Warburton. Please call 131 799 and press option 3 for more info.,0,http://twitter.com
440691378582859777,2014-03-04 03:33:06,"The planned electricity interruption in Barwite, Mansfield, Merrijig today has been delayed. ETR is 15:30",0,http://twitter.com
440615560733155328,2014-03-03 22:31:50,The planned electricity interruption in Millgrove today has been cancelled,1,http://twitter.com
440609810342371328,2014-03-03 22:08:59,The planned electricity interruption in Seville today has been cancelled,1,http://twitter.com
440604798388162561,2014-03-03 21:49:04,The planned electricity interruption in Porepunkah for the 5/3/2014  has been cancelled,0,http://twitter.com
440549383323389952,2014-03-03 18:08:52,"The planned electricity interruption in Garfield (nth), Tynong (Nth) and Bunyip Nth today has been cancelled",0,http://twitter.com
440549087272648704,2014-03-03 18:07:42,Electricity outage in Warranwood. Please call 131 799 and press option 3 for more info.,0,http://twitter.com
440548963297394688,2014-03-03 18:07:12,Electricity outage in Cowes. Please call 131 799 and press option 3 for more info.,0,http://twitter.com
440250619941507072,2014-03-02 22:21:41,Electricity outage in Wandin North. Please call 131 799 and press option 3 for more info.,0,http://twitter.com
440212591286026240,2014-03-02 19:50:35,Electricity has been restored in Sassafras &amp; Sherbrooke. Thank you for your patience.,0,http://twitter.com
440212218005569537,2014-03-02 19:49:06,Electricity outage in Mount Evelyn. Please call 131 799 and press option 3 for more info.,0,http://twitter.com
439822822085361664,2014-03-01 18:01:46,Electricity outage in Sassafras &amp; Sherbrooke. Please call 131 799 and press option 3 for more info.,0,http://twitter.com
439769958864523264,2014-03-01 14:31:43,The planned electricity interruption in Morwell today has been cancelled.,0,http://twitter.com
439286560077275136,2014-02-28 06:30:52,Electricity has been restored in Berwick. Thank you for your patience.,0,http://twitter.com
439155447636176896,2014-02-27 21:49:52,Electricity has been restored in Ferntree Gully. Thank you for your patience.,0,http://twitter.com
438982605409497088,2014-02-27 10:23:03,Electricity outage in Ferntree Gully . Please call 131 799 and press option 3 for more info.,0,http://twitter.com
438835434806722560,2014-02-27 00:38:15,"The planned electricity interruption in Ferny Creek, Kallista, Sherbrooke and surrounds today has been cancelled.",0,http://twitter.com
438801483786485761,2014-02-26 22:23:20,Electricity has been restored in Croydon. Thank you for your patience.,0,http://twitter.com
438799079875686401,2014-02-26 22:13:47,"The planned electricity interruption in Boisdale, Coongulla, Glenmaggie, Maffra West, Newry, Tinamba/West today has been cancelled.",0,http://twitter.com
438793152758317056,2014-02-26 21:50:14,The planned electricity interruption in Leongatha today has been cancelled.,0,http://twitter.com
438793086987014144,2014-02-26 21:49:58,The planned electricity interruption in Drouin South today has been cancelled.,0,http://twitter.com
438793012139655168,2014-02-26 21:49:41,The planned electricity interruption in Narracan today has been cancelled.,0,http://twitter.com
438762659576414208,2014-02-26 19:49:04,Electricity outage in Ferntree Gully &amp; Upper Ferntree Gully. Please call 131 799 and press option 3 for more info.,0,http://twitter.com
438762490155909120,2014-02-26 19:48:24,Electricity outage in Croydon. Please call 131 799 and press option 3 for more info.,0,http://twitter.com
438582099637858304,2014-02-26 07:51:35,"Electricity has been restored in Maindample, Mansfield, Boonie Doon and surrounding areas. Thank you for your patience.",0,http://twitter.com
438470986921291777,2014-02-26 00:30:04,"Electricity outage in Maindample, Mansfield, Boonie Doon and surrounding areas. Please call 131 799 and press option 3 for more info",0,http://twitter.com
438176744684523520,2014-02-25 05:00:51,Electricity has been restored in Olinda. Thank you for your patience.,0,http://twitter.com
438175872634220544,2014-02-25 04:57:23,Electricity outage in Cape Paterson &amp; Surf Beach. Please call 131 799 and press option 3 for more info.,0,http://twitter.com
438175103730188288,2014-02-25 04:54:20,Electricity has been restored in Darnum &amp; Shady Creek. Thank you for your patience.,0,http://twitter.com
438164982287433728,2014-02-25 04:14:07,Electricity outage in Darnum &amp; Shady Creek. Please call 131 799 and press option 3 for more info.,1,http://twitter.com
438092874459000832,2014-02-24 23:27:35,Electricity has been restored in Ringwood East. Thank you for your patience.,0,http://twitter.com
438077799543230464,2014-02-24 22:27:41,Electricity outage in Olinda.   Please call 131 799 and press option 3 for more info.,0,http://twitter.com
438045475275415552,2014-02-24 20:19:14,Electricity outage in Ringwood East.   Please call 131 799 and press option 3 for more info.,0,http://twitter.com
437921017718009856,2014-02-24 12:04:41,"Electricity has been restored in Gembrook, Yellingbo, Hoddles Creek and Beenak. Thank you for your patience.",0,http://twitter.com
437821441845645312,2014-02-24 05:29:00,"Electricity has been restored in Bairnsdale, Forge Creek and Goon Nure. Thank you for your patience.",0,http://twitter.com
437821340574179328,2014-02-24 05:28:36,"Electricity outage in Gembrook, Yellingbo, Hoddles Creek and Beenak.   Please call 131 799 and press option 3 for more info.",0,http://twitter.com
437715851559452672,2014-02-23 22:29:26,Electricity has been restored in Ferntree Gully. Thank you for your patience.,0,http://twitter.com
437657911276212224,2014-02-23 18:39:12,"Electricity outage in Bairnsdale, Forge Creek and Goon Nure. Please call 131 799 and press option 3 for more info.",1,http://twitter.com
437644487628566528,2014-02-23 17:45:51,Electricity outage in Ferntree Gully. Please call 131 799 and press option 3 for more info.,0,http://twitter.com
437512911854907393,2014-02-23 09:03:01,Electricity has been restored in Croydon. Thank you for your patience.,0,http://twitter.com
437497090919256064,2014-02-23 08:00:09,Electricity outage in Croydon. Please call 131 799 and press option 3 for more info.,0,http://twitter.com
436654978459901952,2014-02-21 00:13:54,The planned electricity interruption in Kilsyth today has been cancelled. 407 customers affected.,0,http://twitter.com
436654842191171584,2014-02-21 00:13:21,The planned electricity interruption in Yarragon and Yarragon South today has been cancelled.,0,http://twitter.com
436654761694076928,2014-02-21 00:13:02,"The planned electricity interruption in Glen Forbes, Woolamai and surrounds today has been cancelled.",0,http://twitter.com
436513052314177536,2014-02-20 14:49:56,Electricity has been restored in East Warburton. Thank you for your patience.,0,http://twitter.com
436504702285393920,2014-02-20 14:16:45,Electricity has been restored in Eltham &amp; Montmorency. Thank you for your patience.,0,http://twitter.com
436494852763553793,2014-02-20 13:37:37,Electricity outage in East Warburton. Please call 131 799 and press option 3 for more info.,2,http://twitter.com
436494767346565120,2014-02-20 13:37:16,Electricity outage in Eltham &amp; Montmorency. Please call 131 799 and press option 3 for more info.,0,http://twitter.com
436243934717566976,2014-02-19 21:00:33,The planned electricity interruption in Seville East today has been cancelled. 67 customers affected.,0,http://twitter.com
436023881187328000,2014-02-19 06:26:08,Electricity outage in Yarragon South &amp; Trafalgar South. Please call 131 799 and press option 3 for more info.,0,http://twitter.com
436023542212083712,2014-02-19 06:24:48,Electricity outage in Broadford. Please call 131 799 and press option 3 for more info.,0,http://twitter.com
435997879434350593,2014-02-19 04:42:49,"Electricity has been restored to in McLoughlins Beach, Woodside and surrounds. Thank you for your patience.",0,http://twitter.com
435997783791632385,2014-02-19 04:42:26,"Electricity has been restored to in Gembrook, Hoddles Creek and surrounds. Thank you for your patience.",0,http://twitter.com
435956670611468290,2014-02-19 01:59:04,"Electricity outage in McLoughlins Beach, Woodside and surrounds. Please call 131 799 and press option 3 for more info.",0,http://twitter.com
435928927156969473,2014-02-19 00:08:50,"Electricity outage in Gembrook, Hoddles Creek and surrounds. Please call 131 799 and press option 3 for more info.",0,http://twitter.com
435883141224361984,2014-02-18 21:06:53,Electricity has been restored to Kilmore. Thank you for your patience.,0,http://twitter.com
435860713714622464,2014-02-18 19:37:46,Electricity outage in Kilmore. Please call 131 799 and press option 3 for more info.,0,http://twitter.com
435844525357953024,2014-02-18 18:33:27,"Electricity has been restored Avenel, Locksley &amp; Longwood. Thank you for your patience.",0,http://twitter.com
435840783166369792,2014-02-18 18:18:34,"Electricity outage in Avenel, Locksley &amp; Longwood. Please call 131 799 and press option 3 for more info.",0,http://twitter.com
435651831822176256,2014-02-18 05:47:45,The planned electricity interruption in Toora today has been delayed. Current ETR: 6pm 12 customers affected.,0,http://twitter.com
435651672413450240,2014-02-18 05:47:07,The planned electricity interruption in Donvale today has been delayed. Current ETR: 6pm 23 customers affected.,0,http://twitter.com
435629385995915264,2014-02-18 04:18:33,The planned electricity interruption in Bairnsdale today has been delayed. Current ETR: 4pm 60 customers affected.,0,http://twitter.com
435597363457966082,2014-02-18 02:11:19,Electricity has been restored to Thomastown. Thank you for your patience.,0,http://twitter.com
435593124895666176,2014-02-18 01:54:28,The planned electricity interruption in Bairnsdale today has been cancelled. 60 customers affected.,0,http://twitter.com
435568559280750592,2014-02-18 00:16:51,The planned electricity interruption in Seville East today has been cancelled. 31 customers affected.,0,http://twitter.com
435562367238148096,2014-02-17 23:52:15,The planned electricity interruption in Kalorama and Mount Dandenong today has been cancelled. 165 customers affected.,1,http://twitter.com
435541932643586048,2014-02-17 22:31:03,The planned electricity interruption in Glenburn today has been cancelled. 27 customers affected.,0,http://twitter.com
435534627839569920,2014-02-17 22:02:01,Electricity outage in Thomastown. Please call 131 799 and press option 3 for more info.,0,http://twitter.com
435531319724871680,2014-02-17 21:48:53,Electricity has been restored to Koo Wee Rup. Thank you for your patience.,1,http://twitter.com
435508280748568576,2014-02-17 20:17:20,Electricity outage in Koo Wee Rup. Please call 131 799 and press option 3 for more info.,0,http://twitter.com
435166587125911552,2014-02-16 21:39:34,"Electricity has been restored to Greensborough, Plenty &amp; Diamond Creek. Thank you for your patience.",0,http://twitter.com
435117503614681088,2014-02-16 18:24:31,"Electricity outage in Plenty, Greensborough and Diamond Creek. Please call 131 799 and press option 3 for more info.",0,http://twitter.com
434966242793754624,2014-02-16 08:23:28,Electricity has been restored to Thomastown. Thank you for your patience.,0,http://twitter.com
434845606205325312,2014-02-16 00:24:06,Electricity outage in Thomastown. Please call 131 799 and press option 3 for more info.,0,http://twitter.com
434731235659636736,2014-02-15 16:49:38,Electricity outage in Monomeith and surrounds. Please call 131 799 and press option 3 for more info.,0,http://twitter.com
434731020449886208,2014-02-15 16:48:46,Electricity has been restored to North Wonthaggi. Thank you for your patience.,0,http://twitter.com
434681095531950080,2014-02-15 13:30:23,Electricity outage in North Wonthaggi. Please call 131 799 and press option 3 for more info.,0,http://twitter.com
