Tweet id,Created Time,Tweet Details,Retweet counts,Source URL
923782171453566976,2017-10-27 05:23:27,"We work hard to prepare for fire season,declared early in Gippsland. Watch @9newsgippsland to see how we're helping… https://t.co/pCtGW1mx5o",2,http://twitter.com
917936900702457856,2017-10-11 02:16:26,RT @mcam39: Great @ceda_news panel on #energyfuture @ABBgroupnews @aglenergy @cleannrgcouncil @AusNetServices @MarchmentHill contributing h…,1,http://sproutsocial.com
917163246695735298,2017-10-08 23:02:12,"@Rannonj Hi, I can confirm the power outage is scheduled for an hour, however the maintenance work will continue th… https://t.co/F2yHvlYJKX",0,http://sproutsocial.com
912869526391291904,2017-09-27 02:40:30,RT @HapgoodK: At the @AusNetServices @DeakinSEBE women in engineering scholarships presentation 👏👏👏👏 https://t.co/PYWMzV2JrE,2,http://twitter.com/download/iphone
909597064543182848,2017-09-18 01:56:54,"@mickwarfie Hi mick, outage tracker is indicating an estimated restoration time of 6pm. We are working on a safe return of supply asap.",0,http://twitter.com/download/iphone
908916835302621184,2017-09-16 04:53:55,@ishwindersingh Please check https://t.co/dJd61a2JTf for outage information,0,http://twitter.com/download/iphone
908909127300145152,2017-09-16 04:23:17,"For up to date outage info, go to https://t.co/dJd61a2JTf",0,http://twitter.com/download/iphone
908894930025701377,2017-09-16 03:26:52,A truck hit a powerpole in Heathmont.We have reduced the no. of customers off supply to approx 1900.Crews are working to restore power asap,0,http://twitter.com/download/iphone
908893914249142273,2017-09-16 03:22:50,@PeteNash73 Hi Pete. You should have received a second text with the correct estimated restoration time. Apologies for the confusion.,0,http://twitter.com/download/iphone
907872253211115520,2017-09-13 07:43:07,"@laurashallue Hi Laura, please PM your address and phone number and we will investigate the situation. Thanks",0,http://twitter.com/download/iphone
907387777712623621,2017-09-11 23:37:59,"@Bob_Mart1n Hi Bob, could you PM through your contact details and we'll have one of our customer reps give you a call. Thanks, Emma",0,http://sproutsocial.com
907192995413319680,2017-09-11 10:43:59,RT @cleannrgcouncil: The CEC's @nrcollard speaking with Phaedra Deckart from @aglenergy &amp; Siham Knowles from @AusNetServices at tonight's @…,10,http://twitter.com/download/iphone
904609416699191296,2017-09-04 07:37:46,"@sfish_sfa @LendleaseGroup Thanks for your tweet, we will investigate this thoroughly.",0,http://twitter.com
904609019221860353,2017-09-04 07:36:11,"Ahead of the severe weather, check out our info about preparing for storms https://t.co/VqpnGvkujY",0,http://twitter.com
904608023825457152,2017-09-04 07:32:14,RT @BOM_Vic: Severe Weather Warning remains current for most of #Victoria https://t.co/JrHe5r6hFC https://t.co/2ddLk3lFjj,43,http://twitter.com
902077099380424704,2017-08-28 07:55:14,Applications for our Women in Power Engineering scholarships are open! Click here to apply https://t.co/lN7AcmUHHH… https://t.co/t8SzgyeYXm,4,http://twitter.com
901643633421557760,2017-08-27 03:12:48,"We're here for a little while longer to talk about our $10,000 women in power engineering scholarships… https://t.co/4mz1d1uKWx",2,http://twitter.com/download/iphone
901614686214340608,2017-08-27 01:17:47,"Dean of engineering, Karen Hapgood will be talking about the @Deakin engineering courses at 12pm in building x… https://t.co/O3Cum8aGXm",2,http://twitter.com/download/iphone
901612106067263489,2017-08-27 01:07:31,"RT @Deakin: 'At Deakin we develop employability skills, it's part of your course.' https://t.co/VeWJ9zCu4u",2,http://twitter.com/download/iphone
901601317050654720,2017-08-27 00:24:39,What did the engineer say to the philosopher? #WomenInEngineering @Deakin https://t.co/1WFHP4CID0,0,http://twitter.com/download/iphone
901584976721846272,2017-08-26 23:19:43,Great to see so many potential engineering students so early #DeakinOpenDay Burwood. Come visit us in the HE Buildi… https://t.co/B2GpuUMlST,2,http://twitter.com/download/iphone
900887625489362945,2017-08-25 01:08:42,"@mrs_caneva Hi Caroline, could you let us know what park in Greensborough and we'll follow it up. Thanks, Emma",0,http://sproutsocial.com
900510932123525120,2017-08-24 00:11:51,"Visit @deakin Burwood open day Sunday &amp; talk to our engineers &amp; scholarship holders about our $10,000 scholarships… https://t.co/V5t9onXVVs",0,http://twitter.com
899114818438705152,2017-08-20 03:44:12,Come and meet our current scholarship holders and recent graduates in the Cadet bldg and learn about our scholarshi… https://t.co/zb2xzugs1v,1,http://twitter.com/download/iphone
899087808744247296,2017-08-20 01:56:52,"Danielle, one of our current scholarship recipients speaking with a prospective student of Power Engineering… https://t.co/AYpfpRkhwy",1,http://twitter.com/download/iphone
899080371643367424,2017-08-20 01:27:19,Listen to graduate Dominic talking on the panel about energy in the CADET auditorium at 11.30 #DeakinOpenDay https://t.co/3fHyxxIKjL,0,http://twitter.com/download/iphone
899079098638622720,2017-08-20 01:22:15,AusNet Services Women in Power Engineering scholarships #DeakinOpenDay https://t.co/Ll24k1iYMI,3,http://twitter.com/download/iphone
899064825279422464,2017-08-20 00:25:32,The team has been joined by our MD - come and see us at Cadet Building #DeakinOpenDay https://t.co/cObEpfEWV4,2,http://twitter.com/download/iphone
899056490685661184,2017-08-19 23:52:25,Team is all here - ready to answer all your questions.  #DeakinOpenDay https://t.co/nKOeSil1DD,2,http://twitter.com/download/iphone
899046899813974016,2017-08-19 23:14:19,We are all ready to go at #DeakinOpenDay.  Come and see us at Cadet Building and learn about our scholarships https://t.co/kDXUWT0tG9,3,http://twitter.com/download/iphone
898387056967073792,2017-08-18 03:32:20,"Visit @deakin open day Sunday &amp; meet our engineers &amp; scholarship holders to talk about our $10,000 scholarships… https://t.co/3iYyh7lQSe",3,http://twitter.com
897687427665547266,2017-08-16 05:12:15,"Take a look at our helpful hints and tips about electrical safety before, during and after a storm… https://t.co/eTfBtCP4c5",0,http://twitter.com
897685802687352832,2017-08-16 05:05:48,"Strong winds are predicted over some regions. In case of an outage, go to https://t.co/dJd619L91H &amp; stay away from fallen power lines.",0,http://twitter.com
897674570936852485,2017-08-16 04:21:10,"RT @BOM_Vic: Latest Severe Weather Warning! Squalls across coast &amp; wind gusts over 100 km/h across N/E still possible, see: https://t.co/Jr…",10,http://twitter.com
897243389514588160,2017-08-14 23:47:48,Meet Exec General Mgr Alistair Parker @Deakin Waurn Ponds open day in the CADET building this Sunday 20 August .… https://t.co/1t1GhGGZpC,3,http://twitter.com
895907432903266304,2017-08-11 07:19:11,RT @BOM_Vic: Severe Weather Warning for damaging winds tonight/tomorrow morning now extended to include southern bayside suburbs https://t.…,12,http://twitter.com/download/iphone
895860744901623808,2017-08-11 04:13:40,"Did you know our Women in Power Engineering scholarship program incl $10,000 a year? Read more in our media release https://t.co/L3FPZwZBon",3,http://twitter.com
895859559633309698,2017-08-11 04:08:57,We're excited to offer 3 Women in Power Engineering Scholarships through @Deakin for students starting electrical e… https://t.co/c5uFThVcvB,8,http://twitter.com
895542091375271936,2017-08-10 07:07:27,"RT @BOM_Vic: Latest Severe Weather Warning for damaging winds, north-east ranges still at risk. Check out updated issue: https://t.co/JrHe5…",10,http://twitter.com/download/iphone
894321016708755460,2017-08-06 22:15:20,"@raoulendres Hi Raoul, we are sorry you are still having problems with gas supply. If you DM contact details, a cus… https://t.co/uwhQJMomOO",0,http://sproutsocial.com
893353408521920512,2017-08-04 06:10:24,"For up to date power outage information, visit https://t.co/dJd61a2JTf",0,http://twitter.com
893353006019760129,2017-08-04 06:08:48,"Wild weather predicted this weekend. For info on how to stay safe during bad weather, read https://t.co/a2gU2laDhE",0,http://twitter.com
893352579442159616,2017-08-04 06:07:07,RT @theage: Batten down the hatches Victorians - wild weather is coming this weekend @BOM_Vic https://t.co/smPZ9iud6m,35,http://twitter.com
891837171119804416,2017-07-31 01:45:25,"@rhk2583 Hi Ron, we are aware of the issue and are working on fixing it asap. PM your email address and customer se… https://t.co/W91le7fBDd",0,http://twitter.com
890810546215202817,2017-07-28 05:45:59,Attn Seddon &amp; Yarraville gas customers.The initiative to increase pressure has improved reliability of supply.Thanks for your patience!,1,http://twitter.com
890806421045915650,2017-07-28 05:29:35,"In the event of a storm, do not touch fallen powerlines. If you see a fallen powerline, please call 13 17 99 (24 hours a day). Thank you",1,http://twitter.com
890805888486735872,2017-07-28 05:27:28,"Gale force winds are predicted this weekend.Please read our info about what to do before, during and after a storm.https://t.co/a2gU2laDhE",0,http://twitter.com
890805279163424768,2017-07-28 05:25:03,RT @vicemergency: SEVERE Weather Warning issued for damaging and destructive winds. For more info on how to be storm safe: https://t.co/6ld…,14,http://twitter.com
890805206480437249,2017-07-28 05:24:46,RT @BOM_Vic: A strong front will cross #Victoria Saturday bringing gale force winds. Latest info: https://t.co/HLs2UYFQyQ https://t.co/8pFW…,36,http://twitter.com
890066133994307585,2017-07-26 04:27:57,RT @E_U_A_A: 'Customers at the fore front of our thinking and planning' @AusNetServices #VEF17 #energy,1,http://sproutsocial.com
890065039075545088,2017-07-26 04:23:36,RT @E_U_A_A: Adrian Hill @AusNetServices explains how changing nature of generation is changing the way they manage #transmission #VEF17 #e…,2,http://sproutsocial.com
889983068722933760,2017-07-25 22:57:53,RT @E_U_A_A: 2017 Victorian Energy Forum about to kick off. Thanks to sponsors @powerlinkqld @AusNetServices @GreenSync @transgrid #stanwell,2,http://sproutsocial.com
888183091759648776,2017-07-20 23:45:25,"@pageaffairs Hi Ralph, if you'd like to DM me your contact details and I'll get someone from our customer centre to… https://t.co/imSnYHbxPw",0,http://sproutsocial.com
887914234473873409,2017-07-20 05:57:04,Congratulations to the Mooroolbark mini grid trial team who were joint winners @cleannrgsummit innovation award.… https://t.co/AkYAg2295Y,3,http://twitter.com
887562831801012224,2017-07-19 06:40:43,Be careful during and after severe weather. Stay away from fallen powerlines. Keep up to date on outages at… https://t.co/QR0Gk3iL7S,0,http://sproutsocial.com
887528674118975488,2017-07-19 04:25:00,RT @BOM_Vic: Damaging winds possible over parts of Gippsland on Thursday. #VicWeather Warning details: https://t.co/HLs2UYFQyQ https://t.co…,8,http://twitter.com/download/iphone
887432641342996480,2017-07-18 22:03:24,We are honoured our Mooroolbark Mini Grid has been recognised by the @cleannrgcouncil Congratulations to joint winn… https://t.co/cujd4VT5ox,3,http://sproutsocial.com
887279283562962944,2017-07-18 11:54:00,RT @cleannrgcouncil: It's a tie! The CEC Innovation Award goes to @HorizonPower_WA AND @AusNetServices/@GreenSync/PowerTec. #ACES2017,12,http://twitter.com/#!/download/ipad
887250885557927936,2017-07-18 10:01:10,We have an update to the Seddon &amp; yarraville gas issues on our website. https://t.co/2JA70XWZZb Our gas faults number is 13 67 07.,0,http://twitter.com/download/iphone
885738375285579777,2017-07-14 05:50:59,"Reports received of intermittent gas supply in Seddon &amp; Yarraville. Work's started to solve the issue.For gas issues, call 136707",0,http://twitter.com
885317387775483905,2017-07-13 01:58:08,Our Mooroolbark mini grid project is a finalist in the 2017 Clean Energy Council Awards @cleannrgcouncil. Read more… https://t.co/1dM4lqMoJE,8,http://twitter.com
885049250459078656,2017-07-12 08:12:39,"@jrimbo Hi Jackson, we are sorry about the delay. Crews are working to restore the power now and expect to have it on shortly. Emma.",0,http://sproutsocial.com
885015587755356161,2017-07-12 05:58:53,"@Kittani Hi, we are sorry about the outage. If you'd like to PM me your details, I can organise a customer rep to call you to discuss. Emma",0,http://sproutsocial.com
884939956086607872,2017-07-12 00:58:21,"@tonywillman Hi, sorry about incorrect information. Can confirm there is an outage in the Commercial Drive area. Cr… https://t.co/AaW5a945xS",0,http://sproutsocial.com
884931663800807429,2017-07-12 00:25:24,"@tonywillman Hi Tony, We aren't aware of a power outage in Thomastown at the moment. However, to report an outage p… https://t.co/TaRR5gKIR6",0,http://sproutsocial.com
884600632367136768,2017-07-11 02:30:00,RT @AEMO_Media: Good customer and community outcomes must be central. @AusNetServices @ceda_news #EnergyFuture,3,http://twitter.com/download/iphone
884600483649908736,2017-07-11 02:29:25,RT @AEMO_Media: .@AusNetServices CEO Nico is talking about the need for coordination in renewable generation across state boundaries.,3,http://sproutsocial.com
884600397943406594,2017-07-11 02:29:04,AusNet Services' Nino Ficca is addressing today's CEDA event. #ceda #EnergyFuture,0,http://sproutsocial.com
884336592307068928,2017-07-10 09:00:48,"@Sabrescene Hi Sean, we are sorry for the delay in restoring power and the inconvenience it is causing. We are work… https://t.co/1X0wKZaVBp",1,http://sproutsocial.com
883220531708796928,2017-07-07 07:05:58,RT @esdnews: AusNet to develop transmission line for Victorian wind farm - https://t.co/d2ko4AuNKu @AusNetServices #renewables #energy #tra…,2,http://twitter.com
882820813698813958,2017-07-06 04:37:38,@solutions_live @LetsBelong Hi Live Solutions. Please DM your contact details so we can discuss the matter. Thanks,0,http://twitter.com
878015303183196160,2017-06-22 22:22:15,"@oztish Hi, We are sorry for any inconvenience. A car has hit a power pole, causing the outage. You can get updates… https://t.co/amp9m2ityK",0,http://sproutsocial.com
874796474353188864,2017-06-14 01:11:47,"@chris_bloke Hi, we have sent a survey to some customers on behalf of the AER about energy usage. Unfortunately, so… https://t.co/LOmXDyrnlj",0,http://sproutsocial.com
874763098262994944,2017-06-13 22:59:09,"@Dizey13 Hi Diane, the power should be back on now. We are sorry for any inconvenience. Emma.",0,http://sproutsocial.com
872332382782853120,2017-06-07 06:00:21,RT @HelloGrid: Free Electrons brings together energy innovators from around the globe https://t.co/JT1JqjeEz1! https://t.co/hQRssdiWDf,2,http://sproutsocial.com
869004038032982017,2017-05-29 01:34:42,"@DeanFonzy Hi, We aren't aware of any current outages in Mooroolbark. If you are still without power, phone us on 13 17 99. Emma",0,http://sproutsocial.com
868970602836709377,2017-05-28 23:21:51,"@xxCrystal666xx Hi,
You can report a streetlight fault to us at 13 17 99 or online at https://t.co/bToDjFiC9s 
Thanks, Emma.",0,http://sproutsocial.com
868740708357685248,2017-05-28 08:08:19,"For up to date information about outages, go to https://t.co/dJd61a2JTf",0,http://twitter.com/download/iphone
867971012750475264,2017-05-26 05:09:50,"@BizTalkBill @VicGovAu If you could send details to csc@ausnetservices.com.au and one of our team will get in touch. Thanks, Emma.",0,http://sproutsocial.com
867948957346942976,2017-05-26 03:42:11,"@BizTalkBill @VicGovAu Hi Bill, sorry to hear you are having issues with your meter. If send through your details v… https://t.co/oy2M3E7ONf",0,http://sproutsocial.com
867557041975545856,2017-05-25 01:44:51,RT @VicWater_: Andrew Dillon @AusNetServices explores the future of energy transmission and distribution via disruption @VicWater_ #VicWate…,2,http://sproutsocial.com
866517330574049280,2017-05-22 04:53:25,"Strong, unified approach needed for Oz's energy future: AusNet Services. Our response to @GrattanInst report - https://t.co/nCHPE9s739",2,http://sproutsocial.com
866505300358123522,2017-05-22 04:05:37,"RT @ceda_news: A dynamic energy system needs innovation in both tech &amp; business models: AusNet Services, General Manager Network Engineerin…",3,http://sproutsocial.com
862207184448274432,2017-05-10 07:26:26,A recent milestone shows that our mini-grid trial is finding ways to empower communities and their energy future.… https://t.co/LoxRPBVJxz,4,http://twitter.com
862162949800120320,2017-05-10 04:30:40,RT @JohnBradleyENA: Alistair Parker of @AusNetServices - understanding customer behaviour &amp; preferences crucial to microgrids #gridedge htt…,7,http://twitter.com
851623156754169860,2017-04-11 02:29:17,Last days to apply for a max of $3000 grant if you are a not-for-profit in the Yarra Ranges. Find out more https://t.co/lQ8cCBjYon,0,http://twitter.com
850211887329366016,2017-04-07 05:01:24,"Great news for Avoca residents, with the new gas network complete. https://t.co/CQQZjmKOBf https://t.co/B1K8bJiPwr",2,http://twitter.com
846600505585418242,2017-03-28 05:51:04,RT @EnergyNetworkAu: Program &amp; registration for the Welcome to the Grid Edge seminar is now available. Register now! https://t.co/7eM5Kcziw…,3,http://twitter.com/download/iphone
846254677305929728,2017-03-27 06:56:52,"Our crews are working to restore power to areas affected
by the severe weather in Vic. Please check https://t.co/dJd61a2JTf for updates",0,http://twitter.com
846214323701596160,2017-03-27 04:16:31,Be careful during &amp; after storms.Stay away from fallen powerlines &amp; keep up to date with outages on https://t.co/dJd61a2JTf,1,http://twitter.com/download/iphone
840065092251140097,2017-03-10 05:01:40,"For more information about our Yarra Ranges Community Development Fund, check out our media release https://t.co/c524vf5Jwx @yrcouncil",0,http://twitter.com
840061024506060801,2017-03-10 04:45:30,"We're launching Yarra Ranges Community Dev Fund.Eligible not-for-profits can apply for funds up to $3,000.Apply now! https://t.co/h83fbmKY1h",0,http://twitter.com
839335837682708480,2017-03-08 04:43:52,Today people from across the company are talking about #beboldforchange the 2017 International Women's Day theme. https://t.co/vQksPvMILR,2,http://twitter.com
838967448275542017,2017-03-07 04:20:01,We're excited to announce that we have launched a new website. The address hasn't changed - https://t.co/EAJOJj1LKF… https://t.co/1P5DmNiAxQ,1,http://twitter.com
834226263803899904,2017-02-22 02:20:15,RT @freelectronsAcc: @AusNetServices @DEWA_Official @ESBGroup @edp_open @innogy @originenergy @TEPCO_English #SingaporePower https://t.co/k…,1,http://twitter.com/download/iphone
829493038229581826,2017-02-09 00:52:06,"RT @shana_morgan: ""This moment and this meeting today is pretty seminal for the whole movement"": @TotalRenewYack's Matt Charles-Jones. #min…",3,http://twitter.com
829492706082582528,2017-02-09 00:50:47,RT @DianeShepheard: @TotalRenewYack first step on an amazing journey #minigrid https://t.co/l8qSuVdMai,2,http://twitter.com
829492541544230913,2017-02-09 00:50:07,Great to see such a large turnout for the 1st Yackandandah #minigrid info session today. Thanks everyone!… https://t.co/stMkW9i4me,3,http://twitter.com
829485824001482752,2017-02-09 00:23:26,TFB planned outage info-majority of elec work is cancelled except for jobs that are critical to communities safety.,2,http://twitter.com
826208622682140672,2017-01-30 23:21:00,"Energy startups, don't miss out.Apps close 28 https://t.co/oUZckpePB8 with global utilities &amp; mentors, including us… https://t.co/0I1XPemH1F",3,http://twitter.com
826203231986397185,2017-01-30 22:59:35,Congrats Winchelsea! https://t.co/H9Kba4LGHv,1,http://twitter.com
825995124173795328,2017-01-30 09:12:38,RT @freelectronsAcc: #FreeElectrons Official Program Launch in #Dubai hosted by @DEWA_Official @ESBGroup @originenergy @AusNetServices @edp…,4,http://twitter.com/download/iphone
825811204006309888,2017-01-29 21:01:48,RT @CFA_Updates: Today is a day of TOTAL FIRE BAN across the state. We are monitoring this account &amp; @vicemergency #VicFires https://t.co/M…,47,http://twitter.com/download/iphone
825810745845702657,2017-01-29 20:59:59,RT @BetterHealthGov: Extreme heat forecast today in Vic. For tips on how to #SurviveTheHeat visit https://t.co/rJl2k8dQYS @vicemergency @Am…,24,http://twitter.com/download/iphone
824006849842200576,2017-01-24 21:31:56,"RT @SouthwickMP: Very interesting, I visited @AusNetServices today and saw their facility and had a brief on @TotalRenewYack. Lots of poten…",4,http://twitter.com/download/iphone
821951487181918213,2017-01-19 05:24:40,"RT @BOM_Vic: Severe weather warning, heavy rainfall from midnight tonight western and central Vic. More info at https://t.co/HLs2UYFQyQ htt…",42,http://twitter.com/download/iphone
821655810690469892,2017-01-18 09:49:45,RT @DeakinSEBE: Reminder! Applications for our @AusNetServices Women in Power Engineering Scholarship close on 6 Feb 2017. https://t.co/u6d…,4,http://twitter.com/download/iphone
818934884878032896,2017-01-10 21:37:46,Good news for our gas customers. Prices set to drop under new gas network proposal. Read more… https://t.co/o5ObV4lkgL,2,http://twitter.com
818641525940727808,2017-01-10 02:12:04,Calling all Australian energy start-ups! https://t.co/gKwZ1JaU5Y,2,http://twitter.com
818640862745759745,2017-01-10 02:09:25,#energystartups! Join the world's first global accelerator backed by major utilities. Apply today at… https://t.co/oZvyGPhJyJ,8,http://twitter.com
818313931663937538,2017-01-09 04:30:19,Last days to apply for our 3 #womeninpowerengineering scholarships @Deakin.Kick star your engineering career!.https://t.co/XKRlrj1UDC,1,http://twitter.com
818312239589376000,2017-01-09 04:23:36,RT @BOM_Vic: Severe Thunderstorm Warning issued for heavy rainfall for parts of eastern #Victoria. https://t.co/PNs0WBVDhw https://t.co/Dqy…,7,http://twitter.com
816866184075223040,2017-01-05 04:37:29,RT @wildlife_vic: Thanks so much @AusNetServices for your speedy help rescuing the poor duck on powerlines just now in Healesville. #muchap…,2,http://twitter.com/download/iphone
812109073676050433,2016-12-23 01:34:26,Happy holiday season to all our customers and twitter followers.Remember to use https://t.co/dJd61a2JTf for the lat… https://t.co/vJynAXSy0h,0,http://twitter.com
812107628092370944,2016-12-23 01:28:41,Make sure you are prepared for the upcoming hot spell. https://t.co/JBHVZGyJw4,0,http://twitter.com
809619360809529344,2016-12-16 04:41:12,Good news! Our customers will save about $50 a year on their electricity metering charges. https://t.co/ebq59iZKJM,1,http://twitter.com
809260331386052608,2016-12-15 04:54:32,We are excited to run our scholarships again in 2017. #WomenInEngineering https://t.co/iGZKOtMfFz,2,http://twitter.com
809259631113449477,2016-12-15 04:51:46,With @Deakin we are offering 3 Women in Power Engineering Scholarships starting in 2017.Get your applications in now https://t.co/lN7AcmUHHH,8,http://twitter.com
809257427061178368,2016-12-15 04:43:00,RT @DCC_AU: Great to see @AusNetServices supporting female participation in power engineering!  #womeninenergy #WomenInEngineering https://…,9,http://twitter.com
803090022001823744,2016-11-28 04:15:56,"RT @ContArtSoc: Thanks @AusNetServices  for supporting #ArtatBurnleyHarbour  Richmond. See 100's of artworks! Open December 1, 2, 3: 8am-8p…",1,http://twitter.com/download/iphone
799810601551675392,2016-11-19 03:04:41,"Major maintenance in East Gippsland this weekend, power affected 8-5pm Sat &amp; Sun. Look out for machinery &amp; crews on roads and stay safe.",0,http://twitter.com
799131330818686976,2016-11-17 06:05:31,Read more about connecting Winchelsea to natural gas in our media release https://t.co/I0v7ZBBtEj,0,http://twitter.com
799130877850570752,2016-11-17 06:03:43,Connecting Winchelsea will allow over 600 residents access to natural gas for the first time.Avoca &amp; Bannockburn are next in line in 2017,0,http://twitter.com
799127938582970368,2016-11-17 05:52:02,Thanks to our gas customer Sue who let us hold our official Winchelsea natural gas launch at her house today. https://t.co/R4zOmLhmWB,1,http://twitter.com
797991220081373185,2016-11-14 02:35:07,RT @EnergyNetworkAu: Media Release: Nino Ficca elected Chair of Energy Networks Australia https://t.co/MglppjDfyg,6,http://twitter.com
789298936234119168,2016-10-21 02:55:05,RT @VCdeakin: @Deakin @DeakinSEBE 25 yr School of Engineering celebration with Advisory Board Chair Nino Ficco CEO Ausnet  recalling his #e…,3,http://twitter.com/download/iphone
788984101994831872,2016-10-20 06:04:03,"Remember if you see powerlines down, stay away and report by calling 13 17 99. For fault info visit https://t.co/a8FFd4BLox",0,http://twitter.com
788983576838541312,2016-10-20 06:01:57,Parts of our elec area may experience strong winds tonight.Check out our safety info to help you prepare for storms https://t.co/mWZU4AIxC3,1,http://twitter.com
788982471719215104,2016-10-20 05:57:34,RT @BOM_Vic: Severe Weather Warning for damaging winds extended slightly strongest gusts still due in #Melbourne midnight to 7am https://t.…,44,http://twitter.com
788115128961015808,2016-10-17 20:31:03,"RT @BOM_Vic: Wet #Melbourne commute for those traveling now. A break, then showers, possible pm hail and thunder. Latest radar: https://t.c…",9,http://twitter.com/download/iphone
786876600784523265,2016-10-14 10:29:35,RT @BOM_Vic: Severe Weather Warning for damaging winds tomorrow afternoon and evening for many areas including #Melbourne https://t.co/Auqo…,16,http://twitter.com/download/iphone
