Tweet id,Created Time,Tweet Details,Retweet counts,Source URL
918636837534609408,2017-10-13 00:37:44,GBST has launched a digital capability to the UK market. https://t.co/UFfmbYfl9h,1,http://twitter.com
915080944586973184,2017-10-03 05:07:53,"Australian Superannuation Funds are paying more than $6 billion a year of member’s funds in excess taxation
https://t.co/SCDT9R5XeR",1,http://twitter.com
910301104184868864,2017-09-20 00:34:30,Automation technologies promise to revolutionise capital markets. https://t.co/53tP4e7Vu2,2,http://twitter.com
909550070109847555,2017-09-17 22:50:09,GBST News: GBST adds standalone annuity functionality to offer providers greater flexibility post pension freedoms https://t.co/0GvzJtmLNg,3,http://twitter.com
900947980215132162,2017-08-25 05:08:31,We are recruiting for a IT Project Manager https://t.co/f5XfpXEaSb @LinkedIn,0,http://twitter.com
900947953522692096,2017-08-25 05:08:25,We are recruiting for a Java Analyst Programmer https://t.co/ORV9B2vVuP @LinkedIn,0,http://twitter.com
888321904389398529,2017-07-21 08:57:00,GBST News: GBST appoints Mark Knowlton as Chief Technology Officer https://t.co/TlF2mF2myx,1,http://twitter.com
887516493889523712,2017-07-19 03:36:36,GBST is pleased to be the dinner sponsor again for the FinTech Platforms&amp;Wraps Conference.We look forward to seeing you there! @moneymanage,0,http://twitter.com
881783090367963136,2017-07-03 07:54:06,GBST News: GBST appoints Darren Bayley as Head of Business Development for EMEA. https://t.co/ABHpBmf6dR,1,http://twitter.com
879268434625781760,2017-06-26 09:21:45,GBST News: GBST adds Lifetime ISA functionality.https://t.co/QkZQyM2HOJ,1,http://twitter.com
874505800865021952,2017-06-13 05:56:45,RT @jenetteg: .@GBSTHoldings chief on Cofunds #tech plans and #roboadvice in the UK - Citywire @robdedom @ChristineNMA  https://t.co/vOeXUx…,2,http://twitter.com
870498168869236736,2017-06-02 04:31:51,GBST News: GBST completes its fourth live GBST Syn~ installation in Australia. Read more from here:https://t.co/YN3l8XRcGz,1,http://twitter.com
864378029681778688,2017-05-16 07:12:36,GBST’s head of EMEA invited to comment on the UK platform market by @_moneymarketing Read full article here:https://t.co/51dqVT85x1,1,http://twitter.com
862879059579092992,2017-05-12 03:56:13,Excited for the #FutureSuper next week. Look forward to a new round of dynamic exchange of ideas around today’s superannuation industry.,0,http://twitter.com
859245224106672128,2017-05-02 03:16:40,GBST is proud to have won the ‘Speed-build’ award in the recent Pensions Dashboard TechSprint 24-hour competition.https://t.co/xh9ViS8qLO,3,http://twitter.com
852518023793704960,2017-04-13 13:45:10,Rob Beverley GBST presents solution from @SSP_Worldwide @Fastrak_Reports @nest and @GBSTHoldings  WINS most engagin… https://t.co/o1P1KGgUtD,0,http://twitter.com/download/iphone
852491307377455105,2017-04-13 11:59:00,'Team 8' preparing to present solution ! #Pensionsdashboard @SSP_Worldwide @nest @sprintenterprise @GBSTHoldings https://t.co/afk4SzwLZk,0,http://twitter.com/download/iphone
852080778544656384,2017-04-12 08:47:43,Excited to participate in Pensions Dashboard Tech Sprint #Pensionsdashboard https://t.co/2FZeKBOPsU,0,http://twitter.com/download/iphone
849798949728731136,2017-04-06 01:40:32,Congratulations to ASX Thomson Reuters Charity Foundation for the successful fundraising event! GBST is proud to be… https://t.co/GyeDU6r9wA,0,http://twitter.com
847303167196880898,2017-03-30 04:23:11,"A total of $2,830 was raised from last Friday Outrun Cancer treadmill marathon relay.Well done GBST team and thanks… https://t.co/JNMfFiPLvJ",1,http://twitter.com
841852090733355008,2017-03-15 03:22:33,"Proud to have our flagship Composer(r) solution shortlisted as ""Finance Technology of the Year"" at the… https://t.co/wNbsAfutyP",0,http://twitter.com
839699493306036224,2017-03-09 04:48:54,"AI will inevitably affect jobs in the industry,but investment in the technology is likely to create barrier to entry.https://t.co/0wIENPGGwc",1,http://twitter.com
834656425884291073,2017-02-23 06:49:33,"GBST’s Head of EMEA, David Simpson interviewed by FT Adviser features writer. https://t.co/i9B8sBNvl5",0,http://twitter.com
834250816965861376,2017-02-22 03:57:49,Modern retirement is dynamic and people need flexible products to ensure their long term income needs are met. https://t.co/LtnXZ48Mg5,0,http://twitter.com
831711259821084672,2017-02-15 03:46:31,"Proud to be shortlisted at #PensionsAgeAwards as ""Pensions Technology Firm of the Year"". Look forward to the ceremo… https://t.co/QDLwS7XRVK",2,http://twitter.com
829566541347774464,2017-02-09 05:44:10,"Another GBST event with Australia’s industry leading minds to discuss the latest challenges, trends and opportuniti… https://t.co/cdmmFIfAAT",0,http://twitter.com
823359632131297280,2017-01-23 02:40:08,"RT @robdedom: Looking forward to participating on the Panel, come along and join us.

""By the end of this year, nearly 7 million p…https://…",1,http://twitter.com
821196883628412928,2017-01-17 03:26:08,"RT @noviafinancial: RT @ValRome0: Novia’s Bill Vasilieff talks turning a profit, the future of platforms 
https://t.co/SDMtOnJ8dR https://t…",1,http://twitter.com
821169644849377280,2017-01-17 01:37:54,"A positive attitude towards #fintech : “Even if you can beat them, join them.” https://t.co/RJPhSFNtSP",0,http://twitter.com
818269470716084225,2017-01-09 01:33:39,"2016 Longevity lunches see almost 50% of our staff celebrating 5 years (or more) with GBST, thank you all for your… https://t.co/PRrUbQrL3F",1,http://twitter.com
803799392650018817,2016-11-30 03:14:43,"How to capitalise on new digital technology? Hear from @robdedom, article first published on @FTAdviser https://t.co/fDDi0X3JCx",0,http://twitter.com
798807535708835841,2016-11-16 08:38:52,"Financial wellbeing crucial to personal wellbeing, says @robdedom https://t.co/zKSm9Z4J65",0,http://twitter.com
798414500236054528,2016-11-15 06:37:05,Day 2 at #CSW16. Visit us at booth number 3! https://t.co/HDIQvbeOr3,0,http://twitter.com
798358656211259392,2016-11-15 02:55:11,GBST's Nigel Ashford spoke at panel: Moving towards a streamlined #posttrade ecosystem at #CSW16 https://t.co/gGrEDDHMJZ,0,http://twitter.com
798203112947261440,2016-11-14 16:37:06,Do people really need a current account ......or a retirement account?...#just-Rlas https://t.co/bagNEjLPON,0,http://twitter.com/download/iphone
798058307516698624,2016-11-14 07:01:42,"Government delay &amp; political uncertainty not an excuse for deferred investment,according to @SuncorpGroup CFO https://t.co/kftZgRDRuv",0,http://twitter.com
796956198461288448,2016-11-11 06:02:19,Looking forward to #CSW16 next week. GBST will be exhibiting at booth number 3. See you there! @PostTradeGuru https://t.co/AgBEyVS0OR,1,http://twitter.com
796923517014970370,2016-11-11 03:52:27,"3 themes caused reshape of operating models over the past 2 years,according to a survey by @DeutscheBank @FTRemark https://t.co/FxbExIn0xx",0,http://twitter.com
796890273116631040,2016-11-11 01:40:21,RT @jenetteg: Role of digital in driving customer engagement https://t.co/rZ4QqXN4qv via @robdedom @GBSTHoldings @Finextra,3,http://twitter.com
796606492090781696,2016-11-10 06:52:42,RT @RossKMcGill: O'Brien @GBSTHoldings : re-engineering different from outsourcing and more conerned with integrated worklflow automation #…,2,http://twitter.com
796604010367221760,2016-11-10 06:42:50,RT @RossKMcGill: Panel discussion #nemaasia outsourcing Brian Godins and Ian Stephenson @HSBC Bryan Fletcher @CreditSuisse Donal Obrien @GB…,3,http://twitter.com
796567288971403268,2016-11-10 04:16:55,RT @RossKMcGill: Panel on fintech and blockchain moderated by Paul Beal @GBSTHoldings with pnellists from @HSBC @BainAlerts and SFC #nemaas…,3,http://twitter.com
796535377389555713,2016-11-10 02:10:07,"A fantastic 2-days with insightful content. Thx to all speakers, panelist and participants, look forward to seeing… https://t.co/lzpfOcG9rD",1,http://twitter.com
796304077692878848,2016-11-09 10:51:01,Wrapping up the event with a great panel session on #PostTrade operations. Technology and market infrastructure deb… https://t.co/kTLKlb7aGs,1,http://twitter.com
796275744728940544,2016-11-09 08:58:26,"GBST's Nick Clarke says: Opportunities for #Blockchain are huge, but basics like privacy and data control must be r… https://t.co/iqpbfHbdhw",2,http://twitter.com
796217910796513281,2016-11-09 05:08:37,Come and enjoy a cup of freshly brewed coffee on us and meet our team @damiendipietro @HofmannKathy at #asfa2016! https://t.co/4k8izF0ojw,1,http://twitter.com
795929230185857024,2016-11-08 10:01:30,Great discussion session on the timeless theme - Cost reduction. #Brokerforum #GBSTevents https://t.co/szTUJn4GK4,1,http://twitter.com
795928417308770304,2016-11-08 09:58:16,#Blockchain in Capital Markets - where are we now? - Presentation by GBST Global Head of Product Nick Clarke.… https://t.co/axECYvzgUY,1,http://twitter.com
795908530549059584,2016-11-08 08:39:15,A lot to cover in the next 3 hours. #GBSTteam #Brokerforum https://t.co/bEnW9q6grw,1,http://twitter.com
795901334964686848,2016-11-08 08:10:40,We are all set for our first broker event in Hong Kong! https://t.co/cDtqka5xq5,0,http://twitter.com
794427666887675904,2016-11-04 06:34:50,Insightful events are lined up at @MO_LANDMARKHK by our Hong Kong team. It will be an exciting week! https://t.co/Rm1ma3uLoM,1,http://twitter.com
793852200669904896,2016-11-02 16:28:08,Nutmeg welcome banks return to investments market #langcatdeadx https://t.co/jGw4lqTXO4,0,http://twitter.com/download/iphone
793833555319218177,2016-11-02 15:14:02,Full House in the Crypt at LangCat review of Platforms #langcatdeadx https://t.co/IcxSFc0lxY,2,http://twitter.com/download/iphone
791087689487425536,2016-10-26 01:22:57,RT @ASX: Patrick Salis from @GBSTHoldings $GBT presenting on what it takes to be a successful #fintech. At ASX Spotlight ASIA with @Cunning…,1,http://twitter.com
790399121324597248,2016-10-24 03:46:50,GBST is proud to be named top 100 global fintech company in 2016 IDC Financial Insights Fintech Rankings.… https://t.co/fLeLBCkjdE,0,http://twitter.com
788555278904008704,2016-10-19 01:40:03,"GBST is a proud sponsor of #NeMaAsia (10-11 Nov, Hong Kong). We hope to see you there. https://t.co/vYabLVp5qE",0,http://twitter.com
785841994971185153,2016-10-11 13:58:26,"Paul of Etch re financial apps adoption....'no education , minimise points of friction (inc passwords) just make it simple'! #platforum2016",2,http://twitter.com/download/iphone
785786384414076928,2016-10-11 10:17:27,Session on Retirement opportunities for providers...#platforum2016 Pension or Lisa? Good for savers? https://t.co/81FPeZ9RmK,1,http://twitter.com/download/iphone
785664312752824324,2016-10-11 02:12:23,We are all set for #Platforum2016. Visit us at booth 7 and learn about how you can win away this awesome fitness ea… https://t.co/xBVnMn9omW,1,http://twitter.com
785372865285599232,2016-10-10 06:54:17,UK demographics snapshot? https://t.co/FmU1Wi2Xf5,0,http://twitter.com
783873451144597504,2016-10-06 03:36:09,"Embracing mobile tools can fuel business growth, argues @robdedom https://t.co/htjQv8K75e",0,http://twitter.com
782774047503298560,2016-10-03 02:47:30,David Simpson of GBST will speak at a panel about “platform models” at the upcoming #Platforum2016.Learn more https://t.co/eWwdrAyeuB,1,http://twitter.com
780665964463546368,2016-09-27 07:10:44,RT @GBSTHoldings: Congratulations to @retirementadvan for winning the Innovation Award at the #ILPAwards! https://t.co/KkrqCpNIn3,2,http://twitter.com/download/iphone
780587588402896897,2016-09-27 01:59:18,Congratulations to @retirementadvan for winning the Innovation Award at the #ILPAwards! https://t.co/KkrqCpNIn3,2,http://twitter.com
780275597964513280,2016-09-26 05:19:34,GBST is honored to be invited to the meeting with Queensland deputy premier @jackietrad. https://t.co/QiIlQV7yy2,0,http://twitter.com
780228906167128064,2016-09-26 02:14:01,RT @jenetteg: Should we fear Pensions ISAs? https://t.co/6tw2B3g6Gb via @Finextra @robdedom @GBSTHoldings,1,http://twitter.com
778338836845891584,2016-09-20 21:03:34,Enjoying UK Platform awards with key clients #schrodersukpa https://t.co/ZiXayuev5B,0,http://twitter.com/download/iphone
775528117272055808,2016-09-13 02:54:46,Looking forward to the #SchrodersUKPA next week. See you there and good luck to all the nominees! @SchrodersUKPA,0,http://twitter.com
772716119283081216,2016-09-05 08:40:53,RT @GBSTHoldings: GBST News: GBST secures international Composer contract. https://t.co/qCeH8fBUPl,2,http://twitter.com/download/iphone
772712456506355713,2016-09-05 08:26:20,GBST News: GBST secures international Composer contract. https://t.co/qCeH8fBUPl,2,http://twitter.com
761413860611850240,2016-08-05 04:09:45,RT @ComPeerLimited: ComPeer #research with @GBSTHoldings looked into how dependent firms are on legacy systems. #IT #tech #WealthTech https…,1,http://twitter.com
761413698531368960,2016-08-05 04:09:06,Congratulations to @Novia_Global on the new offering of multi-currency ETFs on their Global #platform. https://t.co/SXIzhasWS6,2,http://twitter.com
759985435976212481,2016-08-01 05:33:42,Interesting survey from UBS exams the impact that #Fintech is having on the sector and its revenues. https://t.co/eyK55iq6ud,0,http://twitter.com
758594268424343552,2016-07-28 09:25:42,How important is the role of #Fintech in the new world of #pensions freedom? Hear what @robdedom of GBST says. https://t.co/REoYuhyqGB,0,http://twitter.com
755653900611485696,2016-07-20 06:41:43,Indeed. Organisations need to be prepared while #fintech innovation continues to evolve the industry. https://t.co/lK0lLEAupJ,0,http://twitter.com
755653555240001536,2016-07-20 06:40:21,RT @jenetteg: JRP Group focuses on @GBSTHoldings powered blended retirement solution -  Partnership scraps blended product https://t.co/Y1o…,1,http://twitter.com
755290984301244417,2016-07-19 06:39:37,What are the benefits of pension consolidation and how technology can help? Hear from GBST CEO @robdedom. https://t.co/sCR7kj5RJE,0,http://twitter.com
754960143956086784,2016-07-18 08:44:59,"RT @robdedom: Good idea, should accelerate pension consolidation &amp; increase savings. A similar threshold used in Australia. https://t.co/2I…",2,http://twitter.com
753420280849047552,2016-07-14 02:46:07,Proud to be the dinner sponsor for #FinTech Platforms&amp;Wraps conference.Look forward to seeing you there.@moneymanage https://t.co/YKWlRIITzA,0,http://twitter.com
752340179843584000,2016-07-11 03:14:11,@robdedom argues that more providers need to invest in #smarttechnology to create innovative income products. https://t.co/boatYB0Nkd,1,http://twitter.com
752319074244321280,2016-07-11 01:50:19,RT @ComPeerLimited: ComPeer research in April sponsored by @EY_UKI @GBSTHoldings found legacy #IT &amp; #tech still exist but allow growth. htt…,1,http://twitter.com
751243038907707393,2016-07-08 02:34:32,Pensions – the Australian Experience. Read the full article by @robdedom from here: https://t.co/iHerlbWq1U,3,http://twitter.com
750246304878518272,2016-07-05 08:33:52,The Potential of Blockchain and DLT in Capital Markets by GBST CEO Robert De Dominicis. https://t.co/PkPOr8dWET via @Finextra,1,http://twitter.com
748701702509867008,2016-07-01 02:16:10,GBST News: GBST appoints head of EMEA https://t.co/VlYY0mP8SL https://t.co/LmWdxhNzI6,2,http://twitter.com
744720491089268736,2016-06-20 02:36:15,We are delighted to announce the launch of our new GBST website. Click here to visit:https://t.co/xJ0HMzW7ee https://t.co/CP2txDLwn2,0,http://twitter.com
743641633363632128,2016-06-17 03:09:16,"GBST staff on Vietnamese news, speaking about working with its technology partner in Vietnam. https://t.co/PSp1LtMBah",0,http://twitter.com
743363230592950272,2016-06-16 08:42:59,"Panel theme = investors will wear the cost of regulation introduced to protect them. 
But can they? #NeMaEvent  https://t.co/Z0D6Vn8jcU",0,http://twitter.com/download/iphone
743352441874219008,2016-06-16 08:00:07,"Clive Triance at HSBC, tempestuous times need authentic leaders to make a positive impact #NeMaEvent #leadership  https://t.co/zKjkIjP1Uu",0,http://twitter.com/download/iphone
743114663420956672,2016-06-15 16:15:16,NeMa day 1 = Great potential to reimagine processing from T2S &amp; DLT. See GBST's view of #blockchain https://t.co/7LKduIoRWy  #NeMaEvent,0,http://twitter.com/download/iphone
743073037629722624,2016-06-15 13:29:52,"Many views &amp; use cases shared in NeMA's double DLT afternoon. Collaboration is key, who will take the lead? #NeMaEvent",0,http://twitter.com/download/iphone
743072828598161408,2016-06-15 13:29:02,RT @AST_Steph: Almost 50 percent of panel attendees say #harmonisation is the main benefit of #T2S. @NeMa_Forum #NeMaEvent https://t.co/Ec4…,4,http://twitter.com/download/iphone
743063730053844992,2016-06-15 12:52:53,"O'Hare says ""Block chain is a brand to become better at post trade"" , most of the room agrees #NeMaEvent https://t.co/Hf48RoJlpO",0,http://twitter.com/download/iphone
742187642809290752,2016-06-13 02:51:37,GBST is pleased to be awarded the GoodAccredited Standard 2016 and nominated to enter the #SITC2016. @Goodacreuk https://t.co/4q9MAMgcwJ,2,http://twitter.com
740009362710618114,2016-06-07 02:35:55,GBST is pleased to be the polling panel sponsor again this year at the #NeMaEvent. Look forward to seeing you there. @NeMa_Forum,0,http://twitter.com
739649004900732929,2016-06-06 02:43:59,Denis Orrock of GBST quoted in @FinancialReview article – “Stockbrokers must tread a new path in robo advice world” https://t.co/omAss4loH6,2,http://twitter.com
738558068481396737,2016-06-03 02:28:59,Blockchain: Coming to an equity market near you? Hear more from GBST CEO @robdedom https://t.co/NSOA5sENOw,2,http://twitter.com
737849071319191553,2016-06-01 03:31:41,Visit us at booth 27 #2016StockbrokersConf and join us tonight for the cocktail reception at The Left Bank! https://t.co/IEkWOQSV0P,0,http://twitter.com
735303748646359040,2016-05-25 02:57:29,@atsavings adds DFMs in GBST replatforming https://t.co/HIf7wAyc9g,0,http://twitter.com
734952575624052736,2016-05-24 03:42:03,@atsavings adds DFMs in GBST replatforming https://t.co/HIf7wAyc9g,0,http://twitter.com
734588088601677824,2016-05-23 03:33:42,"A proud sponsor of the #2016StockbrokersConf, GBST will be exhibiting at booth 27 on 1&amp;2 June at Crown Promenade Melbourne. @StockbrokersAA",2,http://twitter.com
732814329721069568,2016-05-18 06:05:25,GBST CEO Rob DeDominicis provides perspective on pension dashboard https://t.co/Gm5mPD5oI6,4,http://twitter.com
730251751555653634,2016-05-11 04:22:39,GBST News: Haitong International goes live with 2nd phase of GBST’s Syn~TAC middle-office solution https://t.co/uEYnmEHP1H,2,http://twitter.com
728054614486974465,2016-05-05 02:52:01,Where does the future lie for #blockchain technology in the cash equities space? GBST experts discuss four scenarios.https://t.co/HUkD4Q3oRN,3,http://twitter.com
725512770750308354,2016-04-28 02:31:38,GBST will be sponsoring and exhibiting at The Future of Superannuation by @FSTMedia on 26th May at Hilton Sydney. See you there!,0,http://twitter.com
722508546923982848,2016-04-19 19:33:55,"RT @thewealthnet: There are 3 types of people: digital natives, digital immigrants and digital apathetics #compeerlive #wealthtech16 @GBSTH…",1,http://twitter.com/download/iphone
722475389331861509,2016-04-19 17:22:10,GBST research partner to Compeer Wealth Tech Event in London #compeer https://t.co/n5KnKCEzok,0,http://twitter.com/download/iphone
721978530867773440,2016-04-18 08:27:50,Visit us at booth13 #FFAsia16.Learn how our technology can support your business and get a chance to win a case of premium Australian Wines!,1,http://twitter.com
721903429900066817,2016-04-18 03:29:24,RT @_moneymarketing: GBST chief on powering the UK’s platforms | Money Marketing https://t.co/xLBZnSF6bs,5,http://twitter.com
719704446414901248,2016-04-12 01:51:26,GBST will be exhibiting at the upcoming #FFAsia16 in Hong Kong from 18-20 April. See you there! https://t.co/Qqw5qEFqyB,1,http://twitter.com
717178247977443328,2016-04-05 02:33:13,"A proud research partner of @ComPeerLimited, GBST will be speaking at the #WealthTech16 on April 19.Look forward to seeing you there!",2,http://twitter.com
714997162933772288,2016-03-30 02:06:22,This is why flexible and cost effective technology is the key for traditional banking in the mobile era. https://t.co/T1XjJwNnJ0,1,http://twitter.com
704140043053461504,2016-02-29 03:04:03,"GBST News: CLSA Ltd and clearing entity, SetClear renew long term contract with GBST https://t.co/ELuYdRRiFI",0,http://twitter.com
703069162961121280,2016-02-26 04:08:45,#Congrats to our Chairman&amp;founder @johfp on his retirement.Your vision led us into a world class business.Thank you! https://t.co/K5bEWzF24r,0,http://twitter.com
702983946020200448,2016-02-25 22:30:08,@PensionsAge awards GBST 2nd = tonight😉congrats to @equiniti Pensions Tech Firm of 2016 https://t.co/Qf6c0J5JHK,3,http://twitter.com/download/iphone
702982366587912192,2016-02-25 22:23:51,@PensionsAge awards congrats to Barnett Waddingham winning Pensions Consultancy of 2016!@BW_LLP,1,http://twitter.com/download/iphone
702942965665275904,2016-02-25 19:47:17,@PensionsAge awards dinner nominated for Pensions Technology Firm of the Year! https://t.co/YJZmFqHYgq,0,http://twitter.com/download/iphone
701587381904748544,2016-02-22 02:00:41,GBST is shortlisted as Technology Provider of the Year in the @FStechAwards . Winners will be announced on 17 March. https://t.co/HphCeIQ5AW,1,http://twitter.com
694415999999700992,2016-02-02 07:04:10,GBST News: GBST first to confirm T+2 readiness for Australian equities https://t.co/Deft16TdyG,0,http://twitter.com
688911842932994048,2016-01-18 02:32:37,GBST Calls for Urgent Product Innovation to Meet Retirement Reform Customer Needs https://t.co/X26jssvrhI,0,http://twitter.com
674633206239510528,2015-12-09 16:54:25,Good quote from Pete Trainor 'we are  not digitising investing we are investing in a digitised world' #langcatdeadx https://t.co/ZD3oTjhdY9,1,http://twitter.com/download/iphone
674629456477179904,2015-12-09 16:39:31,John Roe LGIM illuminating talk on behavioural psychology in finance people neglect base data! Irrational #langcatdeadx,3,http://twitter.com/download/iphone
674620964450234368,2015-12-09 16:05:46,According to Citizens Advice 40% of UK households have less than £5k financial asset #langcatdeadx,1,http://twitter.com/download/iphone
669721423942828033,2015-11-26 03:36:44,GBST News: Haitong International Goes Live With GBST’s Syn~TAC Middle Office Solution https://t.co/tQ88xRmrA3,1,http://twitter.com
669445524731351040,2015-11-25 09:20:25,GBST pleased to be sponsoring Retirement Income Options Event at London Canary Wharf #retirement https://t.co/LrorRmgvjb,0,http://twitter.com/download/iphone
668720056700940288,2015-11-23 09:17:40,GBST sponsoring Retirement Solutions Event at London Waldorf kicked off by Steve Lowe of JR #retirement #composer https://t.co/2aNfjuVJpu,0,http://twitter.com/download/iphone
667613405973319680,2015-11-20 08:00:14,GBST is proud to sponsor the ASFA Conference again this year in November. https://t.co/WmDR0I7wlc,1,http://twitter.com
666536657793847296,2015-11-17 08:41:37,GBST is excited to exhibit at the upcoming “Retirement Income Options” conference. See you there! https://t.co/xi0zrBVqSI,0,http://twitter.com
665062092680986624,2015-11-13 07:02:13,GBST is a proud exhibitor at The Retirement Solutions Forum on 23rd November. https://t.co/3NfVPLEG4Y,0,http://twitter.com
662194524727484417,2015-11-05 09:07:32,#WEmFEvents looking forward to conference The Future for the pensions and annuities market - priorities for policy Glaziers Hall London,0,http://twitter.com/download/iphone
654251419210489856,2015-10-14 11:04:28,RT @HSRetirementOps: Our thanks to @GBSTHoldings for their support - time for some refreshments and networking! #SIPPs #RetirementOps,1,http://twitter.com/download/iphone
652513825468641280,2015-10-09 15:59:53,GBST sponsoring and speaking at http://t.co/mG1gQFCTjo in London on 14th October,0,http://twitter.com
460952160931282944,2014-04-29 01:22:13,RT @AiteGroup: T+2 to be discuss at http://t.co/HAi59fUDD7 and @gbstholdings @virginieoshea to launch T+2 whitepaper on Apr 29 see http://t…,1,http://twitter.com
460952120481415168,2014-04-29 01:22:04,RT @AiteGroup: A likely short term rise in number of settlement failures? T+2 Settlement: Tech Challenges for Day After Tmrw @gbstholdings …,1,http://twitter.com
460952081579266048,2014-04-29 01:21:55,RT @AiteGroup: What are benefits of\ T+2 settlement in US? Harmonization with Europe? Reduction in counterparty credit risk? @virginieoshea…,1,http://twitter.com
460952039367774208,2014-04-29 01:21:44,RT @AiteGroup: T+2 Settlement: Tech Challenges for Day After Tmrw by @virginieoshea  @GBSTHoldings to be launched Apr 29 at @sifma http://t…,1,http://twitter.com
460952009722433536,2014-04-29 01:21:37,RT @AiteGroup: T+2 Settlement: Tech Challenges for Day After Tmrw by @virginieoshea  @GBSTHoldings explores explores drivers to speed move …,2,http://twitter.com
342825551184158720,2013-06-07 02:09:15,GBST enters the Superstream Gateway market - http://t.co/1W2aOssuvz,0,http://twitter.com
271479983636090880,2012-11-22 05:07:26,"GBST have been awarded an Illawarra Region Investment and Innovation Fund grant to create sustainable employment in the Wollongong, NSW area",1,http://twitter.com
271473935554600961,2012-11-22 04:43:24,GBST are proud sponsors of the 2012 ASFA Conference Welcome Reception at Sydney Convention and Exhibition Centre on Wednesday 28 November,0,http://twitter.com
