Tweet id,Created Time,Tweet Details,Retweet counts,Source URL
763515945646108672,2016-08-10 23:22:41,MoU signed with Cargill Inc for #salt sales in the USA https://t.co/euLfqmVS2z #ausbiz,1,http://twitter.com
757833061090287617,2016-07-26 07:00:56,MOUs signed for 100% offtake of Muga Phase One production https://t.co/DZnlG8Qduy #potash #ausbiz #asx,2,http://twitter.com
753765326827814912,2016-07-15 01:37:12,Our MD speaks to Tom Piotrowski on CommSec's Executive Series https://t.co/tpj8sCywqn,0,http://twitter.com
745767507273736193,2016-06-22 23:56:44,SOP Scoping Study completed to enhance margins from our Muga #potash mine https://t.co/3Bdz6TnqSb #asx #ausbiz,2,http://twitter.com
745034421590331392,2016-06-20 23:23:42,Highfield appoints proven mine builder Peter Albert as Managing Director https://t.co/seweMuwtLC,2,http://twitter.com
712804047674191872,2016-03-24 00:51:42,Muga #Potash Project Update: https://t.co/Aj6eFigvY4 #ausbiz #asx,1,http://twitter.com
706607010670718977,2016-03-06 22:26:54,Taylor Collison maintains Spec BUY on Highfield with price target $3.47/share https://t.co/Ake303gDMS,3,http://twitter.com
706600535370018817,2016-03-06 22:01:10,"Presentation from the Schroder Equities Conference, Zurich: https://t.co/Sdl0ysy079 #ausbiz #potash",2,http://twitter.com
704089159988674561,2016-02-28 23:41:51,Anthony Hall in the Global Mining Observer: Highfield close to debt deal in Spain https://t.co/MjYtIKZZuJ #ausbiz,4,http://twitter.com
689220342984790017,2016-01-18 22:58:29,Muga to position Highfield as the highest margin #potash producer globally https://t.co/bRdTv8o2k4,5,http://twitter.com
681618936035581952,2015-12-28 23:33:12,"$HFR enters into agreement with Spanish global construction company, Acciona, and advances project financing #ASX https://t.co/ePjwWn7ysP",6,http://twitter.com
677608425337970688,2015-12-17 21:56:52,Drill hole likely to increase resource size and life of mine at Muga Project: https://t.co/gJI8yWpIHO #ausbiz,2,http://twitter.com
671132224603992065,2015-11-30 01:02:46,London Analyst's Briefing Presentation: https://t.co/FChLj38btH,2,http://twitter.com
668568711599550465,2015-11-22 23:16:16,Former COO of PotashCorp appointed to Highfield's Board of Directors: https://t.co/L5JvyrEkuS #ausbiz #asx,2,http://twitter.com
666742762255990784,2015-11-17 22:20:36,Highfield in today's @australian Criterion column by Tim Boreham: https://t.co/Mv87o4Bzmw #ausbiz https://t.co/LRUfvGQS9W,2,http://twitter.com
666740835631804416,2015-11-17 22:12:57,We have released an updated investor presentation - click here to view: https://t.co/KSWIVKBbVh #potash #ausbiz #asx,3,http://twitter.com
666377660902211584,2015-11-16 22:09:49,Project optimisation doubles Muga potash mine life to 47 years: https://t.co/nnfyEBt66K #ausbiz,3,http://twitter.com
655868606111047681,2015-10-18 22:10:35,"Mining concession application process advanced, with positive support from community and all levels of government: http://t.co/5TWSTcJcRX",3,http://twitter.com
651569926835011584,2015-10-07 01:29:10,"CEO of @8ip Kerry Series names Highfield ""our highest conviction resources pick"" - hear why on @LivewireMarkets: http://t.co/lRplF7pTQX",2,http://twitter.com
641843443371606016,2015-09-10 05:19:36,We are pleased to announce we have appointed experienced mining executive Mike Norris as our global CFO http://t.co/gsjFL8pVLK #ausbiz,1,http://twitter.com
638845918343593984,2015-09-01 22:48:30,Highfield defines exploration target at Pintanos http://t.co/M7pgCRuxNW #asx #ausbiz,2,http://twitter.com
638193288323792897,2015-08-31 03:35:11,Click here for our 2015 annual report: http://t.co/dCi1TZ3lcE #ausbiz,0,http://twitter.com
636708933370032128,2015-08-27 01:16:53,Highfield agrees project finance mandate with four major European Banks http://t.co/tQ4sNHH28n,3,http://twitter.com
629080188077256704,2015-08-06 00:02:59,Significant exploration target defined in the Vipasca Project area - located on contiguous permits to Muga: http://t.co/SCfFWapqOy,2,http://twitter.com
626910105758474240,2015-07-31 00:19:51,Click here to view our June Quarterly Activities Report: http://t.co/czIuXCVag3,0,http://twitter.com
611732856344162304,2015-06-19 03:10:53,Substantial Exploration Target added to Muga Mine Project area: http://t.co/Wzew35k2Ls #ausbiz,1,http://twitter.com
604098938266755072,2015-05-29 01:36:25,Highfield completes successful drilling campaign - high grade potash mineralisation recorded: http://t.co/NQrHItpHwB #ausbiz #asx,1,http://twitter.com
597896178051584000,2015-05-11 22:48:51,Highfield raises $101 million to develop Muga #Potash Mine http://t.co/gIXKQOlsBA #asx #ausbiz,2,http://twitter.com
596104354093895684,2015-05-07 00:08:47,"We are in trading halt, pending the release of an announcement",1,http://twitter.com
595362444056383488,2015-05-04 23:00:42,Click here to view our updated investor presentation: http://t.co/uc3MVsM0YK #asx #ausbiz,2,http://twitter.com
592851246299643904,2015-04-28 00:42:06,Three new Investigation Permits create Vipasca Project extension; new Izaga #Potash Project http://t.co/vFD4aA8fl7 #asx #ausbiz,4,http://twitter.com
589925911455109121,2015-04-19 22:57:52,Highfield Resources $HFR delivers compelling Scoping Study for 100% owned Sierra Del Perdon #Potash Project http://t.co/o5BaGIuMrd #ASX,3,http://twitter.com
585218695582089217,2015-04-06 23:13:04,Highfield Resources $HFR announces maiden resource estimate for 100% owned Sierra del Perdon #Potash Project http://t.co/daIjbV8AoJ #ausbiz,4,http://twitter.com
582711846550913024,2015-03-31 01:11:45,"Highfield DFS delivers ‘low capex, high margin’ result for Muga mine http://t.co/zigQNPzyyE #ausbiz @MiningWeekly",2,http://twitter.com
582323116564606976,2015-03-29 23:27:04,"DFS confirms high margin, low capex potential for Muga http://t.co/QHQGuZKflj Presentation: http://t.co/RQkEJf5sVd #ausbiz",2,http://twitter.com
572545960795979776,2015-03-02 23:56:09,Highfield Resources $HFR has received confirmation of grid electricity supply at Muga #Potash Mine http://t.co/N76BWjIad0 #ASX #ausbiz,3,http://twitter.com
570429307920588800,2015-02-25 03:45:19,Highfield featured on @MiningNewsNet: a 52% increase to measured and indicated resources at our Muga-Vipasca project http://t.co/S0emcY2Jjq,4,http://twitter.com
570343235391877122,2015-02-24 22:03:18,"Following the announcement of an updated resource for Muga-Vipasca, Foster Stockbroking maintains BUY recommendation and PT of $1.35/share",1,http://twitter.com
569990181664616448,2015-02-23 22:40:23,We are pleased to announce an updated JORC Resource Estimate for Muga-Vipasca of 302 million tonnes http://t.co/5F8mWmRf8q #potash #ausbiz,3,http://twitter.com
567090900950470657,2015-02-15 22:39:41,We are pleased to welcome Mr. Alfredo L. Menéndez Diaz and Mr. Michael X. Schlumpberger to our Spanish project team http://t.co/3ORWYCPpDR,2,http://twitter.com
565741179849830401,2015-02-12 05:16:22,Pareto Securities has initiated coverage on Highfield with a BUY recommendation and price target of $1.20/share http://t.co/r62zB2LMSB,1,http://twitter.com
562422509522276352,2015-02-03 01:29:10,Bell Potter maintains Spec BUY recommendation on Highfield with an upgraded price target of $1.15/share #ausbiz,1,http://twitter.com
557294542362124289,2015-01-19 21:52:27,"Highfield Resources $HFR signed an MOU with Port of Bilbao for 25,000 square meters of wharf space http://t.co/cg3oE6HxdH #ASX #ausbiz",2,http://twitter.com
549460183966285824,2014-12-29 07:01:30,Highfield $HFR releases completed drilling results at 100% owned Muga Project. http://t.co/0oKZRTzmGk #Potash #ASX #ausbiz,1,http://twitter.com
545358432144871425,2014-12-17 23:22:37,We have signed an MOU with the Port Authority of Pasajés to export #potash from our Muga Project http://t.co/KRqykEKXB6 #ausbiz #asx,3,http://twitter.com
539535593143664640,2014-12-01 21:44:44,Click here for our RFC Ambrian #Potash and #Phosphate Day presentation: http://t.co/yITAWilTNz $HFR #ASX #ausbiz,3,http://twitter.com
533158897469517824,2014-11-14 07:26:01,Click here for our AGM presentation http://t.co/Y0N5vYG8CH #ausbiz #ASX $HFR,1,http://twitter.com
526868772724822016,2014-10-27 22:51:18,Additional high-grade drill results announced at our 100%-owned Muga #Potash Project http://t.co/vidDJymRSt #asx #ausbiz,2,http://twitter.com
525417772205871104,2014-10-23 22:45:33,Further high grade #potash intersects at our Muga Project http://t.co/49nfsBAF0k #aubiz #ASX,2,http://twitter.com
522522502304509952,2014-10-15 23:00:47,Canaccord maintains BUY recommendation with an increased 12-month PT of $0.98/sh.$HFR currently trading at $0.62/sh #ausbiz #ASX #Potash,1,http://twitter.com
522161745360474112,2014-10-14 23:07:16,"Highfield Resources featured in the @FinancialReview ""Highfield has promising prospects in Spain"" http://t.co/X1rrU5DBVc #ausbiz",1,http://twitter.com
521869484621963264,2014-10-14 03:45:55,Highfield featured in today's @australian read the article here: http://t.co/Z1BE71GFmV @BarryFitz1 #ausbiz #potash #investing,1,http://twitter.com
520361779902156800,2014-10-09 23:54:50,@Bell_Potter initiates research with BUY recommendation and a 12-month price target of $0.90/share #ausbiz #potash #asx,2,http://twitter.com
518901311236890626,2014-10-05 23:11:27,Cornerstone investor EMR Capital increases stake to 32.4% @proactive_au http://t.co/U9Lyvyzce4 #ausbiz,1,http://twitter.com
511314548955938817,2014-09-15 00:44:22,"Click here to view our latest investor presentation, detailing progress &amp; plans for our four Spanish potash projects http://t.co/ffS6K1KYIp",1,http://twitter.com
496067762154795008,2014-08-03 22:59:05,We are pleased to announce additional pleasing drilling results at our Muga-Vispasca Project http://t.co/fkXno1oxD2 #ausbiz #ASX,1,http://twitter.com
494308539947421698,2014-07-30 02:28:34,Proactive Investors @proactive_au: Highfield Resources $HFR to target initial mine at Muga #Potash Project http://t.co/2hJxnAWxmf #ASX,0,http://twitter.com
494307831487541249,2014-07-30 02:25:45,$HFR announces Javier Project split in two - Muga &amp; Vipasca - focus on initial mine at Muga's shallow mineralisation http://t.co/WH8g7C73kv,1,http://twitter.com
479052608980537344,2014-06-18 00:06:57,"""Highfield $HFR a bargain now, if analyst forecast rings true"" according to @FinancialReview's @smartinvestr http://t.co/3EdrN24UnP #potash",2,http://twitter.com
478782743057149953,2014-06-17 06:14:35,$HFR completed a $32m Institutional Placement last week to fast track development at its 3 Spanish potash projects http://t.co/mIP0Yxc34g,0,http://twitter.com
