Tweet id,Created Time,Tweet Details,Retweet counts,Source URL
847121258781249536,2017-03-29 16:20:21,Find #Heartbeat hiding at @enterprisecon and tweet @irprognosis a selfie for a chance to win! #UCcity #EC17 https://t.co/do8LRndOMp,1,http://www.hootsuite.com
847107387265875969,2017-03-29 15:25:14,When you look in the mirror do you see a superhero looking back at you? @PrognosisGuy #selfie time! #UCcity #EC17,0,http://www.hootsuite.com
846856671330676736,2017-03-28 22:48:58,Great picture Christophe! Rockin the superhero look! Plenty of time for selfies at #EC17 booth 633 to be in with a… https://t.co/cIWLDGwnZE,0,http://twitter.com
846846367611830272,2017-03-28 22:08:02,RT @TelecomReseller: - @IRPrognosis Unveils New Experience Management Solution for  @SkypeBusiness https://t.co/u9KecXXd6m via @TelecomRese…,2,http://twitter.com
846831816925433856,2017-03-28 21:10:13,"Spin the #WheelofRisk at the booth 633 at @enterprisecon, see what perils may be threatening your #UComs and win prizes #EC17",1,http://www.hootsuite.com
846815466068807680,2017-03-28 20:05:14,"Come to IR booth 633 at @enterprisecon to spin the #WheelofRisk, see what perils may be threatening your #UComs and win prizes #EC17",3,http://www.hootsuite.com
846805380579672064,2017-03-28 19:25:10,When you look in the mirror do you see a superhero looking back at you? @irHeartbeat #selfie time! #UCcity #EC17 https://t.co/B2R9ChL0Ty,1,http://www.hootsuite.com
846785294833778689,2017-03-28 18:05:21,Enter to win a TV at @IRPrognosis booth 633! Take a @PrognosisGuy selfie to enter #Uccity #EC17,1,http://www.hootsuite.com
846776621377970176,2017-03-28 17:30:53,#UCCity is under attack come help @PrognosisGuy with a #superhero selfie booth 633 #EC17,1,http://www.hootsuite.com
846766412404273153,2017-03-28 16:50:19,Transform your #ucoms with @PrognosisGuy! Stop by #EC17 booth 633 to learn more and pickup a superhero cubebot!,0,http://www.hootsuite.com
846756390601478145,2017-03-28 16:10:30,Take a superhero #selfie! #UCcity is yours to save. Booth 633 at #EC17. https://t.co/2nV54HVOOp https://t.co/zZk7Pm5GfX,0,http://www.hootsuite.com
846747522492190720,2017-03-28 15:35:15,Stop by #EC17 booth 633 to see how #PrognosisGuy will save #UCcity or keep you out of the #ContactCenter hotseat https://t.co/m8L1wr16Yc,0,http://www.hootsuite.com
846660937079664640,2017-03-28 09:51:12,RT @callcentrehelp: E-Book: The Future of Contact Centres - The Age of Customer Experience https://t.co/dhxRr5VlWT @IRPrognosis #cctr https…,3,http://twitter.com
846617195874598913,2017-03-28 06:57:23,Check out our new Podcast Deployment Phase of Transitioning UC to the Cloud https://t.co/gcG3WIQzLr on #SoundCloud,3,http://soundcloud.com
846483927338405889,2017-03-27 22:07:49,Win an exclusive invite to happy hour with the #UCexperts at #EC17 Booth 633 😬,1,http://twitter.com
846476372725817344,2017-03-27 21:37:48,RT @JeffreyBarenz: Jon K. Never looked so good.    #UCcity https://t.co/GQn1UeayLs,1,http://www.hootsuite.com
846471948632834048,2017-03-27 21:20:13,Exclusive #EC17 Monday HH with #UCexperts from @AudioCodes @WestconComstor @SPSTechBeat and IR! RT for a chance to win a ticket,0,http://www.hootsuite.com
846465637568393216,2017-03-27 20:55:09,Come by booth 663 to take a @PrognosisGuy selfie and enter to win a TV! #UCcity retweet for an extra entry,1,http://www.hootsuite.com
846458102220308483,2017-03-27 20:25:12,Let me take selfie... and win a TV! Booth 663 @PrognosisGuy selfie #Uccity #EC17,0,http://www.hootsuite.com
846450561830522880,2017-03-27 19:55:14,Get a @PrognosisGuy selfie and reveal your inner superhero. Booth 633 @enterprisecon FTW. #EC17 #UCcity… https://t.co/eY7LZHG29b,1,http://www.hootsuite.com
846354917656809473,2017-03-27 13:35:11,.@IRPrognosis  has New Experience Management Solution for MS Skype for Business Online in Office 365 https://t.co/xP82JHSz8n @msPartner#EC17,2,http://www.hootsuite.com
846334809303601152,2017-03-27 12:15:17,IR unveils New Experience Management Solution for MS Skype for Business Online in O365 https://t.co/xP82JHSz8n @msPartner #skype4b #EC17,6,http://www.hootsuite.com
846316024794361856,2017-03-27 11:00:38,Thrilled to announce @IRPrognosis has New Experience Management Solution for @SkypeBusiness Online https://t.co/xP82JHSz8n @msPartner #EC17,2,http://www.hootsuite.com
846200154155896835,2017-03-27 03:20:13,RT @callcentrehelp: The Testing Maturity Model https://t.co/z6IZThtkxb @IRPrognosis #cctr https://t.co/9eSrKHIzeC,1,http://www.hootsuite.com
846124686895468544,2017-03-26 22:20:20,Safe journey to those on their way to #EC17 - we look forward to seeing you - at booth 633 of course! @enterprisecon,4,http://www.hootsuite.com
845336967004991489,2017-03-24 18:10:13,Is SEPA’s Initiative for Instant Payments a Disruptive Game-Changer? https://t.co/3c2dOCeSOV https://t.co/ueTlX6QIto,0,http://www.hootsuite.com
845297943049588739,2017-03-24 15:35:09,TGIF: We're gearing up for a fantastic product announcement next week at #EC17 @enterprisecon https://t.co/GNlDJB5OIb,1,http://www.hootsuite.com
845279125053026305,2017-03-24 14:20:22,To determine if your network is ready for the UC cloud journey set realistic expectations about network traffic… https://t.co/BKg251cxQb,2,http://www.hootsuite.com
845277841336029186,2017-03-24 14:15:16,This time in 6 days @ir_johnd @Beth_Schultz @PEdholm will be talking Systems Management Trends #EC17 :D https://t.co/BJthEGgiIf,2,http://www.hootsuite.com
845185945192185857,2017-03-24 08:10:06,What happened this week at #CeBIT17? Stefan Bartels and Skip Chilcott fill us in https://t.co/2MS9HCxNiL VIDEO #UX Hall 12 Booth E22,0,http://www.hootsuite.com
845172645062594561,2017-03-24 07:17:15,Final day at #CeBIT17 and we're still talking... and walking... and running the find the needle in the haystack cha… https://t.co/DZ7i8iHBvH,2,http://www.hootsuite.com
845070308759490560,2017-03-24 00:30:36,What's the difference between stress testing and soak testing? What types of #IVR testing should I use?… https://t.co/1pl5Fv0Jm1,1,http://www.hootsuite.com
845061108780056577,2017-03-23 23:54:03,RT @logicalis_mike: .@LogicalisUS selects @IRPrognosis to enhance its managed #UnifiedCommunication services https://t.co/43ryVG5AM6 https:…,1,http://twitter.com
845035047962980354,2017-03-23 22:10:30,RT @enterprisecon: Get a deep analysis of Cisco &amp; Microsoft's positioning &amp; what it means for your enterprise during this #EC17 session htt…,3,http://www.hootsuite.com
844938097141932033,2017-03-23 15:45:15,Skype for Business webinar - Go Live with Confidence: watch it here now: https://t.co/ssVlvhkLH7 #skype4b https://t.co/nTYFPpftAW,2,http://www.hootsuite.com
844935559432802304,2017-03-23 15:35:10,Skype for Business webinar: Go Live with Confidence - monitoring and troubleshooting a key part… https://t.co/6yyyBudjFi,0,http://www.hootsuite.com
844930550355910656,2017-03-23 15:15:15,Wise words from this morning's #SkypeforBusiness webinar available here: https://t.co/zeqEQWXc6l #skype4b Go Live w… https://t.co/NUmcgfaZxD,0,http://www.hootsuite.com
844926918822674432,2017-03-23 15:00:50,Coming up in today's webinar on Going Live with Confidence on #SkypeforBusiness JOIN NOW https://t.co/dr1kkJEGNI… https://t.co/x0uRJciNO2,0,http://www.hootsuite.com
844911977751351296,2017-03-23 14:01:27,Skype for Business - Go Live with Confidence WEBINAR kicking off at 11am EST https://t.co/Tvp0S8Vxvn #s4B #skype4B https://t.co/1eIkdAJ4gw,0,http://www.hootsuite.com
844809720972029953,2017-03-23 07:15:07,"Join us at #CeBIT17 Hall 12 Booth E22 again today as as we talk about #unifiedcomms trends, #digitaltransformation… https://t.co/pkC3wN5JAz",1,http://www.hootsuite.com
844700273910169600,2017-03-23 00:00:13,Transitioning #UC to the Cloud - it's a phased approach https://t.co/s5TvVZBENz https://t.co/4ZOAECZcCq,0,http://www.hootsuite.com
844663922288291840,2017-03-22 21:35:46,@akkadianlabs @nojitter @enterprisecon You're very welcome 😬👍 https://t.co/bAklCGnrx3,0,http://twitter.com
844338008123953154,2017-03-22 00:00:42,Increasing Compliance Costs driving #Payments Systems towards Hosted Environments - #FinTech Podcast https://t.co/MkBlaBcTHS,1,http://www.hootsuite.com
844295101090349068,2017-03-21 21:10:13,Increasing Compliance Costs Driving #Payments Systems towards Hosted Environments - #FinTech Podcast… https://t.co/duHL2FVQL4,3,http://www.hootsuite.com
844246014114648065,2017-03-21 17:55:09,Will Robots Replace Humans in the Contact Centre? https://t.co/g5pTZntWhj @callcentrehelp #cctr,3,http://www.hootsuite.com
844198267609071620,2017-03-21 14:45:26,When UC issues arise MSPs can leverage performance-management systems to instantly find out what’s wrong and fix it… https://t.co/05BhFIsTao,3,http://www.hootsuite.com
844128997030199296,2017-03-21 10:10:10,Skip Chilcott holds a captive audience at #CeBIT17 Hall 12 Booth E22... https://t.co/3UbegcFSPq,2,http://www.hootsuite.com
844106336610738177,2017-03-21 08:40:08,"Wow, we have a great looking team and stand at #CeBIT17! Call over and say hi - Hall 12 Booth E22 😉👍 https://t.co/MVhnEDX7aZ",1,http://www.hootsuite.com
844082424581685248,2017-03-21 07:05:06,Come join us for Day 2 at #CeBIT17 Hall 12 Booth E22 - we'll be here all week running the needle in the haystack ch… https://t.co/0xZ2ByMf2L,1,http://www.hootsuite.com
844081195105304576,2017-03-21 07:00:13,Come join us for Day 2 at #CeBIT17 Hall 12 Booth E22 - we'll be here all week running the needle in the haystack challenge and more 😄,1,http://www.hootsuite.com
844023293514579969,2017-03-21 03:10:09,Take a look at our brand NEW #UC Cloud Migration checklist! https://t.co/5FAeV20ahr #ucomms https://t.co/b3uWlM0Uno,2,http://www.hootsuite.com
843993981985996801,2017-03-21 01:13:40,Skype for Business - Go Live with Confidence - get registering for this week's webinar here https://t.co/2SlvlmnG3r https://t.co/aarIjIwMsL,0,http://www.hootsuite.com
843972558466834433,2017-03-20 23:48:32,Check out our new Podcast Planning Phase of Transitioning UC to the Cloud https://t.co/Ia92UI6rPg on #SoundCloud,0,http://soundcloud.com
843965393458941953,2017-03-20 23:20:04,Only a week to go! #EC17 We're excited - Booth 633 will be where all the cools kids are hanging out :D… https://t.co/cnbu88ouQ2,4,http://www.hootsuite.com
843946437914181633,2017-03-20 22:04:45,Check out our stand at #CeBIT17 Hall 12 Booth E22 - We'll be there all week for the needle in the haystack challenge!,5,http://twitter.com
843933986615377926,2017-03-20 21:15:16,Movement towards conversational experiences and environments that are customer facing @UCStrategies https://t.co/2ntXM3FdLd #CX @DaveMario,2,http://www.hootsuite.com
843886175723184128,2017-03-20 18:05:17,Voice of the Customer: Key Insights from the Cisco Beat at Allianz https://t.co/A1opZLC9Lf @KevinFBandy @Cisco #digitaltransformation,0,http://www.hootsuite.com
843837144292581376,2017-03-20 14:50:27,Prognosis for UC increases Operational Visibility into complex hosted collaboration deployments for @LogicalisUS https://t.co/rbpQ3cooKc,1,http://www.hootsuite.com
843827019729326081,2017-03-20 14:10:13,From from the press - our brand new UC #Cloud migration checklist: Now available for download!… https://t.co/tjHD1fChcu,2,http://www.hootsuite.com
842859399471403009,2017-03-17 22:05:15,The importance of assessing your network’s readiness BEFORE you make the switch to #skype4B https://t.co/TD1ymld6uX #S4B,1,http://www.hootsuite.com
842797941194723328,2017-03-17 18:01:02,Load testing and stress testing are the most common types of IVR tests - but what are they exactly? https://t.co/xynRap5xT7 @callcentrehelp,2,http://www.hootsuite.com
842788933717168128,2017-03-17 17:25:14,Payment Hurdles for Brick &amp; Mortar Stores:  https://t.co/CvsI2h7yLD,0,http://www.hootsuite.com
842753754193715200,2017-03-17 15:05:27,What's next for workplace #collaboration? https://t.co/rBplpsdR4u @SuzanneHildreth,0,http://www.hootsuite.com
842728545520631811,2017-03-17 13:25:17,The impact WebRTC on the way we communicate and organizations deliver an improved customer experience https://t.co/XcbH33RuX1 #CX,0,http://www.hootsuite.com
842526068120739840,2017-03-17 00:00:42,Track these six #UC and #collaboration trends in 2017 https://t.co/ELyc8gKv5K #ucomms @imlazar,0,http://www.hootsuite.com
842500304851554304,2017-03-16 22:18:20,If you're having trouble understanding what IVR testing your contact center should be using read this piece on… https://t.co/adePm9T8ai,1,http://twitter.com
842478124000579586,2017-03-16 20:50:11,.@AudioCodes Modernizes UC With New Release https://t.co/RzZwOrx5I0 @FusionConnectSM @tmcnet @yourdailysteve,3,http://www.hootsuite.com
842440411603976192,2017-03-16 18:20:20,"MSPs enable customers to do business better, faster and more cost-effectively through video collab, real-time chat https://t.co/sg3UCbMeqq",1,http://www.hootsuite.com
842429090913255424,2017-03-16 17:35:21,Cuscal used Prognosis for Payments to improve response and resolution time through real-time alerts https://t.co/mZCvh1LOQX,0,http://www.hootsuite.com
842387594273017861,2017-03-16 14:50:27,Click and mortar changed to just a click. The next generation wants to click to chat with someone who could help… https://t.co/veLqHXKNUY,0,http://www.hootsuite.com
842164784812417024,2017-03-16 00:05:06,12 Ways to Ruin Your #UC #Cloud Migration https://t.co/GvscnD5krM @nojitter @Skip_C #ucomms,3,http://www.hootsuite.com
842160627825033216,2017-03-15 23:48:34,@randychapman Thanks for RT Randy! :),0,http://twitter.com
842135173344899072,2017-03-15 22:07:26,RT @TelecomReseller: - @LogicalisUS Selects @IRPrognosis to Enhance Managed Unified Communication Services https://t.co/ZvJMGO0Tat via @Tel…,1,http://twitter.com
842030202549071876,2017-03-15 15:10:19,How Managed Service Providers Can Drive #DigitalTransformation https://t.co/sg3UCbMeqq https://t.co/qABIvjUpRj,1,http://www.hootsuite.com
842001247796363264,2017-03-15 13:15:15,#Omnichannel Contact Center - are you delivering the Customer Experience Promise? https://t.co/MXixVgRToX #cctr  WE… https://t.co/YFJAcGTuao,2,http://www.hootsuite.com
841997578212392961,2017-03-15 13:00:40,Kicking off today's #contactcenter webinar on #omnichannel - delivering the #customerexperience promise… https://t.co/qv2dZNzihs,0,http://www.hootsuite.com
841993681720733696,2017-03-15 12:45:11,Sneak peek 🙈 at today's #cctr webinar: #omnichannel - delivering the customer experience promise.… https://t.co/VQQuWvxqGz,0,http://www.hootsuite.com
841804950002909188,2017-03-15 00:15:14,Monitoring #Payments in High Volume Environments https://t.co/dIJHgc0mUP https://t.co/Yj4UHeXsF1,0,http://www.hootsuite.com
841765275611484160,2017-03-14 21:37:35,RT @LogicalisUS: .@LogicalisUS selects @IRPrognosis to enhance its managed #UnifiedCommunication services https://t.co/IM0dWjDkZs https://t…,3,http://twitter.com
841754610574471168,2017-03-14 20:55:12,Listen in to this week's contact center webinar on #Omnichannel - Delivering on the Customer Experience Promise https://t.co/MNCKcu1SRz #CX,3,http://www.hootsuite.com
841711860030308352,2017-03-14 18:05:20,Some valuable performance lessons which can be applied to software development from our latest from the labs blog. https://t.co/1gMMemC67P,0,http://www.hootsuite.com
841669078645428225,2017-03-14 15:15:20,Cloud #UC and video conferencing adoption see uptick https://t.co/xQVyM5CH1g @ONeillNews @TechTarget #unifiedcomms,0,http://www.hootsuite.com
841631288226414592,2017-03-14 12:45:10,.@LogicalisUS selects IR Prognosis to enhance Managed Unified Communication Services https://t.co/15llar8lK8,1,http://www.hootsuite.com
841429955661709312,2017-03-13 23:25:09,Podcast: Payment Transaction Changes causing Banks to Re-examine their Technology https://t.co/SmIqnC3Xa9 #fintech https://t.co/2lpsbrQQoI,0,http://www.hootsuite.com
841424463321210880,2017-03-13 23:03:19,RT @dtwing: The latest The IT Management Daily! https://t.co/ooHGWDBgwJ Thanks to @WombatSecurity @IRPrognosis @AWNetworks #cloud #it,1,http://twitter.com
841407321586749440,2017-03-13 21:55:12,Skype Operations Framework: Network Readiness https://t.co/TD1ymld6uX #Skype4B #S4B,1,http://www.hootsuite.com
841380913577623552,2017-03-13 20:10:16,Why WebRTC will change the way you communicate [podcast] https://t.co/XcbH33RuX1,0,http://www.hootsuite.com
841346945360764929,2017-03-13 17:55:17,Monitoring Payments in High Volume Environments https://t.co/dIJHgc0mUP,0,http://www.hootsuite.com
841296585678049280,2017-03-13 14:35:11,How #payments technology can help skip the checkout line https://t.co/CvsI2h7yLD,1,http://www.hootsuite.com
841097961333497862,2017-03-13 01:25:55,Check out our new Podcast Transitioning Enterprise UC to Cloud - an Overview https://t.co/WRnV8dgbPE on #SoundCloud,2,http://soundcloud.com
841046512356409344,2017-03-12 22:01:29,RT @devconnect: https://t.co/U7mXQYyEDh @Conveyant @Plantronics @nvtphybridge @lumenvox @Tangonetworks @Scoredata @IRPrognosis https://t.co…,4,http://twitter.com
840651120548691974,2017-03-11 19:50:20,Planning Your Move to the Cloud - @UCStrategies  https://t.co/RIZ3PzYEyM,1,http://www.hootsuite.com
840323923170480130,2017-03-10 22:10:10,What to Consider When Vetting a UC Solution Provider https://t.co/FvkeyhzBqa @FusionConnectSM,0,http://www.hootsuite.com
840289956010610689,2017-03-10 19:55:12,Scale is probably the biggest challenge that banks face when monitoring #payments in a high volume environment.  https://t.co/dIJHgc0mUP,0,http://www.hootsuite.com
840262320479690753,2017-03-10 18:05:23,What were the hot topics of #CCW2017? Andre Cuenin discusses https://t.co/WwPibN8dsJ,0,http://www.hootsuite.com
840254739292008448,2017-03-10 17:35:15,What is IVR Experience Testing? https://t.co/yIU79mxYsd https://t.co/q9z8WkBm0x,0,http://www.hootsuite.com
840229549522706433,2017-03-10 15:55:09,"Like good cars, a good software should be designed with a high-performance mindset.  https://t.co/iu8Qv3b9DI #FromtheLabs",0,http://www.hootsuite.com
839916247315787783,2017-03-09 19:10:12,90% of Telecom Providers Believe Integrated Cloud-based Platforms Speed Time to Market https://t.co/uK9cXAdr6h @Frost_Sullivan,0,http://www.hootsuite.com
839872217852805121,2017-03-09 16:15:15,Our second poll of the webinar today on creating an agile advantage through #UnifiedComms https://t.co/kUrGDg7Ggg https://t.co/hSnTLCVuiY,0,http://www.hootsuite.com
839870974350737408,2017-03-09 16:10:18,The pace of change has accelerated - Creating an Agile Advantage through Unified Comminications. Watch webinar here… https://t.co/e1jThyuutn,0,http://www.hootsuite.com
839867170842685441,2017-03-09 15:55:12,Join Dave Murphy in Creating an Agile Advantage through #unifiedcomms WEBINAR coming up in 5 minutes… https://t.co/rIOIk5VvmT,0,http://www.hootsuite.com
839840800313868290,2017-03-09 14:10:24,"The chain is only as strong as the weakest link, if anything breaks it can impact the #UserExperience… https://t.co/TGqSV1yVrj",0,http://www.hootsuite.com
839670787619512320,2017-03-09 02:54:50,"Teach girls bravery, not perfection #IWD2017 #BeBoldforChange @TEDTalks https://t.co/TqeiGiHHsz",0,http://twitter.com
839606722700410880,2017-03-08 22:40:16,Connected Healthcare of Tomorrow: Under the Microscope https://t.co/H0Z70SWpbm https://t.co/gTQJh3xrOa,0,http://www.hootsuite.com
839597921586855936,2017-03-08 22:05:18,Who is impacted by MiFID II Regulations? https://t.co/WwPibN8dsJ #ccw2017,0,http://www.hootsuite.com
839553858221314049,2017-03-08 19:10:12,Why Cloud Architecture Matters for Multi-location Businesses @UCStrategies  https://t.co/7zy4iX12nn,1,http://www.hootsuite.com
839499778585149440,2017-03-08 15:35:19,What is #IVR Feature Testing? https://t.co/yIU79mxYsd https://t.co/HrtYDHjTar,0,http://www.hootsuite.com
839282057469702148,2017-03-08 01:10:10,Check out our case study: Hewlett Packard Troubleshoots Skype for Business with Prognosis https://t.co/gehzwPcmM0 https://t.co/bVKeFCMbIq,1,http://www.hootsuite.com
839260718499266560,2017-03-07 23:45:22,5 Ways Partners Can Master the #DigitalTransformation @thevarguy  https://t.co/pPZBds74oh,0,http://www.hootsuite.com
839256677043978240,2017-03-07 23:29:19,RT @enterprisecon: Thrilled to welcome @HiveStreaming  @InferenceSol @intel @IRPrognosis  @We_are_Jabra as #EC17 Silver Sponsors! https://t…,5,http://twitter.com
839235499512500224,2017-03-07 22:05:09,How to manage Cisco and Microsoft #UC integration https://t.co/tcVDyubIhF @imlazar @Nemertes @TechTarget #unifiedcomms,2,http://www.hootsuite.com
839186431545311232,2017-03-07 18:50:11,Debating the Telephone's Role in Internet of Things -@nojitter  https://t.co/FcMu05kUY9 #IoT,0,http://www.hootsuite.com
839146177652195331,2017-03-07 16:10:13,How messaging platforms disrupted the #UC market https://t.co/pnZVLvJ4D7 @ONeillNews #ucomms #unifiedcomms,1,http://www.hootsuite.com
839131084671627265,2017-03-07 15:10:15,Want to Create an Agile Advantage through Unified Communications? Jump on our webinar this week with Dave Murphy. https://t.co/K1bmiquI7W,0,http://www.hootsuite.com
838925948217147392,2017-03-07 01:35:07,What is IVR Soak Testing? https://t.co/yIU79mxYsd,0,http://www.hootsuite.com
838917158960775168,2017-03-07 01:00:11,Customer-focused strategy more key than #digitaltransformation hype - do you agree? https://t.co/Hp286HvWrR @antoneg,0,http://www.hootsuite.com
838910247569784832,2017-03-07 00:32:43,RT @Ucdayuk: Our 2nd sponsor @IRPrognosis preparing for their recording https://t.co/Y2lLn18OGT,3,http://twitter.com
838900785840812032,2017-03-06 23:55:08,"#CCW2017 takes on Digital Transformation, User Experience and MiFID II - https://t.co/WwPibN8dsJ https://t.co/RoQrUXDsV3",0,http://www.hootsuite.com
838782564559106048,2017-03-06 16:05:21,Get registering for this week's webinar with Dave Murphy on Creating an Agile Advantage through #ucomms… https://t.co/SpRotNlwOo,0,http://www.hootsuite.com
838753606824259585,2017-03-06 14:10:17,"Why did we attend #ccw2017? Digital Transformation, User Experience and MiFID II all had something to do with it...… https://t.co/AntIRKmz6x",0,http://www.hootsuite.com
838628343767531521,2017-03-06 05:52:32,RT @evankirstel: The Economics Of #Blockchain on @the_marketmogul https://t.co/jcc8AnMOA0 https://t.co/l5natQZJsb,1,http://www.hootsuite.com
838537644040577024,2017-03-05 23:52:08,IR’s Andreas Wächter spoke about Customer Experience Management at #CCW2017 Read more about it here… https://t.co/vLLqfF7JLB,2,http://www.hootsuite.com
837736886684815360,2017-03-03 18:50:12,"#IVR Testing Explained: stress testing, load testing, soak testing and more https://t.co/yIU79mxYsd #cctr #contactcenter",1,http://www.hootsuite.com
837695407383851008,2017-03-03 16:05:23,UC Enabled Apps Improve #CX - 7 Burning #UC Trends for 2017 https://t.co/DYbfi83o3V #custexp,0,http://www.hootsuite.com
837472292154277889,2017-03-03 01:18:48,What's the difference between stress testing and soak testing? What types of #IVR testing should I use?… https://t.co/RN7cQl7O2g,1,http://www.hootsuite.com
837462580360790018,2017-03-03 00:40:13,Retail Industry Changes Influenced by Unified Communications https://t.co/9MRrhNEiKi #ucomms https://t.co/HLhAPP7R4I,0,http://www.hootsuite.com
837431497665744897,2017-03-02 22:36:42,"RT @MPNSupport: Big news, #SkypeforBusiness lovers #tomorrow the technical webcast is about design &amp; deploy solutions 4 #Office365: https:/…",2,http://www.hootsuite.com
837431289510772736,2017-03-02 22:35:52,RT @LyncNewsTweets: (Part of the) Skype for Business Online New Trusted Application API is now in Public Preview! | The ... https://t.co/hf…,3,http://www.hootsuite.com
836980701551546372,2017-03-01 16:45:24,The next generation wants to click to chat with someone who could help. https://t.co/9MRrhNEiKi https://t.co/Ayh4YkBalO,0,http://www.hootsuite.com
836969625166430210,2017-03-01 16:01:23,”Prognosis is important because we rely on it to detect issues quickly and understand where they’re coming from.”… https://t.co/zzUainzZCe,1,http://www.hootsuite.com
836818661360996352,2017-03-01 06:01:30,RT @JimLundy: Big news coming from @AragonResearch1 tomorrow. #tier1 #Research and #Advisory https://t.co/NtrqRqZgzl,7,http://www.hootsuite.com
836713272816488448,2017-02-28 23:02:44,"@grvsmn Sure, you can find the research here: https://t.co/mruRhZ5Vtj",0,http://twitter.com
836696248514187264,2017-02-28 21:55:05,UC Strategies Experts discuss #AvayaEngage conference @UCStrategies https://t.co/vLszrQxZXY PODCAST @PEdholm @robertajfox @SteveLeaden,0,http://www.hootsuite.com
836663799910395907,2017-02-28 19:46:09,What's unified communications got to do with #digitaltransformation and moments of truth? https://t.co/rW5Yh4dLFd #UC,0,http://www.hootsuite.com
836654762481287168,2017-02-28 19:10:14,When to consider converged #infrastructure technologies https://t.co/CCPlLltdrM @clivel_98,0,http://www.hootsuite.com
836610725065940992,2017-02-28 16:15:14,Optimization among the key benefits of converged #infrastructure https://t.co/jslXnbj9cc @ModernInfra @TechTarget,0,http://www.hootsuite.com
836362805217484800,2017-02-27 23:50:06,"In retail if people don’t get a quick response about what they are looking for, they will move on… https://t.co/AMc5OyMxIx",1,http://www.hootsuite.com
836346493145600000,2017-02-27 22:45:17,"""Remote Training and Diagnosis a Reality"" - Connected Healthcare and the #UC Trends affecting it. https://t.co/H0Z70SWpbm",0,http://www.hootsuite.com
836329869743120385,2017-02-27 21:39:13,RT @devconnect: What do @nvtphybridge @tangonetworks @LumenVox @scoredata @irprognosis @Plantronics #algo have in common https://t.co/TwiCf…,2,http://www.hootsuite.com
836292364943691778,2017-02-27 19:10:12,Why 2017 will be the year of the industry #cloud @TechCrunch @thejoefloyd  https://t.co/h6HWMWXamJ,0,http://www.hootsuite.com
