Tweet id,Created Time,Tweet Details,Retweet counts,Source URL
495239244122955776,2014-08-01 16:06:51,#Atlanta! You could win a $2500 gift card to your choice of 4 great retailers by visiting a #100HardieATL modelhome http://t.co/6YCYzdhI5a,0,http://www.radian6.com
494939817256685568,2014-07-31 20:17:02,Lately there's been severe weather in all climates--can your home brave the elements? http://t.co/z0GoWHiJVg,4,http://www.buddymedia.com
494589256120418306,2014-07-30 21:04:02,What impact can #color have on your home or business? Listen here http://t.co/sePbjeDwwg for 'Why Color Matters' by @Lhcolor #podcast,1,http://www.buddymedia.com
494203969800253441,2014-07-29 19:33:02,The entrance to your home is often the 1st thing people see--why not let it stand out with HardiePanel? #reside http://t.co/4PW0odtanp,1,http://www.buddymedia.com
494143345338228739,2014-07-29 15:32:08,Can your neighbors' Low E windows melt you home? It happened to this family! #reside http://t.co/9dz9foGAKf,3,http://www.google.com/
493824553270140928,2014-07-28 18:25:22,RT @DIYNetwork: #BlogCabin sweeps is live! Enter for your chance to win this lakefront bungalow &gt;&gt; http://t.co/VS6XjMlzK7 http://t.co/APWhJ…,32,http://twitter.com
493808782250491905,2014-07-28 17:22:42,"Announcing the 2014 HardieDesign winners: In the #modern category, PSL Architects using HardiePanel… http://t.co/R7imFlfs4f",2,http://instagram.com
492753918532022272,2014-07-25 19:31:03,This Queen Anne #style #home stands out because of it's ornate details. What details stand out on your home? #reside http://t.co/WyKrx2h5Hy,1,http://www.buddymedia.com
492417448684322816,2014-07-24 21:14:03,"Check out this Shelter Island, NY #beforeandafter! The Evening Blue Artisan lap siding looks great! http://t.co/chY8CKbVCt",2,http://www.buddymedia.com
492027883641384960,2014-07-23 19:26:03,Today's ColorPlus #color of the day is Countrylane Red. Would you consider this hue for your #home? http://t.co/DKUT5bub30,7,http://www.buddymedia.com
491703745680781312,2014-07-22 21:58:03,This 1935 Sears Kit Home got a makeover with Iron Gray HardieShingle. What do you think? http://t.co/0A7IIKFqKD,3,http://www.buddymedia.com
491350164775636992,2014-07-21 22:33:02,This home renovation looks great with Timber Bark siding and Navajo Beige trim! What do you think? http://t.co/mms7PDv6CU,3,http://www.buddymedia.com
490212423757217792,2014-07-18 19:12:04,What do you think of the HardieShingle detail on this Farmhouse? http://t.co/ptPYufKizs,1,http://www.buddymedia.com
489162534881361921,2014-07-15 21:40:11,We love supporting! MT @MOBAStOfDreams We love our 2014 sponsors! @AmericanNatBank @mudomahane @CoxComm @James_Hardie http://t.co/Qj3sZ37e3n,0,http://www.buddymedia.com
489162002561257474,2014-07-15 21:38:04,"We like the look of this Southern style #home in Habersham, SC. What styles of homes are in your #neighborhood? http://t.co/xc0O1edfbB",0,http://www.buddymedia.com
488764630232498176,2014-07-14 19:19:03,We're proud to be included as one of @thisoldhouse's Best Building Products #madeinamerica! http://t.co/kobPUCZpZh,1,http://www.buddymedia.com
487697855441018880,2014-07-11 20:40:04,Does your home have existing stone or masonry? Stucco HardiePanel accents it nicely on this Tudor home! #inspiration http://t.co/I4dJ2QNlSt,2,http://www.buddymedia.com
487312307505348608,2014-07-10 19:08:02,#ThrowbackThursday to when our own Ambassadors learned to install Hardie! Does anyone recognize these Ambassadors? http://t.co/NlR2jlSnrM,0,http://www.buddymedia.com
487254425720070144,2014-07-10 15:18:02,"For #ThrowbackThursday, check out @DIYnetwork's virtual tour of their 2012 #diyblogcabin project! http://t.co/YAgQZnexl6 #remodel",1,http://www.buddymedia.com
486947411198492672,2014-07-09 18:58:04,This Before &amp; After really showcases how good your home can look when you redo your #trim! #reside #details http://t.co/z9Ofg12KAT,5,http://www.buddymedia.com
486593574843478016,2014-07-08 19:32:03,Are you considering residing your home? We've got a handy guide for you! http://t.co/VDPXj0rKZW #reside #remodel #curbappeal,5,http://www.buddymedia.com
486215594166190080,2014-07-07 18:30:05,Are you looking to boost your home's #curbappeal? @goodhousemag has 14 tips for you! http://t.co/4ahtSkWvQO,1,http://www.buddymedia.com
485820732963057664,2014-07-06 16:21:03,This dramatic before and after in Iron Gray show just how much difference a #reside can make! http://t.co/cNbMohClh7,4,http://www.buddymedia.com
485507416906534912,2014-07-05 19:36:03,"We love seeing our products on charity projects, especially a Knight's Fortress like this one for @RMDC http://t.co/OVo4PkwRFl #giveback",0,http://www.buddymedia.com
485472944425271296,2014-07-05 17:19:04,How good does the Woodland Cream look with fresh new brick? What color is your favorite with brick? #ColorPlus http://t.co/VGAj9ARsM8,0,http://www.buddymedia.com
485139993011453955,2014-07-04 19:16:02,Happy Fourth of July! #maythefourthbewithyou #independenceday http://t.co/oDhKp8lWea,2,http://www.buddymedia.com
484770559986003968,2014-07-03 18:48:02,Looking for home exterior ideas? Check out our Pinboard for homes with our ColorPlus palette! http://t.co/yAyceV5cob #pinterest,0,http://www.buddymedia.com
484436863953166336,2014-07-02 20:42:03,What ColorPlus color would look best on your home? Use our color palette to decide: http://t.co/jodqjRY8ha,1,http://www.buddymedia.com
484026659734294528,2014-07-01 17:32:03,Do you have a cottage or lake house? Heathered Moss looks great on this century #cottage in NC! http://t.co/KvbjYbdwKx,0,http://www.buddymedia.com
483292826516877312,2014-06-29 16:56:03,What home styles do you prefer? This Victorian home looks great on the block! http://t.co/kdCDgoSRlT,1,http://www.buddymedia.com
483068849638875136,2014-06-29 02:06:03,Farmhouses can be modern too; we like the look of Hardie on this home: http://t.co/ualuQrh0hO,0,http://www.buddymedia.com
482603027761987584,2014-06-27 19:15:02,We love this Before &amp; After in Boothbay Blue! What color do you prefer? http://t.co/8TxyDBTlrK,1,http://www.buddymedia.com
481914492033716224,2014-06-25 21:39:03,RT @StraightLineEx: Go check out @James_Hardie on twitter and https://t.co/c41OohMYH5 on Facebook to learn more about why we like them so m…,1,http://www.buddymedia.com
481489444621783040,2014-06-24 17:30:03,"It's been awhile, but we're still proud of the makeover we gave this @thisoldhouse home: http://t.co/T5yZLeVns6 #timeless",0,http://www.buddymedia.com
481137827716272128,2014-06-23 18:12:51,Us too! MT @kennedyhomeshow: Thank you @James_Hardie for the photo; we look forward to our 9/27 - 9/28/14 event. http://t.co/rjwWsIfzzl,1,http://twitter.com/download/iphone
481089342035996672,2014-06-23 15:00:12,We're glad fiber cement siding made @Mothernaturenet's list of top home renovations to add $$ to your resale value http://t.co/2tvtlBbSOz,4,http://www.buddymedia.com
480776995421552642,2014-06-22 18:19:02,The staggered look of #HardieShingle might be right for your home: http://t.co/fA4yQU0jnF via @4respros,0,http://www.buddymedia.com
480379630487371776,2014-06-21 16:00:03,"Our products are used on a wide variety of homes, from modern to traditional. Here's a modern take from @houzz http://t.co/PXl8RqGNnI",0,http://www.buddymedia.com
480013469031600129,2014-06-20 15:45:03,We like the way the landscaping complements this home in Soft Green #ColorPlus. What's growing in your #garden? http://t.co/WJOi26zHFh,0,http://www.buddymedia.com
479325430206709760,2014-06-18 18:11:02,"It's not easy being #green, but we certainly like to try our best http://t.co/XRVrBn6Eyx #sustainable",2,http://www.buddymedia.com
479020929193091072,2014-06-17 22:01:03,"HardieShingle accents most any house, like this beautiful home! http://t.co/MOHvrXoX0q",2,http://www.buddymedia.com
478532705697947648,2014-06-16 13:41:02,@ShowroomPartner Can you please send more information to marketingdepartment@jameshardie.com ? Thank you.,0,http://www.buddymedia.com
478531450573438977,2014-06-16 13:36:03,Are you a contractor looking for James Hardie #install information? Check out http://t.co/RSHcUfTbFg as a resource on best practices,1,http://www.buddymedia.com
477852727612309504,2014-06-14 16:39:02,The blue sky is a nice accent to this home in Monterrey Taupe. What's your favorite Color Plus color? http://t.co/hIlYNr4L8t,1,http://www.buddymedia.com
477476247396569091,2014-06-13 15:43:03,Inspecting your home regularly is smart. Have you checked out your home's exterior lately? http://t.co/5N5AOh8L7d via @nytimes,3,http://www.buddymedia.com
477110342783631360,2014-06-12 15:29:04,Keep your contemporary design options unique. Loose the maintenance #designideas #remodel http://t.co/ruGg23LRVW,1,http://www.buddymedia.com
476775628621242368,2014-06-11 17:19:02,What colors bring out the best in your home? http://t.co/Js5MpiJRZ1,3,http://www.buddymedia.com
476756503341588482,2014-06-11 16:03:02,"RT @CheekScott: Want to know the proper way to install @James_Hardie fiber cement products, check out: http://t.co/ojKGeLpIj3",1,http://www.buddymedia.com
476464585831383040,2014-06-10 20:43:04,Today's featured ColorPlus color is Arctic White. It looks great on both Plank &amp; Trim! What do you think? http://t.co/U7qwZDcp6u,1,http://www.buddymedia.com
476017130413260802,2014-06-09 15:05:02,Why Architects Choose James Hardie Over Other Products http://t.co/0OL2Wj84Sm,3,http://www.buddymedia.com
475688717743820801,2014-06-08 17:20:02,This #CapeCod style home looks great in Timber Bark! http://t.co/z3U5zyqbX0,0,http://www.buddymedia.com
475302676910342144,2014-06-07 15:46:03,What Color Plus color is your favorite? Today we're liking Harris Cream! http://t.co/n04HY3Qr47,1,http://www.buddymedia.com
474966961894739968,2014-06-06 17:32:02,"Atlanta, you could win a $2500 gift card to your choice of 4 great retailers by visiting a #100HardieATL model
home http://t.co/SMkPTx1Zw8",1,http://www.buddymedia.com
474962687248826368,2014-06-06 17:15:03,The Chicago ambassadors will be at @stcriverfest this weekend! Stop by and see them in the Lincoln Park area http://t.co/jmpOubtyIM,0,http://www.buddymedia.com
474931728818376705,2014-06-06 15:12:02,Many homes were damaged by #hail &amp; high #winds in this week's storms. James Hardie is resistant to hail; learn more: http://t.co/MqnBpRtdy4,0,http://www.buddymedia.com
474655663294283777,2014-06-05 20:55:03,Great #remodel from @premierbuildNY using Mountain Sage &amp; Arctic White Color Plus #reside http://t.co/fmClwDvN44,3,http://www.buddymedia.com
474635275336159232,2014-06-05 19:34:02,RT @QuailHomes: The siding is more than the first thing you see on a home. Learn more from Jason from @James_Hardie.  http://t.co/Vf5aNCKUi…,1,http://www.buddymedia.com
474214754509422593,2014-06-04 15:43:02,Is your home ready for #hurricane season? http://t.co/Tkr1Grj3al,0,http://www.buddymedia.com
473921313460219904,2014-06-03 20:17:00,Craftsman style home in Mountain Sage #Artisan. What style do you prefer? http://t.co/T9jdlSdFlS,1,http://instagram.com
473889614860939264,2014-06-03 18:11:03,"Take a #100HardieSelfie in front of a #100HardieATL model home &amp; get 2 chances at this week's $2500
gift card! http://t.co/kfeToxAFRS",0,http://www.buddymedia.com
473504830934491138,2014-06-02 16:42:03,HardieShingle adds character to homes in all regions. Do you like the staggered look or more standard plank look? http://t.co/G7TXWP0Amt,2,http://www.buddymedia.com
473134890712834048,2014-06-01 16:12:03,Kids from district 211 in #Palatine are learning all about how to build with James Hardie #safetyfirst http://t.co/1z25LEk26p,0,http://www.buddymedia.com
472757402342031361,2014-05-31 15:12:02,We love the look of the front porch on this home in South Carolina. Where does your family like to relax? http://t.co/eXmUWw0mVl,0,http://www.buddymedia.com
471306340921774082,2014-05-27 15:06:02,This beautiful home in #Michigan looks great in Mountain Sage! http://t.co/JSEPWnM01S,2,http://www.buddymedia.com
470955028069769217,2014-05-26 15:50:03,James Hardie proudly salutes the memory of those that died for our country http://t.co/xTCPYYoRrV,1,http://www.buddymedia.com
470583075202936833,2014-05-25 15:12:02,Look at what a difference trim makes on this #beforeandafter from Arlington Heights! http://t.co/y7ROY3kB3B,3,http://www.buddymedia.com
470255165627727872,2014-05-24 17:29:03,"ATL, Picture yourself in a new home. Take a #100HardieSelfie to double your chances in the
#100HardieATL sweepstakes http://t.co/PJBRsCNu1x",0,http://www.buddymedia.com
469927255003901953,2014-05-23 19:46:03,What's better than sitting on your porch on a spring day? Being surrounded by James Hardie siding in Evening Blue http://t.co/OKqwWclvVo,0,http://www.buddymedia.com
469493897492967424,2014-05-22 15:04:02,Where are siding colors trending next? You might be surprised- http://t.co/cf5YPnOa2R,1,http://www.buddymedia.com
469492050040471552,2014-05-22 14:56:42,"Looks ready for summer! RT @804siding: A mix of @James_Hardie prepainted siding, panels &amp; NT3 trim in Virginia. #rva http://t.co/sDTmwwv5Vx",0,http://www.hootsuite.com
469182092770045952,2014-05-21 18:25:02,"Hey #Atlanta, Take a #100HardieSelfie in front of a #100HardieATL model home &amp; get 2 chances at a $2500
gift card http://t.co/HAXQyWpSK9",0,http://www.buddymedia.com
468846579898519553,2014-05-20 20:11:50,@Wonderbear49 Thank You for entering- please visit http://t.co/VBvCGXewni or reach out to us at @james_hardie with any questions!,0,http://twitter.com
468837069373333504,2014-05-20 19:34:02,5 key questions to keep in mind when updating your home #exterior color palette http://t.co/n4jXNHMDxB,2,http://www.buddymedia.com
468828300937154560,2014-05-20 18:59:12,"RT @AshtonWoodsATL: Take a #100HardieSelfie in front of our #100HardieATL model homes, and get 2 chances at this week's $2500 prize http://…",3,http://twitter.com
468060957047267329,2014-05-18 16:10:02,Today's #coloroftheday is #BoothbayBlue. What color suits your home? http://t.co/00yAnasZld,0,http://www.buddymedia.com
467676171245998080,2014-05-17 14:41:02,The seasons are changing; Can your home stand up to the elements? HardieZone is engineered for your climate: http://t.co/UQ7ORnP4lr,1,http://www.buddymedia.com
467374691171454977,2014-05-16 18:43:04,Energy-efficient windows can cause damage to vinyl siding @nbcchicago reports http://t.co/wliUrMIdBF Is your home at risk?,0,http://www.buddymedia.com
467303485927849984,2014-05-16 14:00:07,"If you've got a great design w/JamesHardie products you want to showcase, last chance to enter HardieDesign is today http://t.co/6FHf9TSyU6",0,http://www.buddymedia.com
467046269954056192,2014-05-15 20:58:02,"TOMORROW is the deadline for the HardieDesign Contest! Developers &amp; Architects, get your entries in http://t.co/gxpI5ZZYMB",0,http://www.buddymedia.com
466708241691721728,2014-05-14 22:34:50,RT @Katie_CBD: Factors that influence home siding color trends via @4ResPros and @James_Hardie: http://t.co/rWc6HA2bzp,0,http://www.hootsuite.com
466653182664646656,2014-05-14 18:56:03,"Atlanta, visit a 100% Hardie Model Home for your chance to win. Double your chances by posting a #selfie &amp; tagging it with #100HardieSelfie",0,http://www.buddymedia.com
466581210475802624,2014-05-14 14:10:03,Architects: Will your commercial or multi-family creation be this year's Hardie Design Winner? Deadline is 5/16! http://t.co/7yy6iHtoAi,0,http://www.buddymedia.com
466319481711894528,2014-05-13 20:50:02,Even the smallest homes deserve good design: http://t.co/iKLelMTUZR,0,http://www.buddymedia.com
465874550170087426,2014-05-12 15:22:02,May is National #Remodeling Month! Here are some #reside tips for you &amp; your home: http://t.co/v56GDCwb3x,1,http://www.buddymedia.com
465517954315354112,2014-05-11 15:45:03,Happy Mother's Day to all of the Mothers! http://t.co/of5YnYgm7Q,1,http://www.buddymedia.com
464838475070865409,2014-05-09 18:45:03,What motivates you when choosing #home colors &amp; styles? A piece from @4respros on #siding trends : http://t.co/rWc6HA2bzp,0,http://www.buddymedia.com
464470043477430273,2014-05-08 18:21:02,Hardie isn't just for your home! Check out how the @ridersbaseball stadium got a makeover with HardieTrim http://t.co/50VHZ44ZSr,0,http://www.buddymedia.com
464443621400674304,2014-05-08 16:36:02,"Build a home w/ authentic character. Build w/ 100% HARDIE siding &amp; trim. Go to http://t.co/PbApgGqWrM
to find a local #100HardieATL builder",1,http://www.buddymedia.com
464110931451342848,2014-05-07 18:34:03,"May is #Fire Safety Month! Our siding is non-combustible &amp; that can help, but here are tips to keep your home safe http://t.co/JXrgfi9231",2,http://www.buddymedia.com
463773451111501825,2014-05-06 20:13:01,RT @AtlantaREForum: Core Homebuildes Partners with JamesHardie for 100% Sweepstakes http://t.co/YKvCtJLcwC,0,http://www.hootsuite.com
462312376348737539,2014-05-02 19:27:14,Hey #Atlanta! Announcing #100HardieSelfie: take a pic of yourself at a #100HardieATL model #home &amp;… http://t.co/leH6ij8VWi,0,http://instagram.com
461976464301522944,2014-05-01 21:12:26,Great! RT @kicksnlacs: Used@James_Hardie color pw/ Cobble Stone &amp; Monterey Taupe on this reside of  8 year old home http://t.co/ehtn3TEhcd,0,http://www.hootsuite.com
461950530223620096,2014-05-01 19:29:23,"RT @jhambassadors: Hey NJ, head to #Bridgewater @HomeDepot &amp; have Hardie Ambassadors sign you up for Hardie Home Outdoor Living #Sweepstakes",0,http://www.hootsuite.com
461913479021334528,2014-05-01 17:02:10,Great front porch on this Hardie home in #Norfolk VA http://t.co/bcO3uidu1N http://t.co/WAYz65zM4V,0,http://www.hootsuite.com
461867671144116225,2014-05-01 14:00:08,"Hey #Atlanta, you could win a $2500 gift card to your choice of 4 great retailers by visiting a #100HardieATL model home!",0,http://www.buddymedia.com
461169137533075456,2014-04-29 15:44:25,RT @crownbuilders: Leaders in Their Field: Why James Hardie Siding Is a Top Choice for the Exterior of Your Home http://t.co/hrPK2WQgiw,1,http://www.hootsuite.com
460869580412715008,2014-04-28 19:54:05,James Hardie is proud to be named one of @Forbes magazine's 100 Most Trustworthy Companies in the U.S. for 2014. http://t.co/ng39NjTZJe,6,http://www.hootsuite.com
460853774199029760,2014-04-28 18:51:16,RT @JHAmbassadors: ColorPlus #Playoff: Harris Cream vs Chestnut Brown - you decide! #siding #HardiePlank #remodel http://t.co/OOveW8mJOq,3,http://www.hootsuite.com
459735943759802368,2014-04-25 16:49:25,@willamscarle Looks great!  Is that Woodland Cream?,1,http://www.hootsuite.com
459417383216893953,2014-04-24 19:43:34,Share a photo when it's done! RT @BIGMIKE61: Having house sided with James Hardie fiber cement cedarmill planks,0,http://www.hootsuite.com
459065261753376768,2014-04-23 20:24:22,Gorgeous home! RT @makeitcarefree: Beautiful exterior #renovation using @James_Hardie siding in Monterey Taupe! http://t.co/AE8MBCLAIQ,1,http://www.hootsuite.com
459050501141987329,2014-04-23 19:25:42,Lovely! RT @LQDesignStudio: @James_Hardie siding is low maintenance &amp; durable; used here for porch project #EarthWeek http://t.co/I05sVszgG1,2,http://www.hootsuite.com
458664644450992129,2014-04-22 17:52:27,Happy #EarthDay from James Hardie! Did you know that James Hardie siding products are environmentally sustainable?  http://t.co/oCGIVUEpFL,1,http://www.hootsuite.com
456525939451514880,2014-04-16 20:14:00,"Gorgeous home in #Wyckoff, NJ using HardiePlank in Navajo Beige. Nice work by PJ Sullivan Construction. #homedesign http://t.co/9nzxYFTJmx",1,http://www.hootsuite.com
456189670561697792,2014-04-15 21:57:47,Lovely! RT @Exovations: Navy #jameshardie #siding  http://t.co/xwlY7NaCfg @Exovations Atlanta http://t.co/nWbGE9YoUJ #remodel,0,http://www.hootsuite.com
456119392653574144,2014-04-15 17:18:32,Take a look at this stunning historic renovation using HardiePlank siding: http://t.co/rgu6cp55WB,1,http://www.hootsuite.com
455826130944393218,2014-04-14 21:53:13,"Architects &amp; developers, have you entered your commercial or multi-family project into HardieDesign Contest yet? http://t.co/mNIulE6qD9",3,http://www.hootsuite.com
455777252329127936,2014-04-14 18:38:59,Great historic look RT @CheekScott: Just completed using @James_Hardie Mt Sage siding w/ Navajo Beige trim @LansingBP http://t.co/nuKMvN0GUQ,2,http://www.hootsuite.com
455736707074490368,2014-04-14 15:57:52,Nice article in @fhbweb on the benefits of upgrading to fiber cement siding: http://t.co/2mNVGuhq0J #remodel,1,http://www.hootsuite.com
455482968182915072,2014-04-13 23:09:36,Great look! RT @carpenterstouch: Almost Done with our James Hardie Shakes job....Brooklyn Bound... http://t.co/IThbIUDMEl,1,http://www.hootsuite.com
454639078265610240,2014-04-11 15:16:17,Catch James Hardie products help make over an abandoned home on @AETV 's show Flipping Boston airing tomorrow 12PM ET http://t.co/i8R6KlgsaC,2,http://www.hootsuite.com
454349832560603136,2014-04-10 20:06:56,RT @Siding1IL: A great video &amp; great product!  See James Hardie re-siding project &amp; imagine how you could transform your......,0,http://www.hootsuite.com
454303490618441728,2014-04-10 17:02:47,RT @804siding: A beautiful day in Central Virginia to begin installing new Hardieplank siding on this home. #rva http://t.co/KUR6TzuZQR,0,http://www.hootsuite.com
453965179399983104,2014-04-09 18:38:27,RT @alliedbldgprods: Congrats to everyone involved in the show. @James_Hardie siding on @AETV #FlippingBoston http://t.co/b66xLud6vL,1,http://www.hootsuite.com
453937071955402753,2014-04-09 16:46:46,"Smart move! RT @66ej: Snow day! 
Another hail damage property, improving from vynil to James Hardie Plank. Smart!",1,http://www.hootsuite.com
453909804910923776,2014-04-09 14:58:25,RT @Maintenanceeng: James Hardie Siding Products Highlight Home Renovation on New Episode of A&amp;E's Flipping Boston http://t.co/3FBsUcQbjs,3,http://www.hootsuite.com
453576810924883968,2014-04-08 16:55:13,Ever wonder what exterior color &amp; design questions we get the most? Get the answers! http://t.co/SnhPrS2sY8 #remodel #homedesign,1,http://www.hootsuite.com
453557308812189696,2014-04-08 15:37:43,RT @CheekScott: Need help with installing @James_Hardie products?  Check out this site: http://t.co/TJKNTDYjH5,0,http://www.hootsuite.com
453317175022206976,2014-04-07 23:43:31,RT @holmes_ohio: Ian Holmes was recently featured on Gary Sullivan Show talking James Hardie Siding. Check it out! http://t.co/syYVImM6rj,0,http://www.hootsuite.com
453191392769355776,2014-04-07 15:23:42,"RT @ForTraders: James Hardie : Donates $50,000 in Exterior Panel System Product to Aid Construction of Chicago Children's A......",1,http://www.hootsuite.com
452196367445020672,2014-04-04 21:29:50,Thank you Lansing! RT @LansingBP: Thank you! @Deceuninck @ExteriaBP @hancocklumber @PorchColumns @Henkel @James_Hardie...,0,http://www.hootsuite.com
452108330908266496,2014-04-04 15:40:00,Did you see amazing pics of storm at #frisco #roughriders stadium? Did you know #DrPepperPark has HardiePlank on it? http://t.co/1TalmWwxzR,1,http://www.hootsuite.com
451813280680800258,2014-04-03 20:07:35,RT @willamscarle Come see us http://t.co/Qn9suVYyJh @James_Hardie booth this Sat. April 5 Peachtree City @Drake field @Peachreecitylibrary,1,http://www.hootsuite.com
451764747915239425,2014-04-03 16:54:43,Hey Chicago! Get out of the rain &amp; say hi to the Hardie Ambassadors at the #Northbrook @Lowes &amp; enter the #sweepstakes while you're there!,0,http://www.hootsuite.com
451726475591704577,2014-04-03 14:22:39,RT @804siding: Cobblestone color @James_Hardie re-side project completed today in #charlottesville. #albemarle #va http://t.co/reSZuqyERE,1,http://www.hootsuite.com
451435698743443456,2014-04-02 19:07:12,RT @AHomeContractor: An alternative to vinyl siding? @James_Hardie fiber cement #siding is your answer! #remodel,1,http://www.hootsuite.com
451366312116514816,2014-04-02 14:31:29,RT @DilworthBuild: Replacing old cedar siding w/ @James_Hardie Cedarmill. Sunny skies are welcome! Radnor 2 project. http://t.co/4ZwELDAIUB,0,http://www.hootsuite.com
451021017516109824,2014-04-01 15:39:24,Architects &amp; developers: Enter commercial/multifamily project into HardieDesign Contest! Winners receive custom video http://t.co/179D8YCi3K,3,http://www.hootsuite.com
451006801174343681,2014-04-01 14:42:55,Love the board &amp; batten look! RT @kbhomesnj: James Hardie Siding - http://t.co/OVJHoFwDOC http://t.co/WR8PKkjHHJ #remodel,1,http://www.hootsuite.com
450699006059229184,2014-03-31 18:19:51,Ever wondered how James Hardie siding compares to other types of cladding? Here's a side-by-side comparison: http://t.co/ShCa05Zewz #remodel,4,http://www.hootsuite.com
450305001630752768,2014-03-30 16:14:13,"RT @kicksnlacs: @James_Hardie another top quality ColorPlus re-side out of PDX ,timberbark body w/ cobblestone trim http://t.co/oocAFUBYUa",0,http://www.hootsuite.com
449584319582203905,2014-03-28 16:30:29,"Now that warmer weather is arriving, have you started planning your home's re-side? Learn how to pick a contractor: http://t.co/2ZOTVS10Q3",5,http://www.hootsuite.com
449555349235044352,2014-03-28 14:35:22,RT @HutchE4C: The great melt is on &amp; so is The Spring @cottagelife Show! Come visit @James_Hardie for the best in design &amp; durability,0,http://www.hootsuite.com
449265722502705153,2014-03-27 19:24:29,"RT @prosalesonline: Thanks to @James_Hardie for sponsoring ""Is There a Robot in Your Future"" session #ProSales100 http://t.co/H4JDmhfUv1",3,http://www.hootsuite.com
449257505609515009,2014-03-27 18:51:50,Thanks! RT @paroofer: Love this product! http://t.co/hym7NAeJzq #Fibercement #siding #quality,1,http://www.hootsuite.com
