Tweet id,Created Time,Tweet Details,Retweet counts,Source URL
388533772481593344,2013-10-11 05:17:24,RT @SeeWantShop: Posted // #SpringRacing ft @lovisastore @dresseduponline trendthreads @_edwardsandco #seewantshop @… http://t.co/WbKhLf6pzA,1,http://twitter.com
388179604038381568,2013-10-10 05:50:04,LOVE fashion blogger @SeeWantShop latest edit featuring our Black flowercrown! Read the blog http://t.co/MOkcF17KBG http://t.co/tGYdRmCoRj,1,http://twitter.com/download/iphone
387857797784010752,2013-10-09 08:31:19,Monochrome style insp for derby day! #lovisaloves spring racing! #springcarnival #derbyday http://t.co/YqtLMu1yAM,2,http://twitter.com/download/iphone
387471340241833984,2013-10-08 06:55:41,Congratulations to all our winners and Thank You to everybody who entered! #lovisa http://t.co/Z3hPZ4doci,0,http://twitter.com
387466987984539649,2013-10-08 06:38:23,"@AngieLovely123 Congrats Angela we LOVE your entry, you're our Twitter Winner, pls private message on fb with your info to arrange the prize",0,http://twitter.com
386038031385243648,2013-10-04 08:00:13,Lovisa Loves the new Festival Fever Range! Now Instore and Online http://t.co/fQndhKYYGw #lovisa #jewellery #fashion http://t.co/FnB9m7Db1e,0,http://twitter.com
385989290921959425,2013-10-04 04:46:33,"WIN Exclusive Swarovski Crystal Designs worth up to $299 on our Twitter, Facebook &amp; Instagram http://t.co/69KxY3ubps http://t.co/1IN3r6hcy7",0,http://twitter.com
385656461751099393,2013-10-03 06:44:00,Lovisa's Festival Fever Range featured in @cleomag #lovisaloves this editorial #lovisa #festival #editorial #colour http://t.co/kz2bHTpNGi,0,http://twitter.com
385312087972388864,2013-10-02 07:55:35,"@emmastacey_ yes you can just apply online without a video, see our careers page to find out how",0,http://twitter.com/download/iphone
385293782029070336,2013-10-02 06:42:50,"WIN this one of a kind ring featuring swarovski crystals. Follow us, Retweet, Name the piece and tag #winlovisa http://t.co/WrazKJsh3e",10,http://twitter.com
384937173922742272,2013-10-01 07:05:48,"Your Spring Racing Style Destination, Shop Now http://t.co/GGKgDQGDwl #lovisa #jewellery #hair #racing #Spring #style http://t.co/VLSChn9F6w",2,http://twitter.com
383798202589138944,2013-09-28 03:39:56,Inspiration for Lovisa's essential semi precious range #lovisa #jewellery shop now http://t.co/foS6TII9AK http://t.co/HCwNnBhKTW,1,http://twitter.com/download/iphone
383108216168534016,2013-09-26 05:58:11,#lovisaloves this statement gold tone cuff with semi precious stones #lovisa #jewellery #statement #gold #style #cuff http://t.co/TtMEOtT1iW,3,http://twitter.com
383103957049954304,2013-09-26 05:41:15,RT @XFactorAUStyle: Strapless for @jacintagee @_thirdd3gree in @oneteaspoon_ dress cirqlatepr @lovisastore necklace… http://t.co/KiDPSUnbY6,2,http://twitter.com
382037509305155584,2013-09-23 07:03:34,"Don't miss the last days of sale, 3 FOR $10 on all sale items excluding necklaces, http://t.co/56W7HN8doJ #sale #lovisa #jewellery #shopnow",3,http://twitter.com/download/iphone
381723134979608576,2013-09-22 10:14:22,Loving the style on @xfactorau featuring @lovisajewellery #thirdd3gree #xfactoraustyle http://t.co/mbHYEjapy8,2,http://twitter.com/download/iphone
380601975332556800,2013-09-19 07:59:16,"Lovisa's new Retro Gift Tags are now online, Shop now http://t.co/WP3ant06pb #lovisa #retro #witty #Jewellery #quotes http://t.co/BT1mnj4T33",0,http://twitter.com
380207551846969345,2013-09-18 05:51:59,"Lovisa's street stylists are trending turquoise, which is your favorite look? #lovisa #streetstyle #turquoise #style http://t.co/FWdE5s83kW",1,http://twitter.com
379233357952847872,2013-09-15 13:20:53,@Bit_Square Great post! #lovisaloves,0,http://twitter.com/download/iphone
379183164444250112,2013-09-15 10:01:25,Turquoise style now in store and online #lovisa #turquoise #trend #jewellery http://t.co/OTNN5YoYCL,2,http://twitter.com/download/iphone
378050223450251264,2013-09-12 06:59:31,Check out Lovisa's Tribal Trending Statements on our Blog http://t.co/YiWSqsDUUQ #lovisa #tribal #trend #blog http://t.co/thsD2I214u,0,http://twitter.com
377333689278922752,2013-09-10 07:32:16,"In Store and Online, All SALE Rings &amp; Wristwear 3 FOR $10, http://t.co/nUY4QUBInS #Lovisa #jewellery #sale #shopping http://t.co/k4B5sOiHpI",3,http://twitter.com
375513270049718272,2013-09-05 06:58:34,@sl221 please email us at online@lovisa.com.au and we will resolve this ASAP,0,http://twitter.com/download/android
375206345995071488,2013-09-04 10:38:58,"Don't miss our 24hr VIP SALE, visit http://t.co/U8dsiinUX0 to sign up  http://t.co/Xgzy4fa52t",0,http://twitter.com/download/android
375108500336041984,2013-09-04 04:10:10,RT @ScoutItOutTweet: Find out why we love chunky chain necklaces &amp; decide to spend or save - featuring @lovisastore @ASOS @NETAPORTER http:…,1,http://twitter.com
375108117198946304,2013-09-04 04:08:38,@ScoutItOutTweet Great Edit!,0,http://twitter.com
374103825512005632,2013-09-01 09:37:57,Join the Lovisa team for Christmas. Upload your 2 minute application video now http://t.co/7AVTUv99ZZ #Lovisa #Lovisajewellery,0,http://twitter.com
373600318149246976,2013-08-31 00:17:11,Give the ultimate gift this weekend...#lovisa #lovisajewellery http://t.co/tzNcy4Oj7S,0,http://twitter.com/download/android
373291781502148608,2013-08-30 03:51:10,We LOVE this customers wedding boquet made entirly from Lovisa jewellery #lovisa #lovisajewellery #bride #wedding http://t.co/xzTVggePzD,0,http://twitter.com
372636506126434304,2013-08-28 08:27:21,Lovisa's Bridal Style...for the perfect day  http://t.co/YC1SrXPCGl #lovisa #lovisajewellery #bridal #bridesmaids http://t.co/cF4WI8xCmV,0,http://twitter.com
371877194177343488,2013-08-26 06:10:06,"This season’s power colour, yellow, adds a pop of colour to every outfit. #lovisa #yellow #lovisajewellery #celebrity http://t.co/SQQJljR7wP",1,http://twitter.com
370816651932864512,2013-08-23 07:55:54,"We're thrilled Delta is loving our Exclusive Diamond Simulants Necklace, and we love her note #deltagoodrem #lovisa http://t.co/HXHjjap2hM",0,http://twitter.com
370700298764816384,2013-08-23 00:13:33,Introducing the new Diamond Simulants Range - Perfectly packaged and Exclusive to Lovisa #Lovisa #lovisajewellery http://t.co/nreqWOqDiV,0,http://twitter.com
369663572978053120,2013-08-20 03:33:58,"Loving the must have shape of the season, check out inspirational triangular treasures http://t.co/4r7G0Yq3Nr #lovisa http://t.co/QKwZnD4rx9",0,http://twitter.com
369285263677067264,2013-08-19 02:30:42,"Triangles now trending, we LOVE this Black Plaited Tube Triangle Necklace in Black or White #lovisa #lovisajewellery http://t.co/OxeHrD2NBN",0,http://twitter.com
368951654550220800,2013-08-18 04:25:03,Only 9 days left to apply for our Christmas teams!! Upload a 2 minute video to apply now! http://t.co/7AVTUv99ZZ  #lovisa #lovisajewellery,0,http://twitter.com
367889281278169088,2013-08-15 06:03:34,@lanajosephineb very sorry for the delayed response. Please send a private message on FB and I will ensure our online team gets it asap!,0,http://twitter.com
367886730575114240,2013-08-15 05:53:26,We love how Riri rocks the midi ring trend! Get her look with these beautiful sets. #lovisa #lovisajewellery #Rihanna http://t.co/t5wUHpb4PK,0,http://twitter.com
367558017157308416,2013-08-14 08:07:15,We are loving memory rings right now!! Layered for a luxe effect!  #Lovisa #midirings #memoryrings #lovisajewellery http://t.co/hHXi2YRWNG,0,http://twitter.com
365726669023100930,2013-08-09 06:50:07,Being bold in black is what every style savy fashionista is about right now and we LOVE it http://t.co/YiWSqsDUUQ http://t.co/HoHG3L0IDl,0,http://twitter.com
365359127171575814,2013-08-08 06:29:38,"sydney blogger #Karissasparkes is stunning in a beautiful floral lace top paired with our rose gold diamante earcuff, http://t.co/qh2ajxEyiF",0,http://twitter.com
365255347717410819,2013-08-07 23:37:15,"The amazing tribal necklace is back... in black!
Get it before it sells out, again! http://t.co/eu5UTAClHs #lovisa http://t.co/JlZMbZllEy",0,http://twitter.com
364639787539374081,2013-08-06 06:51:14,"We are now recruiting for our Christmas teams in AUS, NZ, SING &amp; MAL! Upload a 2 minute video to apply now! http://t.co/7AVTUv99ZZ  #lovisa",0,http://twitter.com
364254787560148996,2013-08-05 05:21:23,RT @CelebScoopla: I love my tiger bracelet &amp; outfit today! Thanks @_KOOKAI_ and @lovisastore - @Charli_Robinson xx http://t.co/CVkmftcboo,1,http://twitter.com
364219177021612033,2013-08-05 02:59:53,@alice_the_malis  I think we might figure it out! Love your collection! :-),0,http://twitter.com
364218392913256449,2013-08-05 02:56:47,ANIMAL! How to layer it and how to wear it! This Tiger head worn by @marcia91 is amazing! #lovisa #lovisajewellery http://t.co/tJKvWBZGxo,0,http://twitter.com
363487071346122752,2013-08-03 02:30:45,"Love @scherri_biggs 's statement with her clustered studs.
#lovisa #lovisajewellery #regram
http://t.co/PpDf0jnEOS",0,http://www.hootsuite.com
363190167521484800,2013-08-02 06:50:58,@briepetiteworld thats so pretty! Love your blog!,0,http://www.hootsuite.com
363189995710201857,2013-08-02 06:50:17,@alice_the_malis Its an amazing piece! LOVE the animal trend! Were glad you love it!,0,http://www.hootsuite.com
363188182528966656,2013-08-02 06:43:05,Trend Alert - Statement Studs! #statement #lovisa #lovisajewellery See more on our blog http://t.co/YiWSqsDUUQ http://t.co/zZecyZJm5o,0,http://twitter.com
362783166618030080,2013-08-01 03:53:41,We love @junnita amazing gold snake ring! would you wear this? http://t.co/9BEfZlZc4Z,0,http://twitter.com
362473336409833472,2013-07-31 07:22:32,"Only 5 Available!
Amazing online Exclusive! Get it now http://t.co/wCK2zKIoZB http://t.co/SwH6qvc6Ym",0,http://twitter.com
362464185109577728,2013-07-31 06:46:10,RT @bangandbuck: The latest on http://t.co/V0RUi0Fu1o secret_south @rmk_shoes @lovisastore http://t.co/yev7dDZ0j1,2,http://www.hootsuite.com
362392244700979202,2013-07-31 02:00:18,"Kate Moss, what a style icon!

Who Magazine show you how to get her look with the amazing animal trend! http://t.co/kxVVYvsjSQ",0,http://www.facebook.com/twitter
362331874447728641,2013-07-30 22:00:25,"Celebrities are LOVING the new animal trend, who does it best?

Steal their style here... http://t.co/CS4FrMt9ZS http://t.co/mCn9i97wrG",0,http://www.facebook.com/twitter
362143089462214656,2013-07-30 09:30:15,"ANIMAL INSTINCT... in store and online

Check out our blog for more Animal inspiration, find out how to get the... http://t.co/pmeOFZNz2k",0,http://www.facebook.com/twitter
361753267723702273,2013-07-29 07:41:14,"Congratulations Alanna, you can never go wrong with black and gold, you have won the Lovisa choice of our Snap a... http://t.co/80JFmqswTG",0,http://www.facebook.com/twitter
361752754462531584,2013-07-29 07:39:12,"Congratulations Leanne we loved your statement neck in ocean colours that matched your top, You have won the... http://t.co/0vTx383fEO",0,http://www.facebook.com/twitter
361040819639156739,2013-07-27 08:30:13,"LAST CHANCE TO ENTER!
Upload your selfie now!

Competition closes 11:59pm AEST.
Enter Here http://t.co/t3P9b6s9ei http://t.co/KIzyYFkLcj",0,http://www.facebook.com/twitter
360987977901539328,2013-07-27 05:00:15,"Don't forget to vote for your favorite ""Snap a Lovisa Statement"" competition entry. 

Last day to vote!
View... http://t.co/9s61M6JC7O",0,http://www.facebook.com/twitter
360957788094070784,2013-07-27 03:00:17,"LAST CHANCE TO ENTER!
Enter now to be in with a chance to WIN a $300 Lovisa shopping spree.

Enter Here... http://t.co/ncvdq9rphW",0,http://www.facebook.com/twitter
360942685571399680,2013-07-27 02:00:16,"NW silver or OK gold?
Which do you prefer? http://t.co/XFO10JVNTu",0,http://www.facebook.com/twitter
360685995567489024,2013-07-26 09:00:17,"ONLY 2 DAYS LEFT TO ENTER!
Hurry, enter now for your chance to win a $300 Lovisa shopping spree.

Enter Here... http://t.co/VtFKajR6D1",1,http://www.facebook.com/twitter
360589697929576448,2013-07-26 02:37:38,Celebrities and fashionistas have now embraced the oversized boyfriend watch trend. Who wears it best? http://t.co/7cIlsxwPHs,0,http://twitter.com
360323606439407617,2013-07-25 09:00:16,HURRY! Only 3 days left to enter our selfie competition to be in with a chance to win a $300 LOVISA SHOPPING... http://t.co/xHjHvn0dNk,0,http://www.facebook.com/twitter
360202333952548866,2013-07-25 00:58:23,"I posted 7 photos on Facebook in the album """" http://t.co/D3dtNg18JP",0,http://www.facebook.com/twitter
359924929430437889,2013-07-24 06:36:04,"Our Instagram fans are loving this CHAIN LINK TRIBAL COLLAR NECKLACE 

Back in stock! Its selling out fast so... http://t.co/M6mu6eOXZc",0,http://www.facebook.com/twitter
359498363730800642,2013-07-23 02:21:03,"WIN one of two $300 LOVISA SHOPPING SPREES!
Snap a selfie wearing your fave Lovisa jewellery and upload it!
ENTER NOW http://t.co/t3P9b6s9ei",1,http://twitter.com
359497294531395584,2013-07-23 02:16:48,Remember to head into store or jump online at http://t.co/U8dsiinUX0 to take full advantage of our 2 FOR $15 offer!,0,http://www.facebook.com/twitter
359243993957539840,2013-07-22 09:30:17,"WIN one of two $300 LOVISA SHOPPING SPREES.
Upload a selfie now for your chance to win!

Hurry Competition... http://t.co/mpkkxPg78X",1,http://www.facebook.com/twitter
359158355526713344,2013-07-22 03:49:59,"I posted 8 photos on Facebook in the album ""2 FOR $15"" http://t.co/cz01kENWG6",0,http://www.facebook.com/twitter
358783460992761860,2013-07-21 03:00:17,"Jaclyn is making a statement in this bright neon Lovisa necklace!
Share your statement to WIN a $300 shopping... http://t.co/zf7hL3cQHc",0,http://www.facebook.com/twitter
358421078206464001,2013-07-20 03:00:18,"We are loving our amazing CRYSTAL MARQUIS EAR CUFF as featured in our latest street style snaps. 

Steal her... http://t.co/svSUunH9jJ",0,http://www.facebook.com/twitter
358051127415156737,2013-07-19 02:30:15,"NW Magazine Australia are loving our new Ear Cuffs, as featured below.

Which is your favorite? 

BLACK... http://t.co/LhOgWRlhcN",0,http://www.facebook.com/twitter
357794444268945410,2013-07-18 09:30:17,Check out our Ear Cuff Style blog for inspiration on how to get the celebrity look! http://t.co/YiWSqsDUUQ http://t.co/ciug2zrutK,0,http://www.facebook.com/twitter
357734044890443776,2013-07-18 05:30:17,"Ashlee is stunning in our chunky gold chain necklace! 
Make a statement and share your selfie to win now... http://t.co/CojgB7GMw9",0,http://www.facebook.com/twitter
357687036213334016,2013-07-18 02:23:29,"Win Win Win!
Get your entries uploaded now to be in with a chance to win one of two $300 shopping sprees!... http://t.co/Ml3R7uMix4",0,http://www.facebook.com/twitter
357432058701824000,2013-07-17 09:30:18,"Enter our ""Snap a Lovisa Statement"" competition like Maria has wearing one of our Our Tango Pop necklaces.... http://t.co/L57SlBdfrd",1,http://www.facebook.com/twitter
357417931585486848,2013-07-17 08:34:10,"Enter our ""Snap a Lovisa Statement"" competition like Maria has wearing one of our Our Tango Pop necklaces.... http://t.co/UIy9WvcWzM",0,http://www.facebook.com/twitter
357402781704921088,2013-07-17 07:33:58,"I posted 6 photos on Facebook in the album ""Trend Alert - Ear Cuffs"" http://t.co/4QNrAjBMks",0,http://www.facebook.com/twitter
357069677723267073,2013-07-16 09:30:19,"The statement necklace - forever on trend and now from $19.99

Shop Now http://t.co/RzKWQt0Epj http://t.co/OZbpWarhyU",0,http://www.facebook.com/twitter
357042972296085504,2013-07-16 07:44:12,"New store openings continue in Singapore!
We are delighted to announce that Lovisa is now open at the amazing... http://t.co/2KL00nUyIX",0,http://www.facebook.com/twitter
356707272161894402,2013-07-15 09:30:15,"Just snap and upload your Lovisa statement to win one of two Lovisa $300 shopping sprees. 

Enter now at... http://t.co/y8okuyDly0",0,http://www.facebook.com/twitter
356652618157789185,2013-07-15 05:53:05,"I posted 8 photos on Facebook in the album ""NEW SEASON STATEMENT NECK COLLECTION"" http://t.co/JAHvZUbrAp",0,http://www.facebook.com/twitter
356633469205491712,2013-07-15 04:36:59,"RT @itsissJessss: @lovisastore the long gold n/lace with pastel blue small bird (and a ring in the same line), long gold key n/lace and mus…",1,http://twitter.com
356325240218984449,2013-07-14 08:12:12,Enter now for your chance to win one of two Lovisa shopping sprees! Enter here at http://t.co/t3P9b6s9ei http://t.co/oSppACGw3w,1,http://www.facebook.com/twitter
355509933304840192,2013-07-12 02:12:27,"Lovisa Loves Pinterest!
Check out our 'Luxe Links' board at http://t.co/Ysym9cRJSu http://t.co/pBhrerUn83",0,http://www.facebook.com/twitter
355214591833292800,2013-07-11 06:38:52,"Learn how to layer your links on our blog!
Read more at http://t.co/YiWSqsDUUQ http://t.co/kTBTwkgRwu",0,http://www.facebook.com/twitter
354745321538060289,2013-07-09 23:34:10,RT @lolajagger: The sun is out! ☀☀ wearing the allabouteveclothing abandon tee and the @lovisastore petrol metal… http://t.co/XpKZ4K5NuO,1,http://twitter.com
354745206635110400,2013-07-09 23:33:42,@itsissJessss We agree! What did you buy?,0,http://twitter.com
354745132534349825,2013-07-09 23:33:25,RT @itsissJessss: retail therapy makes the end of a bad day at work a better one!!! @lovisastore,1,http://twitter.com
354139070324154368,2013-07-08 07:25:08,"Shop The Look Now at http://t.co/injzfHyi1L.
Chain Link Tribal Collar Necklace -  AUD $49.99
Silver Chain Link... http://t.co/7YXvRQ4RJ7",0,http://www.facebook.com/twitter
353712543509913600,2013-07-07 03:10:16,"The ultimate statement necklace is back in stock!
We’re loving the way that Theyallhateus has styled her daytime... http://t.co/iMzhJF4uUw",0,http://www.facebook.com/twitter
353362733737054209,2013-07-06 04:00:15,We’re loving the way that All About Edie has styled her Monochrome look with our Metal Mix Chain Necklace!... http://t.co/yR0crJluIy,0,http://www.facebook.com/twitter
352966682752450560,2013-07-05 01:46:29,"Shop The Look Now at http://t.co/Ghz5wnEzNA
Monochrome Ombre Snake Chain Necklace- AUD $24.99
Monochrome Double... http://t.co/Chp9DeVxrc",0,http://www.facebook.com/twitter
352692961806532609,2013-07-04 07:38:49,Read more about the latest Monochrome Mania trend on our blog at http://t.co/YiWSqsDUUQ http://t.co/k9TZWmNAWo,0,http://www.facebook.com/twitter
352359964142088193,2013-07-03 09:35:36,"Chain Link Tribal Collar Necklace - AUD $49.99
Now available exclusively online at http://t.co/Jha9v7wek5 http://t.co/b4h8EmyhGO",0,http://www.facebook.com/twitter
351965525800271872,2013-07-02 07:28:15,RT @mcrylilsister: Very happy with my @lovisastore purchases that arrived this morning! I love a good sale :),1,http://twitter.com
351884640337932289,2013-07-02 02:06:50,"Shop The Look Now at http://t.co/sEin1n5D0Y
Limited Edition Petrol Metal Necklace - AUD $49.99
Limited Edition... http://t.co/yeCJ3yRTNn",0,http://www.facebook.com/twitter
351595450106781696,2013-07-01 06:57:42,"Make a New Season Statement... 
Available Exclusively Online Now at http://t.co/U8dsiinUX0
 
1. Shiny Gold Tube... http://t.co/skF9gSy52v",0,http://www.facebook.com/twitter
351546285372866562,2013-07-01 03:42:20,"Offer Ends Midnight Tonight!
See Terms &amp; Conditions at http://t.co/NjwIo3cDOv http://t.co/QOdlWP2xA8",0,http://www.facebook.com/twitter
351274555563716608,2013-06-30 09:42:35,"I posted 12 photos on Facebook in the album ""Behind The Scenes- Sneak Peek"" http://t.co/gcqz7EX5Mg",0,http://www.facebook.com/twitter
351273501061160960,2013-06-30 09:38:23,"Limited Edition Petrol Metal Collar Necklace- AUD $49.99
Available Exclusively Online Now at http://t.co/U8dsiinUX0 http://t.co/VzV2p4dlaE",0,http://www.facebook.com/twitter
350184377759711232,2013-06-27 09:30:36,Ends Midnight Tonight! Shop Online Now at http://t.co/U8dsiinUX0 http://t.co/mQJgub7EeP,0,http://www.facebook.com/twitter
349496493201309697,2013-06-25 11:57:11,Shop Online Now at http://t.co/U8dsiinUX0 http://t.co/XpG6qRDAJ7,0,http://www.facebook.com/twitter
347977135819997184,2013-06-21 07:19:49,The Lovisa Team were lucky enough to get a sneak peek of the fabulous new season statement product! http://t.co/KDlHCxxKo4,0,http://twitter.com
346896933354348544,2013-06-18 07:47:28,"Offer available In-Store and Online now at http://t.co/nUY4QUBInS Selected Styles Only. 
See T&amp;C's at... http://t.co/6tXU3OGOwj",1,http://www.facebook.com/twitter
346418552770789376,2013-06-17 00:06:33,"Do you love the retail hype and fashion is you?  If you are keen to be part of the Lovisa team, please register... http://t.co/pKbwdcBqo8",0,http://www.facebook.com/twitter
345739991856607233,2013-06-15 03:10:12,See store locations at http://t.co/gfHFKkU9TC http://t.co/pfwmJzLNMO,0,http://www.facebook.com/twitter
345409370575732736,2013-06-14 05:16:25,"Recruiting for the following stores!

VIC- Knox, Bourke St, Epping
NSW- Darling Harbour, Met Center,... http://t.co/tvOd3WBRHH",0,http://www.facebook.com/twitter
344382596832186368,2013-06-11 09:16:24,"Offer available exclusively online at http://t.co/U8dsiinUX0
See T&amp;C's at... http://t.co/HCY4h2k5sB",0,http://www.facebook.com/twitter
344361437361233921,2013-06-11 07:52:19,"Lovisa Loves Pinterest!
Check out our 'Statement Silver' board at http://t.co/jyP7dMWEMb http://t.co/SrfK0YiO14",0,http://www.facebook.com/twitter
344028190643195904,2013-06-10 09:48:07,"Offer available exclusively online at http://t.co/U8dsiinUX0
See T&amp;C's at... http://t.co/C2J70pcUiR",0,http://www.facebook.com/twitter
342541439227547648,2013-06-06 07:20:17,Shop the Look for $50 here at http://t.co/CiPAk386WP http://t.co/PdjN4rSQHe,0,http://www.facebook.com/twitter
342416988188069888,2013-06-05 23:05:46,Lovisa Loves Statement Silver! The newest of new at Lovisa- Now In Store and Online at http://t.co/r3D6aEHr5F http://t.co/sZnInzpljx,0,http://twitter.com
341822849591427072,2013-06-04 07:44:52,RT @RosieRockets80: Today's blog about my new @lovisastore rings http://t.co/KSLcCfAeLR,1,http://twitter.com
340363335969173504,2013-05-31 07:05:17,"Lovisa Loves Pinterest!
Check out our 'Ink' board at http://t.co/hg4BGoK6rp http://t.co/cRzjP4jZ0h",0,http://www.facebook.com/twitter
339588575303704577,2013-05-29 03:46:40,Find new store locations at http://t.co/tTu71VDi9m http://t.co/zUtj1pKDMY,0,http://www.facebook.com/twitter
338097129778188289,2013-05-25 01:00:11,"Lovisa Loves Pinterest!
Get The Gatsby Look with our inspiration board at http://t.co/tHWCVuyRlp http://t.co/wmKDWOKnOs",0,http://www.facebook.com/twitter
337823993811849216,2013-05-24 06:54:51,Lovisa Loves Friday! http://t.co/HnqDaQvEW8,0,http://www.facebook.com/twitter
337813234507718657,2013-05-24 06:12:06,Get The Gatsby Look! Shop the collection in-store &amp; online at http://t.co/CdZbAMbThX #Gatsby #Thegreatgatsby http://t.co/NNoJqTvkPq,0,http://twitter.com
337812224477392897,2013-05-24 06:08:05,@norlinm Woo hoo! Happy Friday! Have a great weekend! x,0,http://twitter.com
337812150443716608,2013-05-24 06:07:47,RT @norlinm: The online order I made a few nights ago from @lovisastore just arrived! Woohoo!!! Love Fridays! http://t.co/JQSbCdCJz5,1,http://twitter.com
337812033904967680,2013-05-24 06:07:19,RT @missnellebelle: Think I have a slight @lovisastore addiction problem #lovisa #sales #jewellery #earrings #ink #mint… http://t.co/bT3dmw…,1,http://twitter.com
337101930562211840,2013-05-22 07:05:37,Available In-Store &amp; Online at http://t.co/nUY4QUBInS http://t.co/mgIPRvgp8m,0,http://www.facebook.com/twitter
336749075720441856,2013-05-21 07:43:30,"Up to 70% off!
 
Shop the mid season sale exclusively online now at http://t.co/nUY4QUBInS
 
Selected Styles... http://t.co/aNdFaLfoLv",0,http://www.facebook.com/twitter
336446563524165632,2013-05-20 11:41:26,"Up to 70% off!

Shop the mid season sale exclusively online now at http://t.co/nUY4QUBInS

Selected Styles Only.... http://t.co/C3pEtyYYU5",0,http://www.facebook.com/twitter
336446226595733505,2013-05-20 11:40:05,"Up to 70% off!

Shop the mid season sale exclusively online now at http://t.co/nUY4QUBInS

Selected Styles Only.... http://t.co/ONMrtQ5bxY",0,http://www.facebook.com/twitter
336398424377266177,2013-05-20 08:30:09,"Sign-up to Lovisa Style Mail at http://t.co/ftDx6BQuDi to
receive the secret password to access the 48 Hour VIP... http://t.co/wIU7esMnCv",0,http://www.facebook.com/twitter
336328576905388033,2013-05-20 03:52:36,"Sign-up to Lovisa Style Mail at http://t.co/ftDx6BQuDi to
receive the secret password to access  48 hour VIP Sale! http://t.co/CnKv0RJkBC",0,http://twitter.com
336327794042740736,2013-05-20 03:49:29,"@klawdan @Roz_Kelly Hi Anna, we have someone looking into it for you and will be in contact as soon as we hear back! Thanks :)",0,http://twitter.com
336327620725702657,2013-05-20 03:48:48,RT @emmaishere: #putaringonit @lovisastore http://t.co/SjFQfheDPn,1,http://twitter.com
336327587578126336,2013-05-20 03:48:40,@SashaNotFierce lucky girl!,0,http://twitter.com
336327520221818881,2013-05-20 03:48:24,"@klawdan Hi Anna, can you describe the necklace for us or give us any further info so that we can look into it for you? :)",0,http://twitter.com
336088896347713536,2013-05-19 12:00:11,Sign-up to Lovisa Style Mail at http://t.co/ftDx6BQuDi to receive the secret password to access the 48 Hour VIP... http://t.co/f46ctGlLa4,0,http://www.facebook.com/twitter
335605706264825856,2013-05-18 04:00:10,"Lovisa Loves Pinterest!
Check out our 'Peacock' board at http://t.co/jhxZ0aGPr9 http://t.co/yseNqhGHTJ",0,http://www.facebook.com/twitter
335286062702292992,2013-05-17 06:50:01,"Too true...
Happy Friday! http://t.co/PA1Lnl72Lu",0,http://www.facebook.com/twitter
334935120752562177,2013-05-16 07:35:30,Visit Us In-Store or email us at style@lovisa.com.au #sydneyfashionweekend #sfw #stylist http://t.co/lwBv3IoSSy,0,http://twitter.com
