Tweet id,Created Time,Tweet Details,Retweet counts,Source URL
243970248993275904,2012-09-07 07:13:34,Don't forget to enter to win! Happy Friday! http://t.co/kGglJ4f0,1,http://www.facebook.com/twitter
243855648146722816,2012-09-06 23:38:11,"Today's awesome competition entry is from Kayla in QLD, who says...

“You're never truly dressed without a... http://t.co/PrrIrM9T",0,http://www.facebook.com/twitter
243610811334004736,2012-09-06 07:25:18,"Check out the latest collection- Neon Brights. In store now! 

1. Rectangle Section Bangle. AU $19.99 / NZ... http://t.co/qfcOKYSx",0,http://www.facebook.com/twitter
243488137853140994,2012-09-05 23:17:50,"Click the link below for your chance to win your dream $1,000 shopping spree at Lovisa!... http://t.co/wJXe4Sjf",1,http://www.facebook.com/twitter
243232905516703744,2012-09-05 06:23:38,"Click the link below for your chance to win your dream $1,000 shopping spree at Lovisa!... http://t.co/9DRWsOL8",1,http://www.facebook.com/twitter
243148064863449088,2012-09-05 00:46:30,"Buyers Pick of the week!
Neon Rectangle Section Bangle. AUD $19.99 / NZD $22.99. In Store Now! http://t.co/A7inxDFE",0,http://www.facebook.com/twitter
242762654098264065,2012-09-03 23:15:01,"Click the link below for your chance to win your dream $1,000 shopping spree at Lovisa!... http://t.co/cO7Hc0fz",1,http://www.facebook.com/twitter
242512040592302080,2012-09-03 06:39:10,I posted a new photo to Facebook http://t.co/tJYzfakD,0,http://www.facebook.com/twitter
242511810538921984,2012-09-03 06:38:15,"Don't forget to enter to win!!!

http://t.co/0a3XSGpA http://t.co/wCf2QVGH",0,http://www.facebook.com/twitter
241441260303429633,2012-08-31 07:44:16,"'Shalyce' entered the Lovisa shopping spree and said...

""My fave friends are my mum, my sister Brittany and my... http://t.co/LkX1ndPE",0,http://www.facebook.com/twitter
241082696435109889,2012-08-30 07:59:28,"Win your dream $1,000 shopping spree at Lovisa by entering our competition...... http://t.co/36lF9joY",0,http://www.facebook.com/twitter
241029495329550336,2012-08-30 04:28:04,"Check out the latest bold black and gold looks now in store!

1. Round Stone Triangle Drop Earring. AU $7.99 /... http://t.co/U0RUoOZ9",0,http://www.facebook.com/twitter
240338881675939840,2012-08-28 06:43:49,http://t.co/f08VcBd8 http://t.co/Zz5A0OjZ,1,http://www.facebook.com/twitter
240253959309246464,2012-08-28 01:06:22,I posted a new photo to Facebook http://t.co/nRxQnmKn,0,http://www.facebook.com/twitter
238912761323716609,2012-08-24 08:16:55,http://t.co/0a3XSGpA http://t.co/oAP2hVHP,0,http://www.facebook.com/twitter
238884480436297728,2012-08-24 06:24:33,Lovisa Facebook - Competition - T&amp;C's http://t.co/VYJ1ILpQ,0,http://www.facebook.com/twitter
238880137800728577,2012-08-24 06:07:17,I posted a new photo to Facebook http://t.co/nMoCU0it,0,http://www.facebook.com/twitter
238871622839316481,2012-08-24 05:33:27,I posted a new photo to Facebook http://t.co/9DSbPHAT,0,http://www.facebook.com/twitter
238450831152779265,2012-08-23 01:41:23,"New Pastel Pallette now in store!

1. Wood &amp; Resin Block Necklace. AU $16.99 / NZ $19.99. In Store Now!

2.... http://t.co/uHSkMcVk",0,http://www.facebook.com/twitter
237378411310485504,2012-08-20 02:39:58,I posted a new photo to Facebook http://t.co/7RfSPUWM,0,http://www.facebook.com/twitter
236351704419954689,2012-08-17 06:40:12,"If this is you……. 
we are seeking Christmas Team Members 
to join our team across all stores!
Go to the link... http://t.co/zJ20WrQm",1,http://www.facebook.com/twitter
236350635719684096,2012-08-17 06:35:57,I posted a new photo to Facebook http://t.co/ykODWmmL,0,http://www.facebook.com/twitter
235946608867565568,2012-08-16 03:50:29,"Its all about ribal this week with more styles hitting stores! 
1.Tribal Thread Ring &amp; Bead Short Necklace. AU... http://t.co/G0OHq7gu",0,http://www.facebook.com/twitter
235946263474999296,2012-08-16 03:49:07,"Its all about ribal this week with more styles hitting stores! 
1.Tribal Thread Ring &amp; Bead Short Necklace. AU... http://t.co/1snZ9xWz",0,http://www.facebook.com/twitter
235945898511855617,2012-08-16 03:47:40,"Its all about ribal this week with more styles hitting stores! 
1.Tribal Thread Ring &amp; Bead Short Necklace. AU... http://t.co/ZU9L9iPc",0,http://www.facebook.com/twitter
235644683475369984,2012-08-15 07:50:45,I posted a new photo to Facebook http://t.co/wV79qmNd,0,http://www.facebook.com/twitter
235188774227820544,2012-08-14 01:39:08,"Behind the senes - Spring 2012
Take a sneak peek at what's to come at Lovisa's latest Spring 2012 shoot!... http://t.co/omj3A7nR",0,http://www.facebook.com/twitter
234875549439377408,2012-08-13 04:54:29,I posted a new photo to Facebook http://t.co/PZWpYcJV,0,http://www.facebook.com/twitter
233823702431698944,2012-08-10 07:14:49,I posted a new photo to Facebook http://t.co/tGyS5XBc,0,http://www.facebook.com/twitter
233823385610776576,2012-08-10 07:13:34,"New Lovisa Broadway Sydney Store Now Open!
Shop 324B, Broadway Shopping Centre
1 Bay Street, Broadway, NSW, 2007... http://t.co/K4EUjPda",0,http://www.facebook.com/twitter
233823342812086272,2012-08-10 07:13:23,"New Lovisa Broadway Sydney Store Now Open!
Shop 324B, Broadway Shopping Centre
1 Bay Street, Broadway, NSW,... http://t.co/erpmQzUz",0,http://www.facebook.com/twitter
232637993452716032,2012-08-07 00:43:14,"Buyers Pick of the week!
Tribal multi rope and bead necklace. AUD $29.99 / NZD $34.99. Now in store!

http://t.co/HyM6vhZ0",0,http://www.facebook.com/twitter
232637960187699201,2012-08-07 00:43:06,"Buyers Pick of the week!
Tribal multi rope and bead necklace. AUD $29.99 / NZD $34.99. Now in store!... http://t.co/ZCP0a1OG",0,http://www.facebook.com/twitter
230911371276058624,2012-08-02 06:22:15,"Buyers pick of the week! 
Citrus and gold coloured metal ring. 
$12.99 AUD / $14.99 NZD. Now in store!

http://t.co/HyM6vhZ0",0,http://www.facebook.com/twitter
230910596260982784,2012-08-02 06:19:10,"Buyers pick of the week! 
Citrus and gold coloured metal ring. 
$12.99 AUD / $14.99 NZD. Now in store!... http://t.co/1hfnGmat",0,http://www.facebook.com/twitter
229819808282189824,2012-07-30 06:04:46,"Check out our latest trend in store now, Oceans Blue! Click through to see a sneak peek of the range!... http://t.co/qlEMfWDB",0,http://www.facebook.com/twitter
227651712167591936,2012-07-24 06:29:32,"Check out our latest editorial from July! 

http://t.co/ch4hU2rO http://t.co/7Brt3jPO",0,http://www.facebook.com/twitter
225443716410777601,2012-07-18 04:15:45,Buyers pick of the week! Metal and resin yellow tribal earrings. $16.99 AUD / $19.99 NZD. Now in store!... http://t.co/hbsRYqcF,0,http://www.facebook.com/twitter
222912679197679617,2012-07-11 04:38:18,"I posted 6 photos on Facebook in the album """" http://t.co/r5XepXr5",0,http://www.facebook.com/twitter
222196563873759233,2012-07-09 05:12:43,I posted a new photo to Facebook http://t.co/jl4b6Q1C,0,http://www.facebook.com/twitter
220794100633440257,2012-07-05 08:19:50,I posted a new photo to Facebook http://t.co/U4BQNHDx,0,http://www.facebook.com/twitter
220392826830192640,2012-07-04 05:45:19,"June 2012 'In The Press'. Lovisa Blog!
http://t.co/XCb2qcDI http://t.co/K0CVXsjK",0,http://www.facebook.com/twitter
220390518486605824,2012-07-04 05:36:08,"I posted 3 photos on Facebook in the album ""Sneek Peek - July 2012"" http://t.co/cAgDwpWj",0,http://www.facebook.com/twitter
217906958425014272,2012-06-27 09:07:22,"Cosmopolitan August, 2012 http://t.co/lSCfYJ8i",1,http://www.facebook.com/twitter
217557028548263936,2012-06-26 09:56:52,ONE MORE SNEAK PEAK... Lovisa 3.12 campaign! http://t.co/aHVhYPu6,0,http://www.facebook.com/twitter
217556126064050177,2012-06-26 09:53:17,ANOTHER SNEAK PEAK... Lovisa 3.12 campaign. http://t.co/QNqWuXWr,0,http://www.facebook.com/twitter
217553242505216000,2012-06-26 09:41:49,SNEAK PEAK... Lovisa 3.12 campaign! Hitting stores soon... http://t.co/1hnygU5P,0,http://www.facebook.com/twitter
217548998393856000,2012-06-26 09:24:57,SNEAK PEAK.... Lovisa 3.12 photo shoot. Hitting stores soon! http://t.co/1Zkea6Cl,1,http://www.facebook.com/twitter
215996394991919105,2012-06-22 02:35:28,Behind the scenes Lovisa Blog... http://t.co/oFKtNaSp http://t.co/kf89TTXo,0,http://www.facebook.com/twitter
215602819489730564,2012-06-21 00:31:32,LOVE. Buyers pick of the week... http://t.co/H2oIzLKJ http://t.co/V78Uctux,0,http://www.facebook.com/twitter
215360619837263872,2012-06-20 08:29:07,Behined the scenes Lovisa blog... http://t.co/c4RSIrUj http://t.co/whzo3f4a,0,http://www.facebook.com/twitter
215239941834289153,2012-06-20 00:29:35,"Keep it feminine in the pretties of gold shades, Rose. Check out our BLOG...... http://t.co/4OR4e3qM",0,http://www.facebook.com/twitter
214985498739998720,2012-06-19 07:38:31,"I posted 7 photos on Facebook in the album ""In the press, June 2012."" http://t.co/IOwY8gmg",1,http://www.facebook.com/twitter
214939099604332545,2012-06-19 04:34:09,"I posted 16 photos on Facebook in the album ""SNEAK PEAK , JUNE 2012"" http://t.co/uzHNPPAd",1,http://www.facebook.com/twitter
214629994431913985,2012-06-18 08:05:52,BUYERS PICK OF THE WEEK... http://t.co/vTAvcGil http://t.co/2jj6xSJp,1,http://www.facebook.com/twitter
214504689016901632,2012-06-17 23:47:57,"Outr'e Gold... One part burnished, one part polished, every part gold. Lovisa BLOG... http://t.co/bD0gpvG6",0,http://www.facebook.com/twitter
213551953316290560,2012-06-15 08:42:07,"ALL sale items 3 for $10, STARTS TOMORROW in Lovisa stores across Australia and New Zealand (excludes Lovisa... http://t.co/7Z10TgtM",3,http://www.facebook.com/twitter
213457616947515392,2012-06-15 02:27:16,LOVISA BLOG... This Sunset Collection is a vibrant blend of daring Orange and exotic Blue.... http://t.co/MrYiN8mh,0,http://www.facebook.com/twitter
213455962575618048,2012-06-15 02:20:41,LOVISA BLOG... This Sunset Collection is a vibrant blend of daring Orange and exotic Blue. Team this with hues of... http://t.co/cZ4tL1Uy,0,http://www.facebook.com/twitter
213063004839878657,2012-06-14 00:19:13,BLACK &amp; GOLD BLOG... http://t.co/HHseCpUO http://t.co/NDZp2pIE,0,http://www.facebook.com/twitter
213049730123567105,2012-06-13 23:26:28,"BLUE ROUTE MALL, South Africa NOW OPEN! http://t.co/zbimIHbl",0,http://www.facebook.com/twitter
210216523070046209,2012-06-06 03:48:19,NEW REDUCTIONS in store now! http://t.co/OQoOSG90,1,http://www.facebook.com/twitter
209781080755146754,2012-06-04 22:58:01,Lovisa in the PRESS! May 2012. http://t.co/1zwJxOcn http://t.co/hzh8TO1A,0,http://www.facebook.com/twitter
207264745080893440,2012-05-29 00:19:00,Lovisa is SERIOUSLY ON SALE! Selected styles are dramatically reduced. Head into store today! http://t.co/OeCDITJ9,6,http://www.facebook.com/twitter
205181342705647616,2012-05-23 06:20:18,"LOVE Lovisa? LOVE fashion? LOVE styling? LOVE Customer service? LOVE accessories? Now recruiting for BROADWAY,... http://t.co/o9CVlw8J",0,http://www.facebook.com/twitter
205178698922606592,2012-05-23 06:09:48,"Lovisa Polsihed Silver Collar. Tough LOVE editorial. Cleo, June 2012. http://t.co/RJLe1Cc0",0,http://www.facebook.com/twitter
205118858233778180,2012-05-23 02:12:01,Put a bit of PUNK in your PASTEL palate this season. Click here...... http://t.co/j7UmlSl2,0,http://www.facebook.com/twitter
205105982685200385,2012-05-23 01:20:51,"NSW, get excited! BROADWAY Lovisa is opening soon! http://t.co/0TSKhAoh",0,http://www.facebook.com/twitter
204417029938221056,2012-05-21 03:43:12,Keep it fresh with mint. BUYERS PICK... http://t.co/Yiy6tKZM http://t.co/UrgMb6CB,0,http://www.facebook.com/twitter
203299214351015937,2012-05-18 01:41:24,BUYERS PICK BLOG... http://t.co/e5uzFYh1 http://t.co/zWetTHod,0,http://www.facebook.com/twitter
202967096706076672,2012-05-17 03:41:41,Distinguished Bride. Lovisa pieces to help you create your glamorous look for your special day. Check out our... http://t.co/qqG0VmMS,0,http://www.facebook.com/twitter
202896506292940801,2012-05-16 23:01:11,Calling all PARRAMATTA Lovisa VIP's! HURRY into the Lovisa Parramatta store today to take advantage of the... http://t.co/i1ZRlpTQ,0,http://www.facebook.com/twitter
202880660984184834,2012-05-16 21:58:13,"Lovisa LOVES a good wedding, this one is no exception. Michael Clarke and Kyly Boldy… Stunning! Congratulations! http://t.co/Gr2eYhUl",0,http://www.facebook.com/twitter
202543836227055616,2012-05-15 23:39:48,BUYERS PICK... http://t.co/TkOWWJP6 http://t.co/iYR8W9fL,0,http://www.facebook.com/twitter
202528986729955328,2012-05-15 22:40:47,"OPENING SOON! Gateway, South Africa. http://t.co/kHfOS8IG",0,http://www.facebook.com/twitter
202309717991751681,2012-05-15 08:09:30,"QUICK, Whitford Lovisa GIRLS NIGHT IN is tomorrow night! To confirm your spot, RSVP to amandap@lovisa.com.au NOW! http://t.co/4Yb6WI06",0,http://www.facebook.com/twitter
202303017964404736,2012-05-15 07:42:52,"Opening soon! Blue Route Mall, South Africa. http://t.co/9wkn5KZq",0,http://www.facebook.com/twitter
202237783593594881,2012-05-15 03:23:39,"Our first SINGAPORE store... WISMA Lovisa, opening soon! http://t.co/DSrU0vPP",1,http://www.facebook.com/twitter
201914647757074433,2012-05-14 05:59:38,Must see. PASTEL PUNK BLOG... http://t.co/H4YW9YcY http://t.co/uygGS9tM,0,http://www.facebook.com/twitter
201888630690693120,2012-05-14 04:16:15,LOVE retail? LOVE fashion? LOVE Lovisa? Want to join our amazing Team? Apply here...... http://t.co/s8NHaX5b,0,http://www.facebook.com/twitter
201887682371129344,2012-05-14 04:12:29,"Exciting time’s for ALBURY, NSW. Lovisa is opening soon! http://t.co/tQsVrt2L",1,http://www.facebook.com/twitter
201863355378569216,2012-05-14 02:35:49,"Want to be the Store Manager of our FLAGSHIP STORE in the fashion capital of VIC, CHADSTONE? Apply here…... http://t.co/fWvw6MsT",0,http://www.facebook.com/twitter
201826775649619968,2012-05-14 00:10:27,"Monday, May 14. BUYERS PICK... http://t.co/XX5HayQj http://t.co/4hNh9BVt",0,http://www.facebook.com/twitter
200860072958631936,2012-05-11 08:09:07,"I posted 5 photos on Facebook in the album ""EMPORIUM, MAY '12"" http://t.co/kxhwsvbJ",0,http://www.facebook.com/twitter
200851015690498048,2012-05-11 07:33:08,Eccentric. Enamel. EMPORIUM. blog... http://t.co/RYYoFsC9 http://t.co/H0ZT5nbx,0,http://www.facebook.com/twitter
200850685938515969,2012-05-11 07:31:49,Eccentric. Enamel. EMPORUIM. Blog... http://t.co/RYYoFsC9 http://t.co/IlSgeYjW,1,http://www.facebook.com/twitter
200805754368831490,2012-05-11 04:33:17,"I posted 5 photos on Facebook in the album ""Lovisa Press Clippings, MAY 2012"" http://t.co/us7mUSof",0,http://www.facebook.com/twitter
200738571269832706,2012-05-11 00:06:19,What goodies have you snapped up in the Lovisa 3 for 2 promotion? http://t.co/9fqXQI9Q,0,http://www.facebook.com/twitter
200509799589351425,2012-05-10 08:57:16,Like to peak at what goes on behind the scenes? This Emporium blog will satisfy your needs...... http://t.co/ulBKnrKS,0,http://www.facebook.com/twitter
200494342513758208,2012-05-10 07:55:50,The Lovisa buyer's have emerald green LOVE! Check out our blog...... http://t.co/HmkxlkZU,0,http://www.facebook.com/twitter
200458345889542146,2012-05-10 05:32:48,"I posted 28 photos on Facebook in the album ""PASTEL PUNK - MAY 2012"" http://t.co/aer022eb",0,http://www.facebook.com/twitter
200388116123631617,2012-05-10 00:53:44,Gift idea for MUM on Mother's Day... Freshwater pearl stud Earring. $4.99 AU / $5.99 NZ. In store NOW! http://t.co/Lww6CAi2,0,http://www.facebook.com/twitter
200162331353825280,2012-05-09 09:56:33,"I posted 7 photos on Facebook in the album ""SNEAK PEAK"" http://t.co/jqGVPDNG",0,http://www.facebook.com/twitter
199639079523069952,2012-05-07 23:17:20,A must have for today... http://t.co/o07VAsql http://t.co/PIgsOcue,0,http://www.facebook.com/twitter
199476666802765826,2012-05-07 12:31:58,"We LOVE the Lovisa Magenta and Gold trim bracelet that Casey Withoos wore on The Voice tonight. Casey, what a... http://t.co/msdhIkvW",0,http://www.facebook.com/twitter
199468033486487553,2012-05-07 11:57:39,CONGRATULATIONS Emma Louise Birdsall... You did an AWESOME job tonight on The Voice and look AMAZING in your... http://t.co/tzwBG1Qp,2,http://www.facebook.com/twitter
199437193373155328,2012-05-07 09:55:06,"SNEAK PEAK... 3 FOR 2 PROMOTION, start's tomorrow! Conditions apply, see in store for details. Happy shopping. http://t.co/9hYT2rUu",1,http://www.facebook.com/twitter
198326978976296962,2012-05-04 08:23:31,"I posted 6 photos on Facebook in the album ""IT'S ALL ABOUT SEMI-PRECIOUS SKULL'S"" http://t.co/weHVhZHz",0,http://www.facebook.com/twitter
198258609967210496,2012-05-04 03:51:50,"I posted 2 photos on Facebook in the album ""GRILS NIGHT IN, Whitford Lovisa"" http://t.co/ZOCj3qtl",0,http://www.facebook.com/twitter
198241011305168896,2012-05-04 02:41:54,I posted a new photo to Facebook http://t.co/qvqkeVuL,0,http://www.facebook.com/twitter
198233442155110401,2012-05-04 02:11:50,"HURRY, it's the LAST DAY'S of the BUILD YOUR BASICS, 2 for $10 campaign. Promotion end's Monday 7th May, 2012.... http://t.co/38s8XHt2",0,http://www.facebook.com/twitter
198232328307351552,2012-05-04 02:07:24,"I posted 30 photos on Facebook in the album ""BUILD YOUR BASICS, 2 FOR $10 PROMOTION"" http://t.co/65NQNEhO",0,http://www.facebook.com/twitter
197978063395487744,2012-05-03 09:17:03,"I posted 2 photos on Facebook in the album """" http://t.co/nrUGFvy4",0,http://www.facebook.com/twitter
197954631891038208,2012-05-03 07:43:56,Add a little TUXEDO to your outfit... http://t.co/Aq1VhjSs http://t.co/3ylnuEaV,0,http://www.facebook.com/twitter
197816859171627008,2012-05-02 22:36:29,"Buy any 3 items, Pay for 2! EASTGARDENS LOVISA is in FOCUS from today untill Saturday 5th May. Conditions apply,... http://t.co/U9mhtj9S",0,http://www.facebook.com/twitter
197814674719391744,2012-05-02 22:27:48,"I posted 2 photos on Facebook in the album ""Celebrities LOVE Lovisa @ TBT Sydney Nest"" http://t.co/X0jn7fjg",0,http://www.facebook.com/twitter
197521002706636801,2012-05-02 03:00:51,CELEBRATE the Grand Opening of the NEW SHELLHARBOUR Lovisa Store TODAY! Come in check out our AMAZING on TREND... http://t.co/K554dBfo,0,http://www.facebook.com/twitter
197136529238409216,2012-05-01 01:33:05,CHECK out the BUYERS PICK blog! This time its MUM'S turn...... http://t.co/zqx9Q19S,0,http://www.facebook.com/twitter
197123261971169281,2012-05-01 00:40:22,Be MUM'S favourite child this Mother's Day with a LOVISA gift from $4.99 AU / $5.99 NZ. http://t.co/GKgP476x,0,http://www.facebook.com/twitter
195829684720771072,2012-04-27 11:00:09,"OK! 7 May, 2012. Features Lovisa 3 pack Marble Resin Bangle in Mustard, Brown and Orange.. PLUS... Statement Multi... http://t.co/1XACYoDZ",0,http://www.facebook.com/twitter
195727507570429952,2012-04-27 04:14:08,A behind the scenes look at the LOVISA 2.12 Campaign Photo Shoot. In focus is Green and Black Bling collection.... http://t.co/NOwUjOK7,0,http://www.facebook.com/twitter
195447573144805376,2012-04-26 09:41:47,"GRAZIA, Apil 30 edition. HOT COLLAR features Lovisa Pearl Peter Pan Collar. Available in Black. In store NOW! http://t.co/UurNtQ5G",1,http://www.facebook.com/twitter
195428996337500160,2012-04-26 08:27:58,Are you a FASHIONISTA that lives in ALBURY and is itching to STYLE the Lovisa Customer? WE WANT YOU! Apply now... http://t.co/B1DF6jDe,0,http://www.facebook.com/twitter
195421583492395009,2012-04-26 07:58:30,"ALBURY, Lovisa we chose you! Are you excited? http://t.co/QKVix9uO",0,http://www.facebook.com/twitter
195411488696053760,2012-04-26 07:18:24,Check out the BUYERS PICK at http://t.co/rVQ5wDcO http://t.co/w7jD5kUl,1,http://www.facebook.com/twitter
195411257917050881,2012-04-26 07:17:29,Check out this blog... http://t.co/UZPPZazg,1,http://www.facebook.com/twitter
195325321233444865,2012-04-26 01:36:00,NEW 2.12 CAMPAIGN LAUNCHED INSTORE TODAY! Check out the behind the scenes BLOG featuring the NEW collection... http://t.co/1r2qZ3Ky,0,http://www.facebook.com/twitter
195311782519246848,2012-04-26 00:42:12,"I posted 15 photos on Facebook in the album ""SNEAK PEAK"" http://t.co/sPhNSG88",0,http://www.facebook.com/twitter
195271482425880576,2012-04-25 22:02:04,Calling all HURSTVILLE Lovisa VIP's! HURRY into the Lovisa Hurstville NSW store today to take advantage of the ONE... http://t.co/dD1wxj5s,0,http://www.facebook.com/twitter
194721467315924992,2012-04-24 09:36:30,Brushed Gold Plated Cream Enamel + Black Enamel + White Crystal Triple Ring Set. $16.99 AU / $19.99 NZ. In Store NOW http://t.co/5DJFCuT8,0,http://www.facebook.com/twitter
194718329318031361,2012-04-24 09:24:02,Brushed Gold Plated Enamel Pink + Black + Brushed Gold Triple Ring Set. $16.99 AU / $19.99 NZ. In Store NOW! http://t.co/X8IE5pPQ,0,http://www.facebook.com/twitter
194718009699483648,2012-04-24 09:22:45,"Lest. We forget.
A day to remember and pay respect to our diggers.... http://t.co/PFHw9UrD",0,http://www.facebook.com/twitter
194300718008647680,2012-04-23 05:44:35,"I posted 30 photos on Facebook in the album ""BUILD YOUR BASICS, 2 FOR $10 PROMOTION"" http://t.co/fXzURNzN",0,http://www.facebook.com/twitter
192845781902966785,2012-04-19 05:23:11,Calling all BURWOOD Lovisa FASHIONISTAS! HURRY to the Lovisa Burwood NSW store today to take advantage of the 3... http://t.co/HXefUJol,0,http://www.facebook.com/twitter
192802498539556865,2012-04-19 02:31:12,"I posted 10 photos on Facebook in the album ""BUILD YOUR BASICS, 2 FOR $10 PROMOTION"" http://t.co/WXSwWjT7",0,http://www.facebook.com/twitter
192743665855242240,2012-04-18 22:37:25,CHERMSIDE Lovisa FASHIONISTAS! Rush to the Lovisa Chermside QLD store today to take advantage of the ONE DAY VIP... http://t.co/k57FlwLD,0,http://www.facebook.com/twitter
192549801173323777,2012-04-18 09:47:04,"BEHIND THE SCENES.... LOVISA 2.12 PHOTO SHOOT, GREEN & BLACK BLING COLLECTION... http://t.co/cfALutjp",0,http://www.facebook.com/twitter
192536336274685952,2012-04-18 08:53:34,"I posted 12 photos on Facebook in the album ""BUILD YOUR BASICS, 2 FOR $10 PROMOTION"" http://t.co/6ZQPB5sO",0,http://www.facebook.com/twitter
192372317496672257,2012-04-17 22:01:49,"BUILD YOUR BASICS. 2 for $10... STARTS TODAY!

Buy any 2 items from the select Jewlery Box Baics range and pay... http://t.co/1fnICxSi",0,http://www.facebook.com/twitter
192023336518287361,2012-04-16 22:55:05,"MISS UNIVERSE AUSTRALIA 2011, Scherri-Lee Briggs styled by Courtney Ryan @ Lovisa Karrinyup. Scherri wears Lovisa... http://t.co/mZTwH5RN",0,http://www.facebook.com/twitter
191798662718951424,2012-04-16 08:02:19,"Michala Banas... wearing LOVISA Statement Bracelet in Sunday Mag, Sunday Herald Sun April 15, 2012. In Store NOW! http://t.co/ULNU0SKS",0,http://www.facebook.com/twitter
191782962700890112,2012-04-16 06:59:56,IN STYLE featuring FOREVER BLUSH FACETED CRYSTAL and VELVET Statement Neck... $49.95 AU / $54.95 NZ. In store NOW! http://t.co/nZD8ow5x,0,http://www.facebook.com/twitter
191646819476975616,2012-04-15 21:58:57,We think ASHER KEDDIE & CARRIE BICKMORE deserve GOLD for best dressed at the Logies last night. What do you think? http://t.co/DOHXh6SD,0,http://www.facebook.com/twitter
191639480585830400,2012-04-15 21:29:47,lOVISA Statement Ear creates that finishing touch on Lisa Wilkinson's STELLAR LOGIES LOOK... Lisa the Lovisa... http://t.co/J1jOEMJU,0,http://www.facebook.com/twitter
190938913236455424,2012-04-13 23:05:59,"EXCLUSIVE for FOUNTAINGATE FASHIONISTAS - BUY 3 ITEMS, PAY FOR 2! Starts today at Lovisa FOUNTAINGATE... Ends... http://t.co/WtYrSbul",0,http://www.facebook.com/twitter
190395008103350272,2012-04-12 11:04:41,IN THE PRESS... MARCH 2012 http://t.co/NCtx5Loj http://t.co/Q5kLorvf,1,http://www.facebook.com/twitter
190291211867799552,2012-04-12 04:12:15,"I posted 3 photos on Facebook in the album """" http://t.co/KwXEPDEv",0,http://www.facebook.com/twitter
190290737051602944,2012-04-12 04:10:21,"HURSTVILLE - NOW OPEN... Come in and meet the Team at our NEW Hurstville Store in Sydney, NSW. Let them Style you... http://t.co/aQbxtCJO",0,http://www.facebook.com/twitter
190274090140057601,2012-04-12 03:04:12,"PARAMATTA - 3 DAYS ONLY... BUY 3 ITEMS, PAY FOR 2! Starts today at Lovisa Paramatta Westfield. Make the most of... http://t.co/pNRNT2Uv",1,http://www.facebook.com/twitter
187804419868463104,2012-04-05 07:30:37,HAPPY EASTER to all the Lovisa FASHIONISTA'S... http://t.co/KGv3XqrX,0,http://www.facebook.com/twitter
187774413557612545,2012-04-05 05:31:23,"SHELLHARBOUR FASHIONISTA'S, we want you! Head to... http://t.co/oY52TfT5",0,http://www.facebook.com/twitter
187676869020221442,2012-04-04 23:03:47,"I posted 3 photos on Facebook in the album """" http://t.co/QGsnuKk1",0,http://www.facebook.com/twitter
187469407977603073,2012-04-04 09:19:24,SWAROVSKI SPARKLE all WRAPPED and READY TO GO... Polished Silver Tripple Ring set with Swarovski Crystal Stone.... http://t.co/FcKu7yhR,1,http://www.facebook.com/twitter
187468542629789697,2012-04-04 09:15:58,"Swarovski Crystal Embelished, Polished Gold Heart Pendant on a dainty Polished Gold Chain. $12.99 AU / $14.99 NZ.... http://t.co/M79uBxWd",1,http://www.facebook.com/twitter
187466248790089728,2012-04-04 09:06:51,"TURQUOISE: Friendship, Happiness. 

LITTLE BOX OF SOMETHING SPECIAL Marbled Turquoise Stone Stud Earring set in... http://t.co/P2CUROAT",1,http://www.facebook.com/twitter
187464869027655680,2012-04-04 09:01:22,CHOCOLATE SUBSTITUTE... LITTLE BOX OF SOMETHING SPECIAL Polished Gold Chain with Jade Pendant. $9.99 AU / $ 10.99... http://t.co/ZP9J8r13,1,http://www.facebook.com/twitter
187460200800854016,2012-04-04 08:42:49,SOMETHING SPECIAL EASTER GIFT... Polished Silver Claw Set Swarovski Crystal Stone Pendant Necklace. $9.99 AU /... http://t.co/p8kgr0Ta,1,http://www.facebook.com/twitter
