Tweet id,Created Time,Tweet Details,Retweet counts,Source URL
890517560004722688,2017-07-27 10:21:45,Lynas clarifies statements on condisoil. https://t.co/IYdSzSSPSg,0,http://twitter.com/download/iphone
890495428038242304,2017-07-27 08:53:49,"Lynas clarifies statements on condisoil.. find the details on our website and facebook.
Lynas operates in a transparent manner..",1,http://twitter.com/download/iphone
801969572874043393,2016-11-25 02:03:40,RT @CommSec: [PODCAST] Executive Series: @Lynas_Corp $LYC CEO &amp; MD Amanda Lacaze speaks with Tom Piotrowski https://t.co/bDJNLo8wHH #ausbiz,1,http://twitter.com
799085091066515456,2016-11-17 03:01:46,"@Lynas_Corp Approval of resolution 4 will make a total
interest saving of approx. A$70m https://t.co/apLr89cHO2",0,http://twitter.com
798348827090567168,2016-11-15 02:16:07,"Approval of Resolution 4 provides the best
opportunity to deliver improved financial outcomes in the future. https://t.co/apLr89cHO2",0,http://twitter.com
796902330125778948,2016-11-11 02:28:15,"@Lynas_Corp 
https://t.co/m8tC1XCmFt",1,http://twitter.com
791934408596959232,2016-10-28 09:27:31,"@Lynas_Corp is a committed member of the Kuantan and broader
Malaysian communities https://t.co/7IW59gwmJT https://t.co/5N4EDrrqPX",2,http://twitter.com
791933738959593474,2016-10-28 09:24:51,"Lynas Corporation: The big picture of our role
as a good corporate citizen https://t.co/7IW59gwmJT",0,http://twitter.com
785649937379844096,2016-10-11 01:15:16,Lynas products are essential for manufacturers all over the world… now and in the future https://t.co/1YrWvnXqwW https://t.co/C6ma9UBJFH,0,http://twitter.com
785649813651980289,2016-10-11 01:14:46,"Lynas Corporation:
The big picture of why the world needs Lynas https://t.co/1YrWvnXqwW",0,http://twitter.com
780640050073567232,2016-09-27 05:27:46,Lynas contributes directly to improvements in its local communities https://t.co/bJ4IQ1zwuS https://t.co/bnrBGvukJd,1,http://twitter.com
780639750185111552,2016-09-27 05:26:34,"Lynas Corporation: The untold picture of how we treat our local
communities https://t.co/bJ4IQ1zwuS",0,http://twitter.com
776269478929633280,2016-09-15 04:00:40,RT @TMAaust: Lynas Corp was born from market #disruption - CEO Amanda Lacaze presents. #ausbiz #commodities https://t.co/WfVWqTIObs,5,http://twitter.com
776269025852600320,2016-09-15 03:58:52,"Lynas operates transparently with care and concern for surrounding
communities &amp; environment https://t.co/HbxGLcQn4D https://t.co/IDosRQ16Hk",1,http://twitter.com
776204339580850176,2016-09-14 23:41:50,Lynas Corporation: The real picture of our transparency https://t.co/HbxGLcQn4D,0,http://twitter.com
773412697966833664,2016-09-07 06:48:51,RT @malaysiakini: #Letters Lynas responds to critics of Gebeng plant https://t.co/QOlwrlzPgw https://t.co/AqdHQybVpC,5,http://twitter.com
770812766202376192,2016-08-31 02:37:39,"Lynas operations are safe for our people,safe for the community and safe for the environment https://t.co/wz8Z5IxdGh https://t.co/3Vfp68JCDr",0,http://twitter.com
770812504339427330,2016-08-31 02:36:36,"Lynas Corporation: The real picture of our
commitment to safety https://t.co/wz8Z5IxdGh",0,http://twitter.com
765001815305822217,2016-08-15 01:47:00,"Today, we start a new chapter in the history of our company with the launch of our new communication program. https://t.co/dH81swxDCU",0,http://twitter.com
765001497788555264,2016-08-15 01:45:44,"The true picture of a global company that has the interests of the local community at heart. 
https://t.co/mICDRVBZAj",0,http://twitter.com
765000504183140352,2016-08-15 01:41:47,Lynas Corporation: Advancing Hand In Hand With You https://t.co/mICDRVBZAj https://t.co/MBd2o8nU55,0,http://twitter.com
332273631273033729,2013-05-08 23:19:41,"Lynas Corporation, Ltd.: Rare Earths Production Expanding Outside China - Prominent Australian company Lynas... http://t.co/WfTcfyF1Cp",0,http://www.tumblr.com/
328977399234576384,2013-04-29 21:01:38,"Lynas Corporation, Ltd.: An Overview of the Rare Earths Supply Chain - Lynas Corporation established itself a… http://t.co/36RpuR8j8p",0,http://www.tumblr.com/
328975914748751875,2013-04-29 20:55:44,"Lynas Corporation, Ltd.: Common Misconceptions about Rare Earths http://t.co/uYI3yGUU3p",0,http://publicize.wp.com/
326365424876933120,2013-04-22 16:02:35,"Lynas Corporation, Ltd.: Company Bolsters Supply Chain Through Strategic Partnerships - A leading provider... http://t.co/aR5IVRMQWX",0,http://www.tumblr.com/
326364902400864257,2013-04-22 16:00:30,Gadolinium: Neutron-Absorbing Rare Earth Element http://t.co/NUoHYbD7rB,0,http://publicize.wp.com/
322455371241385984,2013-04-11 21:05:26,The Potential Impact of Rare Earths Mining on Nuclear Technology - Recognizing an impending shortage of rare... http://t.co/aeKI4JNY9Q,0,http://www.tumblr.com/
322454097032773633,2013-04-11 21:00:22,Cerium: Multipurpose Rare Earth Element http://t.co/qx1MvvJp5S,0,http://publicize.wp.com/
319193265129791488,2013-04-02 21:02:59,Synthetic Materials at Lynas Corporation and Their Environmental Benefits - Lynas Corporation will soon... http://t.co/ejs1VEM1cV,0,http://www.tumblr.com/
319192713562058753,2013-04-02 21:00:47,The Most-Used Rare Earths and Their Applications http://t.co/QDNiv9LdWT,0,http://publicize.wp.com/
314810849724362752,2013-03-21 18:48:50,Lynas Corporation: A Continuing Focus on Protecting Workers and the Environment http://t.co/AJSvPKlhbT,0,http://www.tumblr.com/
314810819663765504,2013-03-21 18:48:42,The Heavy Rare Earths and Their Uses http://t.co/ucNOfgUYYW,0,http://publicize.wp.com/
309760417859788800,2013-03-07 20:20:13,Lynas Corporation: Helping to Create a Greener World http://t.co/s9FPV35l2s,0,http://publicize.wp.com/
304381431524782080,2013-02-21 00:06:03,I just updated my Weebly website. http://t.co/ESii8Stkad via @weebly,0,http://www.weebly.com/
304006412995010561,2013-02-19 23:15:51,Recycling and Reusing Rare Earth Elements Worldwide http://t.co/ykit2yiy,0,http://publicize.wp.com/
302213521830207488,2013-02-15 00:31:33,bigsight  |  Lynas Corporation | @scoopit http://t.co/OJxYfWWS,0,http://www.scoop.it
302213289717407744,2013-02-15 00:30:37,Lynas Corporation - Lynas Corporation | ProfilePond | @scoopit http://t.co/9QgEApvI,0,http://www.scoop.it
302213063870926848,2013-02-15 00:29:43,Lynas Mining | providing new source of supply of Rare Earths | @scoopit http://t.co/En31zERw,0,http://www.scoop.it
302212816465715201,2013-02-15 00:28:44,Lynas Corporation Limited: ASX:LYC quotes &amp; news - Google Finance | @scoopit http://t.co/NxUSvW6U,0,http://www.scoop.it
302210291834437632,2013-02-15 00:18:43,I have created an infographic resume on re.vu http://t.co/WSTUMduw via @resumevu,0,https://dev.twitter.com/docs/tfw
301855463396503552,2013-02-14 00:48:45,new @magnt site! http://t.co/uDJjntA1,0,https://dev.twitter.com/docs/tfw
301123121472208898,2013-02-12 00:18:41,Check out my new website  http://t.co/5YISvCOc via @Webnode,0,https://dev.twitter.com/docs/tfw
301120034682580993,2013-02-12 00:06:25,Check out my @Wix site http://t.co/Jksya5Mg,0,https://dev.twitter.com/docs/tfw
301115517719179264,2013-02-11 23:48:28,Lynas Corporation at http://t.co/0ij7URDT,0,https://dev.twitter.com/docs/tfw
301114124467843072,2013-02-11 23:42:56,I just updated my website! http://t.co/CJKZMsHH via @Zeeblio,0,https://dev.twitter.com/docs/tfw
301110665446297600,2013-02-11 23:29:11,About Lynas http://t.co/XXJ0c85h,0,http://www.shareist.com
301110105561264128,2013-02-11 23:26:58,I just published my portfolio using @Pathbrite - Check it out:  http://t.co/QXitmYDy,0,https://dev.twitter.com/docs/tfw
263363252522713088,2012-10-30 19:34:27,"Sign up for @Alternion, your personal social dashboard. Combine and manage all of your social accounts and emails.",0,http://www.alternion.com/
263362848221167616,2012-10-30 19:32:50,http://t.co/0QlevGKW Lynas Corporation,0,https://dev.twitter.com/docs/tfw
263356752911798274,2012-10-30 19:08:37,Check out this profile /cc @Lynas_Corp https://t.co/OA779dFP #workfu #smartprofile,0,https://dev.twitter.com/docs/tfw
249035851173085184,2012-09-21 06:42:28,"Cool! I won the ""First Lens! "" trophy on @Squidoo: http://t.co/aIlfic2U",0,https://dev.twitter.com/docs/tfw
249033954177478656,2012-09-21 06:34:56,Check out my amazing Glossi page: http://t.co/XNAYD3Lq via @GlossiApp,0,https://dev.twitter.com/docs/tfw
