Tweet id,Created Time,Tweet Details,Retweet counts,Source URL
408281348462215168,2013-12-04 17:07:13,News Corp Appoints Jim Kennedy (@jimkennedy250) as Chief Communications Officer http://t.co/MEE8jlmWAY,1,http://twitter.com
400007535874162688,2013-11-11 21:10:02,News Corp Reports First Quarter Results For Fiscal 2014 http://t.co/tN1EP7ltFl,5,https://dev.twitter.com/docs/tfw
375001082230882304,2013-09-03 21:03:19,News Corp Announces Sale of Dow Jones Local Media Group http://t.co/dL1cIf91ud,3,https://dev.twitter.com/docs/tfw
370207681635549187,2013-08-21 15:36:04,News Corp to Launch Global Programmatic Advertising Exchange http://t.co/TDMZsGuHhw,8,http://twitter.com
368343658061250560,2013-08-16 12:09:06,"News Corp Launches “BallBall” For Exclusive European Football Content In Japan, Indonesia &amp; Vietnam http://t.co/plBxifKwd7",6,https://dev.twitter.com/docs/tfw
366908470869491712,2013-08-12 13:06:10,"News Corp Secures Exclusive Mobile, Internet Rights for Premier League for Japan, Vietnam, Indonesia http://t.co/vXl4FBxNgf",6,https://dev.twitter.com/docs/tfw
355678040291946496,2013-07-12 13:20:27,News Corp Announces Plans for New London Location http://t.co/88xaALQqDx,6,https://dev.twitter.com/docs/tfw
350729216804913157,2013-06-28 21:35:36,The New News Corp Launches as Global Media and Information Services Company http://t.co/9vvuBNs1zy,11,https://dev.twitter.com/docs/tfw
350725405189222401,2013-06-28 21:20:27,Our new web site is now live: http://t.co/oUX9FfWHM0,20,http://twitter.com
350045441255149568,2013-06-27 00:18:31,The official Twitter account of the new News Corp,8,http://twitter.com
