Tweet id,Created Time,Tweet Details,Retweet counts,Source URL
915683498794606592,2017-10-04 21:02:13,News Corp to Report Fiscal 2018 First Quarter Earnings https://t.co/dxr4SyX9yz,2,http://twitter.com
914841198824706048,2017-10-02 13:15:13,"Statement of Robert Thomson, Chief Executive of News Corp, On Google's Decision to End 'First Click Free' … https://t.co/pq13YL65lu",8,http://twitter.com
905162050581749760,2017-09-05 20:13:44,News Corp to Participate in Goldman Sachs 26th Annual Communacopia Conference https://t.co/1wAgqwxxtd,2,http://twitter.com
902218308426096640,2017-08-28 17:16:21,"News Corp to Participate in Bank of America Merrill Lynch 2017 Media, Communications &amp; Entertainment … https://t.co/cIcVxQUFI9",2,http://twitter.com
898141471995461632,2017-08-17 11:16:28,"Foxtel, Fox Sports Australia To Combine Into New Premium Sports and Entertainment Company https://t.co/4vhdwiMcdH",5,http://twitter.com
895741428357148672,2017-08-10 20:19:33,News Corp Reports Fourth Quarter and Full Year for Fiscal 2017 https://t.co/13LGpDGnJD,5,http://twitter.com
885229692516794369,2017-07-12 20:09:40,News Corp to Report Fiscal 2017 Fourth Quarter and Full Year Earnings https://t.co/81vzsNWdL6,3,http://twitter.com
879698204371165184,2017-06-27 13:49:30,Statement from News Corp regarding the European Commission decision to fine Google https://t.co/Pe7Po3zuTA,8,http://twitter.com
862047250356330496,2017-05-09 20:50:55,News Corp Reports Third Quarter Results for Fiscal 2017 https://t.co/F6zybpffFj,2,http://twitter.com
861577051358322688,2017-05-08 13:42:31,News Corp Names Marc Frons Chief Technology Officer https://t.co/kjoDLOYEHf,2,http://twitter.com
859399814517338112,2017-05-02 13:30:57,Storyful and Moat Launch Initiative to Combat Fake News https://t.co/5DHd2Zjwnk,9,http://twitter.com
859030937333620736,2017-05-01 13:05:10,HarperCollins Publishers Highlights the Importance of Literacy with #WhyIRead Social Media and Giving… https://t.co/SHxdTjn73e,3,http://twitter.com
850034156885221377,2017-04-06 17:15:10,Jesse Angelo Named Chief of Digital Advertising Solutions https://t.co/b5p522Q1vo,4,http://twitter.com
848882210145013764,2017-04-03 12:57:45,Kelly Ayotte Elected To News Corp Board of Directors https://t.co/9eKA98CWdA,13,http://twitter.com
842821144604545024,2017-03-17 19:33:14,Robert Thomson:  Advertisers need to go back to basics to protect their brands https://t.co/R3STaYQCJt,6,http://twitter.com
838752275493449728,2017-03-06 14:05:00,HarperCollins Publishers Celebrates Its 200th Anniversary https://t.co/9qqhgAPY4t,4,http://twitter.com
837720492593283072,2017-03-03 17:45:04,"We are honored to donate 13,000 books to ReadNYC schools, including PS 179, and join with @unitedwaynyc to grow in-… https://t.co/ESQf2pfx7S",3,http://twitter.com
836690653593677828,2017-02-28 21:32:51,News Corp’s HarperCollins Publishers to Participate in the Deutsche Bank 25th Annual Media &amp; Telecom … https://t.co/xD0iUBAeRF,1,http://twitter.com
834149815948890115,2017-02-21 21:16:28,"News Corp to Participate in the Morgan Stanley 2017 Technology, Media Telecom Conference https://t.co/MlcL00iPE2",3,http://twitter.com
829859726255091712,2017-02-10 01:09:11,News Corp Chief Executive Says Digital Distributors Have “Eroded The Integrity Of Content” And Notes … https://t.co/L7j9Drjzib,6,http://twitter.com
829803718149275649,2017-02-09 21:26:38,News Corp Reports Second Quarter Results for Fiscal 2017 https://t.co/xFJL66Qdf1,2,http://twitter.com
819311940493262849,2017-01-11 22:36:03,News Corp to Report Fiscal 2017 Second Quarter Earnings https://t.co/ecZ1TqZ1d8,8,http://twitter.com
818679042157199360,2017-01-10 04:41:08,PropTiger and https://t.co/vzMra60pgg Come Together to Become India’s Largest Digital Real Estate Company https://t.co/rDuiYhh2oK,4,http://twitter.com
803632404560650240,2016-11-29 16:11:10,News Corp to Participate in UBS 44th Annual Global Media and Communications Conference https://t.co/2MsL8Jnhij,2,http://twitter.com
795737851459764225,2016-11-07 21:21:02,News Corp Reports First Quarter Results for Fiscal 2017 https://t.co/6qaeHZkMPm,6,http://twitter.com
789496914727276544,2016-10-21 16:01:47,News Corp to Report Fiscal 2017 First Quarter Earnings https://t.co/htmY34P551,1,http://twitter.com
781953510602575872,2016-09-30 20:26:59,John Elkann to Step Down from News Corp Board https://t.co/fy3fe6pdPI,2,http://twitter.com
776513306722959360,2016-09-15 20:09:33,News Corp to Participate in Goldman Sachs 25th Annual Communacopia Conference https://t.co/qeHwnh3GXv,6,http://twitter.com
773985035103920132,2016-09-08 20:43:06,"News Corp’s Move, Inc. to Participate in BAML 2016 Media, Communications &amp; Entertainment Conference - https://t.co/fJ9Zou9YSw",4,http://twitter.com
762742874509185024,2016-08-08 20:10:47,News Corp Reports Fourth Quarter and Full Year Results for Fiscal 2016 https://t.co/OM1MvjlVba,6,http://twitter.com
758604626803425280,2016-07-28 10:06:51,"News Corp's REA Group &amp; Move, Inc. Launch Global Property Network https://t.co/VqoAPTfKsj",6,http://twitter.com
753323101346263040,2016-07-13 20:19:58,News Corp to Report Fiscal 2016 Full Year Earnings https://t.co/Y68AfbZQl3,6,http://twitter.com
747424482751582208,2016-06-27 13:40:57,News Corp Launches the Marie Colvin Fellowship at the @StonyBrookU School of Journalism https://t.co/UVWJhvaktW,16,http://twitter.com
746004976619634688,2016-06-23 15:40:21,Is https://t.co/oDoiOusdiS For Shopping Or Reading? via @forbes https://t.co/7I2kzzQLoS,5,http://twitter.com
735836453729669121,2016-05-26 14:14:16,News Corp and ICFJ to Support Fellowships at The Wall Street Journal for Indian Journalists https://t.co/mkgLIWSPW5,4,http://twitter.com
735835612561952768,2016-05-26 14:10:55,"80,000 Students Benefiting From Innovative STEM Education Projects https://t.co/VR09CCBcbD",4,http://twitter.com
735459808623644674,2016-05-25 13:17:37,Congratulations to @newscorpaus @storyful @wsj @newsUK winners! https://t.co/xtznOKuMyN,1,http://twitter.com
732927745936654336,2016-05-18 13:36:06,"RT @heatstreet: Megyn Kelly Presents Donald Trump on Fox News culminates in news of her book, memoir 'Settle For More' https://t.co/Hi74K00…",8,http://twitter.com
732742894541492224,2016-05-18 01:21:34,"RT @megynkelly: Here is the cover of my book #SettleForMore, 11/15! Pre-order here: https://t.co/QLmlhLx3Wo  https://t.co/NnCu6X8GrW https:…",147,http://twitter.com/download/iphone
729766765413191684,2016-05-09 20:15:29,Congratulations @sarahfwood ! https://t.co/uX5drhSTKD,4,http://twitter.com
728322108112183297,2016-05-05 20:34:56,News Corp Reports Third Quarter Results for Fiscal 2016 https://t.co/v7hubm0sf1,4,http://twitter.com
720604016108048384,2016-04-14 13:26:00,News Corp to Report Fiscal 2016 Third Quarter Earnings https://t.co/gknC1MXhvD,2,http://twitter.com
715294617378430976,2016-03-30 21:48:20,The @newscorp partnership with @unitedwaynyc will provide over 55k books to in-classroom libraries in NYC schools #NewsCorpGiving,5,http://twitter.com
715285111407828993,2016-03-30 21:10:34,"With @newscorp's help, @YouthInc_NYC will develop an analytics platform to aid youth-development orgs measure their impact #NewsCorpGiving",2,http://twitter.com
715262612364214272,2016-03-30 19:41:10,.@newscorp Philanthropy Partner @PowerMyLearning helps bilingual parents play a greater role in their children's education #NewsCorpGiving,4,http://twitter.com
715243885686075392,2016-03-30 18:26:45,The excellent @ASASafterschool program is a 2016 @newscorp Philanthropy Partner #NewsCorpGiving,5,http://twitter.com
715230931477467137,2016-03-30 17:35:17,"For next 5 years, @newscorp will help fund special adaptations in new homes for disabled veterans with @HomesForOurTrps #NewsCorpGiving",5,http://twitter.com
715216150855041025,2016-03-30 16:36:33,We at @newscorp are proud to name Gerald Richards of @826National as our 2016 Murdoch Community Hero #NewsCorpGiving,4,http://twitter.com
707700757726957571,2016-03-09 22:53:03,RT @jimkennedy250: Keisha Smith-Jeremie (L) at @unitedwaynyc women's leadership lunch. @newscorp giving 55K books to Mott Haven schools htt…,3,http://twitter.com/download/iphone
707297061708931072,2016-03-08 20:08:55,"RT @jimkennedy250: Congrats to @newscorp's @NewsUK, @NewsCorpAus, @WSJ and @Storyful for their 14 noms for INMA Global Media Awards https:/…",6,http://twitter.com
705125906331901952,2016-03-02 20:21:31,"RT @jimkennedy250: At @BETNETWORKS conference, @newscorp's Toni Bush on panel with our philanthropy partner @AllStarCode founder Christina …",1,http://twitter.com
705125880008482816,2016-03-02 20:21:25,RT @jimkennedy250: Toni Bush of @newscorp moderates panel at @BETNETWORKS conference to discuss black male achievement. https://t.co/9v9AaJ…,1,http://twitter.com
703298604413403136,2016-02-26 19:20:28,"News Corp to Participate in Deutsche Bank 24th Annual Media, Internet &amp; Telecom Conference https://t.co/6MUsHFK54Z",1,http://twitter.com
702524985819136000,2016-02-24 16:06:23,"Today, News Corp is Participating in Jefferies 2016 Media &amp; Communications Conference https://t.co/vBvh45owdS",2,http://twitter.com
702511281539039232,2016-02-24 15:11:56,RT @Storyful: Bookmark our panel at #SMW2016 on finding and working with social influencers featuring @r2000c  https://t.co/qsb2fjUZMZ,4,http://twitter.com
699717987754971139,2016-02-16 22:12:23,News Corp to Participate in Jefferies 2016 Media &amp; Communications Conference https://t.co/vBvh45owdS,1,http://twitter.com
697874850501808128,2016-02-11 20:08:24,"Proud of our #WomenInSTEM, incl Chief Data Scientist Rachel Schutt, CISO @justlatha and AUS &amp; UK CTOs @alisa_redux and (soon) @c_scott75",7,http://twitter.com
695354495979515904,2016-02-04 21:13:25,News Corp Reports Second Quarter Results for Fiscal 2016 https://t.co/duCAz0odRP,5,http://twitter.com
688041843347582978,2016-01-15 16:55:33,News Corp to Report Fiscal 2016 Second Quarter Earnings https://t.co/8tLApR6Ndm,3,http://twitter.com
674714562592120832,2015-12-09 22:17:41,RT @NewsUK: Just announced partnership with @tabcomau #Tabcorp to launch new online wagering &amp; gaming business #SunBets for launch in 2016,10,http://twitter.com
674253983356162048,2015-12-08 15:47:31,"Rebekah Brooks appoints Chief Technology Officer 
https://t.co/nFKfaNCPWG",3,http://twitter.com
672130168887054336,2015-12-02 19:08:14,News Corp to Participate in UBS 43rd Annual Global Media and Communications Conference https://t.co/6vdjd5R8PM,2,http://twitter.com
666272302590488576,2015-11-16 15:11:10,"News Corp welcomes @newscorpaus Exec Chairman, Michael Miller @mm_newscorpaus and CEO, Peter Tonagh @pt_newscorpaus to Twitter!",4,http://twitter.com
662382192396525568,2015-11-05 21:33:15,News Corp Reports First Quarter Results for Fiscal 2016 https://t.co/FjVDVa90vL,3,http://twitter.com
656218338507497472,2015-10-19 21:20:18,News Corp to Report Fiscal 2016 First Quarter Earnings https://t.co/7dIwwysImA,2,http://twitter.com
649338281717551104,2015-09-30 21:41:25,News Corp Completes Sale of Amplify Digital Education Businesses http://t.co/S9c5J78MsL,6,http://twitter.com
649239049690042368,2015-09-30 15:07:06,"Today, News Corp has completed its acquisition of the feisty and creative @unrulyco.  A catalyst for our brands and a boon for our clients.",42,http://twitter.com
644131792300150784,2015-09-16 12:52:41,A warm welcome to the Unrulies! More of the Unruly story here... https://t.co/Nuo7labPlj,46,http://twitter.com
644130839887003648,2015-09-16 12:48:54,News Corp To Acquire Social Video Ad Platform Unruly http://t.co/gOoil1DtL2,41,http://twitter.com
642430972831662081,2015-09-11 20:14:14,"News Corp’s Move, Inc. to Participate in Goldman Sachs 24th Annual Communacopia Conference http://t.co/QpGI54VxBB",4,http://twitter.com
639145275349729284,2015-09-02 18:38:03,"News Corp to Participate in Bank of America Merrill Lynch 2015 Media, Communications &amp; Entertainment … http://t.co/SywUpHYWpr",3,http://twitter.com
639066533193515008,2015-09-02 13:25:09,News Corp Announces Leadership Changes At News UK http://t.co/K6T4yBwNxe,10,http://twitter.com
631564369562697729,2015-08-12 20:34:14,News Corp Reports Fourth Quarter and Full Year Results for Fiscal 2015 http://t.co/u8gLXrngzH,1,http://twitter.com
628217511427878912,2015-08-03 14:55:01,HarperCollins Publishers Announces the Formation of HarperCollins Brasil http://t.co/mYTJ7ETxsA,3,http://twitter.com
624585192812990464,2015-07-24 14:21:28,News America Marketing Purchases Checkout 51 #NewsAmerica http://t.co/L7kZnoRSce,3,http://twitter.com
623600445127270400,2015-07-21 21:08:26,News Corp to Report Fiscal 2015 Full Year Earnings http://t.co/1x7OV6lm46,2,http://twitter.com
623572372210253824,2015-07-21 19:16:53,Building A Foundation For Digital Growth - News Corp Strategy Discussed http://t.co/FEDip6fygr,1,http://twitter.com
623136416684503040,2015-07-20 14:24:33,"HarperCollins Publishers Sells More Than 1.1 Million Copies of Go Set a Watchman in Print, e-Book and Audio Format http://t.co/wRMHTQVOqZ",3,http://twitter.com
621034599641149440,2015-07-14 19:12:41,Building VCCircle - How Sahad PV Started From A Blog &amp; Created An Extremely Successful Business! http://t.co/GfcORPUmPN,2,http://twitter.com
618438790684782592,2015-07-07 15:17:52,"UK based News Corp staff vote for Alzheimer's Society to receive £50,000 http://t.co/qfLuMjTMQZ",4,http://twitter.com
618427020121362433,2015-07-07 14:31:06,.@Factiva and @Storyful announce partnership to deliver enhanced social intelligence to Factiva customers http://t.co/nxAZYfWhFa,6,http://twitter.com
615579552048410624,2015-06-29 17:56:16,RT @HarperCollinsUK: We were delighted to give cheques to some amazing charities today - incl. @WhizzKidz @LDNairamb @SupportCHAS @alzheime…,12,http://twitter.com
615579248393351168,2015-06-29 17:55:04,"RT @NewsUK: MD @DowJones @VanneckKatie presents @WhizzKidz and @StChrisHospice with their £10,000 #NewsCorpGiving cheques",6,http://twitter.com
615533587757178884,2015-06-29 14:53:38,"RT @NewsUK: .@NewsCorp donated £100k to causes close to #TheNewsBuilding employees' hearts, look forward to welcoming #NewsCorpGiving winne…",3,http://twitter.com
614058336959512576,2015-06-25 13:11:30,Millennial Sentiment Trending More Positively About Purchasing Homes http://t.co/NhlIllyjLI,0,http://twitter.com
613839644707422208,2015-06-24 22:42:30,http://t.co/oDoiOusdiS® and Airbnb Team Up to Give Home Buyers Opportunity to Live Like a Local Before Purchasing | http://t.co/nj2gaOvpFE,0,http://twitter.com/download/iphone
611509125630042114,2015-06-18 12:21:51,News Corp Announces Plans to Initiate Dividend http://t.co/Z7usjb07lz,2,http://twitter.com
611509049360826368,2015-06-18 12:21:33,News Corp Amends Stockholder Rights Plan http://t.co/j0HOrCKE7h,2,http://twitter.com
611168210285654016,2015-06-17 13:47:10,News Corp’s Storyful Unit in Content Deal with Starcom Media Group | http://t.co/HA2hkeLzje: http://t.co/tfJFYVj3Un,5,http://twitter.com
607938712152981504,2015-06-08 15:54:18,News Corp and Jumpstart Partner to Expand Jumpstart’s Programs and Impact http://t.co/mopSieDeJM,4,http://twitter.com
601750344922705920,2015-05-22 14:03:56,News Corp to Participate in Bank of America Merrill Lynch Global Telecom &amp; Media Conference http://t.co/Oiop4ONksV,2,http://twitter.com
598474649287155713,2015-05-13 13:07:30,"Congratulations @Storyful, named Global Innovation Award winner @ #inmawc15 for 'Innovation is a culture'. http://t.co/cNXEhygoX9",6,http://twitter.com
598285649855254528,2015-05-13 00:36:29,RT @realtordotcom: Putting the REAL in #Realtor! Visit the new http://t.co/9M9uQGPLGw and check out our new look! http://t.co/GmIzrvLNUD,29,http://twitter.com
597553173394522112,2015-05-11 00:05:53,News Corp Begins Executing On Stock Buyback Program http://t.co/BlVhrQAlzo,3,http://twitter.com
595682979575439360,2015-05-05 20:14:24,News Corp Reports Third Quarter Results for Fiscal 2015 http://t.co/pqXD045eCY,4,http://twitter.com
595674751168860160,2015-05-05 19:41:42,"In Honor of National Teacher Appreciation Day, News Corp Funds School Technology Projects in Silicon… http://t.co/NplbEqzg0W",6,http://twitter.com
585542721319870465,2015-04-07 20:40:38,News Corp to Report Fiscal 2015 Third Quarter Earnings http://t.co/uPafK4RgwW,1,http://twitter.com
578387679060058113,2015-03-19 02:49:03,News Corp builds its investment in APN News and Media Limited to a 14.99% Stake (Subject to Regulato… http://t.co/A1S7DoKSBg,7,http://twitter.com
577827590481813504,2015-03-17 13:43:27,"Congratulations Rachel Schutt, News Corp's Chief Data Scientist, nominated #YGL @WEF",3,http://twitter.com
575326397008322560,2015-03-10 16:04:36,Storyful Partners with FleishmanHillard’s Social &amp; Digital Practice to Integrate UGC into Brand Content http://t.co/b2oOfrLCUS,1,http://twitter.com
574730452696702976,2015-03-09 00:36:32,"News Corp Announces Acquisition of VCCircle, India’s Leading Digital Data, Information, Training &amp; C… http://t.co/RVa31UkU67",19,http://twitter.com
573489017775394816,2015-03-05 14:23:31,"http://t.co/oDoiOusdiS® Bites Into the Big Apple -- NEW YORK, March 5, 2015 /PRNewswire/ -- http://t.co/QhZAmxCcjR",1,http://twitter.com
572884264284495873,2015-03-03 22:20:26,"News Corp to Participate in Deutsche Bank 23rd Annual Media, Internet &amp; Telecom Conference http://t.co/QBE9E8illK",1,http://twitter.com
569966395867447297,2015-02-23 21:05:52,"News Corp to Participate in Morgan Stanley Technology, Media &amp; Telecom Conference http://t.co/9RKNKJefiw",2,http://twitter.com
567697771214696450,2015-02-17 14:51:10,News Corp announced as a NYC Tech Talent Pipeline Industry Partner http://t.co/APGrzJZhgh via @nycgov,2,http://twitter.com
565880029746585600,2015-02-12 14:28:07,David Pitofsky Named News Corp General Counsel http://t.co/OVIdoyWOLY,2,http://twitter.com
565156006716780544,2015-02-10 14:31:06,.@newscorp's @storyful is one of the top ten most innovative companies in social media http://t.co/w2k42Rks1D,7,http://twitter.com
563444364752732160,2015-02-05 21:09:39,News Corp Reports Second Quarter Results for Fiscal 2015 http://t.co/BquVioDn1A,2,http://twitter.com
562694300610592768,2015-02-03 19:29:10,"RT @WSJ: Harper Lee to publish second book on July 14, 55 years after ""To Kill a Mockingbird."" http://t.co/kUUZMChyfp",383,http://twitter.com
562682690496126977,2015-02-03 18:43:02,"RT @HarperCollins: Second Harper Lee novel, Go Set a Watchman, to be published in July, via @ap: http://t.co/Tz9Be7AvUc",100,http://twitter.com
555389795409879040,2015-01-14 15:43:40,News Corp to Report Fiscal 2015 Second Quarter Earnings http://t.co/jLkKC3mnhR,1,http://twitter.com
546051715925958656,2014-12-19 21:17:28,News Corp Acquires http://t.co/bhfuCZytA7 http://t.co/MlyivCTcxf,8,https://dev.twitter.com/docs/tfw
545336758376734720,2014-12-17 21:56:29,"News Corp Announces New Leadership At Move, Inc. http://t.co/N2zVBdklqR",2,https://dev.twitter.com/docs/tfw
544984516465405952,2014-12-16 22:36:48,RT @nycmedialab: NYC Media Lab announces working group with @newscorp @columbiajourn @nyupoly to build #dataviz tools for journalists. http…,7,http://twitter.com
544500399114186752,2014-12-15 14:33:06,Storyful Announces Leadership Changes To Build On Substantial Growth Momentum Under News Corp http://t.co/eO4c06mPjW,2,https://dev.twitter.com/docs/tfw
540510537981779968,2014-12-04 14:18:49,News Corp to Participate in UBS 42nd Annual Global Media and Communications Conference http://t.co/hivSkvpMKh,0,https://dev.twitter.com/docs/tfw
539501019227779072,2014-12-01 19:27:21,Congrats to @HarperCollins CEO Brian Murray Named @PublishersWkly Person of the Year - http://t.co/5CEVhswRAD,3,http://twitter.com
536990237415591936,2014-11-24 21:10:24,News Corp Expands into Fast Growing Digital Real Estate Sector in India http://t.co/CFAus2Ybla,7,https://dev.twitter.com/docs/tfw
533252194561036290,2014-11-14 13:36:45,"News Corp Completes Acquisition of Move, Inc. http://t.co/uYfPXeJPUs",6,https://dev.twitter.com/docs/tfw
530110773230460928,2014-11-05 21:33:51,News Corp Reports First Quarter Results for Fiscal 2015 http://t.co/T3QDCkwhaB,5,https://dev.twitter.com/docs/tfw
522740492673753088,2014-10-16 13:27:00,Hello @NewsUK!,1,http://twitter.com
520572588624322560,2014-10-10 13:52:31,News Corp to Report Fiscal 2015 First Quarter Earnings http://t.co/MEdk3Snbk6,1,https://dev.twitter.com/docs/tfw
516899052131086336,2014-09-30 10:35:12,"News Corp To Acquire Move, Inc. http://t.co/4b4le9G4o9",29,https://dev.twitter.com/docs/tfw
512360089575886849,2014-09-17 21:58:59,News Corp Opposed Google’s European Commission Settlement Offer http://t.co/orM3TF69tq,3,https://dev.twitter.com/docs/tfw
511911882362322944,2014-09-16 16:17:58,News Corp’s New London Headquarters Officially Opened http://t.co/S5gZRnDP6v,7,https://dev.twitter.com/docs/tfw
509363484807557121,2014-09-09 15:31:32,News Corp to Participate in Goldman Sachs Communacopia Conference http://t.co/Okg9cBdmW1,1,https://dev.twitter.com/docs/tfw
505392897920077824,2014-08-29 16:33:51,Visiting News Corp Fellows from Mexico at The Wall Street Journal http://t.co/saSLyVhlRR,2,http://twitter.com
497474161233494016,2014-08-07 20:07:37,News Corp Reports Fourth Quarter and Full Year Results for Fiscal 2014 http://t.co/2e3FeHIIud,5,https://dev.twitter.com/docs/tfw
495245661038592000,2014-08-01 16:32:21,News Corp Completes Acquisition of Harlequin http://t.co/NjlqdxQy6J,10,https://dev.twitter.com/docs/tfw
491950715485429760,2014-07-23 14:19:25,"Storyful Announces Appointments to Expand Open Newsroom, Sales Operations http://t.co/99M5L4HqnH",1,https://dev.twitter.com/docs/tfw
490141573057761280,2014-07-18 14:30:32,News Corp to Report Fiscal 2014 Full Year Earnings http://t.co/OQdGUlbm86,4,https://dev.twitter.com/docs/tfw
481899218773491713,2014-06-25 20:38:21,"Congrats Brenton James of the Eagle Academy @EAFNYC, a News Corp Philanthropy Partner. Accepted to 21 universities! http://t.co/Dt39VGKR6k",3,http://twitter.com
481090356281225217,2014-06-23 15:04:13,News Corp Sells Community Newspaper Group http://t.co/LM8OhO2X2y,3,https://dev.twitter.com/docs/tfw
479616641311846400,2014-06-19 13:28:12,News Corp’s “BallBall” Wins Official 2014 FIFA World Cup Broadband and Mobile Highlights Rights in Vietnam http://t.co/zJZ69tF09U,3,https://dev.twitter.com/docs/tfw
479357510541770752,2014-06-18 20:18:31,News Corp Amends Stockholder Rights Plan http://t.co/uyGDrE4cTc,0,https://dev.twitter.com/docs/tfw
473840002539864064,2014-06-03 14:53:54,Paul Carlucci Announces Retirement From News America Marketing http://t.co/VY92hYmNth,2,https://dev.twitter.com/docs/tfw
464503236607483904,2014-05-08 20:32:56,News Corp Appoints William Lewis As CEO Of Dow Jones http://t.co/0qoGkDdtCK,14,https://dev.twitter.com/docs/tfw
464503091492966400,2014-05-08 20:32:21,News Corp Reports Third Quarter Results for Fiscal 2014 http://t.co/FA1EYrfaFj,3,https://dev.twitter.com/docs/tfw
463714530929807360,2014-05-06 16:18:54,"For #Teacher Appreciation Day, All http://t.co/pOszcE4QWT Classroom Projects In Brooklyn Funded By News Corp http://t.co/ac5OBlyL8c",3,https://dev.twitter.com/docs/tfw
462185821060083712,2014-05-02 11:04:21,News Corp to Acquire Harlequin http://t.co/e4kjqLPHM1,9,https://dev.twitter.com/docs/tfw
459333772815499264,2014-04-24 14:11:20,Storyful Partners with Facebook for Launch of 'FB Newswire' http://t.co/auCcEDNhbJ,4,https://dev.twitter.com/docs/tfw
458981590584942592,2014-04-23 14:51:53,News Corp to Report Fiscal 2014 Third Quarter Earnings http://t.co/t3UlFzV9tM,1,https://dev.twitter.com/docs/tfw
458272525500563456,2014-04-21 15:54:19,Deadline to apply for News Corp Fellowships for Mexican journalists is May 12 via @ICFJ: http://t.co/H1MemJKler,7,http://twitter.com
453194318979670017,2014-04-07 15:35:20,News Corp Partners With Galaxy Media &amp; Entertainment to Distribute “BallBall” for Exclusive Online E… http://t.co/LZSNzSj22u,2,https://dev.twitter.com/docs/tfw
453179916599967744,2014-04-07 14:38:06,"RT @DowJones: .@WSJ is deepening its political coverage in Washington, D.C. with Capital Journal. See new hires &amp; details: http://t.co/ccYT…",6,http://twitter.com
452143271754891265,2014-04-04 17:58:51,Watch seniors celebrate Ivy League acceptances at Eagle Academy (@EAFNYC) - a News Corp Philanthropy Partner http://t.co/npfaiJh3XH,4,http://twitter.com
451404973385871360,2014-04-02 17:05:07,News Corp to Provide Immersive Fellowships for Mexican Journalists http://t.co/mMns3lICCH,2,https://dev.twitter.com/docs/tfw
450625004837666816,2014-03-31 13:25:48,Congrats to News Corp Chief Data Scientist Rachel Schutt - 2014 @CrainsNewYork 40 Under 40 http://t.co/zb2Z3iN4pa,0,https://dev.twitter.com/docs/tfw
448735072334540800,2014-03-26 08:15:53,Lachlan Murdoch Named Non-Executive Co-Chairman of News Corp http://t.co/Eid9WixlYt,28,https://dev.twitter.com/docs/tfw
442006408007925760,2014-03-07 18:38:34,"News Corp to Participate in Deutsche Bank 22nd Annual Media, Internet and Telecom Conference http://t.co/gmRswUgzgC",0,https://dev.twitter.com/docs/tfw
438698577259278339,2014-02-26 15:34:26,News Corp Joins NYC Media Lab to Pursue Innovation Projects http://t.co/hPv759hlZv,2,https://dev.twitter.com/docs/tfw
431535160446562304,2014-02-06 21:09:34,News Corp Reports Second Quarter Results For Fiscal 2014 http://t.co/Z1U9oV3NeR,4,https://dev.twitter.com/docs/tfw
425746794144751616,2014-01-21 21:48:40,News Corp Announces Changes at Dow Jones &amp; Company http://t.co/khhoCKlMrE,3,https://dev.twitter.com/docs/tfw
420210824834080768,2014-01-06 15:10:42,News Corp Signs Lease for New Home in Central London http://t.co/w85gxXvHhh,3,https://dev.twitter.com/docs/tfw
414025424901902338,2013-12-20 13:32:08,News Corp Acquires Social News Agency Storyful http://t.co/LqlfGtNwvT,36,https://dev.twitter.com/docs/tfw
