Tweet id,Created Time,Tweet Details,Retweet counts,Source URL
925126856256319488,2017-10-30 22:26:45,RT @SupplySchoolAU: Amazing to see @SupplySchoolAU Founding Partner @Stockland's leadership on climate action recognised in this way - grea…,1,http://twitter.com/#!/download/ipad
925126461668737025,2017-10-30 22:25:11,"Our new foreshore project is set to transform our fast-growing, affordable beachside Amberton community in WA https://t.co/jYRP71GiJm",0,http://twitter.com/#!/download/ipad
924797507208585216,2017-10-30 00:38:02,"There's only 3 more days until @hmaustralia opens at Stockland Rockhampton, with celebrations kicking off at 10am o… https://t.co/ahXYpgD0lO",0,http://twitter.com
923714191533293568,2017-10-27 00:53:19,Stockland Rockhampton will open a new #inclusive playground for children of all abilities with a party tomorrow. https://t.co/3wKh8fkBMh,0,http://twitter.com
923395524560011266,2017-10-26 03:47:03,"It was great to be part of Parli Play Date with #CAREFoundation partner @TouchedByOlivia, launching Parliamentary F… https://t.co/YrK6Aathbr",2,http://twitter.com
923327307472764929,2017-10-25 23:15:59,"RT @AFRproperty: Stockland delivers on-track first quarter: shareholders approve remuneration, @SuLin_Tan reports.

https://t.co/tdpNzrPhnB",2,http://twitter.com
923304354202796032,2017-10-25 21:44:46,"We've acquired 138ha at Truganina, next to Mt Atkinson in one of the country's fastest growing residential corridors https://t.co/n5q9YTZvhX",0,http://twitter.com
923086041044545536,2017-10-25 07:17:16,RT @RomillyMadew: @Stockland only Aus Co to make global climate A list released by @CDP Stockland also named 2017 Global Leader for the Lis…,2,http://twitter.com/download/iphone
923013410429722624,2017-10-25 02:28:40,As the only Australian company on @CDP Climate #Alist we're proud to be recognised for our climate action leadershi… https://t.co/dUd27bQNMI,1,http://twitter.com
922965701769363459,2017-10-24 23:19:05,Today we announce a positive start to FY18 driven by all business units with residential leading the way.… https://t.co/4uVb3MZyNP,1,http://twitter.com
922600252338610176,2017-10-23 23:06:55,We’re proud to again be included on @CDP Climate #AList &amp; to see our leadership on climate action recognized… https://t.co/4dFNPIadlA,3,http://twitter.com/#!/download/ipad
922568267935264770,2017-10-23 20:59:50,"RT @AFRproperty: Bulking up in SE QLD: @Stockland buys 400-home Greater Springfield site for $21 million, @larryschles reports.

  https://…",2,http://twitter.com/download/iphone
922295169784856577,2017-10-23 02:54:38,"We have acquired part of Springview Estate in the Greater Springfield region, with existing approval for 400+ homes. https://t.co/6xpN1VN2xk",0,http://twitter.com
921155664994619392,2017-10-19 23:26:39,Stockland Townsville has cemented its status as the centre for fashion in Northern Qld with H&amp;M opening its doors y… https://t.co/JmjiEqTQ75,0,http://twitter.com
920902145037058048,2017-10-19 06:39:15,MD&amp;CEO Mark Steinert joins a panel discussing the future of the Australian residential market at #Propertycongress https://t.co/dbLRicBPBz,0,http://twitter.com/download/iphone
920875396039450624,2017-10-19 04:52:58,Our Commercial Property CEO John Schroder hosts a panel discussion of the retail market at the @propertycouncil 201… https://t.co/aAmizd57r3,0,http://twitter.com
920861252305522688,2017-10-19 03:56:45,We're delighted to welcome the new H&amp;M team to Stockland Townsville! https://t.co/nYYi3Q8sws,0,http://twitter.com
920855005489373185,2017-10-19 03:31:56,@CoraleeORourke @hm Thank you for joining us to mark the occasion. We look forward bringing more of the biggest and… https://t.co/PzKgAyp7wm,0,http://twitter.com
920823468639232001,2017-10-19 01:26:37,Stockland Cairns among five of our Qld shopping centres to receive solar transformation. https://t.co/wzMbwFXAFw,1,http://twitter.com
920793645644517376,2017-10-18 23:28:07,"RT @AnnaRawlings_: $3.4m solar project should be operating at @Stockland #Cairns by Christmas,saving tenants up to 10% on power bills.Detai…",5,http://twitter.com
920787865314799616,2017-10-18 23:05:09,".@Curtis_Pitt_MP joins us at Stockland Cairns, surveying first project in AU’s largest retail property solar progra… https://t.co/Ap18TNjt7w",0,http://twitter.com
920781075441377280,2017-10-18 22:38:10,An exceptional retail coup for this centre and for the region: H&amp;M opens at Stockland Townsville. https://t.co/ryNAE1XE3x,0,http://twitter.com
920772211555778561,2017-10-18 22:02:57,Stockland Townsville cements its status as the centre for fashion in Northern Qld with H&amp;M opening its doors today.… https://t.co/bOPbVjlG85,1,http://twitter.com
920767341234810880,2017-10-18 21:43:35,"H&amp;M a match for Stockland in Queensland, opening at Stockland Townsville today.  https://t.co/iGqQI1rg0L",0,http://twitter.com
920043848188833792,2017-10-16 21:48:41,We've welcomed the opening of Baringa State Primary School's administration building - key to Aura's first school. https://t.co/cWlibbX9K7,0,http://twitter.com
919818897582211074,2017-10-16 06:54:49,RT @Redkite: Redkite team &amp; committee members had a blast this weekend visiting Stockland shopping centres and retirement villages around t…,2,http://twitter.com/download/iphone
918672312219574274,2017-10-13 02:58:41,RT @gbcaus: CASE STUDY | @Stockland looks to community for Indigenous engagement: https://t.co/9MTJfLS2xI #Reconciliation https://t.co/INRG…,1,http://twitter.com
918619430145335297,2017-10-12 23:28:33,"We’ve again been recognised for our commitment to #diversity, receiving a Commendation in the @UDIANSW Diversity in… https://t.co/vfuNdMhPkp",0,http://twitter.com
918324400889348096,2017-10-12 03:56:13,"RT @MichaelSukkarMP: Fantastic to speak to @UDIANSW today on the Government's commitment to secure, stable and affordable housing for all A…",3,http://twitter.com/download/iphone
918320303314309121,2017-10-12 03:39:56,"The Hon @MichaelSukkarMP addressing @UDIANSW on Federal measures to increase supply of #affordable housing, connect… https://t.co/TqK29PM21b",1,http://twitter.com/download/iphone
918287666164088832,2017-10-12 01:30:15,Andrew Whitson @UDIANSW: #Affordability is not just about the house - it’s about the cost of living - energy solutions critical,0,http://twitter.com/download/iphone
918286369276833792,2017-10-12 01:25:06,Residential CEO Andrew Whitson: Central coordinating body to manage approvals vital to keeping up with housing growth targets @UDIANSW,0,http://twitter.com/download/iphone
918283615871451136,2017-10-12 01:14:09,Our Residential CEO Andrew Whitson @UDIANSW panel discussing importance of infrastructure solutions to unlocking ho… https://t.co/sqCzh1inDy,4,http://twitter.com/download/iphone
918258699021328384,2017-10-11 23:35:08,"RT @UDIANSW: Mark Steinert, @Stockland CEO - potential for ""billions of dollars in economic outcome"" from proper planning. #udiansw @house_…",2,http://twitter.com/download/iphone
918254292846264320,2017-10-11 23:17:38,Mark Steinert:collaboration &amp; coordination essential to deliver liveable #WesternSydney city to realise the opportu… https://t.co/UXdp5VuZ9U,1,http://twitter.com/download/iphone
918252489501110273,2017-10-11 23:10:28,Our CEO Mark Steinert joins #WesternSydney panel @UDIANSW State Conference discussing city and community building f… https://t.co/VpNTertTQl,1,http://twitter.com/download/iphone
918242163330228225,2017-10-11 22:29:26,"RT @austethical: Australian Ethical Investment, Stockland, will roll out the largest solar project by a landlord in Australia. https://t.co…",2,http://twitter.com/#!/download/ipad
918242031385714689,2017-10-11 22:28:55,"RT @FinancialReview: .@Stockland stacks up big solar play, reports @NickLenaghan.  https://t.co/j4YeUT3047",9,http://twitter.com/#!/download/ipad
917970785528176640,2017-10-11 04:31:04,"There's just over a week until @hmaustralia opens their Stockland Townsville store, the first H&amp;M in northern Qld. https://t.co/pi85QSMGzr",1,http://twitter.com
917857921886601216,2017-10-10 21:02:36,Our popular Willowdale community continues to offer #affordable homes for Sydney families. https://t.co/9huUArLgBm,2,http://twitter.com
917184238297931777,2017-10-09 00:25:37,"Construction has begun on a $4 million foreshore development project at our Amberton community in Eglinton, WA.… https://t.co/jqIxmkUPx8",2,http://twitter.com
917132765312671744,2017-10-08 21:01:05,RT @JamiesonMark: #Baringa #Aura #SunshineCoast is developing rapidly and the market is responding with increasing sales and families movin…,3,http://twitter.com/#!/download/ipad
915685898095812609,2017-10-04 21:11:45,RT @ethicalp: .@Stockland’s 2017 Annual Review highlights continued leadership &amp; ongoing achievements in #sustainability. https://t.co/4dI2…,1,http://twitter.com/#!/download/ipad
915332934902571008,2017-10-03 21:49:12,The very first residents at our Altrove community in Schofields will soon have a 1.6ha hilltop park https://t.co/NjsgziwAzu,0,http://twitter.com/#!/download/ipad
915029371869528065,2017-10-03 01:42:57,"RT @hmaustralia: Not long till the doors of our Stockland Rockhampton store open on Nov 2 at 10am.
There will be a DJ &amp; gift bags for the f…",2,http://twitter.com
915019632112689152,2017-10-03 01:04:15,RT @CSRwire: .@Stockland releases its 2017 Annual Review &amp; #Sustainability Reporting https://t.co/h6TK0Fk0cV #report #CSR,3,http://twitter.com/#!/download/ipad
914005331885268993,2017-09-30 05:53:47,RT @FlexCareers: 8 ways to tackle gender inequality at work from our partner @WGEAgency featuring our client @Stockland #FlexCareers https:…,1,http://twitter.com/#!/download/ipad
913179529224495104,2017-09-27 23:12:20,"Work is underway on the first and largest park at our Altrove community (NSW), designed for all ages to enjoy.… https://t.co/71kjhEQTlj",0,http://twitter.com
913168683886710784,2017-09-27 22:29:14,"We're delighted to welcome Optus as our major tenant at 2 Victoria Ave Perth, now named The Optus Centre. https://t.co/3OLKVV3mpj",1,http://twitter.com
912901484194533380,2017-09-27 04:47:29,We're proud to deliver inclusive amenities as part of our Stockland Green Hills redevelopment. https://t.co/1fpOSxqA9l via @maitlandmercury,1,http://twitter.com
912856052902723584,2017-09-27 01:46:57,"We're proud to extend our relationship with @Optus, welcoming them as our major tenant at 2 Victoria Ave Perth.… https://t.co/zUKEEIP0Cu",0,http://twitter.com
912152110824693760,2017-09-25 03:09:44,H&amp;M reveals when its Stockland Rockhampton store will open https://t.co/ZJwTw6Vu6N,1,http://twitter.com
912113842422915072,2017-09-25 00:37:40,"We're proud to support H&amp;M as they move into regional Queensland, opening at Stockland Townsville on 19/10 &amp; Stockl… https://t.co/guMpUtmciT",0,http://twitter.com
911048696388771840,2017-09-22 02:05:10,RT @SadafAmiri2: A big shout out to @Stockland for bringing our community together. #healthyhappyliving @Genelle029 @ScottsDavidson https:/…,3,http://twitter.com/#!/download/ipad
911013184663781376,2017-09-21 23:44:03,Our #Sustainability Strategy in Action: Our FY17 Sustainability Deep Dives are now live #GRI #UNGC #sustyreporting… https://t.co/JnWHK1whqT,7,http://twitter.com
911009483739906048,2017-09-21 23:29:21,"We've released our 2017 Annual Review - our integrated reporting on our financial, social environmental performance… https://t.co/AL9U5oCygQ",2,http://twitter.com
910351389645316101,2017-09-20 03:54:19,RT @WGEAgency: Encouraging more men to take parental leave is key for gender equality. See what @Stockland is doing to achieve this https:/…,4,http://twitter.com/#!/download/ipad
910002245088845824,2017-09-19 04:46:56,RT @RomillyMadew: Great to see @gbcaus Board Director Andrew Whitson @Stockland talking about #liveability https://t.co/cQnEAIOTj6,1,http://twitter.com/download/android
909976797931900933,2017-09-19 03:05:49,Our #Liveability Index measures the impact of decisions we make when planning communities on the #health &amp;… https://t.co/1Pa3OjIy7O,3,http://twitter.com
909544097915924481,2017-09-17 22:26:26,"We're 800 homes into the $454m Oceanside community on the #SunshineCoast, designed for healthy active lifestyles. https://t.co/w7r004HXBL",0,http://twitter.com
908529024833527808,2017-09-15 03:12:53,"Pick up some tips &amp; advice on building sustainable homes at our Willowdale community, Denham Court this Sunday
https://t.co/1fASPDxXzC",2,http://twitter.com/#!/download/ipad
908476932861288449,2017-09-14 23:45:54,We have worked closely with @KnoxCC &amp; @gbcaus to design Waterlea as a model development for #affordability and… https://t.co/R74pkeRlJE,3,http://twitter.com/#!/download/ipad
908185518130610176,2017-09-14 04:27:55,We're proud to support #RUOKDay at our offices and assets around the country. https://t.co/xZIrXAtaEa https://t.co/vqR8zEul7P,0,http://twitter.com
907848816380010497,2017-09-13 06:09:59,Proud to be @GRESB Global Leader for Listed Diversified - Office/Retail; recognising our work to create a more sust… https://t.co/8FJxKEiYcy,5,http://twitter.com
907793258000015361,2017-09-13 02:29:13,World-leading sustainable development rating for our Waterlea medium density project; a 6 Star Green Star Community… https://t.co/ntVBgaGAvn,2,http://twitter.com
905947084964061184,2017-09-08 00:13:11,RT @PaulaR0gers: @ceda_news @Stockland Col Dutton opens the State Budget breakfast #BudgetWA https://t.co/efKi1PChea,6,http://twitter.com/download/iphone
905287129428881408,2017-09-06 04:30:45,"Join @SYOrchestras at our Elara and Willowdale communities on 17 Sept for their free, family-friendly 'Meet the Orc… https://t.co/ju41bK9nqH",1,http://twitter.com
905220602864164864,2017-09-06 00:06:24,Residents at our Willowdale community are counting down to the opening of @Coles Willowdale Shopping Centre in Oct. https://t.co/uolYGCtKQr,0,http://twitter.com
904855070839209984,2017-09-04 23:53:54,"We're looking forward to opening the $2 million Jungle Park at our Whiteman Edge community in Brabham this weekend.
https://t.co/drrHFFwiqz",1,http://twitter.com
904507529773760512,2017-09-04 00:52:54,We're proud to have our 6 star Green Star Aura community recognised with a @HlthyLandWater Erosion &amp; Sediment Contr… https://t.co/ZRZkK6biw6,0,http://twitter.com
904485582205665281,2017-09-03 23:25:41,"Congratulations to these mid-north coast community groups, some of 320 Stockland Community Grant recipients in 2017. https://t.co/FNKJKi33jM",0,http://twitter.com
903458805928701952,2017-09-01 03:25:39,RT @SR_Langford: Andrew Whitson from @Stockland points out density done well adds to supply and creates better places. #HousingAustralia @S…,5,http://twitter.com/download/iphone
903458731177852928,2017-09-01 03:25:21,"Andrew Whitson: for Sydney to remain liveable &amp;affordable for future,we all need to show leadership in addressing this challenge @ceda_news",0,http://twitter.com/download/iphone
903457562640605185,2017-09-01 03:20:43,Andrew Whitson: delivering the missing middle is vital - we need to get comfortable with higher density living @ceda_news #HousingAustralia,0,http://twitter.com/download/iphone
903456800367718400,2017-09-01 03:17:41,Andrew Whitson: we've developed a 4-point plan of actions to accelerate land supply in Sydney to help address affor… https://t.co/LHXC09teqX,0,http://twitter.com/download/iphone
903456023775551489,2017-09-01 03:14:36,Our Residential CEO Andrew Whitson addressing @ceda_news on the complex challenge of housing affordability… https://t.co/b4Y8k5r6vG,1,http://twitter.com/download/iphone
903423406791471105,2017-09-01 01:04:59,"Back to the future for cities? Experts @ChrisLeinberger, @LucyTurnbullGSC, Dr Tim Williams @Committee4Syd &amp; Mark St… https://t.co/afgO0yGFhm",9,http://twitter.com
903408004459929601,2017-09-01 00:03:47,"Congratulations to these Shoalhaven community groups, some of this year's 320 Stockland Community Grant recipients. https://t.co/orj6PuwjOi",0,http://twitter.com
902404805888425985,2017-08-29 05:37:26,"Our GM Col Dutton moderating  #HousingAustralia panel with Minister Tinley, Professor Ong @BankwestCurtin &amp; Kathlee… https://t.co/jIPEnW6WS8",2,http://twitter.com/download/iphone
902401884538814464,2017-08-29 05:25:49,"RT @ceda_news: WA Minister for Housing, Hon. Peter Tinley, speaking at today's #HousingAustralia event in Perth. Read the report: https://t…",3,http://twitter.com/download/iphone
902385164768034816,2017-08-29 04:19:23,Col Dutton:critical decisions are reqd at all levels of govt 2 unlock #affordability for all - from first home buyers to retirees @ceda_news,0,http://twitter.com/download/iphone
902384191983165440,2017-08-29 04:15:31,Our General Manager WA Col Dutton introducing today's important @ceda_news #HousingAustralia discussion in Perth https://t.co/EDCZAH5urq,0,http://twitter.com/download/iphone
902371026008281088,2017-08-29 03:23:12,"CEO Mark Steinert features on @AECOM's ‘Talking Cities’ podcast, sharing his views on vibrant, liveable communities. https://t.co/Zl7MvTndkE",4,http://twitter.com
901984876060000256,2017-08-28 01:48:47,VIDEO: We create the places that people make their own - thriving communities and dynamic town centres.… https://t.co/RQFNb7MjHB,0,http://twitter.com
901006046134550528,2017-08-25 08:59:15,"RT @ChargePointAU: Article about energy leadership in #Aura.  You can also charge your #EV in the Display Village, @Stockland 
https://t.co…",1,http://twitter.com/download/android
900860853209120768,2017-08-24 23:22:19,"The new Aura new business park will soon be home to more than 3,000 new jobs, as Aura grows to become an employment… https://t.co/GNjEQbkNY1",1,http://twitter.com
900591560466644992,2017-08-24 05:32:14,RT @katietoney7: #CALOUNDRA Construction has begun on a $222 million business park at Aura. @Stockland says it'll be home to 3000 new jobs.…,2,http://twitter.com/download/android
900544816307503106,2017-08-24 02:26:30,"We're delivering Aura's business park early, creating a jobs hub that will enable early residents to work near home. https://t.co/xDO9Wc9rEO",0,http://twitter.com
900524613196697604,2017-08-24 01:06:13,"We've started construction on $222 million Aura business park, soon to be home to 3,000+ jobs on the #SunshineCoast… https://t.co/18U25UJMGQ",4,http://twitter.com
900477214889615360,2017-08-23 21:57:52,RT @FinancialReview: @Stockland says property values rise faster in areas where people walk more and drive less. https://t.co/pJZVoeeLUV #a…,4,http://twitter.com/#!/download/ipad
900476980935532544,2017-08-23 21:56:56,Our #Liveability Index provides a model for suburban development as Australian cities increase in density &amp; accommo… https://t.co/ioCw304Ans,3,http://twitter.com/#!/download/ipad
900276164089962496,2017-08-23 08:38:58,Today our CEO &amp; MD Mark Steinert discussed how disruption creates opportunities for our retail town centres at ANRE… https://t.co/SWOG0qPqDF,0,http://twitter.com/#!/download/ipad
899923405956304896,2017-08-22 09:17:14,"RT @SupplySchoolAU: A packed room for this morning's #modernslavery Sydney Forum hosted by @Stockland, with @partner4freedom &amp; @propertycou…",3,http://twitter.com/#!/download/ipad
898026783169167360,2017-08-17 03:40:44,"Early activation of infrastructure will bring forward the delivery of affordable homes, making Mt Atkinson accessib… https://t.co/lagTs819Qj",0,http://twitter.com
897714066592018432,2017-08-16 06:58:06,Our MD &amp; CEO Mark Steinert spoke with @CNBCi about our Residential performance &amp; housing #affordability after today… https://t.co/RNjaV0Xw76,0,http://twitter.com
897695546491756545,2017-08-16 05:44:31,@T_khullar Hi @T_khullar. We don’t yet have a stage 1 release date for Mt Atkinson. We encourage you to register fo… https://t.co/1LtysbxbNa,0,http://twitter.com
897689175402586112,2017-08-16 05:19:12,RT @FinancialReview: @Stockland boss Steinert sees biggest Melbourne boom since gold rush. #Chanticleer @TonyBoydAFR  https://t.co/NEzjLdmZ…,2,http://twitter.com
897642765391187968,2017-08-16 02:14:47,We commence the financial year well placed to meet our goals of sustainable profit growth on a through-the-cycle basis #SGP #Results,0,http://twitter.com
897641320554123265,2017-08-16 02:09:02,"We continue to take a leadership position in housing affordability, delivering a range of options for FHBs and families #SGP #Results",0,http://twitter.com
897639080892260354,2017-08-16 02:00:08,"We sold 6,604 Residential lots in FY17; with 75% to owner occupiers and over 50% of net deposits from first home buyers #SGP #Results",0,http://twitter.com
897637703671590912,2017-08-16 01:54:40,Our Logistics and Business Parks business had an outstanding year. Occupancy has increased to 99% #SGP #Results,0,http://twitter.com
897636755859484674,2017-08-16 01:50:54,We were recognised as a global leader in sustainability by #DJSI #CDP #GRESB and are committed to excellence in this space #SGP #Results,0,http://twitter.com
897635609145204736,2017-08-16 01:46:21,"Our customers provide the foundation of our success, with an average satisfaction score of 82% across our business #SGP #Results",0,http://twitter.com
897634314611019776,2017-08-16 01:41:12,Commercial Property delivered a good performance across all asset classes despite challenging conditions in retail market #SGP #Results,0,http://twitter.com
897633316492464130,2017-08-16 01:37:14,Our Residential and Retirement Living businesses achieved record results #SGP #Results,1,http://twitter.com
897632683089645568,2017-08-16 01:34:43,We’ve delivered another positive performance by reinforcing our position as the leading creator of communities in Australia #SGP #Results,0,http://twitter.com
897612836037423105,2017-08-16 00:15:51,"RT @BusinessDay: Stockland profit jumps on back of growth in residential, retirement businesses #ausbiz @msccummins  https://t.co/cgX7xmAh3e",1,http://twitter.com
897606637388677120,2017-08-15 23:51:13,RT @aus_business: Stockland profit jumps on record residential settlements https://t.co/nPmEAAh8vY by @elizabethredman #ausbiz $SGP,2,http://twitter.com
897595981155319809,2017-08-15 23:08:53,Our FY17 results presentation will be webcast via https://t.co/9Pc1KEHJl7 at 11.30am AEST #SGP #Results https://t.co/1Y9W8zYHQ4,0,http://twitter.com
897595287144878080,2017-08-15 23:06:07,"Stockland delivers strong FY17 performance: Statutory profit $1,195m up 34.4% on FY16; FFO $802m up 8.5% on FY16 https://t.co/sGmua9WDsp",1,http://twitter.com
897587630711242752,2017-08-15 22:35:42,Early activation of infrastructure will bring forward the delivery of affordable homes &amp; make Mt Atkinson accessibl… https://t.co/tUOzZXsOLd,0,http://twitter.com
897282811572310020,2017-08-15 02:24:27,"Victorian Government gives go ahead on Mt. Atkinson community, Melbourne &amp; agreement on early infrastucture deliver… https://t.co/EAyLC6QaT1",1,http://twitter.com
895448203016888320,2017-08-10 00:54:22,We're excited to celebrate the topping out of Stockland Green Hills and stage 2 opening today with dignitaries &amp; th… https://t.co/bUuhwI5hlX,0,http://twitter.com
895446607390416897,2017-08-10 00:48:02,"Stockland Green Hills marks double milestone for $412 million redevelopment, opening Stage 2 &amp; ‘topping out’ today.
https://t.co/dREEhdsm8j",0,http://twitter.com
895435611527462913,2017-08-10 00:04:20,"RT @gbcaus: It pays to have walkable communities, says @Stockland's Mark Steinert and 6 Star Green Star rated Aura is proof: https://t.co/2…",4,http://twitter.com
895409055480430592,2017-08-09 22:18:49,"""Liveability is something we must continue to measure and improve"": MD &amp; CEO Mark Steinert shares lessons for citie… https://t.co/t7LYpMfbqF",4,http://twitter.com
894851916139601920,2017-08-08 09:24:57,RT @Committee4Syd: Chris: cities are moving back to the future - walkable urban environments. https://t.co/Q3dHrNTZyF,4,http://twitter.com/download/iphone
894847418491060226,2017-08-08 09:07:04,"Mark Steinert: unlocking greater density in the suburbs, including townhouses is critical for creating affordability for first home buyers",0,http://twitter.com/download/iphone
894843470572961793,2017-08-08 08:51:23,Mark Steinert: Obesity set to cost the economy over $87 billion in the coming decade - #walkable communities vital to health &amp; wellbeing.,0,http://twitter.com/download/iphone
894841227413078016,2017-08-08 08:42:28,"Mark Steinert joins a panel discussion on #walkable neighbourhoods with @LucyTurnbullGSC, Mike Day,… https://t.co/oGLDR3XDx7",3,http://twitter.com/download/iphone
894834638287282176,2017-08-08 08:16:17,RT @steinem6: Walkability creates 2-3x jobs within close proximity delivering social equity due to low cost commute https://t.co/aSKea9qAgi,1,http://twitter.com/download/iphone
894831327173681152,2017-08-08 08:03:08,"RT @Committee4Syd: @ChrisLeinberger is visiting Australia as a guest of the Committee for Sydney, with help from our colleagues at @Stockla…",3,http://twitter.com/download/iphone
894831300246347779,2017-08-08 08:03:01,"Our CEO Mark Steinert: ""Liveable communities are well designed, deliver amenity and infrastructure early for health… https://t.co/DrsxBke7n5",3,http://twitter.com/download/iphone
894830422831415296,2017-08-08 07:59:32,Our CEO Mark Steinert welcomes guests to @Committee4Syd keynote with @ChrisLeinberger on #walkability; launches our… https://t.co/jliG17J0q3,1,http://twitter.com/download/iphone
894362165779456000,2017-08-07 00:58:51,"Dr Tim Williams CEO @Committee4Syd on tour at Balgowlah community: ""This is a classic development that should be em… https://t.co/R56bR3P7xx",1,http://twitter.com/download/iphone
