Tweet id,Created Time,Tweet Details,Retweet counts,Source URL
923059051885355008,2017-10-25 05:30:02,"Toxfree is currently working on a number of high profile projects across Hunter. Read the article @hunterheadline.
https://t.co/lfujTlknml",0,http://twitter.com
922953028092575744,2017-10-24 22:28:44,Toxfree and PTES joined the Care For Hedland volunteers answer questions about how to recycle in Port Hedland. https://t.co/gGVozJid88,0,http://twitter.com
922610671098851328,2017-10-23 23:48:19,Drone footage from the team in Karratha - Heavy Vacs removing ballasts from a bridge in the Pilbara. View the video  https://t.co/2P338vBIXi,0,http://twitter.com
921500025334714369,2017-10-20 22:15:01,"Drop off your household chemical wastes for free at Bicentennial Reserve Park in Willoughby, NSW Saturday and Sunday 9am until 3:30pm.",0,http://sproutsocial.com
921273533157773312,2017-10-20 07:15:01,"Drop off your household chemical wastes for free at Bicentennial Reserve Park in Willoughby, NSW Saturday and Sunday 9am until 3:30pm.",0,http://sproutsocial.com
921204140935561218,2017-10-20 02:39:17,Toxfree’s Daniel Montalto discusses the company’s newly established collection services in NSW and Victoria https://t.co/jbdHvn1TFh,0,http://twitter.com
919113801273708546,2017-10-14 08:13:01,"Drop off your household chemical wastes for free at Rooty Hill Works Depot in Rooty Hill, NSW Sunday 9am until 3:30pm.",0,http://sproutsocial.com
918729266610585600,2017-10-13 06:45:00,"Drop off your household chemical wastes for free at Cintra Park car park in Canada Bay, NSW Saturday 9am until 3:30pm.",1,http://sproutsocial.com
916198087466606593,2017-10-06 07:07:00,Drop off your household chemical wastes for free at Hurtsville Council Works Depot in Mortdale Sat and Sun - 9am until 3:30pm,2,http://sproutsocial.com
913219079657316353,2017-09-28 01:49:30,Who will win the AFL Grand Final?,0,http://twitter.com
912529837889249280,2017-09-26 04:10:41,Toxfree is looking for an experienced sales person to join our sales team in Sydney as a Major Account Manager. https://t.co/7lOOttRFyo,0,http://twitter.com
908589959958933504,2017-09-15 07:15:01,Drop off your household chemical wastes for free at Gosford Showground car park in Gosford 9am until 3:30pm Sat and Sun,0,http://sproutsocial.com
908589707411501056,2017-09-15 07:14:01,"Drop off your household chemical wastes for free at Bellingara Netball Centre car park in Miranda, NSW 9am until 3:30pm Sat-Mon",0,http://sproutsocial.com
906048210615054336,2017-09-08 06:55:01,"Drop off your household chemical wastes tomorrow for free at Heffron Park in Matraville, NSW 9am until 3:30pm.",0,http://sproutsocial.com
905242015717220353,2017-09-06 01:31:29,Toxfree is at the WIOA expo in Bendigo today and tomorrow. Stop by booth 160 to find out more about our services.,1,http://twitter.com
902730894665854976,2017-08-30 03:13:11,Toxfree has released the 2017 Annual Report. https://t.co/3SIVDnthFl,0,http://twitter.com
900521318478565376,2017-08-24 00:53:07,The Toxfree team @AWREexpo today! Drop by Stand B47 to find out more about our services. https://t.co/3VVyeWU9if,2,http://twitter.com
899795946673913856,2017-08-22 00:50:45,Toxfree will be @AWREexpo 23-24th August. Drop by stand B47 to find out more about our Waste Services!,1,http://twitter.com
899794314422648832,2017-08-22 00:44:16,Toxfree has been recognized as an ABA 100 winner in the Australian Business Awards 2017 for Project Management. https://t.co/9Hag8NP2M2,1,http://twitter.com
898398559380185088,2017-08-18 04:18:02,We've launched the NEW Toxfree website. Check it out! https://t.co/Ml1bmoki1Y,0,http://twitter.com
895861753833152512,2017-08-11 04:17:41,Penrith’s Community Recycling Centre is open! https://t.co/lsqh4FqNzu,2,http://twitter.com
895845384504852480,2017-08-11 03:12:38,"Penrith’s Community Recycling Centre is open and taking waste items including paints, oils, gas bottles, e-waste, fluoro tubes and batteries",1,http://twitter.com
892200689727750144,2017-08-01 01:49:55,Toxfree’s Christie St facility welcomes its new addition --The semi-trailer will primarily be used to service Commu… https://t.co/im5zs6jXjb,1,http://twitter.com
891883411563872256,2017-07-31 04:49:10,Toxfree Community Recycling Center at Charles street is a drop-off location for disposing of child car seats.  https://t.co/sgc1w7G26j,3,http://twitter.com
885277677417930752,2017-07-12 23:20:20,First stop today on the @drumMUSTER &amp; @ChemClear agricultural chemical collection at the Wamuran Recycling Centre i… https://t.co/jJnjG5dmg5,1,http://twitter.com
884939081267912704,2017-07-12 00:54:53,First stop today on the @drum_MUSTER road trip at Buderim Resource Recovery Centre. https://t.co/oHz3Gs9cpI,0,http://twitter.com
884938761557102592,2017-07-12 00:53:36,"RT @drum_MUSTER: The long list of obsolete chemicals being delivered to ChemClear, Buderim QLD https://t.co/7KF7Hz9G4t",2,http://twitter.com
884902920692441088,2017-07-11 22:31:11,"Off to catch up with #ChemClear run today.  Our truck is travelling 11,000kms across QLD and safely collecting 38t… https://t.co/r9dGKJQCxz",1,http://twitter.com
875583412634927104,2017-06-16 05:18:47,Check out the article in the June edition of the WMR Magazine about our investments in state of the art technologies.https://t.co/tVL09colpQ,1,http://twitter.com
875185462020775937,2017-06-15 02:57:28,Read about the HazPak MKII https://t.co/6rFKefChmf,1,http://twitter.com
875185303421566976,2017-06-15 02:56:51,Toxfree has made a multi-million $ investment at our St Marys facility on new technologies and is excited to launch… https://t.co/IwgJwSbxun,1,http://twitter.com
869402714551103489,2017-05-30 03:58:54,Our newly branded non-destructive digging @VolvoTrucks  out on site! https://t.co/ZmQVSlv66h,1,http://twitter.com
865409025680080896,2017-05-19 03:29:24,Toxfree is excited to be supporting House Rules on @SevenNetwork. We removed over 180 tonnes of waste in the Gold C… https://t.co/dGUvurxkCy,0,http://twitter.com
859274437425741824,2017-05-02 05:12:45,Toxfree will be at Stand 12 at the 2017 Coffs Harbour @WasteConference. Stop by to find out more about our services! https://t.co/o8VOMQe8dK,0,http://twitter.com
857809533820743681,2017-04-28 04:11:44,Toxfree is pleased to announce we've been awarded 2 @GlencoreAus Coal Assets Australia sites in the NSW Total Waste MGMT Umbrella Agreement,0,http://twitter.com
855268462133784577,2017-04-21 03:54:26,Toxfree is proud to sponsor the Western Force in their first home game of the season against the Reds. https://t.co/xqpi078xbW,0,http://twitter.com
852384995645595648,2017-04-13 04:56:34,"Toxfree is hiring!
Operator – TES – Fulltime 
Kalgoorlie, WA
https://t.co/axEG0vQbVo",0,http://twitter.com
847643305806397443,2017-03-31 02:54:47,Renaye Burns and Kris Fidler from the Broome site delivered a presentation on recyclable waste to students at Broom… https://t.co/9MjUtf4F5F,0,http://twitter.com
842573630668120064,2017-03-17 03:09:42,"Toxfree will be at Fleetwood Primary School Fair on Saturday, March 19. Bring your E-waste for free and secure dest… https://t.co/B18vIaLP3R",1,http://twitter.com
841881794005893121,2017-03-15 05:20:35,"Take a look at this new video on CFC Recycling and the Plascon Process.
https://t.co/cSsImO0xdd",1,http://twitter.com
834253428230549504,2017-02-22 04:08:11,"Come see us at AOG, we're here til Friday. Booth H14! #AOG2017 https://t.co/AAS6xXUNmQ",0,http://twitter.com
834228854742855680,2017-02-22 02:30:32,Toxfree is exhibiting at stand H14 @AOG_expo https://t.co/KN7nqC905w,0,https://mobile.twitter.com
809612083520151552,2016-12-16 04:12:17,Our paint recycling technology is helping Australia recycle thousands of tonnes of paint and packaging every year.… https://t.co/H8PZ3jhp7f,0,http://twitter.com
809270606331973632,2016-12-15 05:35:22,Throwback to September when our Human Resources team were nominated for an Australian HR award… and we won! #tbt https://t.co/nl9JKbV99s,0,http://twitter.com
808906232346054656,2016-12-14 05:27:29,The team with @ScorchersBBL coach Justin Langer at the WA Festival of Cricket. Warming up for our coach partnership… https://t.co/4DfnSXgvat,1,http://twitter.com
808542161071284225,2016-12-13 05:20:47,In June we reported that since 2013 we had raised over $89k for the @RoyalFlyingDoc .The number continues to rise a… https://t.co/T8EloeXWOu,0,http://twitter.com
806732573795753984,2016-12-08 05:30:08,Our first 2016 highlight comes from March when we acquired #waste and #recycling company Worth. Welcome to the fami… https://t.co/7vrB8NcmUC,0,http://twitter.com
806732111008833536,2016-12-08 05:28:18,During December we will be looking back at some of our highlights from 2016! #tbt #yearinreview,0,http://twitter.com
805652079712681984,2016-12-05 05:56:38,". #cleaning services include; vessel and tank cleaning, scaffolding and high pressure cleaning",0,http://twitter.com
805651570943606788,2016-12-05 05:54:37,"We have been awarded a 3-year contract for GLNG upstream operations for provision of #wastemanagement, #industrialservices and #cleaning!",0,http://twitter.com
804550840870522882,2016-12-02 05:00:42,The Stop! Look! Wave! classroom initiative is helping children across Australia. Find out how to get involved here… https://t.co/ETsHDVT8CL,0,http://twitter.com
804443012273012736,2016-12-01 21:52:14,RT @EEON_Victoria: Last year Indigenous Toxfree employees increased by 100% bringing  Indigenous employees to 4.5% of total workforce. http…,4,https://about.twitter.com/products/tweetdeck
804196715465056257,2016-12-01 05:33:32,"Toxfree, in partnership with @VolvoTrucks  rolled out a classroom #safety campaign this year. Read more here –… https://t.co/AV07Fkv1cU",0,http://twitter.com
803410852564975617,2016-11-29 01:30:48,Toxfree has been awarded a 5 year contract with the INPEX - led Ichthys LNG Project to provide waste management ser… https://t.co/5OG6cjmThV,1,http://twitter.com
803082080791867394,2016-11-28 03:44:23,Read more on Northparkes' @WhiteRibbonAust accreditation via @miningnews - https://t.co/ef4e0rixsB #whiteribbonday2016,0,http://twitter.com
803080830746660864,2016-11-28 03:39:25,Pilbara Toxfree Environmental Solutions congratulate Northparkes - the first Australian mine to achieve… https://t.co/McONLFb5lq,0,http://twitter.com
801967439785267200,2016-11-25 01:55:12,Our e-waste #recycling machine helps us recover more e-waste from products than ever before -… https://t.co/1esonIAvPF,0,http://twitter.com
801546886351974400,2016-11-23 22:04:04,"It is our pleasure, have fun! https://t.co/8ijuA1CS9M",1,http://twitter.com
801298353753653249,2016-11-23 05:36:29,Toxfree's cutting edge e-waste #recycling machine. Learn more - https://t.co/5PNtvjtB5D https://t.co/IVJLtT306T,0,http://twitter.com
800867949313560576,2016-11-22 01:06:13,How does our e-waste #recycling machine work? All is explained here. For more information check out our blog -… https://t.co/uTZ64sRdci,0,http://twitter.com
800531027919671296,2016-11-21 02:47:24,"Check out Hobart's newest recycling experts hard at work at the 'Kids I Am' event, where children learn't the impor… https://t.co/r2q7ArWw3P",1,http://twitter.com
799490178318561280,2016-11-18 05:51:26,"Watch our e-waste #recycling machine in action, and learn more about the importance of e-waste recycling solutions 
https://t.co/1QwMjiI62C",2,http://twitter.com
799455523871432704,2016-11-18 03:33:44,Toxfree are leaders in e-waste #recycling. Read about our new BluBox #e-waste recycling machine here -… https://t.co/8hjjJk7K1W,0,http://twitter.com
796151905776857088,2016-11-09 00:46:20,RT @IWCouncil: FREE #ewaste drop off day 2MORROW https://t.co/9toqbiOUzt  @Toxfree_AUS @InfoactivGroup @NSW_EPA https://t.co/ANZDoZsbYE,4,http://twitter.com
791158781933748225,2016-10-26 06:05:27,Toxfree are very excited to announce the strategic acquisition of Daniels Health Australia.Further details… https://t.co/6KkPmEviuE,1,http://twitter.com
786722401643921409,2016-10-14 00:16:51,"RT @AgsafeOz: ChemClear congratulates @Toxfree_AUS on their Stop Look Wave Campaign in conjunction with Volvo. @drum_MUSTER 

https://t.co/…",3,http://twitter.com
783098250207166464,2016-10-04 00:15:46,Check out our new video about e-waste recycling: https://t.co/1QwMjiZGUa via @YouTube #ewaste #recycling,1,http://twitter.com
782702753772470272,2016-10-02 22:04:13,Toxfree Joins As Coaches Partner https://t.co/mteQuliSqF,0,http://twitter.com
780206609691586560,2016-09-26 00:45:25,"Toxfree delivered Stop Look Wave training to Launceston Church Grammar School last week, read all about it here: https://t.co/MTYFpFLFrZ",0,http://twitter.com
778463032020045825,2016-09-21 05:17:04,RT @MobileMuster1: Great game for the #schoolholidays to learn about #recycling mobile phones https://t.co/Za9rHFEpoR @recyclerescue https:…,3,http://twitter.com
778094433288028160,2016-09-20 04:52:23,"RT @HRDAustralia: Congrats to #AusHRAwards @SagecoHQ Best Workplace Diversity &amp; Inclusion Program winner: @toxfree_aus
More here- https://t…",1,http://twitter.com
775094573420810240,2016-09-11 22:12:01,RT @HRDAustralia: The @SagecoHQ Best Workplace Diversity &amp; Inclusion Program award goes to... @toxfree_aus. Congratulations!  #AusHRAwards,2,http://twitter.com
770432074746474496,2016-08-30 01:24:55,RT @AgsafeOz: The guys @Toxfree_AUS giving an overview of the partnership with ChemClear and general approach to waste. Good work! https://…,1,http://twitter.com
768297712563257344,2016-08-24 04:03:43,RT @atnmag: @Toxfree_AUS teams up with @VolvoTrucks for its Stop Look Wave safety campaign https://t.co/E0DDCbNNrr,1,http://twitter.com
766114933905825793,2016-08-18 03:30:08,RT @drum_MUSTER: Congratulations to Rita Thompson for being the July QUEST Leader. The voice of ChemClear. Brilliant! @Toxfree_AUS https://…,1,http://twitter.com
763955152340385792,2016-08-12 04:27:56,Toxfree has been recognised as an ABA100 Winner for Human Resource Management in The Australia Business Awards 2016. https://t.co/n2Do5sWowq,1,http://twitter.com
761363862834655232,2016-08-05 00:51:05,We are very proud to be finalists in the @SagecoHQ awards for Best Workplace Diversity &amp; Inclusions Program! https://t.co/UrepGveSSK,0,http://twitter.com
757713220018798592,2016-07-25 23:04:43,How do we #recycle e-waste at Toxfree? Read about it here: https://t.co/WitHxqsUlH,1,http://twitter.com
755283621167046656,2016-07-19 06:10:22,RT @drum_MUSTER: ChemClear arrives back in Melbourne after a 4 week WA collection. A great job done by the Toxfree team. https://t.co/KS2Id…,2,http://twitter.com
753748386138816512,2016-07-15 00:29:53,A great statistic by @TechCollect! Don't forget that your electronic waste is just as important to recycle! https://t.co/PoMQueh4o6,2,http://twitter.com
744740006695047168,2016-06-20 03:53:48,Toxfree are working with @drum_MUSTER and #ChemClear at the ALGA conference in Canberra today! @AgsafeOz https://t.co/eRelVJGMmM,1,http://twitter.com
728092081105723392,2016-05-05 05:20:54,"RT @PeterVoorhoeve: Volvo trucks launched Stop, Look, Wave campaign with Toxfree today. For safety of our children. https://t.co/T90VFg6wnF",7,http://twitter.com
722301865438744576,2016-04-19 05:52:39,"Last Monday our MD Steve Gostlow spoke to ABC 720 Drive in Perth about #waste, listen here: https://t.co/MdMayA37am",0,http://twitter.com
721839332760289280,2016-04-17 23:14:42,Read our latest #blog post on @Clean_Up here: https://t.co/GEOUylebNl,0,http://twitter.com
721837240452665344,2016-04-17 23:06:23,Clean Up Australia Day 2016 https://t.co/sSBZwCwNDw https://t.co/9bpV7KxcEg,0,http://publicize.wp.com/
719364357935599616,2016-04-11 03:20:02,"Don't forget to register for #APPEA2016. Toxfree are proud to be exhibiting again this year, see us on stand 132! https://t.co/USkbgZY7Vu",0,http://twitter.com
717567086248140802,2016-04-06 04:18:19,@Schrinner thanks for making us aware of this issue Adrian! We will have the truck checked over asap so it does not happen again.,0,http://twitter.com
714946755025117184,2016-03-29 22:46:04,"The new Toxfree RAP has officially been launched, read more here: https://t.co/iLqX3eAabU #Indigenous #Reconciliation",0,http://twitter.com
714944750130896896,2016-03-29 22:38:06,Supporting Indigenous Communities https://t.co/uENAZv0YL0 https://t.co/tfWbFztYit,0,http://publicize.wp.com/
705171207264415744,2016-03-02 23:21:31,Check out this video by @Caromarshall1  https://t.co/FdIhzKvJm4,0,http://twitter.com
704793493789679620,2016-03-01 22:20:38,@Caromarshall1 This is a great video! Thanks for sharing :),0,http://twitter.com
702357048458141697,2016-02-24 04:59:04,"We are excited to be exhibiting at AOG again this year, if you are around say hi to us on stand S1. https://t.co/WdjWCWy9ev",0,http://twitter.com
702244429743022080,2016-02-23 21:31:33,RT @MINE_Magazine: @Toxfree_AUS to provide waste management services for BHP’s Olympic Dam mine: https://t.co/yNMRdGAzYl https://t.co/4ZbPt…,1,http://twitter.com
699832181665824768,2016-02-17 05:46:09,"If you're in WA and have unwanted chemicals, don't forget to register with ChemClear!  https://t.co/mRCLooP8JS",0,http://twitter.com
699069171615707137,2016-02-15 03:14:13,"A great example of material reuse by @PerthZoo with some unused fire hose, read more here: https://t.co/18cuHP2CAi https://t.co/8Kaj7PQhI2",0,http://twitter.com
696876152028160000,2016-02-09 01:59:56,ChemClear has completed its largest collection in Victoria! Great job team! @AgsafeOz @drum_MUSTER  https://t.co/lQEPbNr6UH,1,http://twitter.com
690288111176126464,2016-01-21 21:41:25,Read about our partnership with Penrith City Council and the new #CRC in @RRbizAus https://t.co/BuFzHjfvQZ,1,http://twitter.com
690286751613476864,2016-01-21 21:36:01,"RT @StanKrpan: @LisanevilleMP launching Australian 1st ewaste processing ""BluBox"" tech  @pgm refining @Toxfree_AUS @SustainVic https://t.co…",2,http://twitter.com
676872949291352064,2015-12-15 21:14:21,News Story: New place to drop off awkward waste https://t.co/SD5QMJ1ADa via @stmarysstar,1,http://twitter.com
659546793277919233,2015-10-29 01:46:23,"RT @AgsafeOz: Register your Dichlorvos products with ChemClear

https://t.co/ZEED9Ym5Cf https://t.co/Belb1rHuOs",1,http://twitter.com
655951838152232960,2015-10-19 03:41:19,"Toxfree recently innovated with #underwater high pressure water blasting, read the blog here: http://t.co/e8BcKMXL0C",1,http://twitter.com
655861906872205312,2015-10-18 21:43:58,Congrats to Toxfree's Kathy Hirschfeld for being included as one of @FinancialReview #100WOI! Read more here: http://t.co/Xb4gp4sWpB,0,http://twitter.com
653790988255625216,2015-10-13 04:34:53,Did you see us in the Oct/Nov edition of #SustainabilityMatters? http://t.co/kQM5rNBImU  @wf_sustain http://t.co/csSwJlg0cz,1,http://twitter.com
646927436534312960,2015-09-24 06:01:34,"We are in the latest edition of National Resources Review, take a look here: http://t.co/iBcBcQGrwO #nationalresourcesreview",0,http://twitter.com
646487136053542912,2015-09-23 00:51:59,"@Toxfree_AUS will be exhibiting at the National Works and Engineering Conference from tomorrow in Bendigo, pop in and say hi! #MWOA #NWEC15",0,http://twitter.com
646108817864855552,2015-09-21 23:48:40,Congratulations to ChemClear for their milestone collection!  https://t.co/iYsdbVF2tX,1,http://twitter.com
643986879323336708,2015-09-16 03:16:51,Are you living in a #toxic environment? Check out our latest blog: http://t.co/ZOPsSvUWRc,2,http://twitter.com
639686194310197248,2015-09-04 06:27:28,Toxfree are proud to be one of these organisations! #reconciliation  https://t.co/0rwOmiUI8h,0,http://twitter.com
639611360838422528,2015-09-04 01:30:06,"#ChemClear will be collecting unwanted chemicals in VIC, register now!  https://t.co/unh735C74i",0,http://twitter.com
639234866064719873,2015-09-03 00:34:03,RT @austbizawards: #Toxfree recognised for #Innovation:  http://t.co/iW4Rj6tKkd  #australianbusinessawards #aba100 #2015 http://t.co/HPiiC8…,2,http://twitter.com
639205998280998912,2015-09-02 22:39:20,"ChemClear will be providing the free collection of Fenthion products, don't forget to register before 2017! https://t.co/Vulj6zK7l8",1,http://twitter.com
637058131206402049,2015-08-28 00:24:29,@Toxfree_AUS are introducing #RFID tracking to bins in #Broome. @RRbizAus http://t.co/51qjIERJin,0,http://twitter.com
636383027841466369,2015-08-26 03:41:51,"#ChemClear has completed its second largest collection of unwanted chemicals in QLD, well done team! http://t.co/XvPrV71pFG @AgsafeOz",1,http://twitter.com
636348003511439360,2015-08-26 01:22:41,We are looking forward to #WIOA in Bendigo next week. Visit us on stand 158 and say hi! @WIOAAustralia,1,http://twitter.com
634612832215044096,2015-08-21 06:27:44,@Toxfree_AUS are proud to introduce #RFID bin tracking to #Broome collections. https://t.co/EGXw0q5GVx,0,http://twitter.com
634256742495350784,2015-08-20 06:52:45,"RT @AgsafeOz: Irresponsible disposal is both costly and harmful!

http://t.co/6bZkMX9vIG http://t.co/cERMigeW7r",5,http://twitter.com
633777051946758144,2015-08-18 23:06:38,"Our #aba100 #innovation award is featured in National Resources Review, take a look here: http://t.co/4S0lbmpfxW #australianbusinessawards",1,http://twitter.com
633066540548489216,2015-08-17 00:03:19,@TrainRightAust it was our pleasure!,0,http://twitter.com
632048364171866112,2015-08-14 04:37:27,"@Toxfree_AUS has been recognised as an #aba100 winner for #innovation!
Read about it here: http://t.co/evAkMR8iAD #australianbusinessawards",1,http://twitter.com
632029566987440128,2015-08-14 03:22:45,"RT @austbizawards: 2015 #australianbusinessawards #aba100 #innovation #businessaward #winners announced!
http://t.co/qk4ILRzEuV http://t.co…",6,http://twitter.com
631305397329002496,2015-08-12 03:25:10,"@Toxfree_AUS and @AgsafeOz have a special relationship involving #ChemClear initiative, read more in our latest blog: http://t.co/WNi6jVmb3l",0,http://twitter.com
630915955632148480,2015-08-11 01:37:40,@drum_MUSTER Great job team!  https://t.co/f6oddRuQwP,0,http://twitter.com
630883159995846656,2015-08-10 23:27:21,@Toxfree_AUS helps to protect #Sydney landfills and waterways from #hazardous #chemicals read about it here: http://t.co/d8zS3efmQE,0,http://twitter.com
628728062813667328,2015-08-05 00:43:46,Check out @Toxfree_AUS in issue 12 of the Australasian Mining Review: http://t.co/eBxp9UQ5si you will find us on pages 4-5!,0,http://twitter.com
628078215832014848,2015-08-03 05:41:30,@AgsafeOz A great read team! https://t.co/XIqKrUpXHb,0,http://twitter.com
624369711996882944,2015-07-24 00:05:14,Toxfree are proudly on the front cover and pages 12-13 of the July National Resources Review! Read it online here: http://t.co/JwF9ApC9l4,1,http://twitter.com
623671405842804736,2015-07-22 01:50:25,Need some help making your #office more #sustainable? Read our top 10 tips here: http://t.co/t3w5Toji9u,0,http://twitter.com
620397737209507840,2015-07-13 01:02:01,RT @RecAustralia: Congratulations to all the NAIDOC Award winners for being recognised at the National NAIDOC Awards Ceremony on the weeken…,12,http://twitter.com
618667471017414656,2015-07-08 06:26:34,@Alunfiggy Excellent Timing!,0,http://twitter.com
618623713559187457,2015-07-08 03:32:41,Check out the July edition of The Australian Oil &amp; Gas Review for an editorial on @Toxfree_AUS #oilandgas http://t.co/xP6oma7TGW,0,http://twitter.com
618277529229508608,2015-07-07 04:37:04,"RT @RecAustralia: Right now it’s time to celebrate National #NAIDOCWeek, held every year at the start of July http://t.co/7xWMyD6q5e #NAIDO…",45,http://twitter.com
617824504060837888,2015-07-05 22:36:55,RT @RecAustralia: Lovely Welcome from Aunty Agnes. #standonsacredground #NAIDOC2015 #IndigenousX http://t.co/yMftSMlbZd,4,http://twitter.com
616777665064759297,2015-07-03 01:17:09,Looking good Chas! https://t.co/QzZDQ5vaE3,0,http://twitter.com
616415386167152640,2015-07-02 01:17:35,Toxfree is proudly sponsoring the upcoming #NAIDOCWeek events! We will see you at the opening ceremony Sunday! @RecAustralia @NAIDOCPerth,0,http://twitter.com
613142617526702080,2015-06-23 00:32:46,@AgsafeOz Great job team!  https://t.co/QOiGHffM7e,0,http://twitter.com
612764713181556736,2015-06-21 23:31:06,"@AceDrainClean it sure will be! It's for works between our Wodonga and Shepparton operations, but lives in the Wodonga Depot.",0,http://twitter.com
612760636179640320,2015-06-21 23:14:54,"@AceDrainClean Yes it's a new Rivard Combination Unit. Great photo, thanks for sharing!  https://t.co/VobXfzpOqZ",0,http://twitter.com
610697989154181120,2015-06-16 06:38:41,RT @HouseRulesOn7: Don't miss tomorrow's epic night of reveals AND elimination! It's going to be a BIG night on #HouseRules on Seven!,6,http://twitter.com
610279822250487808,2015-06-15 02:57:02,We interviewed Errol Beere and Rick Bryant about their involvement in the Abrolhos Islands’ clean-up. Read it here: http://t.co/cZwpMK30BC,0,http://twitter.com
604144687935442944,2015-05-29 04:38:12,How amazing is this photo! It is of rubbish collected during the Abrolhos Islands clean-up. Captured by Rick Bryant. http://t.co/oaS7EH6rWi,0,http://twitter.com
603395083522572288,2015-05-27 02:59:33,Check out our latest video showing how @Toxfree_AUS cleaned a heat exchanger with high pressure water blasting! https://t.co/dF349u9r2h,0,http://twitter.com
600789199445303296,2015-05-19 22:24:41,Toxfree supports the clean up of the Abrolhos Islands for the largest clean-up in islands' history. http://t.co/xnsAZgKo7O,0,http://twitter.com
600777643705769984,2015-05-19 21:38:46,Today is our last day at @APPEACONFERENCE visit Toxfree on stand 55 for your chance to win an iPad mini! #APPEA2015,1,http://twitter.com
