Tweet id,Created Time,Tweet Details,Retweet counts,Source URL
925060004289400832,2017-10-30 18:01:06,"Congratulations Kitty Ge, recipient of the CBFCA Student of the Year Award! https://t.co/5h0F6bftUO",0,http://www.hootsuite.com
925011468327714821,2017-10-30 14:48:14,"ICYMI, Richard White spoke this weekend at CBFCA about leveraging automation and surviving the age of the machine. https://t.co/OUV5CtVcd6",0,http://www.hootsuite.com
923719593662861314,2017-10-27 01:14:47,Great start to CBFCA conference! There's a buzz about latest dev announcements we made to brokers here. See us at b… https://t.co/iwOfiB2KUq,0,http://www.hootsuite.com
923383040604295168,2017-10-26 02:57:27,"Accelerating your business starts with your standard operating procedures, says WiseTech CPO James Powell. https://t.co/bkgyl2WOMU",0,http://www.hootsuite.com
922715554909249537,2017-10-24 06:45:06,Well done Coogee Public School on its first STEAM day! Thanks for your help building solar lights to help families… https://t.co/ZHXMxpdEN7,1,http://www.hootsuite.com
922572132919296000,2017-10-23 21:15:11,Don't miss Richard White speaking at the CBFCA National Conference this Sat on leveraging technology and automation… https://t.co/lRsCIbGMdq,1,http://www.hootsuite.com
921262233061134336,2017-10-20 06:30:07,"Come say hi at Intermodal Africa, 22-23 Oct. Hear Nachi Mendelow on digital disruption or drop by booth 17. https://t.co/JbJi7G5etH",0,http://www.hootsuite.com
921156549359390722,2017-10-19 23:30:10,Woodland Management has integrated its warehouse and back-of-house operations to create a strong base for growth. https://t.co/It9oISOd0y,0,http://www.hootsuite.com
920461978338021378,2017-10-18 01:30:11,Join Richard White and the team next week at the CBFCA National Conference in the Gold Coast https://t.co/nB5ZjD8juy,0,http://www.hootsuite.com
919693137022513152,2017-10-15 22:35:05,"If you caught Keith Plummer at the team at the @nap_live 2nd OPENAP Global Meeting and want to chat, get in touch.… https://t.co/QIA2daaRTF",0,http://www.hootsuite.com
918706639821144066,2017-10-13 05:15:06,Thanks to @XLPNetwork for having us at their 2017 AGM! Get in touch to follow up on anything you heard from Martin… https://t.co/3jUVzSKmZe,0,http://www.hootsuite.com
918623650303172608,2017-10-12 23:45:20,RT @AFRLeadership: Congrats Richard White of @WiseTechGlobal one of 21 extraordinary Aussies on #BossTrueLeaders list. @YolandaRedrup https…,4,http://www.hootsuite.com
916329721159405568,2017-10-06 15:50:04,That's a wrap! Our Partner Conference for 2017 has come to a close. See you all next year! https://t.co/YTo3lvnZYr,0,http://www.hootsuite.com
915875478413692928,2017-10-05 09:45:04,"If you're coming to California this month for @wesccon, make sure you drop by booth 12 and say hello. https://t.co/72kKbJzwHq",1,http://www.hootsuite.com
915585555945140225,2017-10-04 14:33:01,We've kicked off our 2017 Partner Conference at the Intercontinental in Frankfurt. 50 partners across 4 channels fr… https://t.co/b4KJ7ebKoS,0,http://www.hootsuite.com
913192803542425602,2017-09-28 00:05:05,Our CEO Richard White spoke to a visiting group from @csesoc  at our Sydney tech hub yesterday. Thnx to all the stu… https://t.co/zyj5PetcAF,0,http://www.hootsuite.com
912145896401448960,2017-09-25 02:45:03,Don't forget to book a 1-to-1 meeting if you're joining us in Malaysia next week at The Freight Summit. https://t.co/TE7fpQI33Z,0,http://www.hootsuite.com
910984509394481152,2017-09-21 21:50:06,We'll be at @wesccon next month and Craig Seelig will be on a panel discussing PGA pitfalls under ACE. Full program https://t.co/72kKbJzwHq,0,http://www.hootsuite.com
910266024112640000,2017-09-19 22:15:06,Book your 1-to-1 meeting with a WTG representative now for The Freight Summit in Malaysia next month. https://t.co/sAmVOvsE1W,0,http://www.hootsuite.com
910004493588320256,2017-09-19 04:55:52,RT @SouthSydneyHigh: Ty @WiseTechGlobal for the Industry Visit. Code Club Ss were highly engaged writing algorithms to sort @Pokemon into t…,2,http://www.hootsuite.com
907432345116037126,2017-09-12 02:35:05,Thanks to the first year CompSci and SoftwareEng students from the @UNSWCoop Program that visited yesterday! See so… https://t.co/ZkAsldTsLA,0,http://www.hootsuite.com
903392135193485314,2017-08-31 23:00:43,We have had a great first Productivity at Lunch event in the UK and have a few spaces left at our events in the US! https://t.co/fnGfzWAorn,0,http://www.hootsuite.com
903176801463218176,2017-08-31 08:45:04,World Exchange is a family business using tech and local partners to build on generations of customs experience. https://t.co/tsS27tGkCw,0,http://www.hootsuite.com
903137281372028929,2017-08-31 06:08:02,Proud to support young innovators at @theiAwards  https://t.co/IqHBtpOMam,3,http://www.hootsuite.com
903136810448146432,2017-08-31 06:06:09,"RT @CommSec: [VIDEO] Executive Series: @WiseTechGlobal Founder &amp; CEO, Richard White discusses $WTC's results https://t.co/PbWtM01MTh #OzEar…",1,http://www.hootsuite.com
900623733962010624,2017-08-24 07:40:05,Thanks to @ExpoLogColombia and Americas Alliance for a great few days in Bogota. If you have anything you want to f… https://t.co/EgjU63sCp6,0,http://www.hootsuite.com
899726612576514048,2017-08-21 20:15:15,Only a few spots left for our Productivity at Lunch sessions! Don't miss out. https://t.co/qTNT28Iik9,0,http://www.hootsuite.com
897281705844908032,2017-08-15 02:20:04,How @merzarioltd went from strength to strength through a focus on customers and technology https://t.co/jbrnGGJ248,0,http://www.hootsuite.com
895471019691003905,2017-08-10 02:25:02,Studying at @westernsydneyu? Come say hi at the Tech Careers Expo and find out about what it's like to work here. https://t.co/ClwSzOBDps,1,http://www.hootsuite.com
895291155650359297,2017-08-09 14:30:19,"Watch this video to see what our Productivity at Lunch events are all about. Register now on our website!
https://t.co/FrPh9WnIiY",0,http://www.hootsuite.com
894744995772551168,2017-08-08 02:20:05,Visit us at booth 709 next week at @ExpoLogColombia in Bogota. https://t.co/a4GgeVjUte,0,http://www.hootsuite.com
893237621622702080,2017-08-03 22:30:19,Air &amp; Surface is committed to providing the human touch. CargoWise One provides the tools to deliver on that promise https://t.co/361s0LaeRK,0,http://www.hootsuite.com
892509011500838913,2017-08-01 22:15:05,".@UNSW, @UTSEngage, and @UOW – we'll be on your campuses this month. Want to prepare? Visit https://t.co/mye2Drj5bi to see what we can offer",1,http://www.hootsuite.com
891984415894765568,2017-07-31 11:30:31,Attention US and UK customers - our WiseService Partners are hosting Productivity at Lunch seminars in Aug/Sept https://t.co/5FeGjlAA5k,0,http://www.hootsuite.com
890734820409700353,2017-07-28 00:45:04,Thanks to @SUITSusyd for dropping by our head office in Sydney this week. Maybe we'll see some of you back inside t… https://t.co/bzVPEbMJM8,0,http://www.hootsuite.com
889384685855543296,2017-07-24 07:20:07,Want a career in tech? Join us at the @UNSW Careers Expo in SYD on Wed. Here are some tips from UNSW on how to prep! https://t.co/iiO5YyaV6l,1,http://www.hootsuite.com
889281627817336836,2017-07-24 00:30:36,Excited to welcome Sydney University Information Technology Society (SUITS) for a site visit next week. https://t.co/4K1KREqhRv,0,http://www.hootsuite.com
889268087610105860,2017-07-23 23:36:48,Port Nelson isn’t just satisfied with facilitating the growth of the region; it wants to help drive it. https://t.co/3RBcIZImLZ,0,http://www.hootsuite.com
884328898049298434,2017-07-10 08:30:13,"We'll be at the Excellence in Aerospace Conference &amp; Exhibition this week in London, drop by + say hi!… https://t.co/i7Mf4uRQLj",3,http://www.hootsuite.com
881984678269509632,2017-07-03 21:15:08,"Thanks to all who dropped by our @ExpoCarga stall last month, it was a great 3 days. If you've got any follow-up q's, get in touch!",1,http://www.hootsuite.com
876921357317144579,2017-06-19 21:55:18,"Why e-AWB has struggled to gain widespread adoption, and what the air cargo industry can do to improve digitization… https://t.co/4TyYqsappu",2,http://www.hootsuite.com
872209025328394241,2017-06-06 21:50:11,"Not long until @ExpoCarga, get a head-start on networking at the LinkedIn group. See you there! https://t.co/pGbzWPLirA",0,http://www.hootsuite.com
869369030481727488,2017-05-30 01:45:03,"We'll be at @ExpoCarga  next month, with Paul Quiroz and WiseBuisness Partner Lety Butron speaking. Register at https://t.co/74O3IoLaf9",0,http://www.hootsuite.com
867395141077794816,2017-05-24 15:01:31,CLEARFreight understands that its systems need to be as innovative &amp; hardworking as they are.… https://t.co/vkewL2479F,0,http://www.hootsuite.com
864605225566564352,2017-05-16 22:15:24,"Thanks for joining us at AFIF earlier in the month. If you have any questions for Scott or the team, get in touch!… https://t.co/dayM7GuWtt",0,http://www.hootsuite.com
864271698262204416,2017-05-16 00:10:04,Winner of our @transport_messe iPad giveaway w/ zNet will be announced soon! Check out our VR experience here.… https://t.co/eQaxBoLTjr,2,http://www.hootsuite.com
861468233613934592,2017-05-08 06:30:06,Coming to @transport_messe? We've got an iPad to give away in partnership with zNet. Visit https://t.co/ZDjp7SBM0i #transportlogistic,0,http://www.hootsuite.com
859632373989855232,2017-05-03 04:55:03,"Congrats to 2017 CBAFF Young Achiever Award Finalists, Adela Bright (Go Logistics) and Phil Burgess (Burnard Intern… https://t.co/Rt7cGK6aub",0,http://www.hootsuite.com
859184464819302402,2017-05-01 23:15:13,Scott McCorquodale will be speaking at AFIF17 on the trends shaping the future of freight forwarding. Program here… https://t.co/zbNnwEmWrp,0,http://www.hootsuite.com
859183207530541056,2017-05-01 23:10:14,The AFIF 2017 National Conference starts tomorrow in the Gold Coast. Have you booked in for a productivity health check yet? Reach out now.,0,http://www.hootsuite.com
857425332340740096,2017-04-27 02:45:04,Attending the AFIF Conf. in QLD next month? Register now for our Productivity b'fast and find out where you stand https://t.co/D3fHa52euY,0,http://www.hootsuite.com
857348867104411648,2017-04-26 21:41:13,Six ways to stay on top of the demands of split case picking in the face of the eCommerce revolution.… https://t.co/qT7JrVWZRM,3,http://www.hootsuite.com
856977534143082496,2017-04-25 21:05:40,Using automated exception management can cut unnecessary costs while increasing your efficiency.… https://t.co/yG5jF3Q8Jv,0,http://www.hootsuite.com
856453961079033856,2017-04-24 10:25:11,Did you make it to our booth or hear Benn Bekic at Intermodal Africa 2017? Let us know if you have any follow up questions.,0,http://www.hootsuite.com
854229304842104832,2017-04-18 07:05:11,"Intermodal Africa 2017 tomorrow, we'll be in Cape Town at booth 18 and Benn Bekic will be speaking at 4:20pm on Wed. Hope to see you there.",0,http://www.hootsuite.com
852631094956621829,2017-04-13 21:14:28,NCBFAA Educational Institute joins WiseEducation Partner program. https://t.co/QPNuFHSlpx https://t.co/pYhhVeM9eu,0,http://www.hootsuite.com
852110345611161601,2017-04-12 10:45:12,"Did you catch Tim Josupait at Twig Talk 2017 in Punta Cana, Dominican Republic? If you want to follow up on anythin… https://t.co/EH12mzg9YE",1,http://www.hootsuite.com
851677181352792065,2017-04-11 06:03:58,RT @NatCookMP: Opening @TheBigDayIn @UniofAdelaide ! 400 students from across SA #thebigdayin @acsfoundation #techfuture https://t.co/GQIyj…,11,http://www.hootsuite.com
851625956632645633,2017-04-11 02:40:25,Our team is all smiles at @TheBigDayIn at @Flinders. Make sure you drop by our table to get the gift of code in p's… https://t.co/39PjEJvWrK,2,http://www.hootsuite.com
851223377167646723,2017-04-10 00:00:42,Thanks to @NCBFAA for a great four days in New Orleans! Find out more about our Customs capabilities with this vid. https://t.co/P9GrHoCQJa,0,http://www.hootsuite.com
851204352018665472,2017-04-09 22:45:06,"Just over a week until our WiseTech team is in Cape Town, South Africa at Intermodal Africa 2017. Come by booth 18. https://t.co/ksmBeWlffO",1,http://www.hootsuite.com
850167519268700160,2017-04-07 02:05:06,".@TheBigDayIn continues around the country! Thanks for having us Perth, next stop Adelaide on 11 April. All young a… https://t.co/SQrDnho6v7",1,http://www.hootsuite.com
850136285197062145,2017-04-07 00:00:59,"Our team is back from #multimodal17. If you want to know more about CargoWise One, check out this video https://t.co/4as8M2MujO",1,http://www.hootsuite.com
849707333945102337,2017-04-05 19:36:29,Henry Ye shares his tips for expanding logistics businesses into the complex but lucrative Chinese market.… https://t.co/3nM6h2RQxI,0,http://www.hootsuite.com
849456711790456834,2017-04-05 03:00:36,"Was great to share insights on logistics in 2017 at #multimodal17, get in touch if you have any Qs for @CargoPlum.",2,http://www.hootsuite.com
848686660476964864,2017-04-03 00:00:42,#Multimodal17 starts tomorrow. Come by booth 3050 to meet our team of experts. https://t.co/EpUX6R4KGe,3,http://www.hootsuite.com
846859582907535365,2017-03-28 23:00:33,We’ve partnered with @groklearning for a massive @TheBigDayIn giveaway. Drop by our booth to find out more.,4,http://www.hootsuite.com
846829395151073284,2017-03-28 21:00:35,Richard White spoke at yesterday’s @TheBigDayIn at @UTSEngage. Catch him again today at 9.40am. https://t.co/n0FWfyALIT,2,http://www.hootsuite.com
846407807729590272,2017-03-27 17:05:21,Did you catch up with Nachi at Indian Ocean Ports &amp; Logistics last week? Get in touch to find out more or watch: https://t.co/gIyVg0Jbid,3,http://www.hootsuite.com
844262721658982400,2017-03-21 19:01:33,Hear about the latest logistics industry trends from @CargoPlum at #multimodal17 in April https://t.co/XYqFCX2EQX,1,http://www.hootsuite.com
844245332963835904,2017-03-21 17:52:27,"Nachi Mendelow will be in Madagascar on Thursday for Indian Ocean Ports &amp; Logistics, let us know if you’ll be there! https://t.co/pTMMUrrmvF",1,http://www.hootsuite.com
844232433771921408,2017-03-21 17:01:11,Our team of experts will be at the @NCBFAA Annual Conference in New Orleans in April. Meet us at booth 51-52. https://t.co/bptipHPAOj,0,http://www.hootsuite.com
842745841270095878,2017-03-17 14:34:00,We’re excited to be at @Multimodal in Birmingham next month. Find us at booth 3050. #multimodal17 https://t.co/q6GpW4fdEk,1,http://www.hootsuite.com
842108754774614017,2017-03-15 20:22:27,Whale Logistics builds strong business continuing to grow with customers focusing on productivity.… https://t.co/PVEgZW8Btd,1,http://www.hootsuite.com
833541839655489536,2017-02-20 05:00:35,"It was great to share insights on logistics in 2017 at @X2Elite_network conference, let us know if you have any Qs… https://t.co/cuCZcjjtEx",1,http://www.hootsuite.com
832436935218102272,2017-02-17 03:50:05,The @X2Elite_network Conference starts tomorrow. Meet us there and hear Benn Bekic's plenary on Feb 20. https://t.co/rFGzVrlamB #X2Conf2017,1,http://www.hootsuite.com
831300428654641152,2017-02-14 00:34:01,"Thanks to everyone who joined us at #cargo2017! For more info on how we can help drive your business forward, watch https://t.co/RQ2J3b2rbu",0,http://www.hootsuite.com
831253396485177344,2017-02-13 21:27:08,Congrats Jamie Turner from @FedEx who is this year's CCS Scholarship winner! We're proud to support this initiative. https://t.co/zvRBmR5ZeX,0,http://www.hootsuite.com
830983600849960964,2017-02-13 03:35:04,Hands up who's coming to the @X2Elite_network conference next week? Grab our last few 1:1 meetings here: https://t.co/BAZ5y44rJA #X2Conf2017,1,http://www.hootsuite.com
829539222490976256,2017-02-09 03:55:37,RT @SimmermanSteve: Thank you also to @WiseTechGlobal for participating in the panel discussion @CargoLogistics today!! https://t.co/wolPnW…,2,http://twitter.com
829530883149410308,2017-02-09 03:22:29,RT @TheBigDayIn: Adelaide teachers!   @TheBigDayIn @uniadelaide is Tues 11 April. Book yr tix now Hear cool speakers incl @jumpgatevr @Wise…,1,http://www.hootsuite.com
829530817479245824,2017-02-09 03:22:13,RT @SuperSnoopyBros: Enjoying @microbit_edu @microbitruntime #maker fun - #cool @WiseTechGlobal tip #coder moments https://t.co/MEPk6bXWuh,3,http://www.hootsuite.com
829530770683346944,2017-02-09 03:22:02,"@leGraNZ_RMCF Thanks Hannes, I've asked our support team to get in touch with you shortly and help resolve the issue.",0,http://www.hootsuite.com
829528518296010753,2017-02-09 03:13:05,Our team is excited to be heading to the @x2elite_network  conference this month. Will you be there?  #X2Conf2017 https://t.co/6keftDWqOz,1,http://www.hootsuite.com
829520710477373440,2017-02-09 02:42:03,"RT @heavy_lift: Benn Bekic, Speaks at the  X2 Logistics Networks Annual Conference https://t.co/NMNLRa2wxI",1,http://twitter.com
828410427184934912,2017-02-06 01:10:11,"Don't miss #cargo2017 panel W08: Future Logistics Technologies, Feb 8  11.15am. WTG industry veteran Cedomir Bekic… https://t.co/oEMCvaxgIM",0,http://www.hootsuite.com
826232994180505600,2017-01-31 00:57:51,"If you don't already have your #cargo2017 ticket, have one on us! Use our special code for free trade show access: https://t.co/hwrSXhO55o",1,http://www.hootsuite.com
826231099307257856,2017-01-31 00:50:19,We're counting down to #cargo2017 with @CargoLogistics  - come visit stand #1618 or join us at the Main Stage panel… https://t.co/pKKdS2w1rM,5,http://www.hootsuite.com
823700856365256704,2017-01-24 01:16:02,A great turnout for Dominic Lam's session at the 2017 Student Case Competition in Hong Kong... talented young minds… https://t.co/OxyTADMiKS,0,http://www.hootsuite.com
823698115735621632,2017-01-24 01:05:09,"So excited to see our #CargoWiseOne customer, @GSC_Global recognised for the great work they do. Congrats team! https://t.co/UKxWlSBCyY",3,http://twitter.com
823696652787712000,2017-01-24 00:59:20,RT @Tapprincess45: Finally testing the Microbit! @WiseTechGlobal #NCSS2017 https://t.co/p5Rv5OzlWe,1,http://www.hootsuite.com
823696628922118144,2017-01-24 00:59:14,@Tapprincess45 So glad you like it Courtney!,0,http://www.hootsuite.com
820740358367748096,2017-01-15 21:12:04,"RT @TripleTASD: Thanks @WiseTechGlobal for #vcool #NCSS site visit, tips abt apps https://t.co/QcUhKeIxFy",3,http://www.hootsuite.com
820740286901059590,2017-01-15 21:11:47,"RT @ncss: Richard White @WiseTechGlobal #ncss2017 challenging students to spread the word of tech education, its importance &amp; become global…",3,http://www.hootsuite.com
818231468442918912,2017-01-08 23:02:38,"RT @jaxon_kneipp: Thanks to @mathemaniac, @googledownunder,   @Atlassian and @WiseTechGlobal for an amazing day yesterday!! #ncss2017 https…",2,http://www.hootsuite.com
817202420568780800,2017-01-06 02:53:34,RT @hayleyavw: Spontaneous dance parties! #ncss2017 #wtg,1,http://www.hootsuite.com
817202284308402177,2017-01-06 02:53:02,RT @hayleyavw: Site visits kicking off with Waffles at WiseTech Global #wtg #ncss2017,2,http://www.hootsuite.com
817202260551811073,2017-01-06 02:52:56,"RT @hayleyavw: ""Reward success. Reward failure. Punish inaction"" - #wtg #ncss2017",4,http://www.hootsuite.com
817202155320934401,2017-01-06 02:52:31,"RT @ncss: Creativity is the creation of an idea, Innovation is turning that idea something people can use. We solve problems. #ncss2017 #wtg",2,http://www.hootsuite.com
817202111935115264,2017-01-06 02:52:21,"RT @ncss: #ncss2017 Use technology as a tool, not as a religion. Use the right tools at the right time in the right way. #ncss2017 #wtg",6,http://www.hootsuite.com
817200935936098304,2017-01-06 02:47:40,@Tapprincess45 We're a big fan of them too Courtney! Glad you joined us today.,0,http://www.hootsuite.com
817200687482368003,2017-01-06 02:46:41,@liamcallaway Glad you enjoyed them Liam!,0,http://www.hootsuite.com
817200562311663618,2017-01-06 02:46:11,@jconicity They were particularly good James... we should have popped one in the fridge for you!,0,http://www.hootsuite.com
817198142819041282,2017-01-06 02:36:34,RT @Tapprincess45: I had Waffles for the first time at @WiseTechGlobal Sydney. I must say I'm impressed 👍🏻#ncss2017,1,http://www.hootsuite.com
817198123542056960,2017-01-06 02:36:30,"RT @ncss: Good work and life advice: Reward success, reward failure, but punish inaction. #ncss2017 site visits @WiseTechGlobal #WTG https:…",1,http://www.hootsuite.com
817198104877338627,2017-01-06 02:36:25,"RT @ncss: @WiseTechGlobal Goal to change the world of logistics, one innovation at a time. Strategy summarised: more, better, faster. #ncss…",2,http://www.hootsuite.com
817198070052126720,2017-01-06 02:36:17,"RT @ncss: Ultimately, innovation is that which solves problems and gets our customers a better outcome. #ncss2017 #wtg @WiseTechGlobal",1,http://www.hootsuite.com
817198050649116672,2017-01-06 02:36:12,RT @jconicity: Missing out on @WiseTechGlobal waffles so I can fight with Maven dependencies at work. #ncss2017 #industrymentorlyf,1,http://www.hootsuite.com
817197032049885184,2017-01-06 02:32:09,"Great to see our CEO, Richard White, encouraging 150 smart @ncss  students on a site visit to WiseTech Global HQ to… https://t.co/CJaKQjsgsp",4,http://www.hootsuite.com
816437907741429761,2017-01-04 00:15:40,"Our CEO, Richard White, addressing the talented students at #NCSS2017. We are looking forward to an incredible week… https://t.co/ByhB65iQaZ",4,http://www.hootsuite.com
811352635588702208,2016-12-20 23:28:37,Less than two weeks to @ncss 2017 Summer School - glad to support the next wave of Australian IT talent #innovation https://t.co/6C3oSpGCUI,0,http://www.hootsuite.com
803090261010038784,2016-11-28 04:16:53,"RT @soapboxmine: The secret to success ""Turn up every day and do it better"" - Richard Wise #kh16 https://t.co/U9Vly2kn18",2,http://twitter.com
803087526369988608,2016-11-28 04:06:01,RT @kingdomhackau: The inspirational and motivating Richard White CEO of @WiseTechGlobal speaking now. #kh16 https://t.co/vidhRR6J5Q,1,http://www.hootsuite.com
803087467758747648,2016-11-28 04:05:47,RT @kingdomhackau: And the winner was LOSTRANUAGHTS.  Congratulations to Winning Kingdom Hack .Bought to you by @WiseTechGlobal  #kh16 #hac…,3,http://www.hootsuite.com
791840651151286272,2016-10-28 03:14:57,RT @JordanGlobal1: @WiseTechGlobal Congrats @WiseTechGlobal Glad you had good show! We love #cargowise best tool to help provide excellence…,2,http://www.hootsuite.com
791840621476638720,2016-10-28 03:14:50,RT @RD_Kreative: Excited for #hackthehack happening this sat! @HackOnSA @WiseTechGlobal @uctgsbsolutions @OPENworkspaces,4,http://www.hootsuite.com
791840306299867138,2016-10-28 03:13:35,Thanks everyone who joined us at #AirCargoForum2016 &amp; came to Simon Clark’s session. Let’s change the future of… https://t.co/fz7bV80Fqh,0,http://www.hootsuite.com
791157737879113728,2016-10-26 06:01:18,Thanks @TIACAorg for asking Simon Clark to speak in the #acf16 Disruptive Innovation session today 12.30pm Don't miss it! #AirCargoForum2016,0,http://www.hootsuite.com
790816464345427968,2016-10-25 07:25:12,Only one more day until TIACA's 28th #AirCargoForum2016 kicks off! Make sure to meet our team at stand 1069. #acf16 https://t.co/BtOEa9gs1X,0,http://www.hootsuite.com
788511686751911936,2016-10-18 22:46:50,"RT @Pearcey_org: Thanks to @VictorDominello, NSW Minister for Innovation, for presenting 2016 NSW Pearcey Entrepreneur of the Year Award to…",4,http://www.hootsuite.com
788202221762641920,2016-10-18 02:17:08,"Thanks to everyone we met at #TFSBali, meeting #freightforwarders from around the world inspires us to keep innovat… https://t.co/s4WX3upxvt",0,http://www.hootsuite.com
788108275581607937,2016-10-17 20:03:49,Focus on the role of continual education and staff productivity. https://t.co/iiLstMfBWO https://t.co/rKg09kbsXF,0,http://www.hootsuite.com
787899768710266880,2016-10-17 06:15:17,At Intermodal Africa? Check out Nachi Mendelow's session at 4pm today on how productivity is a game-changer. Watch https://t.co/oJTFpLGQXm,0,http://www.hootsuite.com
786783662356389888,2016-10-14 04:20:17,Intermodal Africa 2016 is almost here so visit us @ booth33! For a sneak peek on how we help your bottom line watch https://t.co/oJTFpLYrOU,0,http://www.hootsuite.com
786374762754936832,2016-10-13 01:15:28,How is eCommerce affecting logistics in China? Join Rocky Geng at 2.30pm today at #2016CILF &amp; meet us @ booth C1572… https://t.co/vydp10Zrks,0,http://www.hootsuite.com
786115530520457216,2016-10-12 08:05:22,"Thanks for a great session at #Fiata2016, where Simon Clark focused on how #logistics software is a life-changer fo… https://t.co/ZwT28JDR6s",0,http://www.hootsuite.com
785395753485238272,2016-10-10 08:25:14,"Thanks for joining us @ #UKWANatConf2016! Interested how Amazon, Brexit etc affect UK #logistics today? Talk to us:… https://t.co/tjTj5PnorE",0,http://www.hootsuite.com
785328827161509889,2016-10-10 03:59:17,RT @UKWarehouse: Simon Clark of @WiseTechGlobal  - 'we are ALL technology companies.' https://t.co/I6socoNt9M,1,http://www.hootsuite.com
785328801345576960,2016-10-10 03:59:11,RT @NeonFreight: Arrived at @FIATA2016 looking forward to catching up with @cardinalcaptain @goodada_com and @WiseTechGlobal ✈️⚓️🚚🍺,3,http://www.hootsuite.com
785328773768024064,2016-10-10 03:59:05,RT @TheBigDayIn: BiG Day In @Uni_Newcastle 2017 will be Tuesday 16 May - lock in the date @WiseTechGlobal @TCS_News @WestpacScholars @Great…,3,http://www.hootsuite.com
784501164389851136,2016-10-07 21:10:27,At the CBFCA's National Conference? Don't miss Benn Bekic speak on e-Commerce and Industry Trends at 10am today! https://t.co/MWxRhWkPZ6,0,http://www.hootsuite.com
